codice_ateco,settore,sezione,area_mix,n_vignette,adempimenti,fonti,cast_personaggi,image_prompt,titolo_clickbait,corpo_post,cta_prodotto,cta_url,hashtag,nome_file_webp,drive_folder,stato
31.00.11,Manifattura,C,HACCP+Ambientale+Sicurezza+Privacy,10,Rintracciabilita ed Etichettatura | Formazione Ambientale | Rappresentante Lavoratori Sicurezza (RLS) | Gestione Allergeni | Nomina Incaricati/Responsabili | RSPP / Datore di Lavoro RSPP | Movimentazione Manuale Carichi | Stress Lavoro-Correlato | Formazione GDPR | Attrezzature e Macchine,Reg.CE 178/2002 | D.Lgs152/06 | D.Lgs81/08 art.47 | Reg.UE 1169/2011 | GDPR art.28-29 | D.Lgs81/08 art.34 | D.Lgs81/08 Tit.VI | D.Lgs81/08 art.28 | GDPR art.32 | D.Lgs81/08 Tit.III,"SCUDIX>OBLIVIX, TRACCIX>CAOSIX, CHECKIX>RUMORIX, ROBOTIX81>ACQUAIX, PREPOSTIX>RISKIX, BLINKIX>SCHIACCIX, CONSENSIX>FRETTIX, CHEFIX>CHIMIKIX, HYGIENIX>RISKIX, PREPOSTIX>SEGNALEX","Crea una PAGINA A FUMETTI a STORIA COMPLETA, verticale A4 (1024x1536), QUALITA' EDITORIALE DA STAMPA, stile ufficiale 'SICURIX TALES' IDENTICO alle immagini di riferimento allegate (stessi personaggi a mattoncini 3D, stessa impaginazione, stessi colori, stesse rese): minifigure espressive, ambientazioni ricche e dettagliate del settore, luci morbide, profondita', bordi vignetta netti. IMPAGINAZIONE OBBLIGATORIA: da 10 a 12 VIGNETTE numerate che raccontano UNA STORIA con arco narrativo completo (1 situazione normale -> 2-4 arrivano i pericoli coi cattivi -> 5-6 tensione/conseguenza -> 7-9 arriva SICURIX con gli eroi e applica il METODO81+ passo per passo -> 10-11 risoluzione ordinata -> 12 finale). HEADER in alto: SICURIX (mantello, medaglione arancione '81+', bussola) che presenta in un fumetto; grande titolo 'SICURIX TALES'; sottotitolo 'MANIFATTURA: Pericolo vs Soluzione con Metodo 81+'; legenda 3 voci (verde Sicurezza, rosso Rischio, blu 81+ Soluzione); fila di EROI coi nomi: SCUDIX, TRACCIX, CHECKIX, ROBOTIX81, PREPOSTIX, BLINKIX. FOOTER in basso: grande 'Prima vedi. Poi sistemi.'; banner scudo verde 'PROTEGGIAMO. PREVENIAMO. MIGLIORIAMO.' e triangolo rosso 'DISATTENZIONE. RISCHI. COSTI. CAOS.'; logo '81+' + '81plus.net'. TRAMA (usa questi eventi come vignette; se sono meno di 10 aggiungi vignette di contesto, dialogo e reazione per arrivare a 10-12): 1) OBLIVIX causa il pericolo 'Rintracciabilita' (Rintracciabilita ed Etichettatura); poi SCUDIX+SICURIX applicano il METODO81+; 2) CAOSIX causa il pericolo 'Formazione' (Formazione Ambientale); poi TRACCIX+SICURIX applicano il METODO81+; 3) RUMORIX causa il pericolo 'Ruolo/RLS' (Rappresentante Lavoratori Sicurezza (RLS)); poi CHECKIX+SICURIX applicano il METODO81+; 4) ACQUAIX causa il pericolo 'Allergeni' (Gestione Allergeni); poi ROBOTIX81+SICURIX applicano il METODO81+; 5) RISKIX causa il pericolo 'Nomine' (Nomina Incaricati/Responsabili); poi PREPOSTIX+SICURIX applicano il METODO81+; 6) SCHIACCIX causa il pericolo 'Ruolo/RSPP' (RSPP / Datore di Lavoro RSPP); poi BLINKIX+SICURIX applicano il METODO81+; 7) FRETTIX causa il pericolo 'MMC' (Movimentazione Manuale Carichi); poi CONSENSIX+SICURIX applicano il METODO81+; 8) CHIMIKIX causa il pericolo 'Stress' (Stress Lavoro-Correlato); poi CHEFIX+SICURIX applicano il METODO81+; 9) RISKIX causa il pericolo 'Formazione' (Formazione GDPR); poi HYGIENIX+SICURIX applicano il METODO81+; 10) SEGNALEX causa il pericolo 'Attrezzature' (Attrezzature e Macchine); poi PREPOSTIX+SICURIX applicano il METODO81+. PALETTE BRAND ESCLUSIVA: nero #05050A, bianco panna, arancione #FF6A1A/#E8501A; ROSSO solo per 'PERICOLO', VERDE per la checklist 'Metodo 81+'. Logo '81+' ben visibile in OGNI vignetta. REGOLA STORIA: SICURIX NON agisce mai da solo - in OGNI vignetta di soluzione si fa AIUTARE dai suoi colleghi EROI (lavoro di squadra, ognuno col suo ruolo). TESTO: didascalie e fumetti MOLTO BREVI (1-4 parole), GRANDI, centrati, in ITALIANO con ORTOGRAFIA PERFETTA, senza parole inventate, lettere doppie errate o testo tagliato. CATTIVI (coerenti col canone): OBLIVIX, CAOSIX, RUMORIX, ACQUAIX, RISKIX, SCHIACCIX, FRETTIX, CHIMIKIX, SEGNALEX. EROI: SCUDIX, TRACCIX, CHECKIX, ROBOTIX81, PREPOSTIX, BLINKIX, CONSENSIX, CHEFIX, HYGIENIX. NEGATIVE: nessun marchio LEGO reale, nessun personaggio protetto (Asterix ecc.), niente gore/horror, niente claim assoluti ('rischio zero','garantito','zero multe').",In Manifattura c'e' un obbligo che in tanti scoprono solo con la sanzione,"Quello che l'ispettore controlla per primo in Manifattura (e quasi nessuno lo sa)

In manifattura gli adempimenti obbligatori non aspettano: Rintracciabilita, Formazione, Ruolo/RLS, Allergeni, Nomine, Ruolo/RSPP, MMC, Stress, Attrezzature. In questa pagina TALES OF SICURIX il PERICOLO prende forma... e il METODO81+ lo rimette in ordine, passo dopo passo. Immagina la scena: prima il caos, poi la checklist che sistema tutto. Chi si mette in regola prima, dorme meglio dopo.
👉 Iscriviti al corso: Manuale di rintracciabilità -> https://81plus.net/?corso=manuale-di-rintracciabilit
▶️ YouTube: youtube.com/@sicurissimo
Contenuto informativo. Prima vedi. Poi sistemi. 81plus.net",Manuale di rintracciabilità,https://81plus.net/?corso=manuale-di-rintracciabilit,#TalesOfSicurix #SICURIX #Metodo81 #81plus #Sicurissimo #HACCP #Ambientale #Sicurezza #Privacy #SicurezzaSulLavoro,SICURIX_TALES_310011_18_29_4_21_24_5_10_11_25_14.webp,https://drive.google.com/drive/folders/1hICKXdl9JTZBL1pemG19oE_661z-EH_k,IMG_ERR
46.49.22,Commercio,G,HACCP+Privacy+Sicurezza,11,Corso Alimentarista | Nomina Incaricati/Responsabili | Registro dei Trattamenti | Sorveglianza Sanitaria / Medico Competente | Formazione Generale Lavoratori | Rappresentante Lavoratori Sicurezza (RLS) | Formazione Preposto | Documento Valutazione Rischi (DVR) | Gestione Allergeni | Movimentazione Manuale Carichi | Formazione Specifica (rischio medio),Reg.CE 852/2004 | GDPR art.28-29 | GDPR art.30 | D.Lgs81/08 art.41 | Accordo Stato-Regioni | D.Lgs81/08 art.47 | D.Lgs81/08 art.37 | D.Lgs81/08 art.28 | Reg.UE 1169/2011 | D.Lgs81/08 Tit.VI,"PREPOSTIX>MESCOLIX, LUXPECTORIX>HACKIX, ROBOTIX81>CAOSIX, TRACCIX>POLVERIX, PREPOSTIX>VOLTIX, DOCUMIX>TAGLIX, BLINKIX>VOLTIX, DOCUMIX>CAOSIX, TRACCIX>IMPROVVISIX, CIFRIX>IMPROVVISIX, TRACCIX>SOTTOVALUTIX","Crea una PAGINA A FUMETTI a STORIA COMPLETA, verticale A4 (1024x1536), QUALITA' EDITORIALE DA STAMPA, stile ufficiale 'SICURIX TALES' IDENTICO alle immagini di riferimento allegate (stessi personaggi a mattoncini 3D, stessa impaginazione, stessi colori, stesse rese): minifigure espressive, ambientazioni ricche e dettagliate del settore, luci morbide, profondita', bordi vignetta netti. IMPAGINAZIONE OBBLIGATORIA: da 10 a 12 VIGNETTE numerate che raccontano UNA STORIA con arco narrativo completo (1 situazione normale -> 2-4 arrivano i pericoli coi cattivi -> 5-6 tensione/conseguenza -> 7-9 arriva SICURIX con gli eroi e applica il METODO81+ passo per passo -> 10-11 risoluzione ordinata -> 12 finale). HEADER in alto: SICURIX (mantello, medaglione arancione '81+', bussola) che presenta in un fumetto; grande titolo 'SICURIX TALES'; sottotitolo 'COMMERCIO: Pericolo vs Soluzione con Metodo 81+'; legenda 3 voci (verde Sicurezza, rosso Rischio, blu 81+ Soluzione); fila di EROI coi nomi: PREPOSTIX, LUXPECTORIX, ROBOTIX81, TRACCIX, DOCUMIX, BLINKIX. FOOTER in basso: grande 'Prima vedi. Poi sistemi.'; banner scudo verde 'PROTEGGIAMO. PREVENIAMO. MIGLIORIAMO.' e triangolo rosso 'DISATTENZIONE. RISCHI. COSTI. CAOS.'; logo '81+' + '81plus.net'. TRAMA (usa questi eventi come vignette; se sono meno di 10 aggiungi vignette di contesto, dialogo e reazione per arrivare a 10-12): 1) MESCOLIX causa il pericolo 'Corso' (Corso Alimentarista); poi PREPOSTIX+SICURIX applicano il METODO81+; 2) HACKIX causa il pericolo 'Nomine' (Nomina Incaricati/Responsabili); poi LUXPECTORIX+SICURIX applicano il METODO81+; 3) CAOSIX causa il pericolo 'Registro' (Registro dei Trattamenti); poi ROBOTIX81+SICURIX applicano il METODO81+; 4) POLVERIX causa il pericolo 'Sorveglianza sanitaria' (Sorveglianza Sanitaria / Medico Competente); poi TRACCIX+SICURIX applicano il METODO81+; 5) VOLTIX causa il pericolo 'Formazione base' (Formazione Generale Lavoratori); poi PREPOSTIX+SICURIX applicano il METODO81+; 6) TAGLIX causa il pericolo 'Ruolo/RLS' (Rappresentante Lavoratori Sicurezza (RLS)); poi DOCUMIX+SICURIX applicano il METODO81+; 7) VOLTIX causa il pericolo 'Ruolo/Preposto' (Formazione Preposto); poi BLINKIX+SICURIX applicano il METODO81+; 8) CAOSIX causa il pericolo 'Documento' (Documento Valutazione Rischi (DVR)); poi DOCUMIX+SICURIX applicano il METODO81+; 9) IMPROVVISIX causa il pericolo 'Allergeni' (Gestione Allergeni); poi TRACCIX+SICURIX applicano il METODO81+; 10) IMPROVVISIX causa il pericolo 'MMC' (Movimentazione Manuale Carichi); poi CIFRIX+SICURIX applicano il METODO81+; 11) SOTTOVALUTIX causa il pericolo 'Formazione specifica' (Formazione Specifica (rischio medio)); poi TRACCIX+SICURIX applicano il METODO81+. PALETTE BRAND ESCLUSIVA: nero #05050A, bianco panna, arancione #FF6A1A/#E8501A; ROSSO solo per 'PERICOLO', VERDE per la checklist 'Metodo 81+'. Logo '81+' ben visibile in OGNI vignetta. REGOLA STORIA: SICURIX NON agisce mai da solo - in OGNI vignetta di soluzione si fa AIUTARE dai suoi colleghi EROI (lavoro di squadra, ognuno col suo ruolo). TESTO: didascalie e fumetti MOLTO BREVI (1-4 parole), GRANDI, centrati, in ITALIANO con ORTOGRAFIA PERFETTA, senza parole inventate, lettere doppie errate o testo tagliato. CATTIVI (coerenti col canone): MESCOLIX, HACKIX, CAOSIX, POLVERIX, VOLTIX, TAGLIX, IMPROVVISIX, SOTTOVALUTIX. EROI: PREPOSTIX, LUXPECTORIX, ROBOTIX81, TRACCIX, DOCUMIX, BLINKIX, CIFRIX. NEGATIVE: nessun marchio LEGO reale, nessun personaggio protetto (Asterix ecc.), niente gore/horror, niente claim assoluti ('rischio zero','garantito','zero multe').","In Commercio non e' 'se' arriva il controllo, e' 'quando'. Sei pronto?","In Commercio non e' 'se' arriva il controllo, e' 'quando'. Sei pronto?

In commercio gli adempimenti obbligatori non aspettano: Corso, Nomine, Registro, Sorveglianza sanitaria, Formazione base, Ruolo/RLS, Ruolo/Preposto, Documento, Allergeni, MMC, Formazione specifica. In questa pagina TALES OF SICURIX il PERICOLO prende forma... e il METODO81+ lo rimette in ordine, passo dopo passo. Immagina la scena: prima il caos, poi la checklist che sistema tutto. La regola c'e' gia': tu falla lavorare per te.
👉 Iscriviti al corso: Haccp - Corso responsabile industria alimentare -> https://81plus.net/?corso=haccp-corso-responsabile-industria-alimentare
▶️ YouTube: youtube.com/@sicurissimo
Contenuto informativo. Prima vedi. Poi sistemi. 81plus.net",Haccp - Corso responsabile industria alimentare,https://81plus.net/?corso=haccp-corso-responsabile-industria-alimentare,#TalesOfSicurix #SICURIX #Metodo81 #81plus #Sicurissimo #HACCP #Privacy #Sicurezza #SicurezzaSulLavoro,SICURIX_TALES_464922_13_21_20_9_1_4_3_0_18_10_2.webp,https://drive.google.com/drive/folders/1hICKXdl9JTZBL1pemG19oE_661z-EH_k,IMG_ERR
43.32.02,Costruzioni,F,Privacy+Ambientale+Sicurezza,11,Informativa e Consensi | Gestione Rifiuti e Registro | Nomina Incaricati/Responsabili | Formazione GDPR | Formazione Ambientale | Formazione Generale Lavoratori | Registro dei Trattamenti | Stress Lavoro-Correlato | Procedura Data Breach | Addetto Primo Soccorso | Uso e Formazione DPI,GDPR art.13 | D.Lgs152/06 | GDPR art.28-29 | GDPR art.32 | Accordo Stato-Regioni | GDPR art.30 | D.Lgs81/08 art.28 | GDPR art.33-34 | DM 388/2003 | D.Lgs81/08 art.77,"ROBOTIX81>PERMISSIONIX, BLINKIX>OBLIVIX, HYGIENIX>PERMISSIONIX, BLINKIX>PHISHIX, CONSENSIX>FRETTIX, CHECKIX>VIBRIX, BLINKIX>CANCELIX, PRIVACIX>RISKIX, CIFRIX>OBLIVIX, SCUDIX>POLVERIX, PREPOSTIX>TAGLIX","Crea una PAGINA A FUMETTI a STORIA COMPLETA, verticale A4 (1024x1536), QUALITA' EDITORIALE DA STAMPA, stile ufficiale 'SICURIX TALES' IDENTICO alle immagini di riferimento allegate (stessi personaggi a mattoncini 3D, stessa impaginazione, stessi colori, stesse rese): minifigure espressive, ambientazioni ricche e dettagliate del settore, luci morbide, profondita', bordi vignetta netti. IMPAGINAZIONE OBBLIGATORIA: da 10 a 12 VIGNETTE numerate che raccontano UNA STORIA con arco narrativo completo (1 situazione normale -> 2-4 arrivano i pericoli coi cattivi -> 5-6 tensione/conseguenza -> 7-9 arriva SICURIX con gli eroi e applica il METODO81+ passo per passo -> 10-11 risoluzione ordinata -> 12 finale). HEADER in alto: SICURIX (mantello, medaglione arancione '81+', bussola) che presenta in un fumetto; grande titolo 'SICURIX TALES'; sottotitolo 'COSTRUZIONI: Pericolo vs Soluzione con Metodo 81+'; legenda 3 voci (verde Sicurezza, rosso Rischio, blu 81+ Soluzione); fila di EROI coi nomi: ROBOTIX81, BLINKIX, HYGIENIX, CONSENSIX, CHECKIX, PRIVACIX. FOOTER in basso: grande 'Prima vedi. Poi sistemi.'; banner scudo verde 'PROTEGGIAMO. PREVENIAMO. MIGLIORIAMO.' e triangolo rosso 'DISATTENZIONE. RISCHI. COSTI. CAOS.'; logo '81+' + '81plus.net'. TRAMA (usa questi eventi come vignette; se sono meno di 10 aggiungi vignette di contesto, dialogo e reazione per arrivare a 10-12): 1) PERMISSIONIX causa il pericolo 'Documento' (Informativa e Consensi); poi ROBOTIX81+SICURIX applicano il METODO81+; 2) OBLIVIX causa il pericolo 'Rifiuti' (Gestione Rifiuti e Registro); poi BLINKIX+SICURIX applicano il METODO81+; 3) PERMISSIONIX causa il pericolo 'Nomine' (Nomina Incaricati/Responsabili); poi HYGIENIX+SICURIX applicano il METODO81+; 4) PHISHIX causa il pericolo 'Formazione' (Formazione GDPR); poi BLINKIX+SICURIX applicano il METODO81+; 5) FRETTIX causa il pericolo 'Formazione' (Formazione Ambientale); poi CONSENSIX+SICURIX applicano il METODO81+; 6) VIBRIX causa il pericolo 'Formazione base' (Formazione Generale Lavoratori); poi CHECKIX+SICURIX applicano il METODO81+; 7) CANCELIX causa il pericolo 'Registro' (Registro dei Trattamenti); poi BLINKIX+SICURIX applicano il METODO81+; 8) RISKIX causa il pericolo 'Stress' (Stress Lavoro-Correlato); poi PRIVACIX+SICURIX applicano il METODO81+; 9) OBLIVIX causa il pericolo 'Data breach' (Procedura Data Breach); poi CIFRIX+SICURIX applicano il METODO81+; 10) POLVERIX causa il pericolo 'Emergenze/Soccorso' (Addetto Primo Soccorso); poi SCUDIX+SICURIX applicano il METODO81+; 11) TAGLIX causa il pericolo 'DPI' (Uso e Formazione DPI); poi PREPOSTIX+SICURIX applicano il METODO81+. PALETTE BRAND ESCLUSIVA: nero #05050A, bianco panna, arancione #FF6A1A/#E8501A; ROSSO solo per 'PERICOLO', VERDE per la checklist 'Metodo 81+'. Logo '81+' ben visibile in OGNI vignetta. REGOLA STORIA: SICURIX NON agisce mai da solo - in OGNI vignetta di soluzione si fa AIUTARE dai suoi colleghi EROI (lavoro di squadra, ognuno col suo ruolo). TESTO: didascalie e fumetti MOLTO BREVI (1-4 parole), GRANDI, centrati, in ITALIANO con ORTOGRAFIA PERFETTA, senza parole inventate, lettere doppie errate o testo tagliato. CATTIVI (coerenti col canone): PERMISSIONIX, OBLIVIX, PHISHIX, FRETTIX, VIBRIX, CANCELIX, RISKIX, POLVERIX, TAGLIX. EROI: ROBOTIX81, BLINKIX, HYGIENIX, CONSENSIX, CHECKIX, PRIVACIX, CIFRIX, SCUDIX, PREPOSTIX. NEGATIVE: nessun marchio LEGO reale, nessun personaggio protetto (Asterix ecc.), niente gore/horror, niente claim assoluti ('rischio zero','garantito','zero multe').",La differenza tra chi in Costruzioni dorme sereno e chi trema al controllo,"Costruzioni: 3 minuti oggi o un problema enorme domani. Scegli tu.

In costruzioni gli adempimenti obbligatori non aspettano: Documento, Rifiuti, Nomine, Formazione, Formazione base, Registro, Stress, Data breach, Emergenze/Soccorso, DPI. In questa pagina TALES OF SICURIX il PERICOLO prende forma... e il METODO81+ lo rimette in ordine, passo dopo passo. Immagina la scena: prima il caos, poi la checklist che sistema tutto. Non e' burocrazia: e' la tua tranquillita.
👉 Iscriviti al corso: Corso privacy destinato ai lavoratori -> https://81plus.net/?corso=corso-privacy-destinato-ai-lavoratori
▶️ YouTube: youtube.com/@sicurissimo
Contenuto informativo. Prima vedi. Poi sistemi. 81plus.net",Corso privacy destinato ai lavoratori,https://81plus.net/?corso=corso-privacy-destinato-ai-lavoratori,#TalesOfSicurix #SICURIX #Metodo81 #81plus #Sicurissimo #Privacy #Ambientale #Sicurezza #SicurezzaSulLavoro,SICURIX_TALES_433202_14_19_16_17_20_1_15_11_18_6_8.webp,https://drive.google.com/drive/folders/1hICKXdl9JTZBL1pemG19oE_661z-EH_k,IMG_ERR
71.12.20,Servizi alle imprese,N,Sicurezza+Privacy,11,Documento Valutazione Rischi (DVR) | Nomina Incaricati/Responsabili | Formazione Preposto | RSPP / Datore di Lavoro RSPP | Informativa e Consensi | Addetto Antincendio | Rappresentante Lavoratori Sicurezza (RLS) | Procedura Data Breach | Registro dei Trattamenti | Formazione GDPR | Addetto Primo Soccorso,D.Lgs81/08 art.28 | GDPR art.28-29 | D.Lgs81/08 art.37 | D.Lgs81/08 art.34 | GDPR art.13 | DM 2/9/2021 | D.Lgs81/08 art.47 | GDPR art.33-34 | GDPR art.30 | GDPR art.32 | DM 388/2003,"SICURIX>OBLIVIX, BLINKIX>PHISHIX, SICURIX>RUMORIX, CHECKIX>FRETTIX, PRIVACIX>FRETTIX, DOCUMIX>FRETTIX, ROBOTIX81>POLVERIX, SCUDIX>IMPROVVISIX, ROBOTIX81>MULTIX, ROBOTIX81>PHISHIX, CHECKIX>MULTIX","Crea una PAGINA A FUMETTI a STORIA COMPLETA, verticale A4 (1024x1536), QUALITA' EDITORIALE DA STAMPA, stile ufficiale 'SICURIX TALES' IDENTICO alle immagini di riferimento allegate (stessi personaggi a mattoncini 3D, stessa impaginazione, stessi colori, stesse rese): minifigure espressive, ambientazioni ricche e dettagliate del settore, luci morbide, profondita', bordi vignetta netti. IMPAGINAZIONE OBBLIGATORIA: da 10 a 12 VIGNETTE numerate che raccontano UNA STORIA con arco narrativo completo (1 situazione normale -> 2-4 arrivano i pericoli coi cattivi -> 5-6 tensione/conseguenza -> 7-9 arriva SICURIX con gli eroi e applica il METODO81+ passo per passo -> 10-11 risoluzione ordinata -> 12 finale). HEADER in alto: SICURIX (mantello, medaglione arancione '81+', bussola) che presenta in un fumetto; grande titolo 'SICURIX TALES'; sottotitolo 'SERVIZI ALLE IMPRESE: Pericolo vs Soluzione con Metodo 81+'; legenda 3 voci (verde Sicurezza, rosso Rischio, blu 81+ Soluzione); fila di EROI coi nomi: SICURIX, BLINKIX, CHECKIX, PRIVACIX, DOCUMIX, ROBOTIX81. FOOTER in basso: grande 'Prima vedi. Poi sistemi.'; banner scudo verde 'PROTEGGIAMO. PREVENIAMO. MIGLIORIAMO.' e triangolo rosso 'DISATTENZIONE. RISCHI. COSTI. CAOS.'; logo '81+' + '81plus.net'. TRAMA (usa questi eventi come vignette; se sono meno di 10 aggiungi vignette di contesto, dialogo e reazione per arrivare a 10-12): 1) OBLIVIX causa il pericolo 'Documento' (Documento Valutazione Rischi (DVR)); poi SICURIX+SICURIX applicano il METODO81+; 2) PHISHIX causa il pericolo 'Nomine' (Nomina Incaricati/Responsabili); poi BLINKIX+SICURIX applicano il METODO81+; 3) RUMORIX causa il pericolo 'Ruolo/Preposto' (Formazione Preposto); poi SICURIX+SICURIX applicano il METODO81+; 4) FRETTIX causa il pericolo 'Ruolo/RSPP' (RSPP / Datore di Lavoro RSPP); poi CHECKIX+SICURIX applicano il METODO81+; 5) FRETTIX causa il pericolo 'Documento' (Informativa e Consensi); poi PRIVACIX+SICURIX applicano il METODO81+; 6) FRETTIX causa il pericolo 'Emergenze/Incendio' (Addetto Antincendio); poi DOCUMIX+SICURIX applicano il METODO81+; 7) POLVERIX causa il pericolo 'Ruolo/RLS' (Rappresentante Lavoratori Sicurezza (RLS)); poi ROBOTIX81+SICURIX applicano il METODO81+; 8) IMPROVVISIX causa il pericolo 'Data breach' (Procedura Data Breach); poi SCUDIX+SICURIX applicano il METODO81+; 9) MULTIX causa il pericolo 'Registro' (Registro dei Trattamenti); poi ROBOTIX81+SICURIX applicano il METODO81+; 10) PHISHIX causa il pericolo 'Formazione' (Formazione GDPR); poi ROBOTIX81+SICURIX applicano il METODO81+; 11) MULTIX causa il pericolo 'Emergenze/Soccorso' (Addetto Primo Soccorso); poi CHECKIX+SICURIX applicano il METODO81+. PALETTE BRAND ESCLUSIVA: nero #05050A, bianco panna, arancione #FF6A1A/#E8501A; ROSSO solo per 'PERICOLO', VERDE per la checklist 'Metodo 81+'. Logo '81+' ben visibile in OGNI vignetta. REGOLA STORIA: SICURIX NON agisce mai da solo - in OGNI vignetta di soluzione si fa AIUTARE dai suoi colleghi EROI (lavoro di squadra, ognuno col suo ruolo). TESTO: didascalie e fumetti MOLTO BREVI (1-4 parole), GRANDI, centrati, in ITALIANO con ORTOGRAFIA PERFETTA, senza parole inventate, lettere doppie errate o testo tagliato. CATTIVI (coerenti col canone): OBLIVIX, PHISHIX, RUMORIX, FRETTIX, POLVERIX, IMPROVVISIX, MULTIX. EROI: SICURIX, BLINKIX, CHECKIX, PRIVACIX, DOCUMIX, ROBOTIX81, SCUDIX. NEGATIVE: nessun marchio LEGO reale, nessun personaggio protetto (Asterix ecc.), niente gore/horror, niente claim assoluti ('rischio zero','garantito','zero multe').",La differenza tra chi in Servizi alle imprese dorme sereno e chi trema al controllo,"In Servizi alle imprese c'e' un obbligo che in tanti scoprono solo con la sanzione

In servizi alle imprese gli adempimenti obbligatori non aspettano: Documento, Nomine, Ruolo/Preposto, Ruolo/RSPP, Emergenze/Incendio, Ruolo/RLS, Data breach, Registro, Formazione, Emergenze/Soccorso. In questa pagina TALES OF SICURIX il PERICOLO prende forma... e il METODO81+ lo rimette in ordine, passo dopo passo. Immagina la scena: prima il caos, poi la checklist che sistema tutto. Non e' burocrazia: e' la tua tranquillita.
👉 Iscriviti al corso: Corso lavoratore parte GENERALE 4 ore -> https://81plus.net/?corso=corso-lavoratore-parte-generale-4-ore
▶️ YouTube: youtube.com/@sicurissimo
Contenuto informativo. Prima vedi. Poi sistemi. 81plus.net",Corso lavoratore parte GENERALE 4 ore,https://81plus.net/?corso=corso-lavoratore-parte-generale-4-ore,#TalesOfSicurix #SICURIX #Metodo81 #81plus #Sicurissimo #Sicurezza #Privacy #SicurezzaSulLavoro,SICURIX_TALES_711220_0_11_3_5_9_7_4_13_10_12_6.webp,https://drive.google.com/drive/folders/1hICKXdl9JTZBL1pemG19oE_661z-EH_k,IMG_ERR
