codice_ateco,settore,sezione,area_mix,n_vignette,adempimenti,fonti,cast_personaggi,image_prompt,titolo_clickbait,corpo_post,cta_prodotto,cta_url,hashtag,nome_file_webp,drive_folder,stato
13.91.00,Manifattura,C,Sicurezza+Privacy+HACCP,10,Movimentazione Manuale Carichi | Sorveglianza Sanitaria / Medico Competente | Registro dei Trattamenti | Rappresentante Lavoratori Sicurezza (RLS) | Gestione Allergeni | Informativa e Consensi | Nomina Incaricati/Responsabili | Controllo Temperature e Celle | Documento Valutazione Rischi (DVR) | Stress Lavoro-Correlato,D.Lgs81/08 Tit.VI | D.Lgs81/08 art.41 | GDPR art.30 | D.Lgs81/08 art.47 | Reg.UE 1169/2011 | GDPR art.13 | GDPR art.28-29 | Reg.CE 852/2004 | D.Lgs81/08 art.28,"PRIVACIX>IMPROVVISIX, PREPOSTIX>RUMORIX, BLINKIX>HACKIX, CHEFIX>BIOXIX, FORMIX>MULTIX, ROBOTIX81>OBLIVIX, CHECKIX>HACKIX, CHECKIX>ACQUAIX, CONSENSIX>CHIMIKIX, HYGIENIX>FRETTIX","Crea una PAGINA A FUMETTI a STORIA COMPLETA, verticale A4 (1024x1536), QUALITA' EDITORIALE DA STAMPA, stile ufficiale 'SICURIX TALES' IDENTICO alle immagini di riferimento allegate (stessi personaggi a mattoncini 3D, stessa impaginazione, stessi colori, stesse rese): minifigure espressive, ambientazioni ricche e dettagliate del settore, luci morbide, profondita', bordi vignetta netti. IMPAGINAZIONE OBBLIGATORIA: da 10 a 12 VIGNETTE numerate che raccontano UNA STORIA con arco narrativo completo (1 situazione normale -> 2-4 arrivano i pericoli coi cattivi -> 5-6 tensione/conseguenza -> 7-9 arriva SICURIX con gli eroi e applica il METODO81+ passo per passo -> 10-11 risoluzione ordinata -> 12 finale). HEADER in alto: SICURIX (mantello, medaglione arancione '81+', bussola) che presenta in un fumetto; grande titolo 'SICURIX TALES'; sottotitolo 'MANIFATTURA: Pericolo vs Soluzione con Metodo 81+'; legenda 3 voci (verde Sicurezza, rosso Rischio, blu 81+ Soluzione); fila di EROI coi nomi: PRIVACIX, PREPOSTIX, BLINKIX, CHEFIX, FORMIX, ROBOTIX81. FOOTER in basso: grande 'Prima vedi. Poi sistemi.'; banner scudo verde 'PROTEGGIAMO. PREVENIAMO. MIGLIORIAMO.' e triangolo rosso 'DISATTENZIONE. RISCHI. COSTI. CAOS.'; logo '81+' + '81plus.net'. TRAMA (usa questi eventi come vignette; se sono meno di 10 aggiungi vignette di contesto, dialogo e reazione per arrivare a 10-12): 1) IMPROVVISIX causa il pericolo 'MMC' (Movimentazione Manuale Carichi); poi PRIVACIX+SICURIX applicano il METODO81+; 2) RUMORIX causa il pericolo 'Sorveglianza sanitaria' (Sorveglianza Sanitaria / Medico Competente); poi PREPOSTIX+SICURIX applicano il METODO81+; 3) HACKIX causa il pericolo 'Registro' (Registro dei Trattamenti); poi BLINKIX+SICURIX applicano il METODO81+; 4) BIOXIX causa il pericolo 'Ruolo/RLS' (Rappresentante Lavoratori Sicurezza (RLS)); poi CHEFIX+SICURIX applicano il METODO81+; 5) MULTIX causa il pericolo 'Allergeni' (Gestione Allergeni); poi FORMIX+SICURIX applicano il METODO81+; 6) OBLIVIX causa il pericolo 'Documento' (Informativa e Consensi); poi ROBOTIX81+SICURIX applicano il METODO81+; 7) HACKIX causa il pericolo 'Nomine' (Nomina Incaricati/Responsabili); poi CHECKIX+SICURIX applicano il METODO81+; 8) ACQUAIX causa il pericolo 'Temperature' (Controllo Temperature e Celle); poi CHECKIX+SICURIX applicano il METODO81+; 9) CHIMIKIX causa il pericolo 'Documento' (Documento Valutazione Rischi (DVR)); poi CONSENSIX+SICURIX applicano il METODO81+; 10) FRETTIX causa il pericolo 'Stress' (Stress Lavoro-Correlato); poi HYGIENIX+SICURIX applicano il METODO81+. PALETTE BRAND ESCLUSIVA: nero #05050A, bianco panna, arancione #FF6A1A/#E8501A; ROSSO solo per 'PERICOLO', VERDE per la checklist 'Metodo 81+'. Logo '81+' ben visibile in OGNI vignetta. REGOLA STORIA: SICURIX NON agisce mai da solo - in OGNI vignetta di soluzione si fa AIUTARE dai suoi colleghi EROI (lavoro di squadra, ognuno col suo ruolo). TESTO: didascalie e fumetti MOLTO BREVI (1-4 parole), GRANDI, centrati, in ITALIANO con ORTOGRAFIA PERFETTA, senza parole inventate, lettere doppie errate o testo tagliato. CATTIVI (coerenti col canone): IMPROVVISIX, RUMORIX, HACKIX, BIOXIX, MULTIX, OBLIVIX, ACQUAIX, CHIMIKIX, FRETTIX. EROI: PRIVACIX, PREPOSTIX, BLINKIX, CHEFIX, FORMIX, ROBOTIX81, CHECKIX, CONSENSIX, HYGIENIX. NEGATIVE: nessun marchio LEGO reale, nessun personaggio protetto (Asterix ecc.), niente gore/horror, niente claim assoluti ('rischio zero','garantito','zero multe').",La differenza tra chi in Manifattura dorme sereno e chi trema al controllo,"In Manifattura non e' 'se' arriva il controllo, e' 'quando'. Sei pronto?

In manifattura gli adempimenti obbligatori non aspettano: MMC, Sorveglianza sanitaria, Registro, Ruolo/RLS, Allergeni, Documento, Nomine, Temperature, Stress. In questa pagina TALES OF SICURIX il PERICOLO prende forma... e il METODO81+ lo rimette in ordine, passo dopo passo. Immagina la scena: prima il caos, poi la checklist che sistema tutto. Mettere ordine ora costa poco. Rimediare dopo costa caro.
👉 Iscriviti al corso: Corso RSPP Datore di Lavoro : Movimentazione manuale carichi -> https://81plus.net/?corso=corso-rspp-datore-di-lavoro-movimentazione-manuale-carichi
▶️ YouTube: youtube.com/@sicurissimo
Contenuto informativo. Prima vedi. Poi sistemi. 81plus.net",Corso RSPP Datore di Lavoro : Movimentazione manuale carichi,https://81plus.net/?corso=corso-rspp-datore-di-lavoro-movimentazione-manuale-carichi,#TalesOfSicurix #SICURIX #Metodo81 #81plus #Sicurissimo #Sicurezza #Privacy #HACCP #SicurezzaSulLavoro,SICURIX_TALES_139100_10_9_22_4_20_21_23_18_0_11.webp,https://drive.google.com/drive/folders/1hICKXdl9JTZBL1pemG19oE_661z-EH_k,IMG_ERR
96.10.11,Famiglie datori,T,Privacy+Sicurezza,12,Nomina DPO / RPD | RSPP / Datore di Lavoro RSPP | Formazione Preposto | Procedura Data Breach | Informativa e Consensi | Documento Valutazione Rischi (DVR) | Uso e Formazione DPI | Nomina Incaricati/Responsabili | Formazione Generale Lavoratori | Addetto Primo Soccorso | Addetto Antincendio | Registro dei Trattamenti,GDPR art.37 | D.Lgs81/08 art.34 | D.Lgs81/08 art.37 | GDPR art.33-34 | GDPR art.13 | D.Lgs81/08 art.28 | D.Lgs81/08 art.77 | GDPR art.28-29 | Accordo Stato-Regioni | DM 388/2003 | DM 2/9/2021 | GDPR art.30,"CHECKIX>CAOSIX, SICURIX>FUMIX, DOCUMIX>VOLTIX, SICURIX>LEAKIX, CIFRIX>PHISHIX, BLINKIX>TAGLIX, LUXPECTORIX>CAOSIX, SICURIX>CAOSIX, TRACCIX>OBLIVIX, FORMIX>RUMORIX, LUXPECTORIX>POLVERIX, HYGIENIX>OBLIVIX","Crea una PAGINA A FUMETTI a STORIA COMPLETA, verticale A4 (1024x1536), QUALITA' EDITORIALE DA STAMPA, stile ufficiale 'SICURIX TALES' IDENTICO alle immagini di riferimento allegate (stessi personaggi a mattoncini 3D, stessa impaginazione, stessi colori, stesse rese): minifigure espressive, ambientazioni ricche e dettagliate del settore, luci morbide, profondita', bordi vignetta netti. IMPAGINAZIONE OBBLIGATORIA: da 10 a 12 VIGNETTE numerate che raccontano UNA STORIA con arco narrativo completo (1 situazione normale -> 2-4 arrivano i pericoli coi cattivi -> 5-6 tensione/conseguenza -> 7-9 arriva SICURIX con gli eroi e applica il METODO81+ passo per passo -> 10-11 risoluzione ordinata -> 12 finale). HEADER in alto: SICURIX (mantello, medaglione arancione '81+', bussola) che presenta in un fumetto; grande titolo 'SICURIX TALES'; sottotitolo 'FAMIGLIE DATORI: Pericolo vs Soluzione con Metodo 81+'; legenda 3 voci (verde Sicurezza, rosso Rischio, blu 81+ Soluzione); fila di EROI coi nomi: CHECKIX, SICURIX, DOCUMIX, CIFRIX, BLINKIX, LUXPECTORIX. FOOTER in basso: grande 'Prima vedi. Poi sistemi.'; banner scudo verde 'PROTEGGIAMO. PREVENIAMO. MIGLIORIAMO.' e triangolo rosso 'DISATTENZIONE. RISCHI. COSTI. CAOS.'; logo '81+' + '81plus.net'. TRAMA (usa questi eventi come vignette; se sono meno di 10 aggiungi vignette di contesto, dialogo e reazione per arrivare a 10-12): 1) CAOSIX causa il pericolo 'DPO' (Nomina DPO / RPD); poi CHECKIX+SICURIX applicano il METODO81+; 2) FUMIX causa il pericolo 'Ruolo/RSPP' (RSPP / Datore di Lavoro RSPP); poi SICURIX+SICURIX applicano il METODO81+; 3) VOLTIX causa il pericolo 'Ruolo/Preposto' (Formazione Preposto); poi DOCUMIX+SICURIX applicano il METODO81+; 4) LEAKIX causa il pericolo 'Data breach' (Procedura Data Breach); poi SICURIX+SICURIX applicano il METODO81+; 5) PHISHIX causa il pericolo 'Documento' (Informativa e Consensi); poi CIFRIX+SICURIX applicano il METODO81+; 6) TAGLIX causa il pericolo 'Documento' (Documento Valutazione Rischi (DVR)); poi BLINKIX+SICURIX applicano il METODO81+; 7) CAOSIX causa il pericolo 'DPI' (Uso e Formazione DPI); poi LUXPECTORIX+SICURIX applicano il METODO81+; 8) CAOSIX causa il pericolo 'Nomine' (Nomina Incaricati/Responsabili); poi SICURIX+SICURIX applicano il METODO81+; 9) OBLIVIX causa il pericolo 'Formazione base' (Formazione Generale Lavoratori); poi TRACCIX+SICURIX applicano il METODO81+; 10) RUMORIX causa il pericolo 'Emergenze/Soccorso' (Addetto Primo Soccorso); poi FORMIX+SICURIX applicano il METODO81+; 11) POLVERIX causa il pericolo 'Emergenze/Incendio' (Addetto Antincendio); poi LUXPECTORIX+SICURIX applicano il METODO81+; 12) OBLIVIX causa il pericolo 'Registro' (Registro dei Trattamenti); poi HYGIENIX+SICURIX applicano il METODO81+. PALETTE BRAND ESCLUSIVA: nero #05050A, bianco panna, arancione #FF6A1A/#E8501A; ROSSO solo per 'PERICOLO', VERDE per la checklist 'Metodo 81+'. Logo '81+' ben visibile in OGNI vignetta. REGOLA STORIA: SICURIX NON agisce mai da solo - in OGNI vignetta di soluzione si fa AIUTARE dai suoi colleghi EROI (lavoro di squadra, ognuno col suo ruolo). TESTO: didascalie e fumetti MOLTO BREVI (1-4 parole), GRANDI, centrati, in ITALIANO con ORTOGRAFIA PERFETTA, senza parole inventate, lettere doppie errate o testo tagliato. CATTIVI (coerenti col canone): CAOSIX, FUMIX, VOLTIX, LEAKIX, PHISHIX, TAGLIX, OBLIVIX, RUMORIX, POLVERIX. EROI: CHECKIX, SICURIX, DOCUMIX, CIFRIX, BLINKIX, LUXPECTORIX, TRACCIX, FORMIX, HYGIENIX. NEGATIVE: nessun marchio LEGO reale, nessun personaggio protetto (Asterix ecc.), niente gore/horror, niente claim assoluti ('rischio zero','garantito','zero multe').",In Famiglie datori c'e' un obbligo che in tanti scoprono solo con la sanzione,"Famiglie datori: 3 minuti oggi o un problema enorme domani. Scegli tu.

In famiglie datori gli adempimenti obbligatori non aspettano: DPO, Ruolo/RSPP, Ruolo/Preposto, Data breach, Documento, DPI, Nomine, Formazione base, Emergenze/Soccorso, Emergenze/Incendio, Registro. In questa pagina TALES OF SICURIX il PERICOLO prende forma... e il METODO81+ lo rimette in ordine, passo dopo passo. Immagina la scena: prima il caos, poi la checklist che sistema tutto. Non e' burocrazia: e' la tua tranquillita.
👉 Iscriviti al corso: Corso privacy destinato ai lavoratori -> https://81plus.net/?corso=corso-privacy-destinato-ai-lavoratori
▶️ YouTube: youtube.com/@sicurissimo
Contenuto informativo. Prima vedi. Poi sistemi. 81plus.net",Corso privacy destinato ai lavoratori,https://81plus.net/?corso=corso-privacy-destinato-ai-lavoratori,#TalesOfSicurix #SICURIX #Metodo81 #81plus #Sicurissimo #Privacy #Sicurezza #SicurezzaSulLavoro,SICURIX_TALES_961011_14_5_3_13_9_0_8_11_1_6_7_10.webp,https://drive.google.com/drive/folders/1hICKXdl9JTZBL1pemG19oE_661z-EH_k,IMG_ERR
47.78.10,Commercio,G,Privacy+Sicurezza+HACCP,10,Procedura Data Breach | Registro dei Trattamenti | Uso e Formazione DPI | Lotta agli Infestanti (Pest Control) | Piano di Sanificazione | Informativa e Consensi | Stress Lavoro-Correlato | RSPP / Datore di Lavoro RSPP | Rappresentante Lavoratori Sicurezza (RLS) | Formazione Specifica (rischio medio),GDPR art.33-34 | GDPR art.30 | D.Lgs81/08 art.77 | Reg.CE 852/2004 | GDPR art.13 | D.Lgs81/08 art.28 | D.Lgs81/08 art.34 | D.Lgs81/08 art.47 | Accordo Stato-Regioni,"PREPOSTIX>OBLIVIX, PRIVACIX>RISKIX, HYGIENIX>NONDPIX, PRIVACIX>CROSSIX, CHECKIX>CAOSIX, CONSENSIX>HACKIX, FORMIX>SEGNALEX, CHECKIX>IMPROVVISIX, ROBOTIX81>ØTIX, SICURIX>CAOSIX","Crea una PAGINA A FUMETTI a STORIA COMPLETA, verticale A4 (1024x1536), QUALITA' EDITORIALE DA STAMPA, stile ufficiale 'SICURIX TALES' IDENTICO alle immagini di riferimento allegate (stessi personaggi a mattoncini 3D, stessa impaginazione, stessi colori, stesse rese): minifigure espressive, ambientazioni ricche e dettagliate del settore, luci morbide, profondita', bordi vignetta netti. IMPAGINAZIONE OBBLIGATORIA: da 10 a 12 VIGNETTE numerate che raccontano UNA STORIA con arco narrativo completo (1 situazione normale -> 2-4 arrivano i pericoli coi cattivi -> 5-6 tensione/conseguenza -> 7-9 arriva SICURIX con gli eroi e applica il METODO81+ passo per passo -> 10-11 risoluzione ordinata -> 12 finale). HEADER in alto: SICURIX (mantello, medaglione arancione '81+', bussola) che presenta in un fumetto; grande titolo 'SICURIX TALES'; sottotitolo 'COMMERCIO: Pericolo vs Soluzione con Metodo 81+'; legenda 3 voci (verde Sicurezza, rosso Rischio, blu 81+ Soluzione); fila di EROI coi nomi: PREPOSTIX, PRIVACIX, HYGIENIX, CHECKIX, CONSENSIX, FORMIX. FOOTER in basso: grande 'Prima vedi. Poi sistemi.'; banner scudo verde 'PROTEGGIAMO. PREVENIAMO. MIGLIORIAMO.' e triangolo rosso 'DISATTENZIONE. RISCHI. COSTI. CAOS.'; logo '81+' + '81plus.net'. TRAMA (usa questi eventi come vignette; se sono meno di 10 aggiungi vignette di contesto, dialogo e reazione per arrivare a 10-12): 1) OBLIVIX causa il pericolo 'Data breach' (Procedura Data Breach); poi PREPOSTIX+SICURIX applicano il METODO81+; 2) RISKIX causa il pericolo 'Registro' (Registro dei Trattamenti); poi PRIVACIX+SICURIX applicano il METODO81+; 3) NONDPIX causa il pericolo 'DPI' (Uso e Formazione DPI); poi HYGIENIX+SICURIX applicano il METODO81+; 4) CROSSIX causa il pericolo 'Infestanti' (Lotta agli Infestanti (Pest Control)); poi PRIVACIX+SICURIX applicano il METODO81+; 5) CAOSIX causa il pericolo 'Sanificazione' (Piano di Sanificazione); poi CHECKIX+SICURIX applicano il METODO81+; 6) HACKIX causa il pericolo 'Documento' (Informativa e Consensi); poi CONSENSIX+SICURIX applicano il METODO81+; 7) SEGNALEX causa il pericolo 'Stress' (Stress Lavoro-Correlato); poi FORMIX+SICURIX applicano il METODO81+; 8) IMPROVVISIX causa il pericolo 'Ruolo/RSPP' (RSPP / Datore di Lavoro RSPP); poi CHECKIX+SICURIX applicano il METODO81+; 9) ØTIX causa il pericolo 'Ruolo/RLS' (Rappresentante Lavoratori Sicurezza (RLS)); poi ROBOTIX81+SICURIX applicano il METODO81+; 10) CAOSIX causa il pericolo 'Formazione specifica' (Formazione Specifica (rischio medio)); poi SICURIX+SICURIX applicano il METODO81+. PALETTE BRAND ESCLUSIVA: nero #05050A, bianco panna, arancione #FF6A1A/#E8501A; ROSSO solo per 'PERICOLO', VERDE per la checklist 'Metodo 81+'. Logo '81+' ben visibile in OGNI vignetta. REGOLA STORIA: SICURIX NON agisce mai da solo - in OGNI vignetta di soluzione si fa AIUTARE dai suoi colleghi EROI (lavoro di squadra, ognuno col suo ruolo). TESTO: didascalie e fumetti MOLTO BREVI (1-4 parole), GRANDI, centrati, in ITALIANO con ORTOGRAFIA PERFETTA, senza parole inventate, lettere doppie errate o testo tagliato. CATTIVI (coerenti col canone): OBLIVIX, RISKIX, NONDPIX, CROSSIX, CAOSIX, HACKIX, SEGNALEX, IMPROVVISIX, ØTIX. EROI: PREPOSTIX, PRIVACIX, HYGIENIX, CHECKIX, CONSENSIX, FORMIX, ROBOTIX81, SICURIX. NEGATIVE: nessun marchio LEGO reale, nessun personaggio protetto (Asterix ecc.), niente gore/horror, niente claim assoluti ('rischio zero','garantito','zero multe').",Quello che l'ispettore controlla per primo in Commercio (e quasi nessuno lo sa),"Commercio: 3 minuti oggi o un problema enorme domani. Scegli tu.

In commercio gli adempimenti obbligatori non aspettano: Data breach, Registro, DPI, Infestanti, Sanificazione, Documento, Stress, Ruolo/RSPP, Ruolo/RLS, Formazione specifica. In questa pagina TALES OF SICURIX il PERICOLO prende forma... e il METODO81+ lo rimette in ordine, passo dopo passo. Immagina la scena: prima il caos, poi la checklist che sistema tutto. Chi si mette in regola prima, dorme meglio dopo.
👉 Iscriviti al corso: Corso privacy destinato ai lavoratori -> https://81plus.net/?corso=corso-privacy-destinato-ai-lavoratori
▶️ YouTube: youtube.com/@sicurissimo
Contenuto informativo. Prima vedi. Poi sistemi. 81plus.net",Corso privacy destinato ai lavoratori,https://81plus.net/?corso=corso-privacy-destinato-ai-lavoratori,#TalesOfSicurix #SICURIX #Metodo81 #81plus #Sicurissimo #Privacy #Sicurezza #HACCP #SicurezzaSulLavoro,SICURIX_TALES_477810_23_20_8_17_14_19_11_5_4_2.webp,https://drive.google.com/drive/folders/1hICKXdl9JTZBL1pemG19oE_661z-EH_k,IMG_ERR
33.12.70,Manifattura,C,Sicurezza+Ambientale+HACCP+Privacy,11,Formazione Specifica (rischio alto) | Formazione Ambientale | Formazione Preposto | Corso Alimentarista | Documento Valutazione Rischi (DVR) | Sorveglianza Sanitaria / Medico Competente | Informativa e Consensi | Registro dei Trattamenti | Movimentazione Manuale Carichi | Nomina Incaricati/Responsabili | Trattori e Macchine Agricole,Accordo Stato-Regioni | D.Lgs152/06 | D.Lgs81/08 art.37 | Reg.CE 852/2004 | D.Lgs81/08 art.28 | D.Lgs81/08 art.41 | GDPR art.13 | GDPR art.30 | D.Lgs81/08 Tit.VI | GDPR art.28-29,"HYGIENIX>BIOXIX, PRIVACIX>IMPROVVISIX, LUXPECTORIX>MULTIX, FORMIX>OBLIVIX, ROBOTIX81>MULTIX, BLINKIX>CHIMIKIX, SICURIX>SPYIX, SICURIX>OBLIVIX, TRACCIX>OBLIVIX, SICURIX>RISKIX, CHEFIX>FUMIX","Crea una PAGINA A FUMETTI a STORIA COMPLETA, verticale A4 (1024x1536), QUALITA' EDITORIALE DA STAMPA, stile ufficiale 'SICURIX TALES' IDENTICO alle immagini di riferimento allegate (stessi personaggi a mattoncini 3D, stessa impaginazione, stessi colori, stesse rese): minifigure espressive, ambientazioni ricche e dettagliate del settore, luci morbide, profondita', bordi vignetta netti. IMPAGINAZIONE OBBLIGATORIA: da 10 a 12 VIGNETTE numerate che raccontano UNA STORIA con arco narrativo completo (1 situazione normale -> 2-4 arrivano i pericoli coi cattivi -> 5-6 tensione/conseguenza -> 7-9 arriva SICURIX con gli eroi e applica il METODO81+ passo per passo -> 10-11 risoluzione ordinata -> 12 finale). HEADER in alto: SICURIX (mantello, medaglione arancione '81+', bussola) che presenta in un fumetto; grande titolo 'SICURIX TALES'; sottotitolo 'MANIFATTURA: Pericolo vs Soluzione con Metodo 81+'; legenda 3 voci (verde Sicurezza, rosso Rischio, blu 81+ Soluzione); fila di EROI coi nomi: HYGIENIX, PRIVACIX, LUXPECTORIX, FORMIX, ROBOTIX81, BLINKIX. FOOTER in basso: grande 'Prima vedi. Poi sistemi.'; banner scudo verde 'PROTEGGIAMO. PREVENIAMO. MIGLIORIAMO.' e triangolo rosso 'DISATTENZIONE. RISCHI. COSTI. CAOS.'; logo '81+' + '81plus.net'. TRAMA (usa questi eventi come vignette; se sono meno di 10 aggiungi vignette di contesto, dialogo e reazione per arrivare a 10-12): 1) BIOXIX causa il pericolo 'Formazione specifica' (Formazione Specifica (rischio alto)); poi HYGIENIX+SICURIX applicano il METODO81+; 2) IMPROVVISIX causa il pericolo 'Formazione' (Formazione Ambientale); poi PRIVACIX+SICURIX applicano il METODO81+; 3) MULTIX causa il pericolo 'Ruolo/Preposto' (Formazione Preposto); poi LUXPECTORIX+SICURIX applicano il METODO81+; 4) OBLIVIX causa il pericolo 'Corso' (Corso Alimentarista); poi FORMIX+SICURIX applicano il METODO81+; 5) MULTIX causa il pericolo 'Documento' (Documento Valutazione Rischi (DVR)); poi ROBOTIX81+SICURIX applicano il METODO81+; 6) CHIMIKIX causa il pericolo 'Sorveglianza sanitaria' (Sorveglianza Sanitaria / Medico Competente); poi BLINKIX+SICURIX applicano il METODO81+; 7) SPYIX causa il pericolo 'Documento' (Informativa e Consensi); poi SICURIX+SICURIX applicano il METODO81+; 8) OBLIVIX causa il pericolo 'Registro' (Registro dei Trattamenti); poi SICURIX+SICURIX applicano il METODO81+; 9) OBLIVIX causa il pericolo 'MMC' (Movimentazione Manuale Carichi); poi TRACCIX+SICURIX applicano il METODO81+; 10) RISKIX causa il pericolo 'Nomine' (Nomina Incaricati/Responsabili); poi SICURIX+SICURIX applicano il METODO81+; 11) FUMIX causa il pericolo 'Macchine agricole' (Trattori e Macchine Agricole); poi CHEFIX+SICURIX applicano il METODO81+. PALETTE BRAND ESCLUSIVA: nero #05050A, bianco panna, arancione #FF6A1A/#E8501A; ROSSO solo per 'PERICOLO', VERDE per la checklist 'Metodo 81+'. Logo '81+' ben visibile in OGNI vignetta. REGOLA STORIA: SICURIX NON agisce mai da solo - in OGNI vignetta di soluzione si fa AIUTARE dai suoi colleghi EROI (lavoro di squadra, ognuno col suo ruolo). TESTO: didascalie e fumetti MOLTO BREVI (1-4 parole), GRANDI, centrati, in ITALIANO con ORTOGRAFIA PERFETTA, senza parole inventate, lettere doppie errate o testo tagliato. CATTIVI (coerenti col canone): BIOXIX, IMPROVVISIX, MULTIX, OBLIVIX, CHIMIKIX, SPYIX, RISKIX, FUMIX. EROI: HYGIENIX, PRIVACIX, LUXPECTORIX, FORMIX, ROBOTIX81, BLINKIX, SICURIX, TRACCIX, CHEFIX. NEGATIVE: nessun marchio LEGO reale, nessun personaggio protetto (Asterix ecc.), niente gore/horror, niente claim assoluti ('rischio zero','garantito','zero multe').",Manifattura: 3 minuti oggi o un problema enorme domani. Scegli tu.,"La differenza tra chi in Manifattura dorme sereno e chi trema al controllo

In manifattura gli adempimenti obbligatori non aspettano: Formazione specifica, Formazione, Ruolo/Preposto, Corso, Documento, Sorveglianza sanitaria, Registro, MMC, Nomine, Macchine agricole. In questa pagina TALES OF SICURIX il PERICOLO prende forma... e il METODO81+ lo rimette in ordine, passo dopo passo. Immagina la scena: prima il caos, poi la checklist che sistema tutto. Chi si mette in regola prima, dorme meglio dopo.
👉 Iscriviti al corso: Corso lavoratore parte GENERALE 4 ore -> https://81plus.net/?corso=corso-lavoratore-parte-generale-4-ore
▶️ YouTube: youtube.com/@sicurissimo
Contenuto informativo. Prima vedi. Poi sistemi. 81plus.net",Corso lavoratore parte GENERALE 4 ore,https://81plus.net/?corso=corso-lavoratore-parte-generale-4-ore,#TalesOfSicurix #SICURIX #Metodo81 #81plus #Sicurissimo #Sicurezza #Ambientale #HACCP #Privacy #SicurezzaSulLavoro,SICURIX_TALES_331270_2_28_3_16_0_9_22_23_10_24_14.webp,https://drive.google.com/drive/folders/1hICKXdl9JTZBL1pemG19oE_661z-EH_k,IMG_ERR
