codice_ateco,settore,sezione,area_mix,n_vignette,adempimenti,fonti,cast_personaggi,image_prompt,titolo_clickbait,corpo_post,cta_prodotto,cta_url,hashtag,nome_file_webp,drive_folder,stato
46.23.00,Commercio,G,HACCP+Sicurezza+Privacy,10,Lotta agli Infestanti (Pest Control) | Manuale HACCP di Autocontrollo | Sorveglianza Sanitaria / Medico Competente | Videosorveglianza a norma | Formazione GDPR | RSPP / Datore di Lavoro RSPP | Corso Alimentarista | Documento Valutazione Rischi (DVR) | Registro dei Trattamenti | Formazione Preposto,Reg.CE 852/2004 | D.Lgs81/08 art.41 | Provv.Garante | GDPR art.32 | D.Lgs81/08 art.34 | D.Lgs81/08 art.28 | GDPR art.30 | D.Lgs81/08 art.37,"CHECKIX>SPORCKIX, SICURIX>TEMPORIX, SICURIX>SOTTOVALUTIX, PRIVACIX>RISKIX, SCUDIX>IMPROVVISIX, FORMIX>SOTTOVALUTIX, CIFRIX>DOSAGIX, LUXPECTORIX>MULTIX, PREPOSTIX>HACKIX, FORMIX>FUMIX","Crea una PAGINA A FUMETTI a STORIA COMPLETA, verticale A4 (1024x1536), QUALITA' EDITORIALE DA STAMPA, stile ufficiale 'SICURIX TALES' IDENTICO alle immagini di riferimento allegate (stessi personaggi a mattoncini 3D, stessa impaginazione, stessi colori, stesse rese): minifigure espressive, ambientazioni ricche e dettagliate del settore, luci morbide, profondita', bordi vignetta netti. IMPAGINAZIONE OBBLIGATORIA: da 10 a 12 VIGNETTE numerate che raccontano UNA STORIA con arco narrativo completo (1 situazione normale -> 2-4 arrivano i pericoli coi cattivi -> 5-6 tensione/conseguenza -> 7-9 arriva SICURIX con gli eroi e applica il METODO81+ passo per passo -> 10-11 risoluzione ordinata -> 12 finale). HEADER in alto: SICURIX (mantello, medaglione arancione '81+', bussola) che presenta in un fumetto; grande titolo 'SICURIX TALES'; sottotitolo 'COMMERCIO: Pericolo vs Soluzione con Metodo 81+'; legenda 3 voci (verde Sicurezza, rosso Rischio, blu 81+ Soluzione); fila di EROI coi nomi: CHECKIX, SICURIX, PRIVACIX, SCUDIX, FORMIX, CIFRIX. FOOTER in basso: grande 'Prima vedi. Poi sistemi.'; banner scudo verde 'PROTEGGIAMO. PREVENIAMO. MIGLIORIAMO.' e triangolo rosso 'DISATTENZIONE. RISCHI. COSTI. CAOS.'; logo '81+' + '81plus.net'. TRAMA (usa questi eventi come vignette; se sono meno di 10 aggiungi vignette di contesto, dialogo e reazione per arrivare a 10-12): 1) SPORCKIX causa il pericolo 'Infestanti' (Lotta agli Infestanti (Pest Control)); poi CHECKIX+SICURIX applicano il METODO81+; 2) TEMPORIX causa il pericolo 'Documento' (Manuale HACCP di Autocontrollo); poi SICURIX+SICURIX applicano il METODO81+; 3) SOTTOVALUTIX causa il pericolo 'Sorveglianza sanitaria' (Sorveglianza Sanitaria / Medico Competente); poi SICURIX+SICURIX applicano il METODO81+; 4) RISKIX causa il pericolo 'Videosorveglianza' (Videosorveglianza a norma); poi PRIVACIX+SICURIX applicano il METODO81+; 5) IMPROVVISIX causa il pericolo 'Formazione' (Formazione GDPR); poi SCUDIX+SICURIX applicano il METODO81+; 6) SOTTOVALUTIX causa il pericolo 'Ruolo/RSPP' (RSPP / Datore di Lavoro RSPP); poi FORMIX+SICURIX applicano il METODO81+; 7) DOSAGIX causa il pericolo 'Corso' (Corso Alimentarista); poi CIFRIX+SICURIX applicano il METODO81+; 8) MULTIX causa il pericolo 'Documento' (Documento Valutazione Rischi (DVR)); poi LUXPECTORIX+SICURIX applicano il METODO81+; 9) HACKIX causa il pericolo 'Registro' (Registro dei Trattamenti); poi PREPOSTIX+SICURIX applicano il METODO81+; 10) FUMIX causa il pericolo 'Ruolo/Preposto' (Formazione Preposto); poi FORMIX+SICURIX applicano il METODO81+. PALETTE BRAND ESCLUSIVA: nero #05050A, bianco panna, arancione #FF6A1A/#E8501A; ROSSO solo per 'PERICOLO', VERDE per la checklist 'Metodo 81+'. Logo '81+' ben visibile in OGNI vignetta. REGOLA STORIA: SICURIX NON agisce mai da solo - in OGNI vignetta di soluzione si fa AIUTARE dai suoi colleghi EROI (lavoro di squadra, ognuno col suo ruolo). TESTO: didascalie e fumetti MOLTO BREVI (1-4 parole), GRANDI, centrati, in ITALIANO con ORTOGRAFIA PERFETTA, senza parole inventate, lettere doppie errate o testo tagliato. CATTIVI (coerenti col canone): SPORCKIX, TEMPORIX, SOTTOVALUTIX, RISKIX, IMPROVVISIX, DOSAGIX, MULTIX, HACKIX, FUMIX. EROI: CHECKIX, SICURIX, PRIVACIX, SCUDIX, FORMIX, CIFRIX, LUXPECTORIX, PREPOSTIX. NEGATIVE: nessun marchio LEGO reale, nessun personaggio protetto (Asterix ecc.), niente gore/horror, niente claim assoluti ('rischio zero','garantito','zero multe').",Quello che l'ispettore controlla per primo in Commercio (e quasi nessuno lo sa),"Quello che l'ispettore controlla per primo in Commercio (e quasi nessuno lo sa)

In commercio gli adempimenti obbligatori non aspettano: Infestanti, Documento, Sorveglianza sanitaria, Videosorveglianza, Formazione, Ruolo/RSPP, Corso, Registro, Ruolo/Preposto. In questa pagina TALES OF SICURIX il PERICOLO prende forma... e il METODO81+ lo rimette in ordine, passo dopo passo. Immagina la scena: prima il caos, poi la checklist che sistema tutto. La regola c'e' gia': tu falla lavorare per te.
👉 Iscriviti al corso: Haccp - Corso responsabile industria alimentare -> https://81plus.net/?corso=haccp-corso-responsabile-industria-alimentare
▶️ YouTube: youtube.com/@sicurissimo
Contenuto informativo. Prima vedi. Poi sistemi. 81plus.net",Haccp - Corso responsabile industria alimentare,https://81plus.net/?corso=haccp-corso-responsabile-industria-alimentare,#TalesOfSicurix #SICURIX #Metodo81 #81plus #Sicurissimo #HACCP #Sicurezza #Privacy #SicurezzaSulLavoro,SICURIX_TALES_462300_17_12_9_24_22_5_13_0_20_3.webp,https://drive.google.com/drive/folders/1hICKXdl9JTZBL1pemG19oE_661z-EH_k,IMG_ERR
24.54.02,Manifattura,C,HACCP+Sicurezza+Privacy,12,Piano di Sanificazione | Rappresentante Lavoratori Sicurezza (RLS) | Nomina Incaricati/Responsabili | Movimentazione Manuale Carichi | Lotta agli Infestanti (Pest Control) | Sorveglianza Sanitaria / Medico Competente | Gestione Allergeni | Registro dei Trattamenti | Stress Lavoro-Correlato | Informativa e Consensi | Addetto Antincendio | Attrezzature e Macchine,Reg.CE 852/2004 | D.Lgs81/08 art.47 | GDPR art.28-29 | D.Lgs81/08 Tit.VI | D.Lgs81/08 art.41 | Reg.UE 1169/2011 | GDPR art.30 | D.Lgs81/08 art.28 | GDPR art.13 | DM 2/9/2021 | D.Lgs81/08 Tit.III,"LUXPECTORIX>CAOSIX, SICURIX>NONDPIX, PREPOSTIX>CAOSIX, DOCUMIX>OBLIVIX, LUXPECTORIX>CAOSIX, DOCUMIX>FRETTIX, ROBOTIX81>MESCOLIX, CIFRIX>OBLIVIX, CHEFIX>ØTIX, CIFRIX>RISKIX, DOCUMIX>VOLTIX, BLINKIX>SCHIACCIX","Crea una PAGINA A FUMETTI a STORIA COMPLETA, verticale A4 (1024x1536), QUALITA' EDITORIALE DA STAMPA, stile ufficiale 'SICURIX TALES' IDENTICO alle immagini di riferimento allegate (stessi personaggi a mattoncini 3D, stessa impaginazione, stessi colori, stesse rese): minifigure espressive, ambientazioni ricche e dettagliate del settore, luci morbide, profondita', bordi vignetta netti. IMPAGINAZIONE OBBLIGATORIA: da 10 a 12 VIGNETTE numerate che raccontano UNA STORIA con arco narrativo completo (1 situazione normale -> 2-4 arrivano i pericoli coi cattivi -> 5-6 tensione/conseguenza -> 7-9 arriva SICURIX con gli eroi e applica il METODO81+ passo per passo -> 10-11 risoluzione ordinata -> 12 finale). HEADER in alto: SICURIX (mantello, medaglione arancione '81+', bussola) che presenta in un fumetto; grande titolo 'SICURIX TALES'; sottotitolo 'MANIFATTURA: Pericolo vs Soluzione con Metodo 81+'; legenda 3 voci (verde Sicurezza, rosso Rischio, blu 81+ Soluzione); fila di EROI coi nomi: LUXPECTORIX, SICURIX, PREPOSTIX, DOCUMIX, ROBOTIX81, CIFRIX. FOOTER in basso: grande 'Prima vedi. Poi sistemi.'; banner scudo verde 'PROTEGGIAMO. PREVENIAMO. MIGLIORIAMO.' e triangolo rosso 'DISATTENZIONE. RISCHI. COSTI. CAOS.'; logo '81+' + '81plus.net'. TRAMA (usa questi eventi come vignette; se sono meno di 10 aggiungi vignette di contesto, dialogo e reazione per arrivare a 10-12): 1) CAOSIX causa il pericolo 'Sanificazione' (Piano di Sanificazione); poi LUXPECTORIX+SICURIX applicano il METODO81+; 2) NONDPIX causa il pericolo 'Ruolo/RLS' (Rappresentante Lavoratori Sicurezza (RLS)); poi SICURIX+SICURIX applicano il METODO81+; 3) CAOSIX causa il pericolo 'Nomine' (Nomina Incaricati/Responsabili); poi PREPOSTIX+SICURIX applicano il METODO81+; 4) OBLIVIX causa il pericolo 'MMC' (Movimentazione Manuale Carichi); poi DOCUMIX+SICURIX applicano il METODO81+; 5) CAOSIX causa il pericolo 'Infestanti' (Lotta agli Infestanti (Pest Control)); poi LUXPECTORIX+SICURIX applicano il METODO81+; 6) FRETTIX causa il pericolo 'Sorveglianza sanitaria' (Sorveglianza Sanitaria / Medico Competente); poi DOCUMIX+SICURIX applicano il METODO81+; 7) MESCOLIX causa il pericolo 'Allergeni' (Gestione Allergeni); poi ROBOTIX81+SICURIX applicano il METODO81+; 8) OBLIVIX causa il pericolo 'Registro' (Registro dei Trattamenti); poi CIFRIX+SICURIX applicano il METODO81+; 9) ØTIX causa il pericolo 'Stress' (Stress Lavoro-Correlato); poi CHEFIX+SICURIX applicano il METODO81+; 10) RISKIX causa il pericolo 'Documento' (Informativa e Consensi); poi CIFRIX+SICURIX applicano il METODO81+; 11) VOLTIX causa il pericolo 'Emergenze/Incendio' (Addetto Antincendio); poi DOCUMIX+SICURIX applicano il METODO81+; 12) SCHIACCIX causa il pericolo 'Attrezzature' (Attrezzature e Macchine); poi BLINKIX+SICURIX applicano il METODO81+. PALETTE BRAND ESCLUSIVA: nero #05050A, bianco panna, arancione #FF6A1A/#E8501A; ROSSO solo per 'PERICOLO', VERDE per la checklist 'Metodo 81+'. Logo '81+' ben visibile in OGNI vignetta. REGOLA STORIA: SICURIX NON agisce mai da solo - in OGNI vignetta di soluzione si fa AIUTARE dai suoi colleghi EROI (lavoro di squadra, ognuno col suo ruolo). TESTO: didascalie e fumetti MOLTO BREVI (1-4 parole), GRANDI, centrati, in ITALIANO con ORTOGRAFIA PERFETTA, senza parole inventate, lettere doppie errate o testo tagliato. CATTIVI (coerenti col canone): CAOSIX, NONDPIX, OBLIVIX, FRETTIX, MESCOLIX, ØTIX, RISKIX, VOLTIX, SCHIACCIX. EROI: LUXPECTORIX, SICURIX, PREPOSTIX, DOCUMIX, ROBOTIX81, CIFRIX, CHEFIX, BLINKIX. NEGATIVE: nessun marchio LEGO reale, nessun personaggio protetto (Asterix ecc.), niente gore/horror, niente claim assoluti ('rischio zero','garantito','zero multe').",In Manifattura c'e' un obbligo che in tanti scoprono solo con la sanzione,"Manifattura: 3 minuti oggi o un problema enorme domani. Scegli tu.

In manifattura gli adempimenti obbligatori non aspettano: Sanificazione, Ruolo/RLS, Nomine, MMC, Infestanti, Sorveglianza sanitaria, Allergeni, Registro, Stress, Documento, Emergenze/Incendio, Attrezzature. In questa pagina TALES OF SICURIX il PERICOLO prende forma... e il METODO81+ lo rimette in ordine, passo dopo passo. Immagina la scena: prima il caos, poi la checklist che sistema tutto. La regola c'e' gia': tu falla lavorare per te.
👉 Iscriviti al corso: Corso per addetto operazioni di pulizia e sanificazione aziendale rischio Covid-19 -> https://81plus.net/?corso=corso-per-addetto-operazioni-di-pulizia-e-sanificazione-azie
▶️ YouTube: youtube.com/@sicurissimo
Contenuto informativo. Prima vedi. Poi sistemi. 81plus.net",Corso per addetto operazioni di pulizia e sanificazione aziendale rischio Covid-19,https://81plus.net/?corso=corso-per-addetto-operazioni-di-pulizia-e-sanificazione-azie,#TalesOfSicurix #SICURIX #Metodo81 #81plus #Sicurissimo #HACCP #Sicurezza #Privacy #SicurezzaSulLavoro,SICURIX_TALES_245402_16_4_23_10_19_9_20_22_11_21_7_13.webp,https://drive.google.com/drive/folders/1hICKXdl9JTZBL1pemG19oE_661z-EH_k,IMG_ERR
47.52.32,Commercio,G,Sicurezza+HACCP+Privacy,10,RSPP / Datore di Lavoro RSPP | Corso Alimentarista | Registro dei Trattamenti | Movimentazione Manuale Carichi | Gestione Allergeni | Controllo Temperature e Celle | Formazione GDPR | Documento Valutazione Rischi (DVR) | Manuale HACCP di Autocontrollo | Formazione Specifica (rischio medio),D.Lgs81/08 art.34 | Reg.CE 852/2004 | GDPR art.30 | D.Lgs81/08 Tit.VI | Reg.UE 1169/2011 | GDPR art.32 | D.Lgs81/08 art.28 | Accordo Stato-Regioni,"TRACCIX>CADUTIX, CIFRIX>SPORCKIX, SICURIX>HACKIX, CHEFIX>VOLTIX, CHECKIX>FRETTIX, CHECKIX>CAOSIX, CHECKIX>IMPROVVISIX, CIFRIX>ØTIX, CONSENSIX>MULTIX, DOCUMIX>OBLIVIX","Crea una PAGINA A FUMETTI a STORIA COMPLETA, verticale A4 (1024x1536), QUALITA' EDITORIALE DA STAMPA, stile ufficiale 'SICURIX TALES' IDENTICO alle immagini di riferimento allegate (stessi personaggi a mattoncini 3D, stessa impaginazione, stessi colori, stesse rese): minifigure espressive, ambientazioni ricche e dettagliate del settore, luci morbide, profondita', bordi vignetta netti. IMPAGINAZIONE OBBLIGATORIA: da 10 a 12 VIGNETTE numerate che raccontano UNA STORIA con arco narrativo completo (1 situazione normale -> 2-4 arrivano i pericoli coi cattivi -> 5-6 tensione/conseguenza -> 7-9 arriva SICURIX con gli eroi e applica il METODO81+ passo per passo -> 10-11 risoluzione ordinata -> 12 finale). HEADER in alto: SICURIX (mantello, medaglione arancione '81+', bussola) che presenta in un fumetto; grande titolo 'SICURIX TALES'; sottotitolo 'COMMERCIO: Pericolo vs Soluzione con Metodo 81+'; legenda 3 voci (verde Sicurezza, rosso Rischio, blu 81+ Soluzione); fila di EROI coi nomi: TRACCIX, CIFRIX, SICURIX, CHEFIX, CHECKIX, CONSENSIX. FOOTER in basso: grande 'Prima vedi. Poi sistemi.'; banner scudo verde 'PROTEGGIAMO. PREVENIAMO. MIGLIORIAMO.' e triangolo rosso 'DISATTENZIONE. RISCHI. COSTI. CAOS.'; logo '81+' + '81plus.net'. TRAMA (usa questi eventi come vignette; se sono meno di 10 aggiungi vignette di contesto, dialogo e reazione per arrivare a 10-12): 1) CADUTIX causa il pericolo 'Ruolo/RSPP' (RSPP / Datore di Lavoro RSPP); poi TRACCIX+SICURIX applicano il METODO81+; 2) SPORCKIX causa il pericolo 'Corso' (Corso Alimentarista); poi CIFRIX+SICURIX applicano il METODO81+; 3) HACKIX causa il pericolo 'Registro' (Registro dei Trattamenti); poi SICURIX+SICURIX applicano il METODO81+; 4) VOLTIX causa il pericolo 'MMC' (Movimentazione Manuale Carichi); poi CHEFIX+SICURIX applicano il METODO81+; 5) FRETTIX causa il pericolo 'Allergeni' (Gestione Allergeni); poi CHECKIX+SICURIX applicano il METODO81+; 6) CAOSIX causa il pericolo 'Temperature' (Controllo Temperature e Celle); poi CHECKIX+SICURIX applicano il METODO81+; 7) IMPROVVISIX causa il pericolo 'Formazione' (Formazione GDPR); poi CHECKIX+SICURIX applicano il METODO81+; 8) ØTIX causa il pericolo 'Documento' (Documento Valutazione Rischi (DVR)); poi CIFRIX+SICURIX applicano il METODO81+; 9) MULTIX causa il pericolo 'Documento' (Manuale HACCP di Autocontrollo); poi CONSENSIX+SICURIX applicano il METODO81+; 10) OBLIVIX causa il pericolo 'Formazione specifica' (Formazione Specifica (rischio medio)); poi DOCUMIX+SICURIX applicano il METODO81+. PALETTE BRAND ESCLUSIVA: nero #05050A, bianco panna, arancione #FF6A1A/#E8501A; ROSSO solo per 'PERICOLO', VERDE per la checklist 'Metodo 81+'. Logo '81+' ben visibile in OGNI vignetta. REGOLA STORIA: SICURIX NON agisce mai da solo - in OGNI vignetta di soluzione si fa AIUTARE dai suoi colleghi EROI (lavoro di squadra, ognuno col suo ruolo). TESTO: didascalie e fumetti MOLTO BREVI (1-4 parole), GRANDI, centrati, in ITALIANO con ORTOGRAFIA PERFETTA, senza parole inventate, lettere doppie errate o testo tagliato. CATTIVI (coerenti col canone): CADUTIX, SPORCKIX, HACKIX, VOLTIX, FRETTIX, CAOSIX, IMPROVVISIX, ØTIX, MULTIX, OBLIVIX. EROI: TRACCIX, CIFRIX, SICURIX, CHEFIX, CHECKIX, CONSENSIX, DOCUMIX. NEGATIVE: nessun marchio LEGO reale, nessun personaggio protetto (Asterix ecc.), niente gore/horror, niente claim assoluti ('rischio zero','garantito','zero multe').",In Commercio c'e' un obbligo che in tanti scoprono solo con la sanzione,"Commercio: 3 minuti oggi o un problema enorme domani. Scegli tu.

In commercio gli adempimenti obbligatori non aspettano: Ruolo/RSPP, Corso, Registro, MMC, Allergeni, Temperature, Formazione, Documento, Formazione specifica. In questa pagina TALES OF SICURIX il PERICOLO prende forma... e il METODO81+ lo rimette in ordine, passo dopo passo. Immagina la scena: prima il caos, poi la checklist che sistema tutto. La regola c'e' gia': tu falla lavorare per te.
👉 Iscriviti al corso: RSPP Datore di Lavoro modulo 1 e 2 -> https://81plus.net/?corso=rspp-datore-di-lavoro-modulo-1-e-2
▶️ YouTube: youtube.com/@sicurissimo
Contenuto informativo. Prima vedi. Poi sistemi. 81plus.net",RSPP Datore di Lavoro modulo 1 e 2,https://81plus.net/?corso=rspp-datore-di-lavoro-modulo-1-e-2,#TalesOfSicurix #SICURIX #Metodo81 #81plus #Sicurissimo #Sicurezza #HACCP #Privacy #SicurezzaSulLavoro,SICURIX_TALES_475232_5_13_20_10_18_16_22_0_12_2.webp,https://drive.google.com/drive/folders/1hICKXdl9JTZBL1pemG19oE_661z-EH_k,IMG_ERR
11.05.00,Manifattura,C,Sicurezza+HACCP+Privacy,11,Addetto Antincendio | Corso Alimentarista | Procedura Data Breach | Attrezzature e Macchine | Formazione Specifica (rischio alto) | Registro dei Trattamenti | Gestione Allergeni | Rischio Rumore | RSPP / Datore di Lavoro RSPP | Informativa e Consensi | Piano di Sanificazione,DM 2/9/2021 | Reg.CE 852/2004 | GDPR art.33-34 | D.Lgs81/08 Tit.III | Accordo Stato-Regioni | GDPR art.30 | Reg.UE 1169/2011 | D.Lgs81/08 Tit.VIII | D.Lgs81/08 art.34 | GDPR art.13,"ROBOTIX81>SCHIACCIX, SCUDIX>MESCOLIX, TRACCIX>FRETTIX, DOCUMIX>CADUTIX, SICURIX>FUMIX, LUXPECTORIX>FRETTIX, SICURIX>CAOSIX, CHEFIX>CHIMIKIX, CIFRIX>NONDPIX, ROBOTIX81>SPYIX, PRIVACIX>CAOSIX","Crea una PAGINA A FUMETTI a STORIA COMPLETA, verticale A4 (1024x1536), QUALITA' EDITORIALE DA STAMPA, stile ufficiale 'SICURIX TALES' IDENTICO alle immagini di riferimento allegate (stessi personaggi a mattoncini 3D, stessa impaginazione, stessi colori, stesse rese): minifigure espressive, ambientazioni ricche e dettagliate del settore, luci morbide, profondita', bordi vignetta netti. IMPAGINAZIONE OBBLIGATORIA: da 10 a 12 VIGNETTE numerate che raccontano UNA STORIA con arco narrativo completo (1 situazione normale -> 2-4 arrivano i pericoli coi cattivi -> 5-6 tensione/conseguenza -> 7-9 arriva SICURIX con gli eroi e applica il METODO81+ passo per passo -> 10-11 risoluzione ordinata -> 12 finale). HEADER in alto: SICURIX (mantello, medaglione arancione '81+', bussola) che presenta in un fumetto; grande titolo 'SICURIX TALES'; sottotitolo 'MANIFATTURA: Pericolo vs Soluzione con Metodo 81+'; legenda 3 voci (verde Sicurezza, rosso Rischio, blu 81+ Soluzione); fila di EROI coi nomi: ROBOTIX81, SCUDIX, TRACCIX, DOCUMIX, SICURIX, LUXPECTORIX. FOOTER in basso: grande 'Prima vedi. Poi sistemi.'; banner scudo verde 'PROTEGGIAMO. PREVENIAMO. MIGLIORIAMO.' e triangolo rosso 'DISATTENZIONE. RISCHI. COSTI. CAOS.'; logo '81+' + '81plus.net'. TRAMA (usa questi eventi come vignette; se sono meno di 10 aggiungi vignette di contesto, dialogo e reazione per arrivare a 10-12): 1) SCHIACCIX causa il pericolo 'Emergenze/Incendio' (Addetto Antincendio); poi ROBOTIX81+SICURIX applicano il METODO81+; 2) MESCOLIX causa il pericolo 'Corso' (Corso Alimentarista); poi SCUDIX+SICURIX applicano il METODO81+; 3) FRETTIX causa il pericolo 'Data breach' (Procedura Data Breach); poi TRACCIX+SICURIX applicano il METODO81+; 4) CADUTIX causa il pericolo 'Attrezzature' (Attrezzature e Macchine); poi DOCUMIX+SICURIX applicano il METODO81+; 5) FUMIX causa il pericolo 'Formazione specifica' (Formazione Specifica (rischio alto)); poi SICURIX+SICURIX applicano il METODO81+; 6) FRETTIX causa il pericolo 'Registro' (Registro dei Trattamenti); poi LUXPECTORIX+SICURIX applicano il METODO81+; 7) CAOSIX causa il pericolo 'Allergeni' (Gestione Allergeni); poi SICURIX+SICURIX applicano il METODO81+; 8) CHIMIKIX causa il pericolo 'Rumore' (Rischio Rumore); poi CHEFIX+SICURIX applicano il METODO81+; 9) NONDPIX causa il pericolo 'Ruolo/RSPP' (RSPP / Datore di Lavoro RSPP); poi CIFRIX+SICURIX applicano il METODO81+; 10) SPYIX causa il pericolo 'Documento' (Informativa e Consensi); poi ROBOTIX81+SICURIX applicano il METODO81+; 11) CAOSIX causa il pericolo 'Sanificazione' (Piano di Sanificazione); poi PRIVACIX+SICURIX applicano il METODO81+. PALETTE BRAND ESCLUSIVA: nero #05050A, bianco panna, arancione #FF6A1A/#E8501A; ROSSO solo per 'PERICOLO', VERDE per la checklist 'Metodo 81+'. Logo '81+' ben visibile in OGNI vignetta. REGOLA STORIA: SICURIX NON agisce mai da solo - in OGNI vignetta di soluzione si fa AIUTARE dai suoi colleghi EROI (lavoro di squadra, ognuno col suo ruolo). TESTO: didascalie e fumetti MOLTO BREVI (1-4 parole), GRANDI, centrati, in ITALIANO con ORTOGRAFIA PERFETTA, senza parole inventate, lettere doppie errate o testo tagliato. CATTIVI (coerenti col canone): SCHIACCIX, MESCOLIX, FRETTIX, CADUTIX, FUMIX, CAOSIX, CHIMIKIX, NONDPIX, SPYIX. EROI: ROBOTIX81, SCUDIX, TRACCIX, DOCUMIX, SICURIX, LUXPECTORIX, CHEFIX, CIFRIX, PRIVACIX. NEGATIVE: nessun marchio LEGO reale, nessun personaggio protetto (Asterix ecc.), niente gore/horror, niente claim assoluti ('rischio zero','garantito','zero multe').",In Manifattura c'e' un obbligo che in tanti scoprono solo con la sanzione,"In Manifattura non e' 'se' arriva il controllo, e' 'quando'. Sei pronto?

In manifattura gli adempimenti obbligatori non aspettano: Emergenze/Incendio, Corso, Data breach, Attrezzature, Formazione specifica, Registro, Allergeni, Rumore, Ruolo/RSPP, Documento, Sanificazione. In questa pagina TALES OF SICURIX il PERICOLO prende forma... e il METODO81+ lo rimette in ordine, passo dopo passo. Immagina la scena: prima il caos, poi la checklist che sistema tutto. Chi si mette in regola prima, dorme meglio dopo.
👉 Iscriviti al corso: Corso antincendio livello 1 -> https://81plus.net/?corso=corso-antincendio-livello-1
▶️ YouTube: youtube.com/@sicurissimo
Contenuto informativo. Prima vedi. Poi sistemi. 81plus.net",Corso antincendio livello 1,https://81plus.net/?corso=corso-antincendio-livello-1,#TalesOfSicurix #SICURIX #Metodo81 #81plus #Sicurissimo #Sicurezza #HACCP #Privacy #SicurezzaSulLavoro,SICURIX_TALES_110500_7_15_25_13_2_22_20_12_5_21_16.webp,https://drive.google.com/drive/folders/1hICKXdl9JTZBL1pemG19oE_661z-EH_k,IMG_ERR
