codice_ateco,settore,sezione,area_mix,n_vignette,adempimenti,fonti,cast_personaggi,image_prompt,titolo_clickbait,corpo_post,cta_prodotto,cta_url,hashtag,nome_file_webp,drive_folder,stato
42.21.00,Costruzioni,F,Sicurezza+Privacy+Ambientale,10,Addetto Antincendio | Procedura Data Breach | Registro dei Trattamenti | Gestione Rifiuti e Registro | Lavori in Quota e Ponteggi | Rappresentante Lavoratori Sicurezza (RLS) | Formazione Generale Lavoratori | Formazione Preposto | Stress Lavoro-Correlato | Movimentazione Manuale Carichi,DM 2/9/2021 | GDPR art.33-34 | GDPR art.30 | D.Lgs152/06 | D.Lgs81/08 Tit.IV | D.Lgs81/08 art.47 | Accordo Stato-Regioni | D.Lgs81/08 art.37 | D.Lgs81/08 art.28 | D.Lgs81/08 Tit.VI,"BLINKIX>FUMIX, LUXPECTORIX>PHISHIX, DOCUMIX>PHISHIX, SCUDIX>OBLIVIX, SCUDIX>RISKIX, DOCUMIX>SEGNALEX, ROBOTIX81>IMPROVVISIX, FORMIX>OBLIVIX, ROBOTIX81>CHIMIKIX, FORMIX>VIBRIX","Crea una PAGINA A FUMETTI a STORIA COMPLETA, verticale A4 (1024x1536), QUALITA' EDITORIALE DA STAMPA, stile ufficiale 'SICURIX TALES' IDENTICO alle immagini di riferimento allegate (stessi personaggi a mattoncini 3D, stessa impaginazione, stessi colori, stesse rese): minifigure espressive, ambientazioni ricche e dettagliate del settore, luci morbide, profondita', bordi vignetta netti. IMPAGINAZIONE OBBLIGATORIA: da 10 a 12 VIGNETTE numerate che raccontano UNA STORIA con arco narrativo completo (1 situazione normale -> 2-4 arrivano i pericoli coi cattivi -> 5-6 tensione/conseguenza -> 7-9 arriva SICURIX con gli eroi e applica il METODO81+ passo per passo -> 10-11 risoluzione ordinata -> 12 finale). HEADER in alto: SICURIX (mantello, medaglione arancione '81+', bussola) che presenta in un fumetto; grande titolo 'SICURIX TALES'; sottotitolo 'COSTRUZIONI: Pericolo vs Soluzione con Metodo 81+'; legenda 3 voci (verde Sicurezza, rosso Rischio, blu 81+ Soluzione); fila di EROI coi nomi: BLINKIX, LUXPECTORIX, DOCUMIX, SCUDIX, ROBOTIX81, FORMIX. FOOTER in basso: grande 'Prima vedi. Poi sistemi.'; banner scudo verde 'PROTEGGIAMO. PREVENIAMO. MIGLIORIAMO.' e triangolo rosso 'DISATTENZIONE. RISCHI. COSTI. CAOS.'; logo '81+' + '81plus.net'. TRAMA (usa questi eventi come vignette; se sono meno di 10 aggiungi vignette di contesto, dialogo e reazione per arrivare a 10-12): 1) FUMIX causa il pericolo 'Emergenze/Incendio' (Addetto Antincendio); poi BLINKIX+SICURIX applicano il METODO81+; 2) PHISHIX causa il pericolo 'Data breach' (Procedura Data Breach); poi LUXPECTORIX+SICURIX applicano il METODO81+; 3) PHISHIX causa il pericolo 'Registro' (Registro dei Trattamenti); poi DOCUMIX+SICURIX applicano il METODO81+; 4) OBLIVIX causa il pericolo 'Rifiuti' (Gestione Rifiuti e Registro); poi SCUDIX+SICURIX applicano il METODO81+; 5) RISKIX causa il pericolo 'Lavori in quota' (Lavori in Quota e Ponteggi); poi SCUDIX+SICURIX applicano il METODO81+; 6) SEGNALEX causa il pericolo 'Ruolo/RLS' (Rappresentante Lavoratori Sicurezza (RLS)); poi DOCUMIX+SICURIX applicano il METODO81+; 7) IMPROVVISIX causa il pericolo 'Formazione base' (Formazione Generale Lavoratori); poi ROBOTIX81+SICURIX applicano il METODO81+; 8) OBLIVIX causa il pericolo 'Ruolo/Preposto' (Formazione Preposto); poi FORMIX+SICURIX applicano il METODO81+; 9) CHIMIKIX causa il pericolo 'Stress' (Stress Lavoro-Correlato); poi ROBOTIX81+SICURIX applicano il METODO81+; 10) VIBRIX causa il pericolo 'MMC' (Movimentazione Manuale Carichi); poi FORMIX+SICURIX applicano il METODO81+. PALETTE BRAND ESCLUSIVA: nero #05050A, bianco panna, arancione #FF6A1A/#E8501A; ROSSO solo per 'PERICOLO', VERDE per la checklist 'Metodo 81+'. Logo '81+' ben visibile in OGNI vignetta. REGOLA STORIA: SICURIX NON agisce mai da solo - in OGNI vignetta di soluzione si fa AIUTARE dai suoi colleghi EROI (lavoro di squadra, ognuno col suo ruolo). TESTO: didascalie e fumetti MOLTO BREVI (1-4 parole), GRANDI, centrati, in ITALIANO con ORTOGRAFIA PERFETTA, senza parole inventate, lettere doppie errate o testo tagliato. CATTIVI (coerenti col canone): FUMIX, PHISHIX, OBLIVIX, RISKIX, SEGNALEX, IMPROVVISIX, CHIMIKIX, VIBRIX. EROI: BLINKIX, LUXPECTORIX, DOCUMIX, SCUDIX, ROBOTIX81, FORMIX. NEGATIVE: nessun marchio LEGO reale, nessun personaggio protetto (Asterix ecc.), niente gore/horror, niente claim assoluti ('rischio zero','garantito','zero multe').",In Costruzioni c'e' un obbligo che in tanti scoprono solo con la sanzione,"Quello che l'ispettore controlla per primo in Costruzioni (e quasi nessuno lo sa)

In costruzioni gli adempimenti obbligatori non aspettano: Emergenze/Incendio, Data breach, Registro, Rifiuti, Lavori in quota, Ruolo/RLS, Formazione base, Ruolo/Preposto, Stress, MMC. In questa pagina TALES OF SICURIX il PERICOLO prende forma... e il METODO81+ lo rimette in ordine, passo dopo passo. Immagina la scena: prima il caos, poi la checklist che sistema tutto. Non e' burocrazia: e' la tua tranquillita.
👉 Iscriviti al corso: Corso antincendio livello 1 -> https://81plus.net/?corso=corso-antincendio-livello-1
▶️ YouTube: youtube.com/@sicurissimo
Contenuto informativo. Prima vedi. Poi sistemi. 81plus.net",Corso antincendio livello 1,https://81plus.net/?corso=corso-antincendio-livello-1,#TalesOfSicurix #SICURIX #Metodo81 #81plus #Sicurissimo #Sicurezza #Privacy #Ambientale #SicurezzaSulLavoro,SICURIX_TALES_422100_7_20_17_23_14_4_1_3_11_10.webp,https://drive.google.com/drive/folders/1hICKXdl9JTZBL1pemG19oE_661z-EH_k,IMG_ERR
74.11.20,Servizi alle imprese,N,Privacy+Sicurezza,11,Formazione GDPR | RSPP / Datore di Lavoro RSPP | Formazione Generale Lavoratori | Formazione Specifica (rischio basso) | Procedura Data Breach | Addetto Antincendio | Formazione Preposto | Registro dei Trattamenti | Nomina Incaricati/Responsabili | Documento Valutazione Rischi (DVR) | Informativa e Consensi,GDPR art.32 | D.Lgs81/08 art.34 | Accordo Stato-Regioni | GDPR art.33-34 | DM 2/9/2021 | D.Lgs81/08 art.37 | GDPR art.30 | GDPR art.28-29 | D.Lgs81/08 art.28 | GDPR art.13,"PREPOSTIX>CAOSIX, CHEFIX>RUMORIX, SCUDIX>CAOSIX, CONSENSIX>POLVERIX, PRIVACIX>PHISHIX, HYGIENIX>OBLIVIX, HYGIENIX>RUMORIX, BLINKIX>HACKIX, CHEFIX>SPYIX, DOCUMIX>VOLTIX, HYGIENIX>HACKIX","Crea una PAGINA A FUMETTI a STORIA COMPLETA, verticale A4 (1024x1536), QUALITA' EDITORIALE DA STAMPA, stile ufficiale 'SICURIX TALES' IDENTICO alle immagini di riferimento allegate (stessi personaggi a mattoncini 3D, stessa impaginazione, stessi colori, stesse rese): minifigure espressive, ambientazioni ricche e dettagliate del settore, luci morbide, profondita', bordi vignetta netti. IMPAGINAZIONE OBBLIGATORIA: da 10 a 12 VIGNETTE numerate che raccontano UNA STORIA con arco narrativo completo (1 situazione normale -> 2-4 arrivano i pericoli coi cattivi -> 5-6 tensione/conseguenza -> 7-9 arriva SICURIX con gli eroi e applica il METODO81+ passo per passo -> 10-11 risoluzione ordinata -> 12 finale). HEADER in alto: SICURIX (mantello, medaglione arancione '81+', bussola) che presenta in un fumetto; grande titolo 'SICURIX TALES'; sottotitolo 'SERVIZI ALLE IMPRESE: Pericolo vs Soluzione con Metodo 81+'; legenda 3 voci (verde Sicurezza, rosso Rischio, blu 81+ Soluzione); fila di EROI coi nomi: PREPOSTIX, CHEFIX, SCUDIX, CONSENSIX, PRIVACIX, HYGIENIX. FOOTER in basso: grande 'Prima vedi. Poi sistemi.'; banner scudo verde 'PROTEGGIAMO. PREVENIAMO. MIGLIORIAMO.' e triangolo rosso 'DISATTENZIONE. RISCHI. COSTI. CAOS.'; logo '81+' + '81plus.net'. TRAMA (usa questi eventi come vignette; se sono meno di 10 aggiungi vignette di contesto, dialogo e reazione per arrivare a 10-12): 1) CAOSIX causa il pericolo 'Formazione' (Formazione GDPR); poi PREPOSTIX+SICURIX applicano il METODO81+; 2) RUMORIX causa il pericolo 'Ruolo/RSPP' (RSPP / Datore di Lavoro RSPP); poi CHEFIX+SICURIX applicano il METODO81+; 3) CAOSIX causa il pericolo 'Formazione base' (Formazione Generale Lavoratori); poi SCUDIX+SICURIX applicano il METODO81+; 4) POLVERIX causa il pericolo 'Formazione specifica' (Formazione Specifica (rischio basso)); poi CONSENSIX+SICURIX applicano il METODO81+; 5) PHISHIX causa il pericolo 'Data breach' (Procedura Data Breach); poi PRIVACIX+SICURIX applicano il METODO81+; 6) OBLIVIX causa il pericolo 'Emergenze/Incendio' (Addetto Antincendio); poi HYGIENIX+SICURIX applicano il METODO81+; 7) RUMORIX causa il pericolo 'Ruolo/Preposto' (Formazione Preposto); poi HYGIENIX+SICURIX applicano il METODO81+; 8) HACKIX causa il pericolo 'Registro' (Registro dei Trattamenti); poi BLINKIX+SICURIX applicano il METODO81+; 9) SPYIX causa il pericolo 'Nomine' (Nomina Incaricati/Responsabili); poi CHEFIX+SICURIX applicano il METODO81+; 10) VOLTIX causa il pericolo 'Documento' (Documento Valutazione Rischi (DVR)); poi DOCUMIX+SICURIX applicano il METODO81+; 11) HACKIX causa il pericolo 'Documento' (Informativa e Consensi); poi HYGIENIX+SICURIX applicano il METODO81+. PALETTE BRAND ESCLUSIVA: nero #05050A, bianco panna, arancione #FF6A1A/#E8501A; ROSSO solo per 'PERICOLO', VERDE per la checklist 'Metodo 81+'. Logo '81+' ben visibile in OGNI vignetta. REGOLA STORIA: SICURIX NON agisce mai da solo - in OGNI vignetta di soluzione si fa AIUTARE dai suoi colleghi EROI (lavoro di squadra, ognuno col suo ruolo). TESTO: didascalie e fumetti MOLTO BREVI (1-4 parole), GRANDI, centrati, in ITALIANO con ORTOGRAFIA PERFETTA, senza parole inventate, lettere doppie errate o testo tagliato. CATTIVI (coerenti col canone): CAOSIX, RUMORIX, POLVERIX, PHISHIX, OBLIVIX, HACKIX, SPYIX, VOLTIX. EROI: PREPOSTIX, CHEFIX, SCUDIX, CONSENSIX, PRIVACIX, HYGIENIX, BLINKIX, DOCUMIX. NEGATIVE: nessun marchio LEGO reale, nessun personaggio protetto (Asterix ecc.), niente gore/horror, niente claim assoluti ('rischio zero','garantito','zero multe').",Servizi alle imprese: 3 minuti oggi o un problema enorme domani. Scegli tu.,"In Servizi alle imprese c'e' un obbligo che in tanti scoprono solo con la sanzione

In servizi alle imprese gli adempimenti obbligatori non aspettano: Formazione, Ruolo/RSPP, Formazione base, Formazione specifica, Data breach, Emergenze/Incendio, Ruolo/Preposto, Registro, Nomine, Documento. In questa pagina TALES OF SICURIX il PERICOLO prende forma... e il METODO81+ lo rimette in ordine, passo dopo passo. Immagina la scena: prima il caos, poi la checklist che sistema tutto. Mettere ordine ora costa poco. Rimediare dopo costa caro.
👉 Iscriviti al corso: GDPR 2016/679: privacy e trattamento dei dati personali -> https://81plus.net/?corso=gdpr-2016-679-privacy-e-trattamento-dei-dati-personali
▶️ YouTube: youtube.com/@sicurissimo
Contenuto informativo. Prima vedi. Poi sistemi. 81plus.net",GDPR 2016/679: privacy e trattamento dei dati personali,https://81plus.net/?corso=gdpr-2016-679-privacy-e-trattamento-dei-dati-personali,#TalesOfSicurix #SICURIX #Metodo81 #81plus #Sicurissimo #Privacy #Sicurezza #SicurezzaSulLavoro,SICURIX_TALES_741120_12_5_1_2_13_7_3_10_11_0_9.webp,https://drive.google.com/drive/folders/1hICKXdl9JTZBL1pemG19oE_661z-EH_k,IMG_ERR
43.60.00,Costruzioni,F,Sicurezza+Privacy+Ambientale,11,Rappresentante Lavoratori Sicurezza (RLS) | Rischio Rumore | Nomina Incaricati/Responsabili | Uso e Formazione DPI | Lavori in Quota e Ponteggi | Formazione Ambientale | Formazione Preposto | Gestione Rifiuti e Registro | Procedura Data Breach | RSPP / Datore di Lavoro RSPP | Formazione Generale Lavoratori,D.Lgs81/08 art.47 | D.Lgs81/08 Tit.VIII | GDPR art.28-29 | D.Lgs81/08 art.77 | D.Lgs81/08 Tit.IV | D.Lgs152/06 | D.Lgs81/08 art.37 | GDPR art.33-34 | D.Lgs81/08 art.34 | Accordo Stato-Regioni,"PRIVACIX>ØTIX, CIFRIX>FRETTIX, FORMIX>CANCELIX, SICURIX>SEGNALEX, SCUDIX>IMPROVVISIX, DOCUMIX>IMPROVVISIX, SCUDIX>MULTIX, PREPOSTIX>FRETTIX, SCUDIX>CANCELIX, LUXPECTORIX>CAOSIX, CIFRIX>POLVERIX","Crea una PAGINA A FUMETTI a STORIA COMPLETA, verticale A4 (1024x1536), QUALITA' EDITORIALE DA STAMPA, stile ufficiale 'SICURIX TALES' IDENTICO alle immagini di riferimento allegate (stessi personaggi a mattoncini 3D, stessa impaginazione, stessi colori, stesse rese): minifigure espressive, ambientazioni ricche e dettagliate del settore, luci morbide, profondita', bordi vignetta netti. IMPAGINAZIONE OBBLIGATORIA: da 10 a 12 VIGNETTE numerate che raccontano UNA STORIA con arco narrativo completo (1 situazione normale -> 2-4 arrivano i pericoli coi cattivi -> 5-6 tensione/conseguenza -> 7-9 arriva SICURIX con gli eroi e applica il METODO81+ passo per passo -> 10-11 risoluzione ordinata -> 12 finale). HEADER in alto: SICURIX (mantello, medaglione arancione '81+', bussola) che presenta in un fumetto; grande titolo 'SICURIX TALES'; sottotitolo 'COSTRUZIONI: Pericolo vs Soluzione con Metodo 81+'; legenda 3 voci (verde Sicurezza, rosso Rischio, blu 81+ Soluzione); fila di EROI coi nomi: PRIVACIX, CIFRIX, FORMIX, SICURIX, SCUDIX, DOCUMIX. FOOTER in basso: grande 'Prima vedi. Poi sistemi.'; banner scudo verde 'PROTEGGIAMO. PREVENIAMO. MIGLIORIAMO.' e triangolo rosso 'DISATTENZIONE. RISCHI. COSTI. CAOS.'; logo '81+' + '81plus.net'. TRAMA (usa questi eventi come vignette; se sono meno di 10 aggiungi vignette di contesto, dialogo e reazione per arrivare a 10-12): 1) ØTIX causa il pericolo 'Ruolo/RLS' (Rappresentante Lavoratori Sicurezza (RLS)); poi PRIVACIX+SICURIX applicano il METODO81+; 2) FRETTIX causa il pericolo 'Rumore' (Rischio Rumore); poi CIFRIX+SICURIX applicano il METODO81+; 3) CANCELIX causa il pericolo 'Nomine' (Nomina Incaricati/Responsabili); poi FORMIX+SICURIX applicano il METODO81+; 4) SEGNALEX causa il pericolo 'DPI' (Uso e Formazione DPI); poi SICURIX+SICURIX applicano il METODO81+; 5) IMPROVVISIX causa il pericolo 'Lavori in quota' (Lavori in Quota e Ponteggi); poi SCUDIX+SICURIX applicano il METODO81+; 6) IMPROVVISIX causa il pericolo 'Formazione' (Formazione Ambientale); poi DOCUMIX+SICURIX applicano il METODO81+; 7) MULTIX causa il pericolo 'Ruolo/Preposto' (Formazione Preposto); poi SCUDIX+SICURIX applicano il METODO81+; 8) FRETTIX causa il pericolo 'Rifiuti' (Gestione Rifiuti e Registro); poi PREPOSTIX+SICURIX applicano il METODO81+; 9) CANCELIX causa il pericolo 'Data breach' (Procedura Data Breach); poi SCUDIX+SICURIX applicano il METODO81+; 10) CAOSIX causa il pericolo 'Ruolo/RSPP' (RSPP / Datore di Lavoro RSPP); poi LUXPECTORIX+SICURIX applicano il METODO81+; 11) POLVERIX causa il pericolo 'Formazione base' (Formazione Generale Lavoratori); poi CIFRIX+SICURIX applicano il METODO81+. PALETTE BRAND ESCLUSIVA: nero #05050A, bianco panna, arancione #FF6A1A/#E8501A; ROSSO solo per 'PERICOLO', VERDE per la checklist 'Metodo 81+'. Logo '81+' ben visibile in OGNI vignetta. REGOLA STORIA: SICURIX NON agisce mai da solo - in OGNI vignetta di soluzione si fa AIUTARE dai suoi colleghi EROI (lavoro di squadra, ognuno col suo ruolo). TESTO: didascalie e fumetti MOLTO BREVI (1-4 parole), GRANDI, centrati, in ITALIANO con ORTOGRAFIA PERFETTA, senza parole inventate, lettere doppie errate o testo tagliato. CATTIVI (coerenti col canone): ØTIX, FRETTIX, CANCELIX, SEGNALEX, IMPROVVISIX, MULTIX, CAOSIX, POLVERIX. EROI: PRIVACIX, CIFRIX, FORMIX, SICURIX, SCUDIX, DOCUMIX, PREPOSTIX, LUXPECTORIX. NEGATIVE: nessun marchio LEGO reale, nessun personaggio protetto (Asterix ecc.), niente gore/horror, niente claim assoluti ('rischio zero','garantito','zero multe').",Costruzioni: 3 minuti oggi o un problema enorme domani. Scegli tu.,"In Costruzioni c'e' un obbligo che in tanti scoprono solo con la sanzione

In costruzioni gli adempimenti obbligatori non aspettano: Ruolo/RLS, Rumore, Nomine, DPI, Lavori in quota, Formazione, Ruolo/Preposto, Rifiuti, Data breach, Ruolo/RSPP, Formazione base. In questa pagina TALES OF SICURIX il PERICOLO prende forma... e il METODO81+ lo rimette in ordine, passo dopo passo. Immagina la scena: prima il caos, poi la checklist che sistema tutto. Mettere ordine ora costa poco. Rimediare dopo costa caro.
👉 Iscriviti al corso: Corso RLS -> https://81plus.net/?corso=corso-rls
▶️ YouTube: youtube.com/@sicurissimo
Contenuto informativo. Prima vedi. Poi sistemi. 81plus.net",Corso RLS,https://81plus.net/?corso=corso-rls,#TalesOfSicurix #SICURIX #Metodo81 #81plus #Sicurissimo #Sicurezza #Privacy #Ambientale #SicurezzaSulLavoro,SICURIX_TALES_436000_4_12_17_8_14_21_3_20_19_5_1.webp,https://drive.google.com/drive/folders/1hICKXdl9JTZBL1pemG19oE_661z-EH_k,IMG_ERR
74.99.41,Servizi alle imprese,N,Sicurezza+Privacy,12,Formazione Preposto | Addetto Antincendio | Addetto Primo Soccorso | RSPP / Datore di Lavoro RSPP | Formazione Generale Lavoratori | Uso e Formazione DPI | Videoterminali (VDT) | Documento Valutazione Rischi (DVR) | Rappresentante Lavoratori Sicurezza (RLS) | Formazione Specifica (rischio basso) | Procedura Data Breach | Formazione GDPR,D.Lgs81/08 art.37 | DM 2/9/2021 | DM 388/2003 | D.Lgs81/08 art.34 | Accordo Stato-Regioni | D.Lgs81/08 art.77 | D.Lgs81/08 Tit.VII | D.Lgs81/08 art.28 | D.Lgs81/08 art.47 | GDPR art.33-34 | GDPR art.32,"PRIVACIX>SEGNALEX, ROBOTIX81>CAOSIX, BLINKIX>IMPROVVISIX, CONSENSIX>TAGLIX, FORMIX>VIBRIX, CIFRIX>CHIMIKIX, TRACCIX>MULTIX, CIFRIX>SCIVOLIX, CHECKIX>SCHIACCIX, CHECKIX>POLVERIX, FORMIX>CAOSIX, ROBOTIX81>FRETTIX","Crea una PAGINA A FUMETTI a STORIA COMPLETA, verticale A4 (1024x1536), QUALITA' EDITORIALE DA STAMPA, stile ufficiale 'SICURIX TALES' IDENTICO alle immagini di riferimento allegate (stessi personaggi a mattoncini 3D, stessa impaginazione, stessi colori, stesse rese): minifigure espressive, ambientazioni ricche e dettagliate del settore, luci morbide, profondita', bordi vignetta netti. IMPAGINAZIONE OBBLIGATORIA: da 10 a 12 VIGNETTE numerate che raccontano UNA STORIA con arco narrativo completo (1 situazione normale -> 2-4 arrivano i pericoli coi cattivi -> 5-6 tensione/conseguenza -> 7-9 arriva SICURIX con gli eroi e applica il METODO81+ passo per passo -> 10-11 risoluzione ordinata -> 12 finale). HEADER in alto: SICURIX (mantello, medaglione arancione '81+', bussola) che presenta in un fumetto; grande titolo 'SICURIX TALES'; sottotitolo 'SERVIZI ALLE IMPRESE: Pericolo vs Soluzione con Metodo 81+'; legenda 3 voci (verde Sicurezza, rosso Rischio, blu 81+ Soluzione); fila di EROI coi nomi: PRIVACIX, ROBOTIX81, BLINKIX, CONSENSIX, FORMIX, CIFRIX. FOOTER in basso: grande 'Prima vedi. Poi sistemi.'; banner scudo verde 'PROTEGGIAMO. PREVENIAMO. MIGLIORIAMO.' e triangolo rosso 'DISATTENZIONE. RISCHI. COSTI. CAOS.'; logo '81+' + '81plus.net'. TRAMA (usa questi eventi come vignette; se sono meno di 10 aggiungi vignette di contesto, dialogo e reazione per arrivare a 10-12): 1) SEGNALEX causa il pericolo 'Ruolo/Preposto' (Formazione Preposto); poi PRIVACIX+SICURIX applicano il METODO81+; 2) CAOSIX causa il pericolo 'Emergenze/Incendio' (Addetto Antincendio); poi ROBOTIX81+SICURIX applicano il METODO81+; 3) IMPROVVISIX causa il pericolo 'Emergenze/Soccorso' (Addetto Primo Soccorso); poi BLINKIX+SICURIX applicano il METODO81+; 4) TAGLIX causa il pericolo 'Ruolo/RSPP' (RSPP / Datore di Lavoro RSPP); poi CONSENSIX+SICURIX applicano il METODO81+; 5) VIBRIX causa il pericolo 'Formazione base' (Formazione Generale Lavoratori); poi FORMIX+SICURIX applicano il METODO81+; 6) CHIMIKIX causa il pericolo 'DPI' (Uso e Formazione DPI); poi CIFRIX+SICURIX applicano il METODO81+; 7) MULTIX causa il pericolo 'Videoterminali' (Videoterminali (VDT)); poi TRACCIX+SICURIX applicano il METODO81+; 8) SCIVOLIX causa il pericolo 'Documento' (Documento Valutazione Rischi (DVR)); poi CIFRIX+SICURIX applicano il METODO81+; 9) SCHIACCIX causa il pericolo 'Ruolo/RLS' (Rappresentante Lavoratori Sicurezza (RLS)); poi CHECKIX+SICURIX applicano il METODO81+; 10) POLVERIX causa il pericolo 'Formazione specifica' (Formazione Specifica (rischio basso)); poi CHECKIX+SICURIX applicano il METODO81+; 11) CAOSIX causa il pericolo 'Data breach' (Procedura Data Breach); poi FORMIX+SICURIX applicano il METODO81+; 12) FRETTIX causa il pericolo 'Formazione' (Formazione GDPR); poi ROBOTIX81+SICURIX applicano il METODO81+. PALETTE BRAND ESCLUSIVA: nero #05050A, bianco panna, arancione #FF6A1A/#E8501A; ROSSO solo per 'PERICOLO', VERDE per la checklist 'Metodo 81+'. Logo '81+' ben visibile in OGNI vignetta. REGOLA STORIA: SICURIX NON agisce mai da solo - in OGNI vignetta di soluzione si fa AIUTARE dai suoi colleghi EROI (lavoro di squadra, ognuno col suo ruolo). TESTO: didascalie e fumetti MOLTO BREVI (1-4 parole), GRANDI, centrati, in ITALIANO con ORTOGRAFIA PERFETTA, senza parole inventate, lettere doppie errate o testo tagliato. CATTIVI (coerenti col canone): SEGNALEX, CAOSIX, IMPROVVISIX, TAGLIX, VIBRIX, CHIMIKIX, MULTIX, SCIVOLIX, SCHIACCIX, POLVERIX, FRETTIX. EROI: PRIVACIX, ROBOTIX81, BLINKIX, CONSENSIX, FORMIX, CIFRIX, TRACCIX, CHECKIX. NEGATIVE: nessun marchio LEGO reale, nessun personaggio protetto (Asterix ecc.), niente gore/horror, niente claim assoluti ('rischio zero','garantito','zero multe').","In Servizi alle imprese non e' 'se' arriva il controllo, e' 'quando'. Sei pronto?","Servizi alle imprese: 3 minuti oggi o un problema enorme domani. Scegli tu.

In servizi alle imprese gli adempimenti obbligatori non aspettano: Ruolo/Preposto, Emergenze/Incendio, Emergenze/Soccorso, Ruolo/RSPP, Formazione base, DPI, Videoterminali, Documento, Ruolo/RLS, Formazione specifica, Data breach, Formazione. In questa pagina TALES OF SICURIX il PERICOLO prende forma... e il METODO81+ lo rimette in ordine, passo dopo passo. Immagina la scena: prima il caos, poi la checklist che sistema tutto. Non e' burocrazia: e' la tua tranquillita.
👉 Iscriviti al corso: Corso per Preposto -> https://81plus.net/?corso=corso-per-preposto
▶️ YouTube: youtube.com/@sicurissimo
Contenuto informativo. Prima vedi. Poi sistemi. 81plus.net",Corso per Preposto,https://81plus.net/?corso=corso-per-preposto,#TalesOfSicurix #SICURIX #Metodo81 #81plus #Sicurissimo #Sicurezza #Privacy #SicurezzaSulLavoro,SICURIX_TALES_749941_3_7_6_5_1_8_9_0_4_2_14_13.webp,https://drive.google.com/drive/folders/1hICKXdl9JTZBL1pemG19oE_661z-EH_k,IMG_ERR
