codice_ateco,settore,sezione,area_mix,n_vignette,adempimenti,fonti,cast_personaggi,image_prompt,titolo_clickbait,corpo_post,cta_prodotto,cta_url,hashtag,nome_file_webp,drive_folder,stato
35.16.00,Energia,D,Sicurezza+Privacy,10,Attrezzature e Macchine | Addetto Primo Soccorso | Rischio Elettrico (PES/PAV) | Informativa e Consensi | Procedura Data Breach | Formazione Generale Lavoratori | Rappresentante Lavoratori Sicurezza (RLS) | Formazione Preposto | Addetto Antincendio | Movimentazione Manuale Carichi,D.Lgs81/08 Tit.III | DM 388/2003 | CEI 11-27 | GDPR art.13 | GDPR art.33-34 | Accordo Stato-Regioni | D.Lgs81/08 art.47 | D.Lgs81/08 art.37 | DM 2/9/2021 | D.Lgs81/08 Tit.VI,"CONSENSIX>VIBRIX, HYGIENIX>CAOSIX, ROBOTIX81>TAGLIX, CONSENSIX>CAOSIX, SCUDIX>LEAKIX, CIFRIX>POLVERIX, HYGIENIX>RISKIX, SICURIX>CHIMIKIX, BLINKIX>POLVERIX, LUXPECTORIX>CHIMIKIX","Crea una PAGINA A FUMETTI a STORIA COMPLETA, verticale A4 (1024x1536), QUALITA' EDITORIALE DA STAMPA, stile ufficiale 'SICURIX TALES' IDENTICO alle immagini di riferimento allegate (stessi personaggi a mattoncini 3D, stessa impaginazione, stessi colori, stesse rese): minifigure espressive, ambientazioni ricche e dettagliate del settore, luci morbide, profondita', bordi vignetta netti. IMPAGINAZIONE OBBLIGATORIA: da 10 a 12 VIGNETTE numerate che raccontano UNA STORIA con arco narrativo completo (1 situazione normale -> 2-4 arrivano i pericoli coi cattivi -> 5-6 tensione/conseguenza -> 7-9 arriva SICURIX con gli eroi e applica il METODO81+ passo per passo -> 10-11 risoluzione ordinata -> 12 finale). HEADER in alto: SICURIX (mantello, medaglione arancione '81+', bussola) che presenta in un fumetto; grande titolo 'SICURIX TALES'; sottotitolo 'ENERGIA: Pericolo vs Soluzione con Metodo 81+'; legenda 3 voci (verde Sicurezza, rosso Rischio, blu 81+ Soluzione); fila di EROI coi nomi: CONSENSIX, HYGIENIX, ROBOTIX81, SCUDIX, CIFRIX, SICURIX. FOOTER in basso: grande 'Prima vedi. Poi sistemi.'; banner scudo verde 'PROTEGGIAMO. PREVENIAMO. MIGLIORIAMO.' e triangolo rosso 'DISATTENZIONE. RISCHI. COSTI. CAOS.'; logo '81+' + '81plus.net'. TRAMA (usa questi eventi come vignette; se sono meno di 10 aggiungi vignette di contesto, dialogo e reazione per arrivare a 10-12): 1) VIBRIX causa il pericolo 'Attrezzature' (Attrezzature e Macchine); poi CONSENSIX+SICURIX applicano il METODO81+; 2) CAOSIX causa il pericolo 'Emergenze/Soccorso' (Addetto Primo Soccorso); poi HYGIENIX+SICURIX applicano il METODO81+; 3) TAGLIX causa il pericolo 'Rischio elettrico' (Rischio Elettrico (PES/PAV)); poi ROBOTIX81+SICURIX applicano il METODO81+; 4) CAOSIX causa il pericolo 'Documento' (Informativa e Consensi); poi CONSENSIX+SICURIX applicano il METODO81+; 5) LEAKIX causa il pericolo 'Data breach' (Procedura Data Breach); poi SCUDIX+SICURIX applicano il METODO81+; 6) POLVERIX causa il pericolo 'Formazione base' (Formazione Generale Lavoratori); poi CIFRIX+SICURIX applicano il METODO81+; 7) RISKIX causa il pericolo 'Ruolo/RLS' (Rappresentante Lavoratori Sicurezza (RLS)); poi HYGIENIX+SICURIX applicano il METODO81+; 8) CHIMIKIX causa il pericolo 'Ruolo/Preposto' (Formazione Preposto); poi SICURIX+SICURIX applicano il METODO81+; 9) POLVERIX causa il pericolo 'Emergenze/Incendio' (Addetto Antincendio); poi BLINKIX+SICURIX applicano il METODO81+; 10) CHIMIKIX causa il pericolo 'MMC' (Movimentazione Manuale Carichi); poi LUXPECTORIX+SICURIX applicano il METODO81+. PALETTE BRAND ESCLUSIVA: nero #05050A, bianco panna, arancione #FF6A1A/#E8501A; ROSSO solo per 'PERICOLO', VERDE per la checklist 'Metodo 81+'. Logo '81+' ben visibile in OGNI vignetta. REGOLA STORIA: SICURIX NON agisce mai da solo - in OGNI vignetta di soluzione si fa AIUTARE dai suoi colleghi EROI (lavoro di squadra, ognuno col suo ruolo). TESTO: didascalie e fumetti MOLTO BREVI (1-4 parole), GRANDI, centrati, in ITALIANO con ORTOGRAFIA PERFETTA, senza parole inventate, lettere doppie errate o testo tagliato. CATTIVI (coerenti col canone): VIBRIX, CAOSIX, TAGLIX, LEAKIX, POLVERIX, RISKIX, CHIMIKIX. EROI: CONSENSIX, HYGIENIX, ROBOTIX81, SCUDIX, CIFRIX, SICURIX, BLINKIX, LUXPECTORIX. NEGATIVE: nessun marchio LEGO reale, nessun personaggio protetto (Asterix ecc.), niente gore/horror, niente claim assoluti ('rischio zero','garantito','zero multe').","In Energia non e' 'se' arriva il controllo, e' 'quando'. Sei pronto?","La differenza tra chi in Energia dorme sereno e chi trema al controllo

In energia gli adempimenti obbligatori non aspettano: Attrezzature, Emergenze/Soccorso, Rischio elettrico, Documento, Data breach, Formazione base, Ruolo/RLS, Ruolo/Preposto, Emergenze/Incendio, MMC. In questa pagina TALES OF SICURIX il PERICOLO prende forma... e il METODO81+ lo rimette in ordine, passo dopo passo. Immagina la scena: prima il caos, poi la checklist che sistema tutto. Non e' burocrazia: e' la tua tranquillita.
👉 Iscriviti al corso: Corso Lavori in Quota e DPI Anticaduta -> https://81plus.net/?corso=corso-lavori-in-quota-e-dpi-anticaduta
▶️ YouTube: youtube.com/@sicurissimo
Contenuto informativo. Prima vedi. Poi sistemi. 81plus.net",Corso Lavori in Quota e DPI Anticaduta,https://81plus.net/?corso=corso-lavori-in-quota-e-dpi-anticaduta,#TalesOfSicurix #SICURIX #Metodo81 #81plus #Sicurissimo #Sicurezza #Privacy #SicurezzaSulLavoro,SICURIX_TALES_351600_13_6_14_15_19_1_4_3_7_10.webp,https://drive.google.com/drive/folders/1hICKXdl9JTZBL1pemG19oE_661z-EH_k,IMG_ERR
82.30.09,PA,O,Sicurezza+Privacy,12,Formazione Preposto | Nomina Incaricati/Responsabili | Nomina DPO / RPD | Movimentazione Manuale Carichi | Stress Lavoro-Correlato | Documento Valutazione Rischi (DVR) | Addetto Antincendio | Procedura Data Breach | Formazione GDPR | Uso e Formazione DPI | Rappresentante Lavoratori Sicurezza (RLS) | Sorveglianza Sanitaria / Medico Competente,D.Lgs81/08 art.37 | GDPR art.28-29 | GDPR art.37 | D.Lgs81/08 Tit.VI | D.Lgs81/08 art.28 | DM 2/9/2021 | GDPR art.33-34 | GDPR art.32 | D.Lgs81/08 art.77 | D.Lgs81/08 art.47 | D.Lgs81/08 art.41,"CIFRIX>SOTTOVALUTIX, HYGIENIX>PHISHIX, CONSENSIX>LEAKIX, FORMIX>SEGNALEX, SCUDIX>OBLIVIX, SCUDIX>ØTIX, CIFRIX>TAGLIX, LUXPECTORIX>RISKIX, FORMIX>MULTIX, TRACCIX>SOTTOVALUTIX, LUXPECTORIX>RISKIX, TRACCIX>FRETTIX","Crea una PAGINA A FUMETTI a STORIA COMPLETA, verticale A4 (1024x1536), QUALITA' EDITORIALE DA STAMPA, stile ufficiale 'SICURIX TALES' IDENTICO alle immagini di riferimento allegate (stessi personaggi a mattoncini 3D, stessa impaginazione, stessi colori, stesse rese): minifigure espressive, ambientazioni ricche e dettagliate del settore, luci morbide, profondita', bordi vignetta netti. IMPAGINAZIONE OBBLIGATORIA: da 10 a 12 VIGNETTE numerate che raccontano UNA STORIA con arco narrativo completo (1 situazione normale -> 2-4 arrivano i pericoli coi cattivi -> 5-6 tensione/conseguenza -> 7-9 arriva SICURIX con gli eroi e applica il METODO81+ passo per passo -> 10-11 risoluzione ordinata -> 12 finale). HEADER in alto: SICURIX (mantello, medaglione arancione '81+', bussola) che presenta in un fumetto; grande titolo 'SICURIX TALES'; sottotitolo 'PA: Pericolo vs Soluzione con Metodo 81+'; legenda 3 voci (verde Sicurezza, rosso Rischio, blu 81+ Soluzione); fila di EROI coi nomi: CIFRIX, HYGIENIX, CONSENSIX, FORMIX, SCUDIX, LUXPECTORIX. FOOTER in basso: grande 'Prima vedi. Poi sistemi.'; banner scudo verde 'PROTEGGIAMO. PREVENIAMO. MIGLIORIAMO.' e triangolo rosso 'DISATTENZIONE. RISCHI. COSTI. CAOS.'; logo '81+' + '81plus.net'. TRAMA (usa questi eventi come vignette; se sono meno di 10 aggiungi vignette di contesto, dialogo e reazione per arrivare a 10-12): 1) SOTTOVALUTIX causa il pericolo 'Ruolo/Preposto' (Formazione Preposto); poi CIFRIX+SICURIX applicano il METODO81+; 2) PHISHIX causa il pericolo 'Nomine' (Nomina Incaricati/Responsabili); poi HYGIENIX+SICURIX applicano il METODO81+; 3) LEAKIX causa il pericolo 'DPO' (Nomina DPO / RPD); poi CONSENSIX+SICURIX applicano il METODO81+; 4) SEGNALEX causa il pericolo 'MMC' (Movimentazione Manuale Carichi); poi FORMIX+SICURIX applicano il METODO81+; 5) OBLIVIX causa il pericolo 'Stress' (Stress Lavoro-Correlato); poi SCUDIX+SICURIX applicano il METODO81+; 6) ØTIX causa il pericolo 'Documento' (Documento Valutazione Rischi (DVR)); poi SCUDIX+SICURIX applicano il METODO81+; 7) TAGLIX causa il pericolo 'Emergenze/Incendio' (Addetto Antincendio); poi CIFRIX+SICURIX applicano il METODO81+; 8) RISKIX causa il pericolo 'Data breach' (Procedura Data Breach); poi LUXPECTORIX+SICURIX applicano il METODO81+; 9) MULTIX causa il pericolo 'Formazione' (Formazione GDPR); poi FORMIX+SICURIX applicano il METODO81+; 10) SOTTOVALUTIX causa il pericolo 'DPI' (Uso e Formazione DPI); poi TRACCIX+SICURIX applicano il METODO81+; 11) RISKIX causa il pericolo 'Ruolo/RLS' (Rappresentante Lavoratori Sicurezza (RLS)); poi LUXPECTORIX+SICURIX applicano il METODO81+; 12) FRETTIX causa il pericolo 'Sorveglianza sanitaria' (Sorveglianza Sanitaria / Medico Competente); poi TRACCIX+SICURIX applicano il METODO81+. PALETTE BRAND ESCLUSIVA: nero #05050A, bianco panna, arancione #FF6A1A/#E8501A; ROSSO solo per 'PERICOLO', VERDE per la checklist 'Metodo 81+'. Logo '81+' ben visibile in OGNI vignetta. REGOLA STORIA: SICURIX NON agisce mai da solo - in OGNI vignetta di soluzione si fa AIUTARE dai suoi colleghi EROI (lavoro di squadra, ognuno col suo ruolo). TESTO: didascalie e fumetti MOLTO BREVI (1-4 parole), GRANDI, centrati, in ITALIANO con ORTOGRAFIA PERFETTA, senza parole inventate, lettere doppie errate o testo tagliato. CATTIVI (coerenti col canone): SOTTOVALUTIX, PHISHIX, LEAKIX, SEGNALEX, OBLIVIX, ØTIX, TAGLIX, RISKIX, MULTIX, FRETTIX. EROI: CIFRIX, HYGIENIX, CONSENSIX, FORMIX, SCUDIX, LUXPECTORIX, TRACCIX. NEGATIVE: nessun marchio LEGO reale, nessun personaggio protetto (Asterix ecc.), niente gore/horror, niente claim assoluti ('rischio zero','garantito','zero multe').","In PA non e' 'se' arriva il controllo, e' 'quando'. Sei pronto?","La differenza tra chi in PA dorme sereno e chi trema al controllo

In pa gli adempimenti obbligatori non aspettano: Ruolo/Preposto, Nomine, DPO, MMC, Stress, Documento, Emergenze/Incendio, Data breach, Formazione, DPI, Ruolo/RLS, Sorveglianza sanitaria. In questa pagina TALES OF SICURIX il PERICOLO prende forma... e il METODO81+ lo rimette in ordine, passo dopo passo. Immagina la scena: prima il caos, poi la checklist che sistema tutto. Chi si mette in regola prima, dorme meglio dopo.
👉 Iscriviti al corso: Corso per Preposto -> https://81plus.net/?corso=corso-per-preposto
▶️ YouTube: youtube.com/@sicurissimo
Contenuto informativo. Prima vedi. Poi sistemi. 81plus.net",Corso per Preposto,https://81plus.net/?corso=corso-per-preposto,#TalesOfSicurix #SICURIX #Metodo81 #81plus #Sicurissimo #Sicurezza #Privacy #SicurezzaSulLavoro,SICURIX_TALES_823009_3_14_17_10_11_0_7_16_15_8_4_9.webp,https://drive.google.com/drive/folders/1hICKXdl9JTZBL1pemG19oE_661z-EH_k,IMG_ERR
74.99.99,Servizi alle imprese,N,Sicurezza+Privacy,10,Documento Valutazione Rischi (DVR) | Formazione Specifica (rischio basso) | Rappresentante Lavoratori Sicurezza (RLS) | Addetto Primo Soccorso | RSPP / Datore di Lavoro RSPP | Nomina Incaricati/Responsabili | Informativa e Consensi | Uso e Formazione DPI | Addetto Antincendio | Formazione Generale Lavoratori,D.Lgs81/08 art.28 | Accordo Stato-Regioni | D.Lgs81/08 art.47 | DM 388/2003 | D.Lgs81/08 art.34 | GDPR art.28-29 | GDPR art.13 | D.Lgs81/08 art.77 | DM 2/9/2021,"ROBOTIX81>BIOXIX, CONSENSIX>POLVERIX, CONSENSIX>NONDPIX, CHECKIX>CAOSIX, PREPOSTIX>VOLTIX, FORMIX>IMPROVVISIX, DOCUMIX>IMPROVVISIX, LUXPECTORIX>ØTIX, CHECKIX>NONDPIX, CHECKIX>CADUTIX","Crea una PAGINA A FUMETTI a STORIA COMPLETA, verticale A4 (1024x1536), QUALITA' EDITORIALE DA STAMPA, stile ufficiale 'SICURIX TALES' IDENTICO alle immagini di riferimento allegate (stessi personaggi a mattoncini 3D, stessa impaginazione, stessi colori, stesse rese): minifigure espressive, ambientazioni ricche e dettagliate del settore, luci morbide, profondita', bordi vignetta netti. IMPAGINAZIONE OBBLIGATORIA: da 10 a 12 VIGNETTE numerate che raccontano UNA STORIA con arco narrativo completo (1 situazione normale -> 2-4 arrivano i pericoli coi cattivi -> 5-6 tensione/conseguenza -> 7-9 arriva SICURIX con gli eroi e applica il METODO81+ passo per passo -> 10-11 risoluzione ordinata -> 12 finale). HEADER in alto: SICURIX (mantello, medaglione arancione '81+', bussola) che presenta in un fumetto; grande titolo 'SICURIX TALES'; sottotitolo 'SERVIZI ALLE IMPRESE: Pericolo vs Soluzione con Metodo 81+'; legenda 3 voci (verde Sicurezza, rosso Rischio, blu 81+ Soluzione); fila di EROI coi nomi: ROBOTIX81, CONSENSIX, CHECKIX, PREPOSTIX, FORMIX, DOCUMIX. FOOTER in basso: grande 'Prima vedi. Poi sistemi.'; banner scudo verde 'PROTEGGIAMO. PREVENIAMO. MIGLIORIAMO.' e triangolo rosso 'DISATTENZIONE. RISCHI. COSTI. CAOS.'; logo '81+' + '81plus.net'. TRAMA (usa questi eventi come vignette; se sono meno di 10 aggiungi vignette di contesto, dialogo e reazione per arrivare a 10-12): 1) BIOXIX causa il pericolo 'Documento' (Documento Valutazione Rischi (DVR)); poi ROBOTIX81+SICURIX applicano il METODO81+; 2) POLVERIX causa il pericolo 'Formazione specifica' (Formazione Specifica (rischio basso)); poi CONSENSIX+SICURIX applicano il METODO81+; 3) NONDPIX causa il pericolo 'Ruolo/RLS' (Rappresentante Lavoratori Sicurezza (RLS)); poi CONSENSIX+SICURIX applicano il METODO81+; 4) CAOSIX causa il pericolo 'Emergenze/Soccorso' (Addetto Primo Soccorso); poi CHECKIX+SICURIX applicano il METODO81+; 5) VOLTIX causa il pericolo 'Ruolo/RSPP' (RSPP / Datore di Lavoro RSPP); poi PREPOSTIX+SICURIX applicano il METODO81+; 6) IMPROVVISIX causa il pericolo 'Nomine' (Nomina Incaricati/Responsabili); poi FORMIX+SICURIX applicano il METODO81+; 7) IMPROVVISIX causa il pericolo 'Documento' (Informativa e Consensi); poi DOCUMIX+SICURIX applicano il METODO81+; 8) ØTIX causa il pericolo 'DPI' (Uso e Formazione DPI); poi LUXPECTORIX+SICURIX applicano il METODO81+; 9) NONDPIX causa il pericolo 'Emergenze/Incendio' (Addetto Antincendio); poi CHECKIX+SICURIX applicano il METODO81+; 10) CADUTIX causa il pericolo 'Formazione base' (Formazione Generale Lavoratori); poi CHECKIX+SICURIX applicano il METODO81+. PALETTE BRAND ESCLUSIVA: nero #05050A, bianco panna, arancione #FF6A1A/#E8501A; ROSSO solo per 'PERICOLO', VERDE per la checklist 'Metodo 81+'. Logo '81+' ben visibile in OGNI vignetta. REGOLA STORIA: SICURIX NON agisce mai da solo - in OGNI vignetta di soluzione si fa AIUTARE dai suoi colleghi EROI (lavoro di squadra, ognuno col suo ruolo). TESTO: didascalie e fumetti MOLTO BREVI (1-4 parole), GRANDI, centrati, in ITALIANO con ORTOGRAFIA PERFETTA, senza parole inventate, lettere doppie errate o testo tagliato. CATTIVI (coerenti col canone): BIOXIX, POLVERIX, NONDPIX, CAOSIX, VOLTIX, IMPROVVISIX, ØTIX, CADUTIX. EROI: ROBOTIX81, CONSENSIX, CHECKIX, PREPOSTIX, FORMIX, DOCUMIX, LUXPECTORIX. NEGATIVE: nessun marchio LEGO reale, nessun personaggio protetto (Asterix ecc.), niente gore/horror, niente claim assoluti ('rischio zero','garantito','zero multe').",La differenza tra chi in Servizi alle imprese dorme sereno e chi trema al controllo,"Servizi alle imprese: 3 minuti oggi o un problema enorme domani. Scegli tu.

In servizi alle imprese gli adempimenti obbligatori non aspettano: Documento, Formazione specifica, Ruolo/RLS, Emergenze/Soccorso, Ruolo/RSPP, Nomine, DPI, Emergenze/Incendio, Formazione base. In questa pagina TALES OF SICURIX il PERICOLO prende forma... e il METODO81+ lo rimette in ordine, passo dopo passo. Immagina la scena: prima il caos, poi la checklist che sistema tutto. Mettere ordine ora costa poco. Rimediare dopo costa caro.
👉 Iscriviti al corso: Corso lavoratore parte GENERALE 4 ore -> https://81plus.net/?corso=corso-lavoratore-parte-generale-4-ore
▶️ YouTube: youtube.com/@sicurissimo
Contenuto informativo. Prima vedi. Poi sistemi. 81plus.net",Corso lavoratore parte GENERALE 4 ore,https://81plus.net/?corso=corso-lavoratore-parte-generale-4-ore,#TalesOfSicurix #SICURIX #Metodo81 #81plus #Sicurissimo #Sicurezza #Privacy #SicurezzaSulLavoro,SICURIX_TALES_749999_0_2_4_6_5_11_9_8_7_1.webp,https://drive.google.com/drive/folders/1hICKXdl9JTZBL1pemG19oE_661z-EH_k,IMG_ERR
16.28.11,Manifattura,C,HACCP+Sicurezza+Ambientale+Privacy,12,Piano di Sanificazione | Addetto Antincendio | Rintracciabilita ed Etichettatura | Gestione Allergeni | Formazione Generale Lavoratori | Gestione Rifiuti e Registro | Rappresentante Lavoratori Sicurezza (RLS) | Movimentazione Manuale Carichi | Registro dei Trattamenti | Attrezzature e Macchine | Uso e Formazione DPI | Manuale HACCP di Autocontrollo,Reg.CE 852/2004 | DM 2/9/2021 | Reg.CE 178/2002 | Reg.UE 1169/2011 | Accordo Stato-Regioni | D.Lgs152/06 | D.Lgs81/08 art.47 | D.Lgs81/08 Tit.VI | GDPR art.30 | D.Lgs81/08 Tit.III | D.Lgs81/08 art.77,"CHEFIX>RISKIX, ROBOTIX81>RISKIX, CHECKIX>SCADUTIX, TRACCIX>CROSSIX, ROBOTIX81>CADUTIX, FORMIX>FRETTIX, LUXPECTORIX>IMPROVVISIX, BLINKIX>CADUTIX, SCUDIX>IMPROVVISIX, SCUDIX>SEGNALEX, ROBOTIX81>OBLIVIX, CONSENSIX>SCADUTIX","Crea una PAGINA A FUMETTI a STORIA COMPLETA, verticale A4 (1024x1536), QUALITA' EDITORIALE DA STAMPA, stile ufficiale 'SICURIX TALES' IDENTICO alle immagini di riferimento allegate (stessi personaggi a mattoncini 3D, stessa impaginazione, stessi colori, stesse rese): minifigure espressive, ambientazioni ricche e dettagliate del settore, luci morbide, profondita', bordi vignetta netti. IMPAGINAZIONE OBBLIGATORIA: da 10 a 12 VIGNETTE numerate che raccontano UNA STORIA con arco narrativo completo (1 situazione normale -> 2-4 arrivano i pericoli coi cattivi -> 5-6 tensione/conseguenza -> 7-9 arriva SICURIX con gli eroi e applica il METODO81+ passo per passo -> 10-11 risoluzione ordinata -> 12 finale). HEADER in alto: SICURIX (mantello, medaglione arancione '81+', bussola) che presenta in un fumetto; grande titolo 'SICURIX TALES'; sottotitolo 'MANIFATTURA: Pericolo vs Soluzione con Metodo 81+'; legenda 3 voci (verde Sicurezza, rosso Rischio, blu 81+ Soluzione); fila di EROI coi nomi: CHEFIX, ROBOTIX81, CHECKIX, TRACCIX, FORMIX, LUXPECTORIX. FOOTER in basso: grande 'Prima vedi. Poi sistemi.'; banner scudo verde 'PROTEGGIAMO. PREVENIAMO. MIGLIORIAMO.' e triangolo rosso 'DISATTENZIONE. RISCHI. COSTI. CAOS.'; logo '81+' + '81plus.net'. TRAMA (usa questi eventi come vignette; se sono meno di 10 aggiungi vignette di contesto, dialogo e reazione per arrivare a 10-12): 1) RISKIX causa il pericolo 'Sanificazione' (Piano di Sanificazione); poi CHEFIX+SICURIX applicano il METODO81+; 2) RISKIX causa il pericolo 'Emergenze/Incendio' (Addetto Antincendio); poi ROBOTIX81+SICURIX applicano il METODO81+; 3) SCADUTIX causa il pericolo 'Rintracciabilita' (Rintracciabilita ed Etichettatura); poi CHECKIX+SICURIX applicano il METODO81+; 4) CROSSIX causa il pericolo 'Allergeni' (Gestione Allergeni); poi TRACCIX+SICURIX applicano il METODO81+; 5) CADUTIX causa il pericolo 'Formazione base' (Formazione Generale Lavoratori); poi ROBOTIX81+SICURIX applicano il METODO81+; 6) FRETTIX causa il pericolo 'Rifiuti' (Gestione Rifiuti e Registro); poi FORMIX+SICURIX applicano il METODO81+; 7) IMPROVVISIX causa il pericolo 'Ruolo/RLS' (Rappresentante Lavoratori Sicurezza (RLS)); poi LUXPECTORIX+SICURIX applicano il METODO81+; 8) CADUTIX causa il pericolo 'MMC' (Movimentazione Manuale Carichi); poi BLINKIX+SICURIX applicano il METODO81+; 9) IMPROVVISIX causa il pericolo 'Registro' (Registro dei Trattamenti); poi SCUDIX+SICURIX applicano il METODO81+; 10) SEGNALEX causa il pericolo 'Attrezzature' (Attrezzature e Macchine); poi SCUDIX+SICURIX applicano il METODO81+; 11) OBLIVIX causa il pericolo 'DPI' (Uso e Formazione DPI); poi ROBOTIX81+SICURIX applicano il METODO81+; 12) SCADUTIX causa il pericolo 'Documento' (Manuale HACCP di Autocontrollo); poi CONSENSIX+SICURIX applicano il METODO81+. PALETTE BRAND ESCLUSIVA: nero #05050A, bianco panna, arancione #FF6A1A/#E8501A; ROSSO solo per 'PERICOLO', VERDE per la checklist 'Metodo 81+'. Logo '81+' ben visibile in OGNI vignetta. REGOLA STORIA: SICURIX NON agisce mai da solo - in OGNI vignetta di soluzione si fa AIUTARE dai suoi colleghi EROI (lavoro di squadra, ognuno col suo ruolo). TESTO: didascalie e fumetti MOLTO BREVI (1-4 parole), GRANDI, centrati, in ITALIANO con ORTOGRAFIA PERFETTA, senza parole inventate, lettere doppie errate o testo tagliato. CATTIVI (coerenti col canone): RISKIX, SCADUTIX, CROSSIX, CADUTIX, FRETTIX, IMPROVVISIX, SEGNALEX, OBLIVIX. EROI: CHEFIX, ROBOTIX81, CHECKIX, TRACCIX, FORMIX, LUXPECTORIX, BLINKIX, SCUDIX, CONSENSIX. NEGATIVE: nessun marchio LEGO reale, nessun personaggio protetto (Asterix ecc.), niente gore/horror, niente claim assoluti ('rischio zero','garantito','zero multe').",Manifattura: 3 minuti oggi o un problema enorme domani. Scegli tu.,"La differenza tra chi in Manifattura dorme sereno e chi trema al controllo

In manifattura gli adempimenti obbligatori non aspettano: Sanificazione, Emergenze/Incendio, Rintracciabilita, Allergeni, Formazione base, Rifiuti, Ruolo/RLS, MMC, Registro, Attrezzature, DPI, Documento. In questa pagina TALES OF SICURIX il PERICOLO prende forma... e il METODO81+ lo rimette in ordine, passo dopo passo. Immagina la scena: prima il caos, poi la checklist che sistema tutto. Chi si mette in regola prima, dorme meglio dopo.
👉 Iscriviti al corso: Corso per addetto operazioni di pulizia e sanificazione aziendale rischio Covid-19 -> https://81plus.net/?corso=corso-per-addetto-operazioni-di-pulizia-e-sanificazione-azie
▶️ YouTube: youtube.com/@sicurissimo
Contenuto informativo. Prima vedi. Poi sistemi. 81plus.net",Corso per addetto operazioni di pulizia e sanificazione aziendale rischio Covid-19,https://81plus.net/?corso=corso-per-addetto-operazioni-di-pulizia-e-sanificazione-azie,#TalesOfSicurix #SICURIX #Metodo81 #81plus #Sicurissimo #HACCP #Sicurezza #Ambientale #Privacy #SicurezzaSulLavoro,SICURIX_TALES_162811_16_7_17_20_1_26_4_10_22_13_8_14.webp,https://drive.google.com/drive/folders/1hICKXdl9JTZBL1pemG19oE_661z-EH_k,IMG_ERR
