codice_ateco,settore,sezione,area_mix,n_vignette,adempimenti,fonti,cast_personaggi,image_prompt,titolo_clickbait,corpo_post,cta_prodotto,cta_url,hashtag,nome_file_webp,drive_folder,stato
84.22.00,Istruzione,P,Privacy+Sicurezza,10,Informativa e Consensi | Nomina DPO / RPD | Nomina Incaricati/Responsabili | Formazione GDPR | Formazione Specifica (rischio medio) | Stress Lavoro-Correlato | Procedura Data Breach | Documento Valutazione Rischi (DVR) | Addetto Antincendio | Valutazione d'Impatto (DPIA),GDPR art.13 | GDPR art.37 | GDPR art.28-29 | GDPR art.32 | Accordo Stato-Regioni | D.Lgs81/08 art.28 | GDPR art.33-34 | DM 2/9/2021 | GDPR art.35,"PREPOSTIX>MULTIX, PREPOSTIX>LEAKIX, SCUDIX>CAOSIX, SICURIX>PHISHIX, PRIVACIX>NONDPIX, DOCUMIX>RISKIX, CONSENSIX>SPYIX, SCUDIX>SEGNALEX, SCUDIX>MULTIX, ROBOTIX81>OBLIVIX","Crea una PAGINA A FUMETTI a STORIA COMPLETA, verticale A4 (1024x1536), QUALITA' EDITORIALE DA STAMPA, stile ufficiale 'SICURIX TALES' IDENTICO alle immagini di riferimento allegate (stessi personaggi a mattoncini 3D, stessa impaginazione, stessi colori, stesse rese): minifigure espressive, ambientazioni ricche e dettagliate del settore, luci morbide, profondita', bordi vignetta netti. IMPAGINAZIONE OBBLIGATORIA: da 10 a 12 VIGNETTE numerate che raccontano UNA STORIA con arco narrativo completo (1 situazione normale -> 2-4 arrivano i pericoli coi cattivi -> 5-6 tensione/conseguenza -> 7-9 arriva SICURIX con gli eroi e applica il METODO81+ passo per passo -> 10-11 risoluzione ordinata -> 12 finale). HEADER in alto: SICURIX (mantello, medaglione arancione '81+', bussola) che presenta in un fumetto; grande titolo 'SICURIX TALES'; sottotitolo 'ISTRUZIONE: Pericolo vs Soluzione con Metodo 81+'; legenda 3 voci (verde Sicurezza, rosso Rischio, blu 81+ Soluzione); fila di EROI coi nomi: PREPOSTIX, SCUDIX, SICURIX, PRIVACIX, DOCUMIX, CONSENSIX. FOOTER in basso: grande 'Prima vedi. Poi sistemi.'; banner scudo verde 'PROTEGGIAMO. PREVENIAMO. MIGLIORIAMO.' e triangolo rosso 'DISATTENZIONE. RISCHI. COSTI. CAOS.'; logo '81+' + '81plus.net'. TRAMA (usa questi eventi come vignette; se sono meno di 10 aggiungi vignette di contesto, dialogo e reazione per arrivare a 10-12): 1) MULTIX causa il pericolo 'Documento' (Informativa e Consensi); poi PREPOSTIX+SICURIX applicano il METODO81+; 2) LEAKIX causa il pericolo 'DPO' (Nomina DPO / RPD); poi PREPOSTIX+SICURIX applicano il METODO81+; 3) CAOSIX causa il pericolo 'Nomine' (Nomina Incaricati/Responsabili); poi SCUDIX+SICURIX applicano il METODO81+; 4) PHISHIX causa il pericolo 'Formazione' (Formazione GDPR); poi SICURIX+SICURIX applicano il METODO81+; 5) NONDPIX causa il pericolo 'Formazione specifica' (Formazione Specifica (rischio medio)); poi PRIVACIX+SICURIX applicano il METODO81+; 6) RISKIX causa il pericolo 'Stress' (Stress Lavoro-Correlato); poi DOCUMIX+SICURIX applicano il METODO81+; 7) SPYIX causa il pericolo 'Data breach' (Procedura Data Breach); poi CONSENSIX+SICURIX applicano il METODO81+; 8) SEGNALEX causa il pericolo 'Documento' (Documento Valutazione Rischi (DVR)); poi SCUDIX+SICURIX applicano il METODO81+; 9) MULTIX causa il pericolo 'Emergenze/Incendio' (Addetto Antincendio); poi SCUDIX+SICURIX applicano il METODO81+; 10) OBLIVIX causa il pericolo 'DPIA' (Valutazione d'Impatto (DPIA)); poi ROBOTIX81+SICURIX applicano il METODO81+. PALETTE BRAND ESCLUSIVA: nero #05050A, bianco panna, arancione #FF6A1A/#E8501A; ROSSO solo per 'PERICOLO', VERDE per la checklist 'Metodo 81+'. Logo '81+' ben visibile in OGNI vignetta. REGOLA STORIA: SICURIX NON agisce mai da solo - in OGNI vignetta di soluzione si fa AIUTARE dai suoi colleghi EROI (lavoro di squadra, ognuno col suo ruolo). TESTO: didascalie e fumetti MOLTO BREVI (1-4 parole), GRANDI, centrati, in ITALIANO con ORTOGRAFIA PERFETTA, senza parole inventate, lettere doppie errate o testo tagliato. CATTIVI (coerenti col canone): MULTIX, LEAKIX, CAOSIX, PHISHIX, NONDPIX, RISKIX, SPYIX, SEGNALEX, OBLIVIX. EROI: PREPOSTIX, SCUDIX, SICURIX, PRIVACIX, DOCUMIX, CONSENSIX, ROBOTIX81. NEGATIVE: nessun marchio LEGO reale, nessun personaggio protetto (Asterix ecc.), niente gore/horror, niente claim assoluti ('rischio zero','garantito','zero multe').",In Istruzione c'e' un obbligo che in tanti scoprono solo con la sanzione,"Quello che l'ispettore controlla per primo in Istruzione (e quasi nessuno lo sa)

In istruzione gli adempimenti obbligatori non aspettano: Documento, DPO, Nomine, Formazione, Formazione specifica, Stress, Data breach, Emergenze/Incendio, DPIA. In questa pagina TALES OF SICURIX il PERICOLO prende forma... e il METODO81+ lo rimette in ordine, passo dopo passo. Immagina la scena: prima il caos, poi la checklist che sistema tutto. La regola c'e' gia': tu falla lavorare per te.
👉 Iscriviti al corso: Corso privacy destinato ai lavoratori -> https://81plus.net/?corso=corso-privacy-destinato-ai-lavoratori
▶️ YouTube: youtube.com/@sicurissimo
Contenuto informativo. Prima vedi. Poi sistemi. 81plus.net",Corso privacy destinato ai lavoratori,https://81plus.net/?corso=corso-privacy-destinato-ai-lavoratori,#TalesOfSicurix #SICURIX #Metodo81 #81plus #Sicurissimo #Privacy #Sicurezza #SicurezzaSulLavoro,SICURIX_TALES_842200_12_17_14_15_2_11_16_0_7_18.webp,https://drive.google.com/drive/folders/1hICKXdl9JTZBL1pemG19oE_661z-EH_k,IMG_ERR
85.10.00,Sanita/Sociale,Q,Privacy+Sicurezza,12,Registro dei Trattamenti | Documento Valutazione Rischi (DVR) | Formazione GDPR | Addetto Antincendio | Procedura Data Breach | Addetto Primo Soccorso | Sorveglianza Sanitaria / Medico Competente | Nomina Incaricati/Responsabili | Formazione Preposto | Uso e Formazione DPI | Informativa e Consensi | Nomina DPO / RPD,GDPR art.30 | D.Lgs81/08 art.28 | GDPR art.32 | DM 2/9/2021 | GDPR art.33-34 | DM 388/2003 | D.Lgs81/08 art.41 | GDPR art.28-29 | D.Lgs81/08 art.37 | D.Lgs81/08 art.77 | GDPR art.13 | GDPR art.37,"ROBOTIX81>SPYIX, CONSENSIX>SCIVOLIX, LUXPECTORIX>MULTIX, PREPOSTIX>IMPROVVISIX, HYGIENIX>SPYIX, PRIVACIX>TAGLIX, SCUDIX>ØTIX, HYGIENIX>HACKIX, TRACCIX>TAGLIX, SCUDIX>CHIMIKIX, ROBOTIX81>IMPROVVISIX, FORMIX>RISKIX","Crea una PAGINA A FUMETTI a STORIA COMPLETA, verticale A4 (1024x1536), QUALITA' EDITORIALE DA STAMPA, stile ufficiale 'SICURIX TALES' IDENTICO alle immagini di riferimento allegate (stessi personaggi a mattoncini 3D, stessa impaginazione, stessi colori, stesse rese): minifigure espressive, ambientazioni ricche e dettagliate del settore, luci morbide, profondita', bordi vignetta netti. IMPAGINAZIONE OBBLIGATORIA: da 10 a 12 VIGNETTE numerate che raccontano UNA STORIA con arco narrativo completo (1 situazione normale -> 2-4 arrivano i pericoli coi cattivi -> 5-6 tensione/conseguenza -> 7-9 arriva SICURIX con gli eroi e applica il METODO81+ passo per passo -> 10-11 risoluzione ordinata -> 12 finale). HEADER in alto: SICURIX (mantello, medaglione arancione '81+', bussola) che presenta in un fumetto; grande titolo 'SICURIX TALES'; sottotitolo 'SANITA/SOCIALE: Pericolo vs Soluzione con Metodo 81+'; legenda 3 voci (verde Sicurezza, rosso Rischio, blu 81+ Soluzione); fila di EROI coi nomi: ROBOTIX81, CONSENSIX, LUXPECTORIX, PREPOSTIX, HYGIENIX, PRIVACIX. FOOTER in basso: grande 'Prima vedi. Poi sistemi.'; banner scudo verde 'PROTEGGIAMO. PREVENIAMO. MIGLIORIAMO.' e triangolo rosso 'DISATTENZIONE. RISCHI. COSTI. CAOS.'; logo '81+' + '81plus.net'. TRAMA (usa questi eventi come vignette; se sono meno di 10 aggiungi vignette di contesto, dialogo e reazione per arrivare a 10-12): 1) SPYIX causa il pericolo 'Registro' (Registro dei Trattamenti); poi ROBOTIX81+SICURIX applicano il METODO81+; 2) SCIVOLIX causa il pericolo 'Documento' (Documento Valutazione Rischi (DVR)); poi CONSENSIX+SICURIX applicano il METODO81+; 3) MULTIX causa il pericolo 'Formazione' (Formazione GDPR); poi LUXPECTORIX+SICURIX applicano il METODO81+; 4) IMPROVVISIX causa il pericolo 'Emergenze/Incendio' (Addetto Antincendio); poi PREPOSTIX+SICURIX applicano il METODO81+; 5) SPYIX causa il pericolo 'Data breach' (Procedura Data Breach); poi HYGIENIX+SICURIX applicano il METODO81+; 6) TAGLIX causa il pericolo 'Emergenze/Soccorso' (Addetto Primo Soccorso); poi PRIVACIX+SICURIX applicano il METODO81+; 7) ØTIX causa il pericolo 'Sorveglianza sanitaria' (Sorveglianza Sanitaria / Medico Competente); poi SCUDIX+SICURIX applicano il METODO81+; 8) HACKIX causa il pericolo 'Nomine' (Nomina Incaricati/Responsabili); poi HYGIENIX+SICURIX applicano il METODO81+; 9) TAGLIX causa il pericolo 'Ruolo/Preposto' (Formazione Preposto); poi TRACCIX+SICURIX applicano il METODO81+; 10) CHIMIKIX causa il pericolo 'DPI' (Uso e Formazione DPI); poi SCUDIX+SICURIX applicano il METODO81+; 11) IMPROVVISIX causa il pericolo 'Documento' (Informativa e Consensi); poi ROBOTIX81+SICURIX applicano il METODO81+; 12) RISKIX causa il pericolo 'DPO' (Nomina DPO / RPD); poi FORMIX+SICURIX applicano il METODO81+. PALETTE BRAND ESCLUSIVA: nero #05050A, bianco panna, arancione #FF6A1A/#E8501A; ROSSO solo per 'PERICOLO', VERDE per la checklist 'Metodo 81+'. Logo '81+' ben visibile in OGNI vignetta. REGOLA STORIA: SICURIX NON agisce mai da solo - in OGNI vignetta di soluzione si fa AIUTARE dai suoi colleghi EROI (lavoro di squadra, ognuno col suo ruolo). TESTO: didascalie e fumetti MOLTO BREVI (1-4 parole), GRANDI, centrati, in ITALIANO con ORTOGRAFIA PERFETTA, senza parole inventate, lettere doppie errate o testo tagliato. CATTIVI (coerenti col canone): SPYIX, SCIVOLIX, MULTIX, IMPROVVISIX, TAGLIX, ØTIX, HACKIX, CHIMIKIX, RISKIX. EROI: ROBOTIX81, CONSENSIX, LUXPECTORIX, PREPOSTIX, HYGIENIX, PRIVACIX, SCUDIX, TRACCIX, FORMIX. NEGATIVE: nessun marchio LEGO reale, nessun personaggio protetto (Asterix ecc.), niente gore/horror, niente claim assoluti ('rischio zero','garantito','zero multe').",Sanita/Sociale: 3 minuti oggi o un problema enorme domani. Scegli tu.,"In Sanita/Sociale non e' 'se' arriva il controllo, e' 'quando'. Sei pronto?

In sanita/sociale gli adempimenti obbligatori non aspettano: Registro, Documento, Formazione, Emergenze/Incendio, Data breach, Emergenze/Soccorso, Sorveglianza sanitaria, Nomine, Ruolo/Preposto, DPI, DPO. In questa pagina TALES OF SICURIX il PERICOLO prende forma... e il METODO81+ lo rimette in ordine, passo dopo passo. Immagina la scena: prima il caos, poi la checklist che sistema tutto. La regola c'e' gia': tu falla lavorare per te.
👉 Iscriviti al corso: Corso privacy destinato ai lavoratori -> https://81plus.net/?corso=corso-privacy-destinato-ai-lavoratori
▶️ YouTube: youtube.com/@sicurissimo
Contenuto informativo. Prima vedi. Poi sistemi. 81plus.net",Corso privacy destinato ai lavoratori,https://81plus.net/?corso=corso-privacy-destinato-ai-lavoratori,#TalesOfSicurix #SICURIX #Metodo81 #81plus #Sicurissimo #Privacy #Sicurezza #SicurezzaSulLavoro,SICURIX_TALES_851000_13_0_15_7_16_6_9_14_3_8_12_17.webp,https://drive.google.com/drive/folders/1hICKXdl9JTZBL1pemG19oE_661z-EH_k,IMG_ERR
23.70.30,Manifattura,C,Sicurezza+Privacy+HACCP,10,RSPP / Datore di Lavoro RSPP | Uso e Formazione DPI | Formazione Preposto | Stress Lavoro-Correlato | Formazione GDPR | Controllo Temperature e Celle | Procedura Data Breach | Nomina Incaricati/Responsabili | Rappresentante Lavoratori Sicurezza (RLS) | Manuale HACCP di Autocontrollo,D.Lgs81/08 art.34 | D.Lgs81/08 art.77 | D.Lgs81/08 art.37 | D.Lgs81/08 art.28 | GDPR art.32 | Reg.CE 852/2004 | GDPR art.33-34 | GDPR art.28-29 | D.Lgs81/08 art.47,"FORMIX>FRETTIX, TRACCIX>TAGLIX, CHECKIX>FUMIX, CHECKIX>FUMIX, TRACCIX>PHISHIX, CHECKIX>OBLIVIX, CHECKIX>FRETTIX, SICURIX>HACKIX, TRACCIX>CADUTIX, PREPOSTIX>CROSSIX","Crea una PAGINA A FUMETTI a STORIA COMPLETA, verticale A4 (1024x1536), QUALITA' EDITORIALE DA STAMPA, stile ufficiale 'SICURIX TALES' IDENTICO alle immagini di riferimento allegate (stessi personaggi a mattoncini 3D, stessa impaginazione, stessi colori, stesse rese): minifigure espressive, ambientazioni ricche e dettagliate del settore, luci morbide, profondita', bordi vignetta netti. IMPAGINAZIONE OBBLIGATORIA: da 10 a 12 VIGNETTE numerate che raccontano UNA STORIA con arco narrativo completo (1 situazione normale -> 2-4 arrivano i pericoli coi cattivi -> 5-6 tensione/conseguenza -> 7-9 arriva SICURIX con gli eroi e applica il METODO81+ passo per passo -> 10-11 risoluzione ordinata -> 12 finale). HEADER in alto: SICURIX (mantello, medaglione arancione '81+', bussola) che presenta in un fumetto; grande titolo 'SICURIX TALES'; sottotitolo 'MANIFATTURA: Pericolo vs Soluzione con Metodo 81+'; legenda 3 voci (verde Sicurezza, rosso Rischio, blu 81+ Soluzione); fila di EROI coi nomi: FORMIX, TRACCIX, CHECKIX, SICURIX, PREPOSTIX. FOOTER in basso: grande 'Prima vedi. Poi sistemi.'; banner scudo verde 'PROTEGGIAMO. PREVENIAMO. MIGLIORIAMO.' e triangolo rosso 'DISATTENZIONE. RISCHI. COSTI. CAOS.'; logo '81+' + '81plus.net'. TRAMA (usa questi eventi come vignette; se sono meno di 10 aggiungi vignette di contesto, dialogo e reazione per arrivare a 10-12): 1) FRETTIX causa il pericolo 'Ruolo/RSPP' (RSPP / Datore di Lavoro RSPP); poi FORMIX+SICURIX applicano il METODO81+; 2) TAGLIX causa il pericolo 'DPI' (Uso e Formazione DPI); poi TRACCIX+SICURIX applicano il METODO81+; 3) FUMIX causa il pericolo 'Ruolo/Preposto' (Formazione Preposto); poi CHECKIX+SICURIX applicano il METODO81+; 4) FUMIX causa il pericolo 'Stress' (Stress Lavoro-Correlato); poi CHECKIX+SICURIX applicano il METODO81+; 5) PHISHIX causa il pericolo 'Formazione' (Formazione GDPR); poi TRACCIX+SICURIX applicano il METODO81+; 6) OBLIVIX causa il pericolo 'Temperature' (Controllo Temperature e Celle); poi CHECKIX+SICURIX applicano il METODO81+; 7) FRETTIX causa il pericolo 'Data breach' (Procedura Data Breach); poi CHECKIX+SICURIX applicano il METODO81+; 8) HACKIX causa il pericolo 'Nomine' (Nomina Incaricati/Responsabili); poi SICURIX+SICURIX applicano il METODO81+; 9) CADUTIX causa il pericolo 'Ruolo/RLS' (Rappresentante Lavoratori Sicurezza (RLS)); poi TRACCIX+SICURIX applicano il METODO81+; 10) CROSSIX causa il pericolo 'Documento' (Manuale HACCP di Autocontrollo); poi PREPOSTIX+SICURIX applicano il METODO81+. PALETTE BRAND ESCLUSIVA: nero #05050A, bianco panna, arancione #FF6A1A/#E8501A; ROSSO solo per 'PERICOLO', VERDE per la checklist 'Metodo 81+'. Logo '81+' ben visibile in OGNI vignetta. REGOLA STORIA: SICURIX NON agisce mai da solo - in OGNI vignetta di soluzione si fa AIUTARE dai suoi colleghi EROI (lavoro di squadra, ognuno col suo ruolo). TESTO: didascalie e fumetti MOLTO BREVI (1-4 parole), GRANDI, centrati, in ITALIANO con ORTOGRAFIA PERFETTA, senza parole inventate, lettere doppie errate o testo tagliato. CATTIVI (coerenti col canone): FRETTIX, TAGLIX, FUMIX, PHISHIX, OBLIVIX, HACKIX, CADUTIX, CROSSIX. EROI: FORMIX, TRACCIX, CHECKIX, SICURIX, PREPOSTIX. NEGATIVE: nessun marchio LEGO reale, nessun personaggio protetto (Asterix ecc.), niente gore/horror, niente claim assoluti ('rischio zero','garantito','zero multe').",Manifattura: 3 minuti oggi o un problema enorme domani. Scegli tu.,"In Manifattura non e' 'se' arriva il controllo, e' 'quando'. Sei pronto?

In manifattura gli adempimenti obbligatori non aspettano: Ruolo/RSPP, DPI, Ruolo/Preposto, Stress, Formazione, Temperature, Data breach, Nomine, Ruolo/RLS, Documento. In questa pagina TALES OF SICURIX il PERICOLO prende forma... e il METODO81+ lo rimette in ordine, passo dopo passo. Immagina la scena: prima il caos, poi la checklist che sistema tutto. Non e' burocrazia: e' la tua tranquillita.
👉 Iscriviti al corso: RSPP Datore di Lavoro modulo 1 e 2 -> https://81plus.net/?corso=rspp-datore-di-lavoro-modulo-1-e-2
▶️ YouTube: youtube.com/@sicurissimo
Contenuto informativo. Prima vedi. Poi sistemi. 81plus.net",RSPP Datore di Lavoro modulo 1 e 2,https://81plus.net/?corso=rspp-datore-di-lavoro-modulo-1-e-2,#TalesOfSicurix #SICURIX #Metodo81 #81plus #Sicurissimo #Sicurezza #Privacy #HACCP #SicurezzaSulLavoro,SICURIX_TALES_237030_5_8_3_11_24_18_25_23_4_14.webp,https://drive.google.com/drive/folders/1hICKXdl9JTZBL1pemG19oE_661z-EH_k,IMG_ERR
81.30.00,PA,O,Privacy+Sicurezza,10,Informativa e Consensi | Nomina Incaricati/Responsabili | Movimentazione Manuale Carichi | Formazione GDPR | Formazione Generale Lavoratori | RSPP / Datore di Lavoro RSPP | Documento Valutazione Rischi (DVR) | Addetto Primo Soccorso | Formazione Specifica (rischio medio) | Registro dei Trattamenti,GDPR art.13 | GDPR art.28-29 | D.Lgs81/08 Tit.VI | GDPR art.32 | Accordo Stato-Regioni | D.Lgs81/08 art.34 | D.Lgs81/08 art.28 | DM 388/2003 | GDPR art.30,"SCUDIX>FRETTIX, SICURIX>LEAKIX, FORMIX>POLVERIX, SCUDIX>IMPROVVISIX, BLINKIX>TAGLIX, LUXPECTORIX>BIOXIX, LUXPECTORIX>CHIMIKIX, FORMIX>SCIVOLIX, ROBOTIX81>RUMORIX, LUXPECTORIX>RISKIX","Crea una PAGINA A FUMETTI a STORIA COMPLETA, verticale A4 (1024x1536), QUALITA' EDITORIALE DA STAMPA, stile ufficiale 'SICURIX TALES' IDENTICO alle immagini di riferimento allegate (stessi personaggi a mattoncini 3D, stessa impaginazione, stessi colori, stesse rese): minifigure espressive, ambientazioni ricche e dettagliate del settore, luci morbide, profondita', bordi vignetta netti. IMPAGINAZIONE OBBLIGATORIA: da 10 a 12 VIGNETTE numerate che raccontano UNA STORIA con arco narrativo completo (1 situazione normale -> 2-4 arrivano i pericoli coi cattivi -> 5-6 tensione/conseguenza -> 7-9 arriva SICURIX con gli eroi e applica il METODO81+ passo per passo -> 10-11 risoluzione ordinata -> 12 finale). HEADER in alto: SICURIX (mantello, medaglione arancione '81+', bussola) che presenta in un fumetto; grande titolo 'SICURIX TALES'; sottotitolo 'PA: Pericolo vs Soluzione con Metodo 81+'; legenda 3 voci (verde Sicurezza, rosso Rischio, blu 81+ Soluzione); fila di EROI coi nomi: SCUDIX, SICURIX, FORMIX, BLINKIX, LUXPECTORIX, ROBOTIX81. FOOTER in basso: grande 'Prima vedi. Poi sistemi.'; banner scudo verde 'PROTEGGIAMO. PREVENIAMO. MIGLIORIAMO.' e triangolo rosso 'DISATTENZIONE. RISCHI. COSTI. CAOS.'; logo '81+' + '81plus.net'. TRAMA (usa questi eventi come vignette; se sono meno di 10 aggiungi vignette di contesto, dialogo e reazione per arrivare a 10-12): 1) FRETTIX causa il pericolo 'Documento' (Informativa e Consensi); poi SCUDIX+SICURIX applicano il METODO81+; 2) LEAKIX causa il pericolo 'Nomine' (Nomina Incaricati/Responsabili); poi SICURIX+SICURIX applicano il METODO81+; 3) POLVERIX causa il pericolo 'MMC' (Movimentazione Manuale Carichi); poi FORMIX+SICURIX applicano il METODO81+; 4) IMPROVVISIX causa il pericolo 'Formazione' (Formazione GDPR); poi SCUDIX+SICURIX applicano il METODO81+; 5) TAGLIX causa il pericolo 'Formazione base' (Formazione Generale Lavoratori); poi BLINKIX+SICURIX applicano il METODO81+; 6) BIOXIX causa il pericolo 'Ruolo/RSPP' (RSPP / Datore di Lavoro RSPP); poi LUXPECTORIX+SICURIX applicano il METODO81+; 7) CHIMIKIX causa il pericolo 'Documento' (Documento Valutazione Rischi (DVR)); poi LUXPECTORIX+SICURIX applicano il METODO81+; 8) SCIVOLIX causa il pericolo 'Emergenze/Soccorso' (Addetto Primo Soccorso); poi FORMIX+SICURIX applicano il METODO81+; 9) RUMORIX causa il pericolo 'Formazione specifica' (Formazione Specifica (rischio medio)); poi ROBOTIX81+SICURIX applicano il METODO81+; 10) RISKIX causa il pericolo 'Registro' (Registro dei Trattamenti); poi LUXPECTORIX+SICURIX applicano il METODO81+. PALETTE BRAND ESCLUSIVA: nero #05050A, bianco panna, arancione #FF6A1A/#E8501A; ROSSO solo per 'PERICOLO', VERDE per la checklist 'Metodo 81+'. Logo '81+' ben visibile in OGNI vignetta. REGOLA STORIA: SICURIX NON agisce mai da solo - in OGNI vignetta di soluzione si fa AIUTARE dai suoi colleghi EROI (lavoro di squadra, ognuno col suo ruolo). TESTO: didascalie e fumetti MOLTO BREVI (1-4 parole), GRANDI, centrati, in ITALIANO con ORTOGRAFIA PERFETTA, senza parole inventate, lettere doppie errate o testo tagliato. CATTIVI (coerenti col canone): FRETTIX, LEAKIX, POLVERIX, IMPROVVISIX, TAGLIX, BIOXIX, CHIMIKIX, SCIVOLIX, RUMORIX, RISKIX. EROI: SCUDIX, SICURIX, FORMIX, BLINKIX, LUXPECTORIX, ROBOTIX81. NEGATIVE: nessun marchio LEGO reale, nessun personaggio protetto (Asterix ecc.), niente gore/horror, niente claim assoluti ('rischio zero','garantito','zero multe').",La differenza tra chi in PA dorme sereno e chi trema al controllo,"In PA non e' 'se' arriva il controllo, e' 'quando'. Sei pronto?

In pa gli adempimenti obbligatori non aspettano: Documento, Nomine, MMC, Formazione, Formazione base, Ruolo/RSPP, Emergenze/Soccorso, Formazione specifica, Registro. In questa pagina TALES OF SICURIX il PERICOLO prende forma... e il METODO81+ lo rimette in ordine, passo dopo passo. Immagina la scena: prima il caos, poi la checklist che sistema tutto. Chi si mette in regola prima, dorme meglio dopo.
👉 Iscriviti al corso: Corso privacy destinato ai lavoratori -> https://81plus.net/?corso=corso-privacy-destinato-ai-lavoratori
▶️ YouTube: youtube.com/@sicurissimo
Contenuto informativo. Prima vedi. Poi sistemi. 81plus.net",Corso privacy destinato ai lavoratori,https://81plus.net/?corso=corso-privacy-destinato-ai-lavoratori,#TalesOfSicurix #SICURIX #Metodo81 #81plus #Sicurissimo #Privacy #Sicurezza #SicurezzaSulLavoro,SICURIX_TALES_813000_12_14_10_15_1_5_0_6_2_13.webp,https://drive.google.com/drive/folders/1hICKXdl9JTZBL1pemG19oE_661z-EH_k,IMG_ERR
