codice_ateco,settore,sezione,area_mix,n_vignette,adempimenti,fonti,cast_personaggi,image_prompt,titolo_clickbait,corpo_post,cta_prodotto,cta_url,hashtag,nome_file_webp,drive_folder,stato
46.64.99,Commercio,G,Sicurezza+HACCP+Privacy,11,Stress Lavoro-Correlato | Controllo Temperature e Celle | Procedura Data Breach | Documento Valutazione Rischi (DVR) | Formazione Specifica (rischio medio) | Lotta agli Infestanti (Pest Control) | Registro dei Trattamenti | Formazione GDPR | Movimentazione Manuale Carichi | Addetto Primo Soccorso | Sorveglianza Sanitaria / Medico Competente,D.Lgs81/08 art.28 | Reg.CE 852/2004 | GDPR art.33-34 | Accordo Stato-Regioni | GDPR art.30 | GDPR art.32 | D.Lgs81/08 Tit.VI | DM 388/2003 | D.Lgs81/08 art.41,"SCUDIX>RISKIX, BLINKIX>SCADUTIX, CHECKIX>OBLIVIX, LUXPECTORIX>NONDPIX, CHEFIX>VIBRIX, CONSENSIX>CAOSIX, PREPOSTIX>HACKIX, SCUDIX>PERMISSIONIX, DOCUMIX>FRETTIX, CIFRIX>CAOSIX, DOCUMIX>SCIVOLIX","Crea una PAGINA A FUMETTI a STORIA COMPLETA, verticale A4 (1024x1536), QUALITA' EDITORIALE DA STAMPA, stile ufficiale 'SICURIX TALES' IDENTICO alle immagini di riferimento allegate (stessi personaggi a mattoncini 3D, stessa impaginazione, stessi colori, stesse rese): minifigure espressive, ambientazioni ricche e dettagliate del settore, luci morbide, profondita', bordi vignetta netti. IMPAGINAZIONE OBBLIGATORIA: da 10 a 12 VIGNETTE numerate che raccontano UNA STORIA con arco narrativo completo (1 situazione normale -> 2-4 arrivano i pericoli coi cattivi -> 5-6 tensione/conseguenza -> 7-9 arriva SICURIX con gli eroi e applica il METODO81+ passo per passo -> 10-11 risoluzione ordinata -> 12 finale). HEADER in alto: SICURIX (mantello, medaglione arancione '81+', bussola) che presenta in un fumetto; grande titolo 'SICURIX TALES'; sottotitolo 'COMMERCIO: Pericolo vs Soluzione con Metodo 81+'; legenda 3 voci (verde Sicurezza, rosso Rischio, blu 81+ Soluzione); fila di EROI coi nomi: SCUDIX, BLINKIX, CHECKIX, LUXPECTORIX, CHEFIX, CONSENSIX. FOOTER in basso: grande 'Prima vedi. Poi sistemi.'; banner scudo verde 'PROTEGGIAMO. PREVENIAMO. MIGLIORIAMO.' e triangolo rosso 'DISATTENZIONE. RISCHI. COSTI. CAOS.'; logo '81+' + '81plus.net'. TRAMA (usa questi eventi come vignette; se sono meno di 10 aggiungi vignette di contesto, dialogo e reazione per arrivare a 10-12): 1) RISKIX causa il pericolo 'Stress' (Stress Lavoro-Correlato); poi SCUDIX+SICURIX applicano il METODO81+; 2) SCADUTIX causa il pericolo 'Temperature' (Controllo Temperature e Celle); poi BLINKIX+SICURIX applicano il METODO81+; 3) OBLIVIX causa il pericolo 'Data breach' (Procedura Data Breach); poi CHECKIX+SICURIX applicano il METODO81+; 4) NONDPIX causa il pericolo 'Documento' (Documento Valutazione Rischi (DVR)); poi LUXPECTORIX+SICURIX applicano il METODO81+; 5) VIBRIX causa il pericolo 'Formazione specifica' (Formazione Specifica (rischio medio)); poi CHEFIX+SICURIX applicano il METODO81+; 6) CAOSIX causa il pericolo 'Infestanti' (Lotta agli Infestanti (Pest Control)); poi CONSENSIX+SICURIX applicano il METODO81+; 7) HACKIX causa il pericolo 'Registro' (Registro dei Trattamenti); poi PREPOSTIX+SICURIX applicano il METODO81+; 8) PERMISSIONIX causa il pericolo 'Formazione' (Formazione GDPR); poi SCUDIX+SICURIX applicano il METODO81+; 9) FRETTIX causa il pericolo 'MMC' (Movimentazione Manuale Carichi); poi DOCUMIX+SICURIX applicano il METODO81+; 10) CAOSIX causa il pericolo 'Emergenze/Soccorso' (Addetto Primo Soccorso); poi CIFRIX+SICURIX applicano il METODO81+; 11) SCIVOLIX causa il pericolo 'Sorveglianza sanitaria' (Sorveglianza Sanitaria / Medico Competente); poi DOCUMIX+SICURIX applicano il METODO81+. PALETTE BRAND ESCLUSIVA: nero #05050A, bianco panna, arancione #FF6A1A/#E8501A; ROSSO solo per 'PERICOLO', VERDE per la checklist 'Metodo 81+'. Logo '81+' ben visibile in OGNI vignetta. REGOLA STORIA: SICURIX NON agisce mai da solo - in OGNI vignetta di soluzione si fa AIUTARE dai suoi colleghi EROI (lavoro di squadra, ognuno col suo ruolo). TESTO: didascalie e fumetti MOLTO BREVI (1-4 parole), GRANDI, centrati, in ITALIANO con ORTOGRAFIA PERFETTA, senza parole inventate, lettere doppie errate o testo tagliato. CATTIVI (coerenti col canone): RISKIX, SCADUTIX, OBLIVIX, NONDPIX, VIBRIX, CAOSIX, HACKIX, PERMISSIONIX, FRETTIX, SCIVOLIX. EROI: SCUDIX, BLINKIX, CHECKIX, LUXPECTORIX, CHEFIX, CONSENSIX, PREPOSTIX, DOCUMIX, CIFRIX. NEGATIVE: nessun marchio LEGO reale, nessun personaggio protetto (Asterix ecc.), niente gore/horror, niente claim assoluti ('rischio zero','garantito','zero multe').","In Commercio non e' 'se' arriva il controllo, e' 'quando'. Sei pronto?","La differenza tra chi in Commercio dorme sereno e chi trema al controllo

In commercio gli adempimenti obbligatori non aspettano: Stress, Temperature, Data breach, Documento, Formazione specifica, Infestanti, Registro, Formazione, MMC, Emergenze/Soccorso, Sorveglianza sanitaria. In questa pagina TALES OF SICURIX il PERICOLO prende forma... e il METODO81+ lo rimette in ordine, passo dopo passo. Immagina la scena: prima il caos, poi la checklist che sistema tutto. Chi si mette in regola prima, dorme meglio dopo.
👉 Iscriviti al corso: Rischio stress lavoro correlato -> https://81plus.net/?corso=rischio-stress-lavoro-correlato
▶️ YouTube: youtube.com/@sicurissimo
Contenuto informativo. Prima vedi. Poi sistemi. 81plus.net",Rischio stress lavoro correlato,https://81plus.net/?corso=rischio-stress-lavoro-correlato,#TalesOfSicurix #SICURIX #Metodo81 #81plus #Sicurissimo #Sicurezza #HACCP #Privacy #SicurezzaSulLavoro,SICURIX_TALES_466499_11_16_23_0_2_17_20_22_10_6_9.webp,https://drive.google.com/drive/folders/1hICKXdl9JTZBL1pemG19oE_661z-EH_k,IMG_ERR
43.33.00,Costruzioni,F,Ambientale+Sicurezza,11,Formazione Ambientale | Formazione Generale Lavoratori | Uso e Formazione DPI | Addetto Antincendio | Rappresentante Lavoratori Sicurezza (RLS) | Attrezzature e Macchine | Movimentazione Manuale Carichi | Formazione Preposto | Rischio Rumore | Gestione Rifiuti e Registro | Stress Lavoro-Correlato,D.Lgs152/06 | Accordo Stato-Regioni | D.Lgs81/08 art.77 | DM 2/9/2021 | D.Lgs81/08 art.47 | D.Lgs81/08 Tit.III | D.Lgs81/08 Tit.VI | D.Lgs81/08 art.37 | D.Lgs81/08 Tit.VIII | D.Lgs81/08 art.28,"LUXPECTORIX>CAOSIX, LUXPECTORIX>IMPROVVISIX, FORMIX>VOLTIX, SCUDIX>ØTIX, FORMIX>SEGNALEX, CONSENSIX>SOTTOVALUTIX, SCUDIX>BIOXIX, FORMIX>RISKIX, CONSENSIX>CHIMIKIX, BLINKIX>CAOSIX, BLINKIX>MULTIX","Crea una PAGINA A FUMETTI a STORIA COMPLETA, verticale A4 (1024x1536), QUALITA' EDITORIALE DA STAMPA, stile ufficiale 'SICURIX TALES' IDENTICO alle immagini di riferimento allegate (stessi personaggi a mattoncini 3D, stessa impaginazione, stessi colori, stesse rese): minifigure espressive, ambientazioni ricche e dettagliate del settore, luci morbide, profondita', bordi vignetta netti. IMPAGINAZIONE OBBLIGATORIA: da 10 a 12 VIGNETTE numerate che raccontano UNA STORIA con arco narrativo completo (1 situazione normale -> 2-4 arrivano i pericoli coi cattivi -> 5-6 tensione/conseguenza -> 7-9 arriva SICURIX con gli eroi e applica il METODO81+ passo per passo -> 10-11 risoluzione ordinata -> 12 finale). HEADER in alto: SICURIX (mantello, medaglione arancione '81+', bussola) che presenta in un fumetto; grande titolo 'SICURIX TALES'; sottotitolo 'COSTRUZIONI: Pericolo vs Soluzione con Metodo 81+'; legenda 3 voci (verde Sicurezza, rosso Rischio, blu 81+ Soluzione); fila di EROI coi nomi: LUXPECTORIX, FORMIX, SCUDIX, CONSENSIX, BLINKIX. FOOTER in basso: grande 'Prima vedi. Poi sistemi.'; banner scudo verde 'PROTEGGIAMO. PREVENIAMO. MIGLIORIAMO.' e triangolo rosso 'DISATTENZIONE. RISCHI. COSTI. CAOS.'; logo '81+' + '81plus.net'. TRAMA (usa questi eventi come vignette; se sono meno di 10 aggiungi vignette di contesto, dialogo e reazione per arrivare a 10-12): 1) CAOSIX causa il pericolo 'Formazione' (Formazione Ambientale); poi LUXPECTORIX+SICURIX applicano il METODO81+; 2) IMPROVVISIX causa il pericolo 'Formazione base' (Formazione Generale Lavoratori); poi LUXPECTORIX+SICURIX applicano il METODO81+; 3) VOLTIX causa il pericolo 'DPI' (Uso e Formazione DPI); poi FORMIX+SICURIX applicano il METODO81+; 4) ØTIX causa il pericolo 'Emergenze/Incendio' (Addetto Antincendio); poi SCUDIX+SICURIX applicano il METODO81+; 5) SEGNALEX causa il pericolo 'Ruolo/RLS' (Rappresentante Lavoratori Sicurezza (RLS)); poi FORMIX+SICURIX applicano il METODO81+; 6) SOTTOVALUTIX causa il pericolo 'Attrezzature' (Attrezzature e Macchine); poi CONSENSIX+SICURIX applicano il METODO81+; 7) BIOXIX causa il pericolo 'MMC' (Movimentazione Manuale Carichi); poi SCUDIX+SICURIX applicano il METODO81+; 8) RISKIX causa il pericolo 'Ruolo/Preposto' (Formazione Preposto); poi FORMIX+SICURIX applicano il METODO81+; 9) CHIMIKIX causa il pericolo 'Rumore' (Rischio Rumore); poi CONSENSIX+SICURIX applicano il METODO81+; 10) CAOSIX causa il pericolo 'Rifiuti' (Gestione Rifiuti e Registro); poi BLINKIX+SICURIX applicano il METODO81+; 11) MULTIX causa il pericolo 'Stress' (Stress Lavoro-Correlato); poi BLINKIX+SICURIX applicano il METODO81+. PALETTE BRAND ESCLUSIVA: nero #05050A, bianco panna, arancione #FF6A1A/#E8501A; ROSSO solo per 'PERICOLO', VERDE per la checklist 'Metodo 81+'. Logo '81+' ben visibile in OGNI vignetta. REGOLA STORIA: SICURIX NON agisce mai da solo - in OGNI vignetta di soluzione si fa AIUTARE dai suoi colleghi EROI (lavoro di squadra, ognuno col suo ruolo). TESTO: didascalie e fumetti MOLTO BREVI (1-4 parole), GRANDI, centrati, in ITALIANO con ORTOGRAFIA PERFETTA, senza parole inventate, lettere doppie errate o testo tagliato. CATTIVI (coerenti col canone): CAOSIX, IMPROVVISIX, VOLTIX, ØTIX, SEGNALEX, SOTTOVALUTIX, BIOXIX, RISKIX, CHIMIKIX, MULTIX. EROI: LUXPECTORIX, FORMIX, SCUDIX, CONSENSIX, BLINKIX. NEGATIVE: nessun marchio LEGO reale, nessun personaggio protetto (Asterix ecc.), niente gore/horror, niente claim assoluti ('rischio zero','garantito','zero multe').",Costruzioni: 3 minuti oggi o un problema enorme domani. Scegli tu.,"In Costruzioni non e' 'se' arriva il controllo, e' 'quando'. Sei pronto?

In costruzioni gli adempimenti obbligatori non aspettano: Formazione, Formazione base, DPI, Emergenze/Incendio, Ruolo/RLS, Attrezzature, MMC, Ruolo/Preposto, Rumore, Rifiuti, Stress. In questa pagina TALES OF SICURIX il PERICOLO prende forma... e il METODO81+ lo rimette in ordine, passo dopo passo. Immagina la scena: prima il caos, poi la checklist che sistema tutto. La regola c'e' gia': tu falla lavorare per te.
👉 Iscriviti al corso: Preposto incaricato alla gestione ambientale nei cantieri - 16 ore -> https://81plus.net/?corso=preposto-incaricato-alla-gestione-ambientale-nei-cantieri-16
▶️ YouTube: youtube.com/@sicurissimo
Contenuto informativo. Prima vedi. Poi sistemi. 81plus.net",Preposto incaricato alla gestione ambientale nei cantieri - 16 ore,https://81plus.net/?corso=preposto-incaricato-alla-gestione-ambientale-nei-cantieri-16,#TalesOfSicurix #SICURIX #Metodo81 #81plus #Sicurissimo #Ambientale #Sicurezza #SicurezzaSulLavoro,SICURIX_TALES_433300_20_1_8_7_4_13_10_3_12_19_11.webp,https://drive.google.com/drive/folders/1hICKXdl9JTZBL1pemG19oE_661z-EH_k,IMG_ERR
68.20.01,Attivita professionali,M,Sicurezza+Privacy,10,Rappresentante Lavoratori Sicurezza (RLS) | Informativa e Consensi | Formazione Specifica (rischio basso) | Uso e Formazione DPI | RSPP / Datore di Lavoro RSPP | Formazione GDPR | Formazione Preposto | Nomina Incaricati/Responsabili | Addetto Antincendio | Procedura Data Breach,D.Lgs81/08 art.47 | GDPR art.13 | Accordo Stato-Regioni | D.Lgs81/08 art.77 | D.Lgs81/08 art.34 | GDPR art.32 | D.Lgs81/08 art.37 | GDPR art.28-29 | DM 2/9/2021 | GDPR art.33-34,"CIFRIX>TAGLIX, CONSENSIX>RISKIX, CONSENSIX>RISKIX, TRACCIX>FUMIX, LUXPECTORIX>MULTIX, TRACCIX>IMPROVVISIX, CHECKIX>CHIMIKIX, SICURIX>PERMISSIONIX, CHEFIX>OBLIVIX, CHECKIX>IMPROVVISIX","Crea una PAGINA A FUMETTI a STORIA COMPLETA, verticale A4 (1024x1536), QUALITA' EDITORIALE DA STAMPA, stile ufficiale 'SICURIX TALES' IDENTICO alle immagini di riferimento allegate (stessi personaggi a mattoncini 3D, stessa impaginazione, stessi colori, stesse rese): minifigure espressive, ambientazioni ricche e dettagliate del settore, luci morbide, profondita', bordi vignetta netti. IMPAGINAZIONE OBBLIGATORIA: da 10 a 12 VIGNETTE numerate che raccontano UNA STORIA con arco narrativo completo (1 situazione normale -> 2-4 arrivano i pericoli coi cattivi -> 5-6 tensione/conseguenza -> 7-9 arriva SICURIX con gli eroi e applica il METODO81+ passo per passo -> 10-11 risoluzione ordinata -> 12 finale). HEADER in alto: SICURIX (mantello, medaglione arancione '81+', bussola) che presenta in un fumetto; grande titolo 'SICURIX TALES'; sottotitolo 'ATTIVITA PROFESSIONALI: Pericolo vs Soluzione con Metodo 81+'; legenda 3 voci (verde Sicurezza, rosso Rischio, blu 81+ Soluzione); fila di EROI coi nomi: CIFRIX, CONSENSIX, TRACCIX, LUXPECTORIX, CHECKIX, SICURIX. FOOTER in basso: grande 'Prima vedi. Poi sistemi.'; banner scudo verde 'PROTEGGIAMO. PREVENIAMO. MIGLIORIAMO.' e triangolo rosso 'DISATTENZIONE. RISCHI. COSTI. CAOS.'; logo '81+' + '81plus.net'. TRAMA (usa questi eventi come vignette; se sono meno di 10 aggiungi vignette di contesto, dialogo e reazione per arrivare a 10-12): 1) TAGLIX causa il pericolo 'Ruolo/RLS' (Rappresentante Lavoratori Sicurezza (RLS)); poi CIFRIX+SICURIX applicano il METODO81+; 2) RISKIX causa il pericolo 'Documento' (Informativa e Consensi); poi CONSENSIX+SICURIX applicano il METODO81+; 3) RISKIX causa il pericolo 'Formazione specifica' (Formazione Specifica (rischio basso)); poi CONSENSIX+SICURIX applicano il METODO81+; 4) FUMIX causa il pericolo 'DPI' (Uso e Formazione DPI); poi TRACCIX+SICURIX applicano il METODO81+; 5) MULTIX causa il pericolo 'Ruolo/RSPP' (RSPP / Datore di Lavoro RSPP); poi LUXPECTORIX+SICURIX applicano il METODO81+; 6) IMPROVVISIX causa il pericolo 'Formazione' (Formazione GDPR); poi TRACCIX+SICURIX applicano il METODO81+; 7) CHIMIKIX causa il pericolo 'Ruolo/Preposto' (Formazione Preposto); poi CHECKIX+SICURIX applicano il METODO81+; 8) PERMISSIONIX causa il pericolo 'Nomine' (Nomina Incaricati/Responsabili); poi SICURIX+SICURIX applicano il METODO81+; 9) OBLIVIX causa il pericolo 'Emergenze/Incendio' (Addetto Antincendio); poi CHEFIX+SICURIX applicano il METODO81+; 10) IMPROVVISIX causa il pericolo 'Data breach' (Procedura Data Breach); poi CHECKIX+SICURIX applicano il METODO81+. PALETTE BRAND ESCLUSIVA: nero #05050A, bianco panna, arancione #FF6A1A/#E8501A; ROSSO solo per 'PERICOLO', VERDE per la checklist 'Metodo 81+'. Logo '81+' ben visibile in OGNI vignetta. REGOLA STORIA: SICURIX NON agisce mai da solo - in OGNI vignetta di soluzione si fa AIUTARE dai suoi colleghi EROI (lavoro di squadra, ognuno col suo ruolo). TESTO: didascalie e fumetti MOLTO BREVI (1-4 parole), GRANDI, centrati, in ITALIANO con ORTOGRAFIA PERFETTA, senza parole inventate, lettere doppie errate o testo tagliato. CATTIVI (coerenti col canone): TAGLIX, RISKIX, FUMIX, MULTIX, IMPROVVISIX, CHIMIKIX, PERMISSIONIX, OBLIVIX. EROI: CIFRIX, CONSENSIX, TRACCIX, LUXPECTORIX, CHECKIX, SICURIX, CHEFIX. NEGATIVE: nessun marchio LEGO reale, nessun personaggio protetto (Asterix ecc.), niente gore/horror, niente claim assoluti ('rischio zero','garantito','zero multe').","In Attivita professionali non e' 'se' arriva il controllo, e' 'quando'. Sei pronto?","La differenza tra chi in Attivita professionali dorme sereno e chi trema al controllo

In attivita professionali gli adempimenti obbligatori non aspettano: Ruolo/RLS, Documento, Formazione specifica, DPI, Ruolo/RSPP, Formazione, Ruolo/Preposto, Nomine, Emergenze/Incendio, Data breach. In questa pagina TALES OF SICURIX il PERICOLO prende forma... e il METODO81+ lo rimette in ordine, passo dopo passo. Immagina la scena: prima il caos, poi la checklist che sistema tutto. La regola c'e' gia': tu falla lavorare per te.
👉 Iscriviti al corso: Corso RLS -> https://81plus.net/?corso=corso-rls
▶️ YouTube: youtube.com/@sicurissimo
Contenuto informativo. Prima vedi. Poi sistemi. 81plus.net",Corso RLS,https://81plus.net/?corso=corso-rls,#TalesOfSicurix #SICURIX #Metodo81 #81plus #Sicurissimo #Sicurezza #Privacy #SicurezzaSulLavoro,SICURIX_TALES_682001_4_9_2_8_5_12_3_11_7_13.webp,https://drive.google.com/drive/folders/1hICKXdl9JTZBL1pemG19oE_661z-EH_k,IMG_ERR
47.81.10,Commercio,G,Privacy+Sicurezza+HACCP,10,Videosorveglianza a norma | Movimentazione Manuale Carichi | Formazione Preposto | Lotta agli Infestanti (Pest Control) | Formazione GDPR | Gestione Allergeni | Manuale HACCP di Autocontrollo | Sorveglianza Sanitaria / Medico Competente | Nomina Incaricati/Responsabili | Documento Valutazione Rischi (DVR),Provv.Garante | D.Lgs81/08 Tit.VI | D.Lgs81/08 art.37 | Reg.CE 852/2004 | GDPR art.32 | Reg.UE 1169/2011 | D.Lgs81/08 art.41 | GDPR art.28-29 | D.Lgs81/08 art.28,"CIFRIX>HACKIX, CIFRIX>VOLTIX, SCUDIX>BIOXIX, PREPOSTIX>FRETTIX, HYGIENIX>OBLIVIX, SICURIX>SCADUTIX, ROBOTIX81>OBLIVIX, CHEFIX>CADUTIX, DOCUMIX>HACKIX, TRACCIX>IMPROVVISIX","Crea una PAGINA A FUMETTI a STORIA COMPLETA, verticale A4 (1024x1536), QUALITA' EDITORIALE DA STAMPA, stile ufficiale 'SICURIX TALES' IDENTICO alle immagini di riferimento allegate (stessi personaggi a mattoncini 3D, stessa impaginazione, stessi colori, stesse rese): minifigure espressive, ambientazioni ricche e dettagliate del settore, luci morbide, profondita', bordi vignetta netti. IMPAGINAZIONE OBBLIGATORIA: da 10 a 12 VIGNETTE numerate che raccontano UNA STORIA con arco narrativo completo (1 situazione normale -> 2-4 arrivano i pericoli coi cattivi -> 5-6 tensione/conseguenza -> 7-9 arriva SICURIX con gli eroi e applica il METODO81+ passo per passo -> 10-11 risoluzione ordinata -> 12 finale). HEADER in alto: SICURIX (mantello, medaglione arancione '81+', bussola) che presenta in un fumetto; grande titolo 'SICURIX TALES'; sottotitolo 'COMMERCIO: Pericolo vs Soluzione con Metodo 81+'; legenda 3 voci (verde Sicurezza, rosso Rischio, blu 81+ Soluzione); fila di EROI coi nomi: CIFRIX, SCUDIX, PREPOSTIX, HYGIENIX, SICURIX, ROBOTIX81. FOOTER in basso: grande 'Prima vedi. Poi sistemi.'; banner scudo verde 'PROTEGGIAMO. PREVENIAMO. MIGLIORIAMO.' e triangolo rosso 'DISATTENZIONE. RISCHI. COSTI. CAOS.'; logo '81+' + '81plus.net'. TRAMA (usa questi eventi come vignette; se sono meno di 10 aggiungi vignette di contesto, dialogo e reazione per arrivare a 10-12): 1) HACKIX causa il pericolo 'Videosorveglianza' (Videosorveglianza a norma); poi CIFRIX+SICURIX applicano il METODO81+; 2) VOLTIX causa il pericolo 'MMC' (Movimentazione Manuale Carichi); poi CIFRIX+SICURIX applicano il METODO81+; 3) BIOXIX causa il pericolo 'Ruolo/Preposto' (Formazione Preposto); poi SCUDIX+SICURIX applicano il METODO81+; 4) FRETTIX causa il pericolo 'Infestanti' (Lotta agli Infestanti (Pest Control)); poi PREPOSTIX+SICURIX applicano il METODO81+; 5) OBLIVIX causa il pericolo 'Formazione' (Formazione GDPR); poi HYGIENIX+SICURIX applicano il METODO81+; 6) SCADUTIX causa il pericolo 'Allergeni' (Gestione Allergeni); poi SICURIX+SICURIX applicano il METODO81+; 7) OBLIVIX causa il pericolo 'Documento' (Manuale HACCP di Autocontrollo); poi ROBOTIX81+SICURIX applicano il METODO81+; 8) CADUTIX causa il pericolo 'Sorveglianza sanitaria' (Sorveglianza Sanitaria / Medico Competente); poi CHEFIX+SICURIX applicano il METODO81+; 9) HACKIX causa il pericolo 'Nomine' (Nomina Incaricati/Responsabili); poi DOCUMIX+SICURIX applicano il METODO81+; 10) IMPROVVISIX causa il pericolo 'Documento' (Documento Valutazione Rischi (DVR)); poi TRACCIX+SICURIX applicano il METODO81+. PALETTE BRAND ESCLUSIVA: nero #05050A, bianco panna, arancione #FF6A1A/#E8501A; ROSSO solo per 'PERICOLO', VERDE per la checklist 'Metodo 81+'. Logo '81+' ben visibile in OGNI vignetta. REGOLA STORIA: SICURIX NON agisce mai da solo - in OGNI vignetta di soluzione si fa AIUTARE dai suoi colleghi EROI (lavoro di squadra, ognuno col suo ruolo). TESTO: didascalie e fumetti MOLTO BREVI (1-4 parole), GRANDI, centrati, in ITALIANO con ORTOGRAFIA PERFETTA, senza parole inventate, lettere doppie errate o testo tagliato. CATTIVI (coerenti col canone): HACKIX, VOLTIX, BIOXIX, FRETTIX, OBLIVIX, SCADUTIX, CADUTIX, IMPROVVISIX. EROI: CIFRIX, SCUDIX, PREPOSTIX, HYGIENIX, SICURIX, ROBOTIX81, CHEFIX, DOCUMIX, TRACCIX. NEGATIVE: nessun marchio LEGO reale, nessun personaggio protetto (Asterix ecc.), niente gore/horror, niente claim assoluti ('rischio zero','garantito','zero multe').",La differenza tra chi in Commercio dorme sereno e chi trema al controllo,"Commercio: 3 minuti oggi o un problema enorme domani. Scegli tu.

In commercio gli adempimenti obbligatori non aspettano: Videosorveglianza, MMC, Ruolo/Preposto, Infestanti, Formazione, Allergeni, Documento, Sorveglianza sanitaria, Nomine. In questa pagina TALES OF SICURIX il PERICOLO prende forma... e il METODO81+ lo rimette in ordine, passo dopo passo. Immagina la scena: prima il caos, poi la checklist che sistema tutto. Non e' burocrazia: e' la tua tranquillita.
👉 Iscriviti al corso: Corso privacy destinato ai lavoratori -> https://81plus.net/?corso=corso-privacy-destinato-ai-lavoratori
▶️ YouTube: youtube.com/@sicurissimo
Contenuto informativo. Prima vedi. Poi sistemi. 81plus.net",Corso privacy destinato ai lavoratori,https://81plus.net/?corso=corso-privacy-destinato-ai-lavoratori,#TalesOfSicurix #SICURIX #Metodo81 #81plus #Sicurissimo #Privacy #Sicurezza #HACCP #SicurezzaSulLavoro,SICURIX_TALES_478110_24_10_3_17_22_18_12_9_21_0.webp,https://drive.google.com/drive/folders/1hICKXdl9JTZBL1pemG19oE_661z-EH_k,IMG_ERR
