codice_ateco,settore,sezione,area_mix,n_vignette,adempimenti,fonti,cast_personaggi,image_prompt,titolo_clickbait,corpo_post,cta_prodotto,cta_url,hashtag,nome_file_webp,drive_folder,stato
70.20.01,Servizi alle imprese,N,Sicurezza+Privacy,10,Addetto Primo Soccorso | Formazione Preposto | Formazione Generale Lavoratori | Documento Valutazione Rischi (DVR) | Procedura Data Breach | Formazione Specifica (rischio basso) | RSPP / Datore di Lavoro RSPP | Videoterminali (VDT) | Informativa e Consensi | Uso e Formazione DPI,DM 388/2003 | D.Lgs81/08 art.37 | Accordo Stato-Regioni | D.Lgs81/08 art.28 | GDPR art.33-34 | D.Lgs81/08 art.34 | D.Lgs81/08 Tit.VII | GDPR art.13 | D.Lgs81/08 art.77,"TRACCIX>MULTIX, PREPOSTIX>MULTIX, CIFRIX>OBLIVIX, CHECKIX>SCHIACCIX, TRACCIX>HACKIX, PREPOSTIX>BIOXIX, BLINKIX>FRETTIX, CHEFIX>CAOSIX, ROBOTIX81>MULTIX, PRIVACIX>POLVERIX","Crea una PAGINA A FUMETTI a STORIA COMPLETA, verticale A4 (1024x1536), QUALITA' EDITORIALE DA STAMPA, stile ufficiale 'SICURIX TALES' IDENTICO alle immagini di riferimento allegate (stessi personaggi a mattoncini 3D, stessa impaginazione, stessi colori, stesse rese): minifigure espressive, ambientazioni ricche e dettagliate del settore, luci morbide, profondita', bordi vignetta netti. IMPAGINAZIONE OBBLIGATORIA: da 10 a 12 VIGNETTE numerate che raccontano UNA STORIA con arco narrativo completo (1 situazione normale -> 2-4 arrivano i pericoli coi cattivi -> 5-6 tensione/conseguenza -> 7-9 arriva SICURIX con gli eroi e applica il METODO81+ passo per passo -> 10-11 risoluzione ordinata -> 12 finale). HEADER in alto: SICURIX (mantello, medaglione arancione '81+', bussola) che presenta in un fumetto; grande titolo 'SICURIX TALES'; sottotitolo 'SERVIZI ALLE IMPRESE: Pericolo vs Soluzione con Metodo 81+'; legenda 3 voci (verde Sicurezza, rosso Rischio, blu 81+ Soluzione); fila di EROI coi nomi: TRACCIX, PREPOSTIX, CIFRIX, CHECKIX, BLINKIX, CHEFIX. FOOTER in basso: grande 'Prima vedi. Poi sistemi.'; banner scudo verde 'PROTEGGIAMO. PREVENIAMO. MIGLIORIAMO.' e triangolo rosso 'DISATTENZIONE. RISCHI. COSTI. CAOS.'; logo '81+' + '81plus.net'. TRAMA (usa questi eventi come vignette; se sono meno di 10 aggiungi vignette di contesto, dialogo e reazione per arrivare a 10-12): 1) MULTIX causa il pericolo 'Emergenze/Soccorso' (Addetto Primo Soccorso); poi TRACCIX+SICURIX applicano il METODO81+; 2) MULTIX causa il pericolo 'Ruolo/Preposto' (Formazione Preposto); poi PREPOSTIX+SICURIX applicano il METODO81+; 3) OBLIVIX causa il pericolo 'Formazione base' (Formazione Generale Lavoratori); poi CIFRIX+SICURIX applicano il METODO81+; 4) SCHIACCIX causa il pericolo 'Documento' (Documento Valutazione Rischi (DVR)); poi CHECKIX+SICURIX applicano il METODO81+; 5) HACKIX causa il pericolo 'Data breach' (Procedura Data Breach); poi TRACCIX+SICURIX applicano il METODO81+; 6) BIOXIX causa il pericolo 'Formazione specifica' (Formazione Specifica (rischio basso)); poi PREPOSTIX+SICURIX applicano il METODO81+; 7) FRETTIX causa il pericolo 'Ruolo/RSPP' (RSPP / Datore di Lavoro RSPP); poi BLINKIX+SICURIX applicano il METODO81+; 8) CAOSIX causa il pericolo 'Videoterminali' (Videoterminali (VDT)); poi CHEFIX+SICURIX applicano il METODO81+; 9) MULTIX causa il pericolo 'Documento' (Informativa e Consensi); poi ROBOTIX81+SICURIX applicano il METODO81+; 10) POLVERIX causa il pericolo 'DPI' (Uso e Formazione DPI); poi PRIVACIX+SICURIX applicano il METODO81+. PALETTE BRAND ESCLUSIVA: nero #05050A, bianco panna, arancione #FF6A1A/#E8501A; ROSSO solo per 'PERICOLO', VERDE per la checklist 'Metodo 81+'. Logo '81+' ben visibile in OGNI vignetta. REGOLA STORIA: SICURIX NON agisce mai da solo - in OGNI vignetta di soluzione si fa AIUTARE dai suoi colleghi EROI (lavoro di squadra, ognuno col suo ruolo). TESTO: didascalie e fumetti MOLTO BREVI (1-4 parole), GRANDI, centrati, in ITALIANO con ORTOGRAFIA PERFETTA, senza parole inventate, lettere doppie errate o testo tagliato. CATTIVI (coerenti col canone): MULTIX, OBLIVIX, SCHIACCIX, HACKIX, BIOXIX, FRETTIX, CAOSIX, POLVERIX. EROI: TRACCIX, PREPOSTIX, CIFRIX, CHECKIX, BLINKIX, CHEFIX, ROBOTIX81, PRIVACIX. NEGATIVE: nessun marchio LEGO reale, nessun personaggio protetto (Asterix ecc.), niente gore/horror, niente claim assoluti ('rischio zero','garantito','zero multe').",In Servizi alle imprese c'e' un obbligo che in tanti scoprono solo con la sanzione,"La differenza tra chi in Servizi alle imprese dorme sereno e chi trema al controllo

In servizi alle imprese gli adempimenti obbligatori non aspettano: Emergenze/Soccorso, Ruolo/Preposto, Formazione base, Documento, Data breach, Formazione specifica, Ruolo/RSPP, Videoterminali, DPI. In questa pagina TALES OF SICURIX il PERICOLO prende forma... e il METODO81+ lo rimette in ordine, passo dopo passo. Immagina la scena: prima il caos, poi la checklist che sistema tutto. Mettere ordine ora costa poco. Rimediare dopo costa caro.
👉 Iscriviti al corso: Corso Primo Soccorso (A-B-C) -> https://81plus.net/?corso=corso-primo-soccorso-a-b-c
▶️ YouTube: youtube.com/@sicurissimo
Contenuto informativo. Prima vedi. Poi sistemi. 81plus.net",Corso Primo Soccorso (A-B-C),https://81plus.net/?corso=corso-primo-soccorso-a-b-c,#TalesOfSicurix #SICURIX #Metodo81 #81plus #Sicurissimo #Sicurezza #Privacy #SicurezzaSulLavoro,SICURIX_TALES_702001_6_3_1_0_14_2_5_9_10_8.webp,https://drive.google.com/drive/folders/1hICKXdl9JTZBL1pemG19oE_661z-EH_k,IMG_ERR
46.18.99,Commercio,G,Sicurezza+Privacy+HACCP,10,Rappresentante Lavoratori Sicurezza (RLS) | Stress Lavoro-Correlato | Addetto Primo Soccorso | Procedura Data Breach | Addetto Antincendio | Sorveglianza Sanitaria / Medico Competente | Movimentazione Manuale Carichi | Controllo Temperature e Celle | Gestione Allergeni | RSPP / Datore di Lavoro RSPP,D.Lgs81/08 art.47 | D.Lgs81/08 art.28 | DM 388/2003 | GDPR art.33-34 | DM 2/9/2021 | D.Lgs81/08 art.41 | D.Lgs81/08 Tit.VI | Reg.CE 852/2004 | Reg.UE 1169/2011 | D.Lgs81/08 art.34,"SCUDIX>TAGLIX, CIFRIX>POLVERIX, LUXPECTORIX>FUMIX, LUXPECTORIX>PHISHIX, TRACCIX>FRETTIX, ROBOTIX81>POLVERIX, SICURIX>SEGNALEX, SCUDIX>CAOSIX, TRACCIX>SCADUTIX, SCUDIX>MULTIX","Crea una PAGINA A FUMETTI a STORIA COMPLETA, verticale A4 (1024x1536), QUALITA' EDITORIALE DA STAMPA, stile ufficiale 'SICURIX TALES' IDENTICO alle immagini di riferimento allegate (stessi personaggi a mattoncini 3D, stessa impaginazione, stessi colori, stesse rese): minifigure espressive, ambientazioni ricche e dettagliate del settore, luci morbide, profondita', bordi vignetta netti. IMPAGINAZIONE OBBLIGATORIA: da 10 a 12 VIGNETTE numerate che raccontano UNA STORIA con arco narrativo completo (1 situazione normale -> 2-4 arrivano i pericoli coi cattivi -> 5-6 tensione/conseguenza -> 7-9 arriva SICURIX con gli eroi e applica il METODO81+ passo per passo -> 10-11 risoluzione ordinata -> 12 finale). HEADER in alto: SICURIX (mantello, medaglione arancione '81+', bussola) che presenta in un fumetto; grande titolo 'SICURIX TALES'; sottotitolo 'COMMERCIO: Pericolo vs Soluzione con Metodo 81+'; legenda 3 voci (verde Sicurezza, rosso Rischio, blu 81+ Soluzione); fila di EROI coi nomi: SCUDIX, CIFRIX, LUXPECTORIX, TRACCIX, ROBOTIX81, SICURIX. FOOTER in basso: grande 'Prima vedi. Poi sistemi.'; banner scudo verde 'PROTEGGIAMO. PREVENIAMO. MIGLIORIAMO.' e triangolo rosso 'DISATTENZIONE. RISCHI. COSTI. CAOS.'; logo '81+' + '81plus.net'. TRAMA (usa questi eventi come vignette; se sono meno di 10 aggiungi vignette di contesto, dialogo e reazione per arrivare a 10-12): 1) TAGLIX causa il pericolo 'Ruolo/RLS' (Rappresentante Lavoratori Sicurezza (RLS)); poi SCUDIX+SICURIX applicano il METODO81+; 2) POLVERIX causa il pericolo 'Stress' (Stress Lavoro-Correlato); poi CIFRIX+SICURIX applicano il METODO81+; 3) FUMIX causa il pericolo 'Emergenze/Soccorso' (Addetto Primo Soccorso); poi LUXPECTORIX+SICURIX applicano il METODO81+; 4) PHISHIX causa il pericolo 'Data breach' (Procedura Data Breach); poi LUXPECTORIX+SICURIX applicano il METODO81+; 5) FRETTIX causa il pericolo 'Emergenze/Incendio' (Addetto Antincendio); poi TRACCIX+SICURIX applicano il METODO81+; 6) POLVERIX causa il pericolo 'Sorveglianza sanitaria' (Sorveglianza Sanitaria / Medico Competente); poi ROBOTIX81+SICURIX applicano il METODO81+; 7) SEGNALEX causa il pericolo 'MMC' (Movimentazione Manuale Carichi); poi SICURIX+SICURIX applicano il METODO81+; 8) CAOSIX causa il pericolo 'Temperature' (Controllo Temperature e Celle); poi SCUDIX+SICURIX applicano il METODO81+; 9) SCADUTIX causa il pericolo 'Allergeni' (Gestione Allergeni); poi TRACCIX+SICURIX applicano il METODO81+; 10) MULTIX causa il pericolo 'Ruolo/RSPP' (RSPP / Datore di Lavoro RSPP); poi SCUDIX+SICURIX applicano il METODO81+. PALETTE BRAND ESCLUSIVA: nero #05050A, bianco panna, arancione #FF6A1A/#E8501A; ROSSO solo per 'PERICOLO', VERDE per la checklist 'Metodo 81+'. Logo '81+' ben visibile in OGNI vignetta. REGOLA STORIA: SICURIX NON agisce mai da solo - in OGNI vignetta di soluzione si fa AIUTARE dai suoi colleghi EROI (lavoro di squadra, ognuno col suo ruolo). TESTO: didascalie e fumetti MOLTO BREVI (1-4 parole), GRANDI, centrati, in ITALIANO con ORTOGRAFIA PERFETTA, senza parole inventate, lettere doppie errate o testo tagliato. CATTIVI (coerenti col canone): TAGLIX, POLVERIX, FUMIX, PHISHIX, FRETTIX, SEGNALEX, CAOSIX, SCADUTIX, MULTIX. EROI: SCUDIX, CIFRIX, LUXPECTORIX, TRACCIX, ROBOTIX81, SICURIX. NEGATIVE: nessun marchio LEGO reale, nessun personaggio protetto (Asterix ecc.), niente gore/horror, niente claim assoluti ('rischio zero','garantito','zero multe').",In Commercio c'e' un obbligo che in tanti scoprono solo con la sanzione,"Commercio: 3 minuti oggi o un problema enorme domani. Scegli tu.

In commercio gli adempimenti obbligatori non aspettano: Ruolo/RLS, Stress, Emergenze/Soccorso, Data breach, Emergenze/Incendio, Sorveglianza sanitaria, MMC, Temperature, Allergeni, Ruolo/RSPP. In questa pagina TALES OF SICURIX il PERICOLO prende forma... e il METODO81+ lo rimette in ordine, passo dopo passo. Immagina la scena: prima il caos, poi la checklist che sistema tutto. La regola c'e' gia': tu falla lavorare per te.
👉 Iscriviti al corso: Corso RLS -> https://81plus.net/?corso=corso-rls
▶️ YouTube: youtube.com/@sicurissimo
Contenuto informativo. Prima vedi. Poi sistemi. 81plus.net",Corso RLS,https://81plus.net/?corso=corso-rls,#TalesOfSicurix #SICURIX #Metodo81 #81plus #Sicurissimo #Sicurezza #Privacy #HACCP #SicurezzaSulLavoro,SICURIX_TALES_461899_4_11_6_23_7_9_10_16_18_5.webp,https://drive.google.com/drive/folders/1hICKXdl9JTZBL1pemG19oE_661z-EH_k,IMG_ERR
91.22.00,Altri servizi,S,Sicurezza+HACCP+Privacy,11,RSPP / Datore di Lavoro RSPP | Addetto Antincendio | Stress Lavoro-Correlato | Rintracciabilita ed Etichettatura | Piano di Sanificazione | Manuale HACCP di Autocontrollo | Gestione Allergeni | Documento Valutazione Rischi (DVR) | Lotta agli Infestanti (Pest Control) | Formazione Specifica (rischio medio) | Nomina Incaricati/Responsabili,D.Lgs81/08 art.34 | DM 2/9/2021 | D.Lgs81/08 art.28 | Reg.CE 178/2002 | Reg.CE 852/2004 | Reg.UE 1169/2011 | Accordo Stato-Regioni | GDPR art.28-29,"PREPOSTIX>RUMORIX, PREPOSTIX>CHIMIKIX, CHEFIX>SOTTOVALUTIX, CHECKIX>ACQUAIX, PREPOSTIX>MULTIX, TRACCIX>DOSAGIX, CIFRIX>FRETTIX, SCUDIX>RUMORIX, ROBOTIX81>MULTIX, ROBOTIX81>TAGLIX, SCUDIX>CANCELIX","Crea una PAGINA A FUMETTI a STORIA COMPLETA, verticale A4 (1024x1536), QUALITA' EDITORIALE DA STAMPA, stile ufficiale 'SICURIX TALES' IDENTICO alle immagini di riferimento allegate (stessi personaggi a mattoncini 3D, stessa impaginazione, stessi colori, stesse rese): minifigure espressive, ambientazioni ricche e dettagliate del settore, luci morbide, profondita', bordi vignetta netti. IMPAGINAZIONE OBBLIGATORIA: da 10 a 12 VIGNETTE numerate che raccontano UNA STORIA con arco narrativo completo (1 situazione normale -> 2-4 arrivano i pericoli coi cattivi -> 5-6 tensione/conseguenza -> 7-9 arriva SICURIX con gli eroi e applica il METODO81+ passo per passo -> 10-11 risoluzione ordinata -> 12 finale). HEADER in alto: SICURIX (mantello, medaglione arancione '81+', bussola) che presenta in un fumetto; grande titolo 'SICURIX TALES'; sottotitolo 'ALTRI SERVIZI: Pericolo vs Soluzione con Metodo 81+'; legenda 3 voci (verde Sicurezza, rosso Rischio, blu 81+ Soluzione); fila di EROI coi nomi: PREPOSTIX, CHEFIX, CHECKIX, TRACCIX, CIFRIX, SCUDIX. FOOTER in basso: grande 'Prima vedi. Poi sistemi.'; banner scudo verde 'PROTEGGIAMO. PREVENIAMO. MIGLIORIAMO.' e triangolo rosso 'DISATTENZIONE. RISCHI. COSTI. CAOS.'; logo '81+' + '81plus.net'. TRAMA (usa questi eventi come vignette; se sono meno di 10 aggiungi vignette di contesto, dialogo e reazione per arrivare a 10-12): 1) RUMORIX causa il pericolo 'Ruolo/RSPP' (RSPP / Datore di Lavoro RSPP); poi PREPOSTIX+SICURIX applicano il METODO81+; 2) CHIMIKIX causa il pericolo 'Emergenze/Incendio' (Addetto Antincendio); poi PREPOSTIX+SICURIX applicano il METODO81+; 3) SOTTOVALUTIX causa il pericolo 'Stress' (Stress Lavoro-Correlato); poi CHEFIX+SICURIX applicano il METODO81+; 4) ACQUAIX causa il pericolo 'Rintracciabilita' (Rintracciabilita ed Etichettatura); poi CHECKIX+SICURIX applicano il METODO81+; 5) MULTIX causa il pericolo 'Sanificazione' (Piano di Sanificazione); poi PREPOSTIX+SICURIX applicano il METODO81+; 6) DOSAGIX causa il pericolo 'Documento' (Manuale HACCP di Autocontrollo); poi TRACCIX+SICURIX applicano il METODO81+; 7) FRETTIX causa il pericolo 'Allergeni' (Gestione Allergeni); poi CIFRIX+SICURIX applicano il METODO81+; 8) RUMORIX causa il pericolo 'Documento' (Documento Valutazione Rischi (DVR)); poi SCUDIX+SICURIX applicano il METODO81+; 9) MULTIX causa il pericolo 'Infestanti' (Lotta agli Infestanti (Pest Control)); poi ROBOTIX81+SICURIX applicano il METODO81+; 10) TAGLIX causa il pericolo 'Formazione specifica' (Formazione Specifica (rischio medio)); poi ROBOTIX81+SICURIX applicano il METODO81+; 11) CANCELIX causa il pericolo 'Nomine' (Nomina Incaricati/Responsabili); poi SCUDIX+SICURIX applicano il METODO81+. PALETTE BRAND ESCLUSIVA: nero #05050A, bianco panna, arancione #FF6A1A/#E8501A; ROSSO solo per 'PERICOLO', VERDE per la checklist 'Metodo 81+'. Logo '81+' ben visibile in OGNI vignetta. REGOLA STORIA: SICURIX NON agisce mai da solo - in OGNI vignetta di soluzione si fa AIUTARE dai suoi colleghi EROI (lavoro di squadra, ognuno col suo ruolo). TESTO: didascalie e fumetti MOLTO BREVI (1-4 parole), GRANDI, centrati, in ITALIANO con ORTOGRAFIA PERFETTA, senza parole inventate, lettere doppie errate o testo tagliato. CATTIVI (coerenti col canone): RUMORIX, CHIMIKIX, SOTTOVALUTIX, ACQUAIX, MULTIX, DOSAGIX, FRETTIX, TAGLIX, CANCELIX. EROI: PREPOSTIX, CHEFIX, CHECKIX, TRACCIX, CIFRIX, SCUDIX, ROBOTIX81. NEGATIVE: nessun marchio LEGO reale, nessun personaggio protetto (Asterix ecc.), niente gore/horror, niente claim assoluti ('rischio zero','garantito','zero multe').",In Altri servizi c'e' un obbligo che in tanti scoprono solo con la sanzione,"Altri servizi: 3 minuti oggi o un problema enorme domani. Scegli tu.

In altri servizi gli adempimenti obbligatori non aspettano: Ruolo/RSPP, Emergenze/Incendio, Stress, Rintracciabilita, Sanificazione, Documento, Allergeni, Infestanti, Formazione specifica, Nomine. In questa pagina TALES OF SICURIX il PERICOLO prende forma... e il METODO81+ lo rimette in ordine, passo dopo passo. Immagina la scena: prima il caos, poi la checklist che sistema tutto. Mettere ordine ora costa poco. Rimediare dopo costa caro.
👉 Iscriviti al corso: RSPP Datore di Lavoro modulo 1 e 2 -> https://81plus.net/?corso=rspp-datore-di-lavoro-modulo-1-e-2
▶️ YouTube: youtube.com/@sicurissimo
Contenuto informativo. Prima vedi. Poi sistemi. 81plus.net",RSPP Datore di Lavoro modulo 1 e 2,https://81plus.net/?corso=rspp-datore-di-lavoro-modulo-1-e-2,#TalesOfSicurix #SICURIX #Metodo81 #81plus #Sicurissimo #Sicurezza #HACCP #Privacy #SicurezzaSulLavoro,SICURIX_TALES_912200_5_7_11_15_14_12_18_0_17_2_21.webp,https://drive.google.com/drive/folders/1hICKXdl9JTZBL1pemG19oE_661z-EH_k,IMG_ERR
74.99.16,Servizi alle imprese,N,Sicurezza+Privacy,12,Uso e Formazione DPI | Addetto Antincendio | Rappresentante Lavoratori Sicurezza (RLS) | Procedura Data Breach | RSPP / Datore di Lavoro RSPP | Formazione Preposto | Formazione Specifica (rischio basso) | Documento Valutazione Rischi (DVR) | Informativa e Consensi | Addetto Primo Soccorso | Registro dei Trattamenti | Videoterminali (VDT),D.Lgs81/08 art.77 | DM 2/9/2021 | D.Lgs81/08 art.47 | GDPR art.33-34 | D.Lgs81/08 art.34 | D.Lgs81/08 art.37 | Accordo Stato-Regioni | D.Lgs81/08 art.28 | GDPR art.13 | DM 388/2003 | GDPR art.30 | D.Lgs81/08 Tit.VII,"CONSENSIX>TAGLIX, BLINKIX>MULTIX, CHEFIX>RISKIX, CHECKIX>PERMISSIONIX, SCUDIX>RUMORIX, BLINKIX>CHIMIKIX, PREPOSTIX>RISKIX, PREPOSTIX>CADUTIX, PRIVACIX>RISKIX, DOCUMIX>RUMORIX, FORMIX>CAOSIX, CHEFIX>SCIVOLIX","Crea una PAGINA A FUMETTI a STORIA COMPLETA, verticale A4 (1024x1536), QUALITA' EDITORIALE DA STAMPA, stile ufficiale 'SICURIX TALES' IDENTICO alle immagini di riferimento allegate (stessi personaggi a mattoncini 3D, stessa impaginazione, stessi colori, stesse rese): minifigure espressive, ambientazioni ricche e dettagliate del settore, luci morbide, profondita', bordi vignetta netti. IMPAGINAZIONE OBBLIGATORIA: da 10 a 12 VIGNETTE numerate che raccontano UNA STORIA con arco narrativo completo (1 situazione normale -> 2-4 arrivano i pericoli coi cattivi -> 5-6 tensione/conseguenza -> 7-9 arriva SICURIX con gli eroi e applica il METODO81+ passo per passo -> 10-11 risoluzione ordinata -> 12 finale). HEADER in alto: SICURIX (mantello, medaglione arancione '81+', bussola) che presenta in un fumetto; grande titolo 'SICURIX TALES'; sottotitolo 'SERVIZI ALLE IMPRESE: Pericolo vs Soluzione con Metodo 81+'; legenda 3 voci (verde Sicurezza, rosso Rischio, blu 81+ Soluzione); fila di EROI coi nomi: CONSENSIX, BLINKIX, CHEFIX, CHECKIX, SCUDIX, PREPOSTIX. FOOTER in basso: grande 'Prima vedi. Poi sistemi.'; banner scudo verde 'PROTEGGIAMO. PREVENIAMO. MIGLIORIAMO.' e triangolo rosso 'DISATTENZIONE. RISCHI. COSTI. CAOS.'; logo '81+' + '81plus.net'. TRAMA (usa questi eventi come vignette; se sono meno di 10 aggiungi vignette di contesto, dialogo e reazione per arrivare a 10-12): 1) TAGLIX causa il pericolo 'DPI' (Uso e Formazione DPI); poi CONSENSIX+SICURIX applicano il METODO81+; 2) MULTIX causa il pericolo 'Emergenze/Incendio' (Addetto Antincendio); poi BLINKIX+SICURIX applicano il METODO81+; 3) RISKIX causa il pericolo 'Ruolo/RLS' (Rappresentante Lavoratori Sicurezza (RLS)); poi CHEFIX+SICURIX applicano il METODO81+; 4) PERMISSIONIX causa il pericolo 'Data breach' (Procedura Data Breach); poi CHECKIX+SICURIX applicano il METODO81+; 5) RUMORIX causa il pericolo 'Ruolo/RSPP' (RSPP / Datore di Lavoro RSPP); poi SCUDIX+SICURIX applicano il METODO81+; 6) CHIMIKIX causa il pericolo 'Ruolo/Preposto' (Formazione Preposto); poi BLINKIX+SICURIX applicano il METODO81+; 7) RISKIX causa il pericolo 'Formazione specifica' (Formazione Specifica (rischio basso)); poi PREPOSTIX+SICURIX applicano il METODO81+; 8) CADUTIX causa il pericolo 'Documento' (Documento Valutazione Rischi (DVR)); poi PREPOSTIX+SICURIX applicano il METODO81+; 9) RISKIX causa il pericolo 'Documento' (Informativa e Consensi); poi PRIVACIX+SICURIX applicano il METODO81+; 10) RUMORIX causa il pericolo 'Emergenze/Soccorso' (Addetto Primo Soccorso); poi DOCUMIX+SICURIX applicano il METODO81+; 11) CAOSIX causa il pericolo 'Registro' (Registro dei Trattamenti); poi FORMIX+SICURIX applicano il METODO81+; 12) SCIVOLIX causa il pericolo 'Videoterminali' (Videoterminali (VDT)); poi CHEFIX+SICURIX applicano il METODO81+. PALETTE BRAND ESCLUSIVA: nero #05050A, bianco panna, arancione #FF6A1A/#E8501A; ROSSO solo per 'PERICOLO', VERDE per la checklist 'Metodo 81+'. Logo '81+' ben visibile in OGNI vignetta. REGOLA STORIA: SICURIX NON agisce mai da solo - in OGNI vignetta di soluzione si fa AIUTARE dai suoi colleghi EROI (lavoro di squadra, ognuno col suo ruolo). TESTO: didascalie e fumetti MOLTO BREVI (1-4 parole), GRANDI, centrati, in ITALIANO con ORTOGRAFIA PERFETTA, senza parole inventate, lettere doppie errate o testo tagliato. CATTIVI (coerenti col canone): TAGLIX, MULTIX, RISKIX, PERMISSIONIX, RUMORIX, CHIMIKIX, CADUTIX, CAOSIX, SCIVOLIX. EROI: CONSENSIX, BLINKIX, CHEFIX, CHECKIX, SCUDIX, PREPOSTIX, PRIVACIX, DOCUMIX, FORMIX. NEGATIVE: nessun marchio LEGO reale, nessun personaggio protetto (Asterix ecc.), niente gore/horror, niente claim assoluti ('rischio zero','garantito','zero multe').",Quello che l'ispettore controlla per primo in Servizi alle imprese (e quasi nessuno lo sa),"La differenza tra chi in Servizi alle imprese dorme sereno e chi trema al controllo

In servizi alle imprese gli adempimenti obbligatori non aspettano: DPI, Emergenze/Incendio, Ruolo/RLS, Data breach, Ruolo/RSPP, Ruolo/Preposto, Formazione specifica, Documento, Emergenze/Soccorso, Registro, Videoterminali. In questa pagina TALES OF SICURIX il PERICOLO prende forma... e il METODO81+ lo rimette in ordine, passo dopo passo. Immagina la scena: prima il caos, poi la checklist che sistema tutto. Non e' burocrazia: e' la tua tranquillita.
👉 Iscriviti al corso: Corso Lavori in Quota e DPI Anticaduta -> https://81plus.net/?corso=corso-lavori-in-quota-e-dpi-anticaduta
▶️ YouTube: youtube.com/@sicurissimo
Contenuto informativo. Prima vedi. Poi sistemi. 81plus.net",Corso Lavori in Quota e DPI Anticaduta,https://81plus.net/?corso=corso-lavori-in-quota-e-dpi-anticaduta,#TalesOfSicurix #SICURIX #Metodo81 #81plus #Sicurissimo #Sicurezza #Privacy #SicurezzaSulLavoro,SICURIX_TALES_749916_8_7_4_14_5_3_2_0_10_6_11_9.webp,https://drive.google.com/drive/folders/1hICKXdl9JTZBL1pemG19oE_661z-EH_k,IMG_ERR
