codice_ateco,settore,sezione,area_mix,n_vignette,adempimenti,fonti,cast_personaggi,image_prompt,titolo_clickbait,corpo_post,cta_prodotto,cta_url,hashtag,nome_file_webp,drive_folder,stato
93.13.09,Altri servizi,S,Sicurezza+Privacy+HACCP,12,Formazione Specifica (rischio medio) | Documento Valutazione Rischi (DVR) | Registro dei Trattamenti | Formazione Generale Lavoratori | Nomina Incaricati/Responsabili | Corso Alimentarista | Formazione GDPR | Procedura Data Breach | Rintracciabilita ed Etichettatura | Addetto Primo Soccorso | Controllo Temperature e Celle | Addetto Antincendio,Accordo Stato-Regioni | D.Lgs81/08 art.28 | GDPR art.30 | GDPR art.28-29 | Reg.CE 852/2004 | GDPR art.32 | GDPR art.33-34 | Reg.CE 178/2002 | DM 388/2003 | DM 2/9/2021,"FORMIX>SCHIACCIX, FORMIX>CADUTIX, DOCUMIX>PERMISSIONIX, CHECKIX>VOLTIX, HYGIENIX>MULTIX, PREPOSTIX>TEMPORIX, CONSENSIX>MULTIX, CONSENSIX>RISKIX, CIFRIX>OBLIVIX, CHECKIX>MULTIX, LUXPECTORIX>CAOSIX, LUXPECTORIX>POLVERIX","Crea una PAGINA A FUMETTI a STORIA COMPLETA, verticale A4 (1024x1536), QUALITA' EDITORIALE DA STAMPA, stile ufficiale 'SICURIX TALES' IDENTICO alle immagini di riferimento allegate (stessi personaggi a mattoncini 3D, stessa impaginazione, stessi colori, stesse rese): minifigure espressive, ambientazioni ricche e dettagliate del settore, luci morbide, profondita', bordi vignetta netti. IMPAGINAZIONE OBBLIGATORIA: da 10 a 12 VIGNETTE numerate che raccontano UNA STORIA con arco narrativo completo (1 situazione normale -> 2-4 arrivano i pericoli coi cattivi -> 5-6 tensione/conseguenza -> 7-9 arriva SICURIX con gli eroi e applica il METODO81+ passo per passo -> 10-11 risoluzione ordinata -> 12 finale). HEADER in alto: SICURIX (mantello, medaglione arancione '81+', bussola) che presenta in un fumetto; grande titolo 'SICURIX TALES'; sottotitolo 'ALTRI SERVIZI: Pericolo vs Soluzione con Metodo 81+'; legenda 3 voci (verde Sicurezza, rosso Rischio, blu 81+ Soluzione); fila di EROI coi nomi: FORMIX, DOCUMIX, CHECKIX, HYGIENIX, PREPOSTIX, CONSENSIX. FOOTER in basso: grande 'Prima vedi. Poi sistemi.'; banner scudo verde 'PROTEGGIAMO. PREVENIAMO. MIGLIORIAMO.' e triangolo rosso 'DISATTENZIONE. RISCHI. COSTI. CAOS.'; logo '81+' + '81plus.net'. TRAMA (usa questi eventi come vignette; se sono meno di 10 aggiungi vignette di contesto, dialogo e reazione per arrivare a 10-12): 1) SCHIACCIX causa il pericolo 'Formazione specifica' (Formazione Specifica (rischio medio)); poi FORMIX+SICURIX applicano il METODO81+; 2) CADUTIX causa il pericolo 'Documento' (Documento Valutazione Rischi (DVR)); poi FORMIX+SICURIX applicano il METODO81+; 3) PERMISSIONIX causa il pericolo 'Registro' (Registro dei Trattamenti); poi DOCUMIX+SICURIX applicano il METODO81+; 4) VOLTIX causa il pericolo 'Formazione base' (Formazione Generale Lavoratori); poi CHECKIX+SICURIX applicano il METODO81+; 5) MULTIX causa il pericolo 'Nomine' (Nomina Incaricati/Responsabili); poi HYGIENIX+SICURIX applicano il METODO81+; 6) TEMPORIX causa il pericolo 'Corso' (Corso Alimentarista); poi PREPOSTIX+SICURIX applicano il METODO81+; 7) MULTIX causa il pericolo 'Formazione' (Formazione GDPR); poi CONSENSIX+SICURIX applicano il METODO81+; 8) RISKIX causa il pericolo 'Data breach' (Procedura Data Breach); poi CONSENSIX+SICURIX applicano il METODO81+; 9) OBLIVIX causa il pericolo 'Rintracciabilita' (Rintracciabilita ed Etichettatura); poi CIFRIX+SICURIX applicano il METODO81+; 10) MULTIX causa il pericolo 'Emergenze/Soccorso' (Addetto Primo Soccorso); poi CHECKIX+SICURIX applicano il METODO81+; 11) CAOSIX causa il pericolo 'Temperature' (Controllo Temperature e Celle); poi LUXPECTORIX+SICURIX applicano il METODO81+; 12) POLVERIX causa il pericolo 'Emergenze/Incendio' (Addetto Antincendio); poi LUXPECTORIX+SICURIX applicano il METODO81+. PALETTE BRAND ESCLUSIVA: nero #05050A, bianco panna, arancione #FF6A1A/#E8501A; ROSSO solo per 'PERICOLO', VERDE per la checklist 'Metodo 81+'. Logo '81+' ben visibile in OGNI vignetta. REGOLA STORIA: SICURIX NON agisce mai da solo - in OGNI vignetta di soluzione si fa AIUTARE dai suoi colleghi EROI (lavoro di squadra, ognuno col suo ruolo). TESTO: didascalie e fumetti MOLTO BREVI (1-4 parole), GRANDI, centrati, in ITALIANO con ORTOGRAFIA PERFETTA, senza parole inventate, lettere doppie errate o testo tagliato. CATTIVI (coerenti col canone): SCHIACCIX, CADUTIX, PERMISSIONIX, VOLTIX, MULTIX, TEMPORIX, RISKIX, OBLIVIX, CAOSIX, POLVERIX. EROI: FORMIX, DOCUMIX, CHECKIX, HYGIENIX, PREPOSTIX, CONSENSIX, CIFRIX, LUXPECTORIX. NEGATIVE: nessun marchio LEGO reale, nessun personaggio protetto (Asterix ecc.), niente gore/horror, niente claim assoluti ('rischio zero','garantito','zero multe').",La differenza tra chi in Altri servizi dorme sereno e chi trema al controllo,"In Altri servizi c'e' un obbligo che in tanti scoprono solo con la sanzione

In altri servizi gli adempimenti obbligatori non aspettano: Formazione specifica, Documento, Registro, Formazione base, Nomine, Corso, Formazione, Data breach, Rintracciabilita, Emergenze/Soccorso, Temperature, Emergenze/Incendio. In questa pagina TALES OF SICURIX il PERICOLO prende forma... e il METODO81+ lo rimette in ordine, passo dopo passo. Immagina la scena: prima il caos, poi la checklist che sistema tutto. Mettere ordine ora costa poco. Rimediare dopo costa caro.
👉 Iscriviti al corso: Corso lavoratore parte GENERALE 4 ore -> https://81plus.net/?corso=corso-lavoratore-parte-generale-4-ore
▶️ YouTube: youtube.com/@sicurissimo
Contenuto informativo. Prima vedi. Poi sistemi. 81plus.net",Corso lavoratore parte GENERALE 4 ore,https://81plus.net/?corso=corso-lavoratore-parte-generale-4-ore,#TalesOfSicurix #SICURIX #Metodo81 #81plus #Sicurissimo #Sicurezza #Privacy #HACCP #SicurezzaSulLavoro,SICURIX_TALES_931309_2_0_20_1_21_13_22_23_15_6_16_7.webp,https://drive.google.com/drive/folders/1hICKXdl9JTZBL1pemG19oE_661z-EH_k,IMG_ERR
52.22.01,Trasporti/Magazzino,H,Sicurezza+Privacy,11,Stress Lavoro-Correlato | Procedura Data Breach | Addetto Primo Soccorso | Formazione Specifica (rischio alto) | RSPP / Datore di Lavoro RSPP | Attrezzature e Macchine | Rischio Rumore | Sorveglianza Sanitaria / Medico Competente | Uso e Formazione DPI | Rappresentante Lavoratori Sicurezza (RLS) | Formazione Generale Lavoratori,D.Lgs81/08 art.28 | GDPR art.33-34 | DM 388/2003 | Accordo Stato-Regioni | D.Lgs81/08 art.34 | D.Lgs81/08 Tit.III | D.Lgs81/08 Tit.VIII | D.Lgs81/08 art.41 | D.Lgs81/08 art.77 | D.Lgs81/08 art.47,"PRIVACIX>CHIMIKIX, CHECKIX>OBLIVIX, PREPOSTIX>POLVERIX, TRACCIX>FUMIX, BLINKIX>CHIMIKIX, CIFRIX>VIBRIX, PREPOSTIX>ØTIX, FORMIX>OBLIVIX, DOCUMIX>TAGLIX, SCUDIX>TAGLIX, CHECKIX>VOLTIX","Crea una PAGINA A FUMETTI a STORIA COMPLETA, verticale A4 (1024x1536), QUALITA' EDITORIALE DA STAMPA, stile ufficiale 'SICURIX TALES' IDENTICO alle immagini di riferimento allegate (stessi personaggi a mattoncini 3D, stessa impaginazione, stessi colori, stesse rese): minifigure espressive, ambientazioni ricche e dettagliate del settore, luci morbide, profondita', bordi vignetta netti. IMPAGINAZIONE OBBLIGATORIA: da 10 a 12 VIGNETTE numerate che raccontano UNA STORIA con arco narrativo completo (1 situazione normale -> 2-4 arrivano i pericoli coi cattivi -> 5-6 tensione/conseguenza -> 7-9 arriva SICURIX con gli eroi e applica il METODO81+ passo per passo -> 10-11 risoluzione ordinata -> 12 finale). HEADER in alto: SICURIX (mantello, medaglione arancione '81+', bussola) che presenta in un fumetto; grande titolo 'SICURIX TALES'; sottotitolo 'TRASPORTI/MAGAZZINO: Pericolo vs Soluzione con Metodo 81+'; legenda 3 voci (verde Sicurezza, rosso Rischio, blu 81+ Soluzione); fila di EROI coi nomi: PRIVACIX, CHECKIX, PREPOSTIX, TRACCIX, BLINKIX, CIFRIX. FOOTER in basso: grande 'Prima vedi. Poi sistemi.'; banner scudo verde 'PROTEGGIAMO. PREVENIAMO. MIGLIORIAMO.' e triangolo rosso 'DISATTENZIONE. RISCHI. COSTI. CAOS.'; logo '81+' + '81plus.net'. TRAMA (usa questi eventi come vignette; se sono meno di 10 aggiungi vignette di contesto, dialogo e reazione per arrivare a 10-12): 1) CHIMIKIX causa il pericolo 'Stress' (Stress Lavoro-Correlato); poi PRIVACIX+SICURIX applicano il METODO81+; 2) OBLIVIX causa il pericolo 'Data breach' (Procedura Data Breach); poi CHECKIX+SICURIX applicano il METODO81+; 3) POLVERIX causa il pericolo 'Emergenze/Soccorso' (Addetto Primo Soccorso); poi PREPOSTIX+SICURIX applicano il METODO81+; 4) FUMIX causa il pericolo 'Formazione specifica' (Formazione Specifica (rischio alto)); poi TRACCIX+SICURIX applicano il METODO81+; 5) CHIMIKIX causa il pericolo 'Ruolo/RSPP' (RSPP / Datore di Lavoro RSPP); poi BLINKIX+SICURIX applicano il METODO81+; 6) VIBRIX causa il pericolo 'Attrezzature' (Attrezzature e Macchine); poi CIFRIX+SICURIX applicano il METODO81+; 7) ØTIX causa il pericolo 'Rumore' (Rischio Rumore); poi PREPOSTIX+SICURIX applicano il METODO81+; 8) OBLIVIX causa il pericolo 'Sorveglianza sanitaria' (Sorveglianza Sanitaria / Medico Competente); poi FORMIX+SICURIX applicano il METODO81+; 9) TAGLIX causa il pericolo 'DPI' (Uso e Formazione DPI); poi DOCUMIX+SICURIX applicano il METODO81+; 10) TAGLIX causa il pericolo 'Ruolo/RLS' (Rappresentante Lavoratori Sicurezza (RLS)); poi SCUDIX+SICURIX applicano il METODO81+; 11) VOLTIX causa il pericolo 'Formazione base' (Formazione Generale Lavoratori); poi CHECKIX+SICURIX applicano il METODO81+. PALETTE BRAND ESCLUSIVA: nero #05050A, bianco panna, arancione #FF6A1A/#E8501A; ROSSO solo per 'PERICOLO', VERDE per la checklist 'Metodo 81+'. Logo '81+' ben visibile in OGNI vignetta. REGOLA STORIA: SICURIX NON agisce mai da solo - in OGNI vignetta di soluzione si fa AIUTARE dai suoi colleghi EROI (lavoro di squadra, ognuno col suo ruolo). TESTO: didascalie e fumetti MOLTO BREVI (1-4 parole), GRANDI, centrati, in ITALIANO con ORTOGRAFIA PERFETTA, senza parole inventate, lettere doppie errate o testo tagliato. CATTIVI (coerenti col canone): CHIMIKIX, OBLIVIX, POLVERIX, FUMIX, VIBRIX, ØTIX, TAGLIX, VOLTIX. EROI: PRIVACIX, CHECKIX, PREPOSTIX, TRACCIX, BLINKIX, CIFRIX, FORMIX, DOCUMIX, SCUDIX. NEGATIVE: nessun marchio LEGO reale, nessun personaggio protetto (Asterix ecc.), niente gore/horror, niente claim assoluti ('rischio zero','garantito','zero multe').","In Trasporti/Magazzino non e' 'se' arriva il controllo, e' 'quando'. Sei pronto?","In Trasporti/Magazzino c'e' un obbligo che in tanti scoprono solo con la sanzione

In trasporti/magazzino gli adempimenti obbligatori non aspettano: Stress, Data breach, Emergenze/Soccorso, Formazione specifica, Ruolo/RSPP, Attrezzature, Rumore, Sorveglianza sanitaria, DPI, Ruolo/RLS, Formazione base. In questa pagina TALES OF SICURIX il PERICOLO prende forma... e il METODO81+ lo rimette in ordine, passo dopo passo. Immagina la scena: prima il caos, poi la checklist che sistema tutto. Mettere ordine ora costa poco. Rimediare dopo costa caro.
👉 Iscriviti al corso: Rischio stress lavoro correlato -> https://81plus.net/?corso=rischio-stress-lavoro-correlato
▶️ YouTube: youtube.com/@sicurissimo
Contenuto informativo. Prima vedi. Poi sistemi. 81plus.net",Rischio stress lavoro correlato,https://81plus.net/?corso=rischio-stress-lavoro-correlato,#TalesOfSicurix #SICURIX #Metodo81 #81plus #Sicurissimo #Sicurezza #Privacy #SicurezzaSulLavoro,SICURIX_TALES_522201_11_19_6_2_5_13_12_9_8_4_1.webp,https://drive.google.com/drive/folders/1hICKXdl9JTZBL1pemG19oE_661z-EH_k,IMG_ERR
86.91.01,Arte/Sport,R,HACCP+Sicurezza+Privacy,10,Corso Alimentarista | Rappresentante Lavoratori Sicurezza (RLS) | Lotta agli Infestanti (Pest Control) | Gestione Allergeni | Addetto Antincendio | Procedura Data Breach | Addetto Primo Soccorso | RSPP / Datore di Lavoro RSPP | Formazione Preposto | Movimentazione Manuale Carichi,Reg.CE 852/2004 | D.Lgs81/08 art.47 | Reg.UE 1169/2011 | DM 2/9/2021 | GDPR art.33-34 | DM 388/2003 | D.Lgs81/08 art.34 | D.Lgs81/08 art.37 | D.Lgs81/08 Tit.VI,"HYGIENIX>CROSSIX, SCUDIX>SOTTOVALUTIX, CONSENSIX>TEMPORIX, CHECKIX>MULTIX, PREPOSTIX>CAOSIX, HYGIENIX>OBLIVIX, ROBOTIX81>FUMIX, SCUDIX>VIBRIX, DOCUMIX>FUMIX, CHECKIX>CHIMIKIX","Crea una PAGINA A FUMETTI a STORIA COMPLETA, verticale A4 (1024x1536), QUALITA' EDITORIALE DA STAMPA, stile ufficiale 'SICURIX TALES' IDENTICO alle immagini di riferimento allegate (stessi personaggi a mattoncini 3D, stessa impaginazione, stessi colori, stesse rese): minifigure espressive, ambientazioni ricche e dettagliate del settore, luci morbide, profondita', bordi vignetta netti. IMPAGINAZIONE OBBLIGATORIA: da 10 a 12 VIGNETTE numerate che raccontano UNA STORIA con arco narrativo completo (1 situazione normale -> 2-4 arrivano i pericoli coi cattivi -> 5-6 tensione/conseguenza -> 7-9 arriva SICURIX con gli eroi e applica il METODO81+ passo per passo -> 10-11 risoluzione ordinata -> 12 finale). HEADER in alto: SICURIX (mantello, medaglione arancione '81+', bussola) che presenta in un fumetto; grande titolo 'SICURIX TALES'; sottotitolo 'ARTE/SPORT: Pericolo vs Soluzione con Metodo 81+'; legenda 3 voci (verde Sicurezza, rosso Rischio, blu 81+ Soluzione); fila di EROI coi nomi: HYGIENIX, SCUDIX, CONSENSIX, CHECKIX, PREPOSTIX, ROBOTIX81. FOOTER in basso: grande 'Prima vedi. Poi sistemi.'; banner scudo verde 'PROTEGGIAMO. PREVENIAMO. MIGLIORIAMO.' e triangolo rosso 'DISATTENZIONE. RISCHI. COSTI. CAOS.'; logo '81+' + '81plus.net'. TRAMA (usa questi eventi come vignette; se sono meno di 10 aggiungi vignette di contesto, dialogo e reazione per arrivare a 10-12): 1) CROSSIX causa il pericolo 'Corso' (Corso Alimentarista); poi HYGIENIX+SICURIX applicano il METODO81+; 2) SOTTOVALUTIX causa il pericolo 'Ruolo/RLS' (Rappresentante Lavoratori Sicurezza (RLS)); poi SCUDIX+SICURIX applicano il METODO81+; 3) TEMPORIX causa il pericolo 'Infestanti' (Lotta agli Infestanti (Pest Control)); poi CONSENSIX+SICURIX applicano il METODO81+; 4) MULTIX causa il pericolo 'Allergeni' (Gestione Allergeni); poi CHECKIX+SICURIX applicano il METODO81+; 5) CAOSIX causa il pericolo 'Emergenze/Incendio' (Addetto Antincendio); poi PREPOSTIX+SICURIX applicano il METODO81+; 6) OBLIVIX causa il pericolo 'Data breach' (Procedura Data Breach); poi HYGIENIX+SICURIX applicano il METODO81+; 7) FUMIX causa il pericolo 'Emergenze/Soccorso' (Addetto Primo Soccorso); poi ROBOTIX81+SICURIX applicano il METODO81+; 8) VIBRIX causa il pericolo 'Ruolo/RSPP' (RSPP / Datore di Lavoro RSPP); poi SCUDIX+SICURIX applicano il METODO81+; 9) FUMIX causa il pericolo 'Ruolo/Preposto' (Formazione Preposto); poi DOCUMIX+SICURIX applicano il METODO81+; 10) CHIMIKIX causa il pericolo 'MMC' (Movimentazione Manuale Carichi); poi CHECKIX+SICURIX applicano il METODO81+. PALETTE BRAND ESCLUSIVA: nero #05050A, bianco panna, arancione #FF6A1A/#E8501A; ROSSO solo per 'PERICOLO', VERDE per la checklist 'Metodo 81+'. Logo '81+' ben visibile in OGNI vignetta. REGOLA STORIA: SICURIX NON agisce mai da solo - in OGNI vignetta di soluzione si fa AIUTARE dai suoi colleghi EROI (lavoro di squadra, ognuno col suo ruolo). TESTO: didascalie e fumetti MOLTO BREVI (1-4 parole), GRANDI, centrati, in ITALIANO con ORTOGRAFIA PERFETTA, senza parole inventate, lettere doppie errate o testo tagliato. CATTIVI (coerenti col canone): CROSSIX, SOTTOVALUTIX, TEMPORIX, MULTIX, CAOSIX, OBLIVIX, FUMIX, VIBRIX, CHIMIKIX. EROI: HYGIENIX, SCUDIX, CONSENSIX, CHECKIX, PREPOSTIX, ROBOTIX81, DOCUMIX. NEGATIVE: nessun marchio LEGO reale, nessun personaggio protetto (Asterix ecc.), niente gore/horror, niente claim assoluti ('rischio zero','garantito','zero multe').","In Arte/Sport non e' 'se' arriva il controllo, e' 'quando'. Sei pronto?","Arte/Sport: 3 minuti oggi o un problema enorme domani. Scegli tu.

In arte/sport gli adempimenti obbligatori non aspettano: Corso, Ruolo/RLS, Infestanti, Allergeni, Emergenze/Incendio, Data breach, Emergenze/Soccorso, Ruolo/RSPP, Ruolo/Preposto, MMC. In questa pagina TALES OF SICURIX il PERICOLO prende forma... e il METODO81+ lo rimette in ordine, passo dopo passo. Immagina la scena: prima il caos, poi la checklist che sistema tutto. Mettere ordine ora costa poco. Rimediare dopo costa caro.
👉 Iscriviti al corso: Haccp - Corso responsabile industria alimentare -> https://81plus.net/?corso=haccp-corso-responsabile-industria-alimentare
▶️ YouTube: youtube.com/@sicurissimo
Contenuto informativo. Prima vedi. Poi sistemi. 81plus.net",Haccp - Corso responsabile industria alimentare,https://81plus.net/?corso=haccp-corso-responsabile-industria-alimentare,#TalesOfSicurix #SICURIX #Metodo81 #81plus #Sicurissimo #HACCP #Sicurezza #Privacy #SicurezzaSulLavoro,SICURIX_TALES_869101_13_4_17_18_7_23_6_5_3_10.webp,https://drive.google.com/drive/folders/1hICKXdl9JTZBL1pemG19oE_661z-EH_k,IMG_ERR
32.50.30,Manifattura,C,Sicurezza+HACCP+Privacy+Ambientale,10,Attrezzature e Macchine | Controllo Temperature e Celle | Gestione Allergeni | Procedura Data Breach | Addetto Antincendio | Gestione Rifiuti e Registro | Formazione Ambientale | Documento Valutazione Rischi (DVR) | Piano di Sanificazione | Formazione Preposto,D.Lgs81/08 Tit.III | Reg.CE 852/2004 | Reg.UE 1169/2011 | GDPR art.33-34 | DM 2/9/2021 | D.Lgs152/06 | D.Lgs81/08 art.28 | D.Lgs81/08 art.37,"FORMIX>FRETTIX, SICURIX>OBLIVIX, TRACCIX>CROSSIX, CHECKIX>CAOSIX, PREPOSTIX>RUMORIX, SICURIX>IMPROVVISIX, CONSENSIX>CAOSIX, SICURIX>TAGLIX, SICURIX>CROSSIX, HYGIENIX>TAGLIX","Crea una PAGINA A FUMETTI a STORIA COMPLETA, verticale A4 (1024x1536), QUALITA' EDITORIALE DA STAMPA, stile ufficiale 'SICURIX TALES' IDENTICO alle immagini di riferimento allegate (stessi personaggi a mattoncini 3D, stessa impaginazione, stessi colori, stesse rese): minifigure espressive, ambientazioni ricche e dettagliate del settore, luci morbide, profondita', bordi vignetta netti. IMPAGINAZIONE OBBLIGATORIA: da 10 a 12 VIGNETTE numerate che raccontano UNA STORIA con arco narrativo completo (1 situazione normale -> 2-4 arrivano i pericoli coi cattivi -> 5-6 tensione/conseguenza -> 7-9 arriva SICURIX con gli eroi e applica il METODO81+ passo per passo -> 10-11 risoluzione ordinata -> 12 finale). HEADER in alto: SICURIX (mantello, medaglione arancione '81+', bussola) che presenta in un fumetto; grande titolo 'SICURIX TALES'; sottotitolo 'MANIFATTURA: Pericolo vs Soluzione con Metodo 81+'; legenda 3 voci (verde Sicurezza, rosso Rischio, blu 81+ Soluzione); fila di EROI coi nomi: FORMIX, SICURIX, TRACCIX, CHECKIX, PREPOSTIX, CONSENSIX. FOOTER in basso: grande 'Prima vedi. Poi sistemi.'; banner scudo verde 'PROTEGGIAMO. PREVENIAMO. MIGLIORIAMO.' e triangolo rosso 'DISATTENZIONE. RISCHI. COSTI. CAOS.'; logo '81+' + '81plus.net'. TRAMA (usa questi eventi come vignette; se sono meno di 10 aggiungi vignette di contesto, dialogo e reazione per arrivare a 10-12): 1) FRETTIX causa il pericolo 'Attrezzature' (Attrezzature e Macchine); poi FORMIX+SICURIX applicano il METODO81+; 2) OBLIVIX causa il pericolo 'Temperature' (Controllo Temperature e Celle); poi SICURIX+SICURIX applicano il METODO81+; 3) CROSSIX causa il pericolo 'Allergeni' (Gestione Allergeni); poi TRACCIX+SICURIX applicano il METODO81+; 4) CAOSIX causa il pericolo 'Data breach' (Procedura Data Breach); poi CHECKIX+SICURIX applicano il METODO81+; 5) RUMORIX causa il pericolo 'Emergenze/Incendio' (Addetto Antincendio); poi PREPOSTIX+SICURIX applicano il METODO81+; 6) IMPROVVISIX causa il pericolo 'Rifiuti' (Gestione Rifiuti e Registro); poi SICURIX+SICURIX applicano il METODO81+; 7) CAOSIX causa il pericolo 'Formazione' (Formazione Ambientale); poi CONSENSIX+SICURIX applicano il METODO81+; 8) TAGLIX causa il pericolo 'Documento' (Documento Valutazione Rischi (DVR)); poi SICURIX+SICURIX applicano il METODO81+; 9) CROSSIX causa il pericolo 'Sanificazione' (Piano di Sanificazione); poi SICURIX+SICURIX applicano il METODO81+; 10) TAGLIX causa il pericolo 'Ruolo/Preposto' (Formazione Preposto); poi HYGIENIX+SICURIX applicano il METODO81+. PALETTE BRAND ESCLUSIVA: nero #05050A, bianco panna, arancione #FF6A1A/#E8501A; ROSSO solo per 'PERICOLO', VERDE per la checklist 'Metodo 81+'. Logo '81+' ben visibile in OGNI vignetta. REGOLA STORIA: SICURIX NON agisce mai da solo - in OGNI vignetta di soluzione si fa AIUTARE dai suoi colleghi EROI (lavoro di squadra, ognuno col suo ruolo). TESTO: didascalie e fumetti MOLTO BREVI (1-4 parole), GRANDI, centrati, in ITALIANO con ORTOGRAFIA PERFETTA, senza parole inventate, lettere doppie errate o testo tagliato. CATTIVI (coerenti col canone): FRETTIX, OBLIVIX, CROSSIX, CAOSIX, RUMORIX, IMPROVVISIX, TAGLIX. EROI: FORMIX, SICURIX, TRACCIX, CHECKIX, PREPOSTIX, CONSENSIX, HYGIENIX. NEGATIVE: nessun marchio LEGO reale, nessun personaggio protetto (Asterix ecc.), niente gore/horror, niente claim assoluti ('rischio zero','garantito','zero multe').","In Manifattura non e' 'se' arriva il controllo, e' 'quando'. Sei pronto?","In Manifattura non e' 'se' arriva il controllo, e' 'quando'. Sei pronto?

In manifattura gli adempimenti obbligatori non aspettano: Attrezzature, Temperature, Allergeni, Data breach, Emergenze/Incendio, Rifiuti, Formazione, Documento, Sanificazione, Ruolo/Preposto. In questa pagina TALES OF SICURIX il PERICOLO prende forma... e il METODO81+ lo rimette in ordine, passo dopo passo. Immagina la scena: prima il caos, poi la checklist che sistema tutto. Chi si mette in regola prima, dorme meglio dopo.
👉 Iscriviti al corso: Corso Lavori in Quota e DPI Anticaduta -> https://81plus.net/?corso=corso-lavori-in-quota-e-dpi-anticaduta
▶️ YouTube: youtube.com/@sicurissimo
Contenuto informativo. Prima vedi. Poi sistemi. 81plus.net",Corso Lavori in Quota e DPI Anticaduta,https://81plus.net/?corso=corso-lavori-in-quota-e-dpi-anticaduta,#TalesOfSicurix #SICURIX #Metodo81 #81plus #Sicurissimo #Sicurezza #HACCP #Privacy #Ambientale #SicurezzaSulLavoro,SICURIX_TALES_325030_13_18_20_25_7_26_27_0_16_3.webp,https://drive.google.com/drive/folders/1hICKXdl9JTZBL1pemG19oE_661z-EH_k,IMG_ERR
