codice_ateco,settore,sezione,area_mix,n_vignette,adempimenti,fonti,cast_personaggi,image_prompt,titolo_clickbait,corpo_post,cta_prodotto,cta_url,hashtag,nome_file_webp,drive_folder,stato
46.50.30,Commercio,G,Sicurezza+HACCP+Privacy,11,Sorveglianza Sanitaria / Medico Competente | RSPP / Datore di Lavoro RSPP | Addetto Antincendio | Stress Lavoro-Correlato | Formazione Generale Lavoratori | Formazione Specifica (rischio medio) | Manuale HACCP di Autocontrollo | Videoterminali (VDT) | Procedura Data Breach | Registro dei Trattamenti | Corso Alimentarista,D.Lgs81/08 art.41 | D.Lgs81/08 art.34 | DM 2/9/2021 | D.Lgs81/08 art.28 | Accordo Stato-Regioni | Reg.CE 852/2004 | D.Lgs81/08 Tit.VII | GDPR art.33-34 | GDPR art.30,"TRACCIX>TAGLIX, ROBOTIX81>VIBRIX, SCUDIX>RISKIX, SCUDIX>CAOSIX, CHECKIX>BIOXIX, SCUDIX>FRETTIX, CHEFIX>ACQUAIX, HYGIENIX>OBLIVIX, CHECKIX>MULTIX, CHEFIX>MULTIX, HYGIENIX>CAOSIX","Crea una PAGINA A FUMETTI a STORIA COMPLETA, verticale A4 (1024x1536), QUALITA' EDITORIALE DA STAMPA, stile ufficiale 'SICURIX TALES' IDENTICO alle immagini di riferimento allegate (stessi personaggi a mattoncini 3D, stessa impaginazione, stessi colori, stesse rese): minifigure espressive, ambientazioni ricche e dettagliate del settore, luci morbide, profondita', bordi vignetta netti. IMPAGINAZIONE OBBLIGATORIA: da 10 a 12 VIGNETTE numerate che raccontano UNA STORIA con arco narrativo completo (1 situazione normale -> 2-4 arrivano i pericoli coi cattivi -> 5-6 tensione/conseguenza -> 7-9 arriva SICURIX con gli eroi e applica il METODO81+ passo per passo -> 10-11 risoluzione ordinata -> 12 finale). HEADER in alto: SICURIX (mantello, medaglione arancione '81+', bussola) che presenta in un fumetto; grande titolo 'SICURIX TALES'; sottotitolo 'COMMERCIO: Pericolo vs Soluzione con Metodo 81+'; legenda 3 voci (verde Sicurezza, rosso Rischio, blu 81+ Soluzione); fila di EROI coi nomi: TRACCIX, ROBOTIX81, SCUDIX, CHECKIX, CHEFIX, HYGIENIX. FOOTER in basso: grande 'Prima vedi. Poi sistemi.'; banner scudo verde 'PROTEGGIAMO. PREVENIAMO. MIGLIORIAMO.' e triangolo rosso 'DISATTENZIONE. RISCHI. COSTI. CAOS.'; logo '81+' + '81plus.net'. TRAMA (usa questi eventi come vignette; se sono meno di 10 aggiungi vignette di contesto, dialogo e reazione per arrivare a 10-12): 1) TAGLIX causa il pericolo 'Sorveglianza sanitaria' (Sorveglianza Sanitaria / Medico Competente); poi TRACCIX+SICURIX applicano il METODO81+; 2) VIBRIX causa il pericolo 'Ruolo/RSPP' (RSPP / Datore di Lavoro RSPP); poi ROBOTIX81+SICURIX applicano il METODO81+; 3) RISKIX causa il pericolo 'Emergenze/Incendio' (Addetto Antincendio); poi SCUDIX+SICURIX applicano il METODO81+; 4) CAOSIX causa il pericolo 'Stress' (Stress Lavoro-Correlato); poi SCUDIX+SICURIX applicano il METODO81+; 5) BIOXIX causa il pericolo 'Formazione base' (Formazione Generale Lavoratori); poi CHECKIX+SICURIX applicano il METODO81+; 6) FRETTIX causa il pericolo 'Formazione specifica' (Formazione Specifica (rischio medio)); poi SCUDIX+SICURIX applicano il METODO81+; 7) ACQUAIX causa il pericolo 'Documento' (Manuale HACCP di Autocontrollo); poi CHEFIX+SICURIX applicano il METODO81+; 8) OBLIVIX causa il pericolo 'Videoterminali' (Videoterminali (VDT)); poi HYGIENIX+SICURIX applicano il METODO81+; 9) MULTIX causa il pericolo 'Data breach' (Procedura Data Breach); poi CHECKIX+SICURIX applicano il METODO81+; 10) MULTIX causa il pericolo 'Registro' (Registro dei Trattamenti); poi CHEFIX+SICURIX applicano il METODO81+; 11) CAOSIX causa il pericolo 'Corso' (Corso Alimentarista); poi HYGIENIX+SICURIX applicano il METODO81+. PALETTE BRAND ESCLUSIVA: nero #05050A, bianco panna, arancione #FF6A1A/#E8501A; ROSSO solo per 'PERICOLO', VERDE per la checklist 'Metodo 81+'. Logo '81+' ben visibile in OGNI vignetta. REGOLA STORIA: SICURIX NON agisce mai da solo - in OGNI vignetta di soluzione si fa AIUTARE dai suoi colleghi EROI (lavoro di squadra, ognuno col suo ruolo). TESTO: didascalie e fumetti MOLTO BREVI (1-4 parole), GRANDI, centrati, in ITALIANO con ORTOGRAFIA PERFETTA, senza parole inventate, lettere doppie errate o testo tagliato. CATTIVI (coerenti col canone): TAGLIX, VIBRIX, RISKIX, CAOSIX, BIOXIX, FRETTIX, ACQUAIX, OBLIVIX, MULTIX. EROI: TRACCIX, ROBOTIX81, SCUDIX, CHECKIX, CHEFIX, HYGIENIX. NEGATIVE: nessun marchio LEGO reale, nessun personaggio protetto (Asterix ecc.), niente gore/horror, niente claim assoluti ('rischio zero','garantito','zero multe').","In Commercio non e' 'se' arriva il controllo, e' 'quando'. Sei pronto?","In Commercio non e' 'se' arriva il controllo, e' 'quando'. Sei pronto?

In commercio gli adempimenti obbligatori non aspettano: Sorveglianza sanitaria, Ruolo/RSPP, Emergenze/Incendio, Stress, Formazione base, Formazione specifica, Documento, Videoterminali, Data breach, Registro, Corso. In questa pagina TALES OF SICURIX il PERICOLO prende forma... e il METODO81+ lo rimette in ordine, passo dopo passo. Immagina la scena: prima il caos, poi la checklist che sistema tutto. La regola c'e' gia': tu falla lavorare per te.
👉 Iscriviti al corso: Corso lavoratore parte GENERALE 4 ore -> https://81plus.net/?corso=corso-lavoratore-parte-generale-4-ore
▶️ YouTube: youtube.com/@sicurissimo
Contenuto informativo. Prima vedi. Poi sistemi. 81plus.net",Corso lavoratore parte GENERALE 4 ore,https://81plus.net/?corso=corso-lavoratore-parte-generale-4-ore,#TalesOfSicurix #SICURIX #Metodo81 #81plus #Sicurissimo #Sicurezza #HACCP #Privacy #SicurezzaSulLavoro,SICURIX_TALES_465030_9_5_7_11_1_2_13_12_24_21_14.webp,https://drive.google.com/drive/folders/1hICKXdl9JTZBL1pemG19oE_661z-EH_k,IMG_ERR
24.53.02,Manifattura,C,Sicurezza+Ambientale+Privacy+HACCP,10,Movimentazione Manuale Carichi | Formazione Preposto | Formazione Ambientale | Documento Valutazione Rischi (DVR) | Informativa e Consensi | Piano di Sanificazione | Formazione Generale Lavoratori | Procedura Data Breach | Lotta agli Infestanti (Pest Control) | Formazione Specifica (rischio alto),D.Lgs81/08 Tit.VI | D.Lgs81/08 art.37 | D.Lgs152/06 | D.Lgs81/08 art.28 | GDPR art.13 | Reg.CE 852/2004 | Accordo Stato-Regioni | GDPR art.33-34,"SCUDIX>BIOXIX, DOCUMIX>RUMORIX, LUXPECTORIX>RISKIX, PRIVACIX>SCIVOLIX, BLINKIX>LEAKIX, LUXPECTORIX>DOSAGIX, SICURIX>CADUTIX, TRACCIX>CANCELIX, HYGIENIX>MULTIX, HYGIENIX>CADUTIX","Crea una PAGINA A FUMETTI a STORIA COMPLETA, verticale A4 (1024x1536), QUALITA' EDITORIALE DA STAMPA, stile ufficiale 'SICURIX TALES' IDENTICO alle immagini di riferimento allegate (stessi personaggi a mattoncini 3D, stessa impaginazione, stessi colori, stesse rese): minifigure espressive, ambientazioni ricche e dettagliate del settore, luci morbide, profondita', bordi vignetta netti. IMPAGINAZIONE OBBLIGATORIA: da 10 a 12 VIGNETTE numerate che raccontano UNA STORIA con arco narrativo completo (1 situazione normale -> 2-4 arrivano i pericoli coi cattivi -> 5-6 tensione/conseguenza -> 7-9 arriva SICURIX con gli eroi e applica il METODO81+ passo per passo -> 10-11 risoluzione ordinata -> 12 finale). HEADER in alto: SICURIX (mantello, medaglione arancione '81+', bussola) che presenta in un fumetto; grande titolo 'SICURIX TALES'; sottotitolo 'MANIFATTURA: Pericolo vs Soluzione con Metodo 81+'; legenda 3 voci (verde Sicurezza, rosso Rischio, blu 81+ Soluzione); fila di EROI coi nomi: SCUDIX, DOCUMIX, LUXPECTORIX, PRIVACIX, BLINKIX, SICURIX. FOOTER in basso: grande 'Prima vedi. Poi sistemi.'; banner scudo verde 'PROTEGGIAMO. PREVENIAMO. MIGLIORIAMO.' e triangolo rosso 'DISATTENZIONE. RISCHI. COSTI. CAOS.'; logo '81+' + '81plus.net'. TRAMA (usa questi eventi come vignette; se sono meno di 10 aggiungi vignette di contesto, dialogo e reazione per arrivare a 10-12): 1) BIOXIX causa il pericolo 'MMC' (Movimentazione Manuale Carichi); poi SCUDIX+SICURIX applicano il METODO81+; 2) RUMORIX causa il pericolo 'Ruolo/Preposto' (Formazione Preposto); poi DOCUMIX+SICURIX applicano il METODO81+; 3) RISKIX causa il pericolo 'Formazione' (Formazione Ambientale); poi LUXPECTORIX+SICURIX applicano il METODO81+; 4) SCIVOLIX causa il pericolo 'Documento' (Documento Valutazione Rischi (DVR)); poi PRIVACIX+SICURIX applicano il METODO81+; 5) LEAKIX causa il pericolo 'Documento' (Informativa e Consensi); poi BLINKIX+SICURIX applicano il METODO81+; 6) DOSAGIX causa il pericolo 'Sanificazione' (Piano di Sanificazione); poi LUXPECTORIX+SICURIX applicano il METODO81+; 7) CADUTIX causa il pericolo 'Formazione base' (Formazione Generale Lavoratori); poi SICURIX+SICURIX applicano il METODO81+; 8) CANCELIX causa il pericolo 'Data breach' (Procedura Data Breach); poi TRACCIX+SICURIX applicano il METODO81+; 9) MULTIX causa il pericolo 'Infestanti' (Lotta agli Infestanti (Pest Control)); poi HYGIENIX+SICURIX applicano il METODO81+; 10) CADUTIX causa il pericolo 'Formazione specifica' (Formazione Specifica (rischio alto)); poi HYGIENIX+SICURIX applicano il METODO81+. PALETTE BRAND ESCLUSIVA: nero #05050A, bianco panna, arancione #FF6A1A/#E8501A; ROSSO solo per 'PERICOLO', VERDE per la checklist 'Metodo 81+'. Logo '81+' ben visibile in OGNI vignetta. REGOLA STORIA: SICURIX NON agisce mai da solo - in OGNI vignetta di soluzione si fa AIUTARE dai suoi colleghi EROI (lavoro di squadra, ognuno col suo ruolo). TESTO: didascalie e fumetti MOLTO BREVI (1-4 parole), GRANDI, centrati, in ITALIANO con ORTOGRAFIA PERFETTA, senza parole inventate, lettere doppie errate o testo tagliato. CATTIVI (coerenti col canone): BIOXIX, RUMORIX, RISKIX, SCIVOLIX, LEAKIX, DOSAGIX, CADUTIX, CANCELIX, MULTIX. EROI: SCUDIX, DOCUMIX, LUXPECTORIX, PRIVACIX, BLINKIX, SICURIX, TRACCIX, HYGIENIX. NEGATIVE: nessun marchio LEGO reale, nessun personaggio protetto (Asterix ecc.), niente gore/horror, niente claim assoluti ('rischio zero','garantito','zero multe').",Quello che l'ispettore controlla per primo in Manifattura (e quasi nessuno lo sa),"In Manifattura c'e' un obbligo che in tanti scoprono solo con la sanzione

In manifattura gli adempimenti obbligatori non aspettano: MMC, Ruolo/Preposto, Formazione, Documento, Sanificazione, Formazione base, Data breach, Infestanti, Formazione specifica. In questa pagina TALES OF SICURIX il PERICOLO prende forma... e il METODO81+ lo rimette in ordine, passo dopo passo. Immagina la scena: prima il caos, poi la checklist che sistema tutto. Mettere ordine ora costa poco. Rimediare dopo costa caro.
👉 Iscriviti al corso: Corso RSPP Datore di Lavoro : Movimentazione manuale carichi -> https://81plus.net/?corso=corso-rspp-datore-di-lavoro-movimentazione-manuale-carichi
▶️ YouTube: youtube.com/@sicurissimo
Contenuto informativo. Prima vedi. Poi sistemi. 81plus.net",Corso RSPP Datore di Lavoro : Movimentazione manuale carichi,https://81plus.net/?corso=corso-rspp-datore-di-lavoro-movimentazione-manuale-carichi,#TalesOfSicurix #SICURIX #Metodo81 #81plus #Sicurissimo #Sicurezza #Ambientale #Privacy #HACCP #SicurezzaSulLavoro,SICURIX_TALES_245302_10_3_27_0_21_16_1_25_19_2.webp,https://drive.google.com/drive/folders/1hICKXdl9JTZBL1pemG19oE_661z-EH_k,IMG_ERR
26.11.00,Manifattura,C,Sicurezza+Privacy+HACCP,10,Rischio Rumore | Nomina Incaricati/Responsabili | Formazione Generale Lavoratori | Formazione Specifica (rischio alto) | Piano di Sanificazione | Movimentazione Manuale Carichi | Rischio Elettrico (PES/PAV) | Informativa e Consensi | Corso Alimentarista | Registro dei Trattamenti,D.Lgs81/08 Tit.VIII | GDPR art.28-29 | Accordo Stato-Regioni | Reg.CE 852/2004 | D.Lgs81/08 Tit.VI | CEI 11-27 | GDPR art.13 | GDPR art.30,"LUXPECTORIX>VIBRIX, CIFRIX>CAOSIX, CHEFIX>POLVERIX, BLINKIX>RUMORIX, TRACCIX>CAOSIX, CONSENSIX>SCIVOLIX, BLINKIX>VIBRIX, SCUDIX>HACKIX, CONSENSIX>SPORCKIX, SCUDIX>RISKIX","Crea una PAGINA A FUMETTI a STORIA COMPLETA, verticale A4 (1024x1536), QUALITA' EDITORIALE DA STAMPA, stile ufficiale 'SICURIX TALES' IDENTICO alle immagini di riferimento allegate (stessi personaggi a mattoncini 3D, stessa impaginazione, stessi colori, stesse rese): minifigure espressive, ambientazioni ricche e dettagliate del settore, luci morbide, profondita', bordi vignetta netti. IMPAGINAZIONE OBBLIGATORIA: da 10 a 12 VIGNETTE numerate che raccontano UNA STORIA con arco narrativo completo (1 situazione normale -> 2-4 arrivano i pericoli coi cattivi -> 5-6 tensione/conseguenza -> 7-9 arriva SICURIX con gli eroi e applica il METODO81+ passo per passo -> 10-11 risoluzione ordinata -> 12 finale). HEADER in alto: SICURIX (mantello, medaglione arancione '81+', bussola) che presenta in un fumetto; grande titolo 'SICURIX TALES'; sottotitolo 'MANIFATTURA: Pericolo vs Soluzione con Metodo 81+'; legenda 3 voci (verde Sicurezza, rosso Rischio, blu 81+ Soluzione); fila di EROI coi nomi: LUXPECTORIX, CIFRIX, CHEFIX, BLINKIX, TRACCIX, CONSENSIX. FOOTER in basso: grande 'Prima vedi. Poi sistemi.'; banner scudo verde 'PROTEGGIAMO. PREVENIAMO. MIGLIORIAMO.' e triangolo rosso 'DISATTENZIONE. RISCHI. COSTI. CAOS.'; logo '81+' + '81plus.net'. TRAMA (usa questi eventi come vignette; se sono meno di 10 aggiungi vignette di contesto, dialogo e reazione per arrivare a 10-12): 1) VIBRIX causa il pericolo 'Rumore' (Rischio Rumore); poi LUXPECTORIX+SICURIX applicano il METODO81+; 2) CAOSIX causa il pericolo 'Nomine' (Nomina Incaricati/Responsabili); poi CIFRIX+SICURIX applicano il METODO81+; 3) POLVERIX causa il pericolo 'Formazione base' (Formazione Generale Lavoratori); poi CHEFIX+SICURIX applicano il METODO81+; 4) RUMORIX causa il pericolo 'Formazione specifica' (Formazione Specifica (rischio alto)); poi BLINKIX+SICURIX applicano il METODO81+; 5) CAOSIX causa il pericolo 'Sanificazione' (Piano di Sanificazione); poi TRACCIX+SICURIX applicano il METODO81+; 6) SCIVOLIX causa il pericolo 'MMC' (Movimentazione Manuale Carichi); poi CONSENSIX+SICURIX applicano il METODO81+; 7) VIBRIX causa il pericolo 'Rischio elettrico' (Rischio Elettrico (PES/PAV)); poi BLINKIX+SICURIX applicano il METODO81+; 8) HACKIX causa il pericolo 'Documento' (Informativa e Consensi); poi SCUDIX+SICURIX applicano il METODO81+; 9) SPORCKIX causa il pericolo 'Corso' (Corso Alimentarista); poi CONSENSIX+SICURIX applicano il METODO81+; 10) RISKIX causa il pericolo 'Registro' (Registro dei Trattamenti); poi SCUDIX+SICURIX applicano il METODO81+. PALETTE BRAND ESCLUSIVA: nero #05050A, bianco panna, arancione #FF6A1A/#E8501A; ROSSO solo per 'PERICOLO', VERDE per la checklist 'Metodo 81+'. Logo '81+' ben visibile in OGNI vignetta. REGOLA STORIA: SICURIX NON agisce mai da solo - in OGNI vignetta di soluzione si fa AIUTARE dai suoi colleghi EROI (lavoro di squadra, ognuno col suo ruolo). TESTO: didascalie e fumetti MOLTO BREVI (1-4 parole), GRANDI, centrati, in ITALIANO con ORTOGRAFIA PERFETTA, senza parole inventate, lettere doppie errate o testo tagliato. CATTIVI (coerenti col canone): VIBRIX, CAOSIX, POLVERIX, RUMORIX, SCIVOLIX, HACKIX, SPORCKIX, RISKIX. EROI: LUXPECTORIX, CIFRIX, CHEFIX, BLINKIX, TRACCIX, CONSENSIX, SCUDIX. NEGATIVE: nessun marchio LEGO reale, nessun personaggio protetto (Asterix ecc.), niente gore/horror, niente claim assoluti ('rischio zero','garantito','zero multe').",Manifattura: 3 minuti oggi o un problema enorme domani. Scegli tu.,"La differenza tra chi in Manifattura dorme sereno e chi trema al controllo

In manifattura gli adempimenti obbligatori non aspettano: Rumore, Nomine, Formazione base, Formazione specifica, Sanificazione, MMC, Rischio elettrico, Documento, Corso, Registro. In questa pagina TALES OF SICURIX il PERICOLO prende forma... e il METODO81+ lo rimette in ordine, passo dopo passo. Immagina la scena: prima il caos, poi la checklist che sistema tutto. La regola c'e' gia': tu falla lavorare per te.
👉 Iscriviti al corso: Corso RSPP Datore di Lavoro : rischio rumore -> https://81plus.net/?corso=corso-rspp-datore-di-lavoro-rischio-rumore
▶️ YouTube: youtube.com/@sicurissimo
Contenuto informativo. Prima vedi. Poi sistemi. 81plus.net",Corso RSPP Datore di Lavoro : rischio rumore,https://81plus.net/?corso=corso-rspp-datore-di-lavoro-rischio-rumore,#TalesOfSicurix #SICURIX #Metodo81 #81plus #Sicurissimo #Sicurezza #Privacy #HACCP #SicurezzaSulLavoro,SICURIX_TALES_261100_12_24_1_2_17_10_14_22_16_23.webp,https://drive.google.com/drive/folders/1hICKXdl9JTZBL1pemG19oE_661z-EH_k,IMG_ERR
47.12.20,Commercio,G,HACCP+Sicurezza+Privacy,11,Controllo Temperature e Celle | Addetto Primo Soccorso | Rappresentante Lavoratori Sicurezza (RLS) | Documento Valutazione Rischi (DVR) | Lotta agli Infestanti (Pest Control) | Procedura Data Breach | Nomina Incaricati/Responsabili | Movimentazione Manuale Carichi | Rintracciabilita ed Etichettatura | RSPP / Datore di Lavoro RSPP | Piano di Sanificazione,Reg.CE 852/2004 | DM 388/2003 | D.Lgs81/08 art.47 | D.Lgs81/08 art.28 | GDPR art.33-34 | GDPR art.28-29 | D.Lgs81/08 Tit.VI | Reg.CE 178/2002 | D.Lgs81/08 art.34,"TRACCIX>SCADUTIX, HYGIENIX>RISKIX, TRACCIX>VIBRIX, CHEFIX>POLVERIX, FORMIX>RISKIX, LUXPECTORIX>CANCELIX, DOCUMIX>CAOSIX, CHEFIX>OBLIVIX, CHECKIX>SPORCKIX, CHECKIX>CADUTIX, SCUDIX>MULTIX","Crea una PAGINA A FUMETTI a STORIA COMPLETA, verticale A4 (1024x1536), QUALITA' EDITORIALE DA STAMPA, stile ufficiale 'SICURIX TALES' IDENTICO alle immagini di riferimento allegate (stessi personaggi a mattoncini 3D, stessa impaginazione, stessi colori, stesse rese): minifigure espressive, ambientazioni ricche e dettagliate del settore, luci morbide, profondita', bordi vignetta netti. IMPAGINAZIONE OBBLIGATORIA: da 10 a 12 VIGNETTE numerate che raccontano UNA STORIA con arco narrativo completo (1 situazione normale -> 2-4 arrivano i pericoli coi cattivi -> 5-6 tensione/conseguenza -> 7-9 arriva SICURIX con gli eroi e applica il METODO81+ passo per passo -> 10-11 risoluzione ordinata -> 12 finale). HEADER in alto: SICURIX (mantello, medaglione arancione '81+', bussola) che presenta in un fumetto; grande titolo 'SICURIX TALES'; sottotitolo 'COMMERCIO: Pericolo vs Soluzione con Metodo 81+'; legenda 3 voci (verde Sicurezza, rosso Rischio, blu 81+ Soluzione); fila di EROI coi nomi: TRACCIX, HYGIENIX, CHEFIX, FORMIX, LUXPECTORIX, DOCUMIX. FOOTER in basso: grande 'Prima vedi. Poi sistemi.'; banner scudo verde 'PROTEGGIAMO. PREVENIAMO. MIGLIORIAMO.' e triangolo rosso 'DISATTENZIONE. RISCHI. COSTI. CAOS.'; logo '81+' + '81plus.net'. TRAMA (usa questi eventi come vignette; se sono meno di 10 aggiungi vignette di contesto, dialogo e reazione per arrivare a 10-12): 1) SCADUTIX causa il pericolo 'Temperature' (Controllo Temperature e Celle); poi TRACCIX+SICURIX applicano il METODO81+; 2) RISKIX causa il pericolo 'Emergenze/Soccorso' (Addetto Primo Soccorso); poi HYGIENIX+SICURIX applicano il METODO81+; 3) VIBRIX causa il pericolo 'Ruolo/RLS' (Rappresentante Lavoratori Sicurezza (RLS)); poi TRACCIX+SICURIX applicano il METODO81+; 4) POLVERIX causa il pericolo 'Documento' (Documento Valutazione Rischi (DVR)); poi CHEFIX+SICURIX applicano il METODO81+; 5) RISKIX causa il pericolo 'Infestanti' (Lotta agli Infestanti (Pest Control)); poi FORMIX+SICURIX applicano il METODO81+; 6) CANCELIX causa il pericolo 'Data breach' (Procedura Data Breach); poi LUXPECTORIX+SICURIX applicano il METODO81+; 7) CAOSIX causa il pericolo 'Nomine' (Nomina Incaricati/Responsabili); poi DOCUMIX+SICURIX applicano il METODO81+; 8) OBLIVIX causa il pericolo 'MMC' (Movimentazione Manuale Carichi); poi CHEFIX+SICURIX applicano il METODO81+; 9) SPORCKIX causa il pericolo 'Rintracciabilita' (Rintracciabilita ed Etichettatura); poi CHECKIX+SICURIX applicano il METODO81+; 10) CADUTIX causa il pericolo 'Ruolo/RSPP' (RSPP / Datore di Lavoro RSPP); poi CHECKIX+SICURIX applicano il METODO81+; 11) MULTIX causa il pericolo 'Sanificazione' (Piano di Sanificazione); poi SCUDIX+SICURIX applicano il METODO81+. PALETTE BRAND ESCLUSIVA: nero #05050A, bianco panna, arancione #FF6A1A/#E8501A; ROSSO solo per 'PERICOLO', VERDE per la checklist 'Metodo 81+'. Logo '81+' ben visibile in OGNI vignetta. REGOLA STORIA: SICURIX NON agisce mai da solo - in OGNI vignetta di soluzione si fa AIUTARE dai suoi colleghi EROI (lavoro di squadra, ognuno col suo ruolo). TESTO: didascalie e fumetti MOLTO BREVI (1-4 parole), GRANDI, centrati, in ITALIANO con ORTOGRAFIA PERFETTA, senza parole inventate, lettere doppie errate o testo tagliato. CATTIVI (coerenti col canone): SCADUTIX, RISKIX, VIBRIX, POLVERIX, CANCELIX, CAOSIX, OBLIVIX, SPORCKIX, CADUTIX, MULTIX. EROI: TRACCIX, HYGIENIX, CHEFIX, FORMIX, LUXPECTORIX, DOCUMIX, CHECKIX, SCUDIX. NEGATIVE: nessun marchio LEGO reale, nessun personaggio protetto (Asterix ecc.), niente gore/horror, niente claim assoluti ('rischio zero','garantito','zero multe').",Commercio: 3 minuti oggi o un problema enorme domani. Scegli tu.,"Quello che l'ispettore controlla per primo in Commercio (e quasi nessuno lo sa)

In commercio gli adempimenti obbligatori non aspettano: Temperature, Emergenze/Soccorso, Ruolo/RLS, Documento, Infestanti, Data breach, Nomine, MMC, Rintracciabilita, Ruolo/RSPP, Sanificazione. In questa pagina TALES OF SICURIX il PERICOLO prende forma... e il METODO81+ lo rimette in ordine, passo dopo passo. Immagina la scena: prima il caos, poi la checklist che sistema tutto. Chi si mette in regola prima, dorme meglio dopo.
👉 Iscriviti al corso: Le esecuzioni civili, le procedure concorsuali e i servizi di cancelleria -> https://81plus.net/?corso=le-esecuzioni-civili-le-procedure-concorsuali-e-i-servizi-di
▶️ YouTube: youtube.com/@sicurissimo
Contenuto informativo. Prima vedi. Poi sistemi. 81plus.net","Le esecuzioni civili, le procedure concorsuali e i servizi di cancelleria",https://81plus.net/?corso=le-esecuzioni-civili-le-procedure-concorsuali-e-i-servizi-di,#TalesOfSicurix #SICURIX #Metodo81 #81plus #Sicurissimo #HACCP #Sicurezza #Privacy #SicurezzaSulLavoro,SICURIX_TALES_471220_16_6_4_0_17_23_21_10_15_5_14.webp,https://drive.google.com/drive/folders/1hICKXdl9JTZBL1pemG19oE_661z-EH_k,IMG_ERR
