codice_ateco,settore,sezione,area_mix,n_vignette,adempimenti,fonti,cast_personaggi,image_prompt,titolo_clickbait,corpo_post,cta_prodotto,cta_url,hashtag,nome_file_webp,drive_folder,stato
10.51.10,Manifattura,C,Sicurezza+HACCP+Privacy,11,Addetto Primo Soccorso | Rappresentante Lavoratori Sicurezza (RLS) | Documento Valutazione Rischi (DVR) | Piano di Sanificazione | Attrezzature e Macchine | Formazione Generale Lavoratori | Controllo Temperature e Celle | Registro dei Trattamenti | Informativa e Consensi | Uso e Formazione DPI | Formazione Preposto,DM 388/2003 | D.Lgs81/08 art.47 | D.Lgs81/08 art.28 | Reg.CE 852/2004 | D.Lgs81/08 Tit.III | Accordo Stato-Regioni | GDPR art.30 | GDPR art.13 | D.Lgs81/08 art.77 | D.Lgs81/08 art.37,"CIFRIX>VIBRIX, HYGIENIX>SOTTOVALUTIX, LUXPECTORIX>OBLIVIX, DOCUMIX>IMPROVVISIX, CIFRIX>POLVERIX, SICURIX>POLVERIX, CIFRIX>CROSSIX, LUXPECTORIX>RISKIX, CHECKIX>FRETTIX, CIFRIX>SCHIACCIX, PRIVACIX>MULTIX","Crea una PAGINA A FUMETTI a STORIA COMPLETA, verticale A4 (1024x1536), QUALITA' EDITORIALE DA STAMPA, stile ufficiale 'SICURIX TALES' IDENTICO alle immagini di riferimento allegate (stessi personaggi a mattoncini 3D, stessa impaginazione, stessi colori, stesse rese): minifigure espressive, ambientazioni ricche e dettagliate del settore, luci morbide, profondita', bordi vignetta netti. IMPAGINAZIONE OBBLIGATORIA: da 10 a 12 VIGNETTE numerate che raccontano UNA STORIA con arco narrativo completo (1 situazione normale -> 2-4 arrivano i pericoli coi cattivi -> 5-6 tensione/conseguenza -> 7-9 arriva SICURIX con gli eroi e applica il METODO81+ passo per passo -> 10-11 risoluzione ordinata -> 12 finale). HEADER in alto: SICURIX (mantello, medaglione arancione '81+', bussola) che presenta in un fumetto; grande titolo 'SICURIX TALES'; sottotitolo 'MANIFATTURA: Pericolo vs Soluzione con Metodo 81+'; legenda 3 voci (verde Sicurezza, rosso Rischio, blu 81+ Soluzione); fila di EROI coi nomi: CIFRIX, HYGIENIX, LUXPECTORIX, DOCUMIX, SICURIX, CHECKIX. FOOTER in basso: grande 'Prima vedi. Poi sistemi.'; banner scudo verde 'PROTEGGIAMO. PREVENIAMO. MIGLIORIAMO.' e triangolo rosso 'DISATTENZIONE. RISCHI. COSTI. CAOS.'; logo '81+' + '81plus.net'. TRAMA (usa questi eventi come vignette; se sono meno di 10 aggiungi vignette di contesto, dialogo e reazione per arrivare a 10-12): 1) VIBRIX causa il pericolo 'Emergenze/Soccorso' (Addetto Primo Soccorso); poi CIFRIX+SICURIX applicano il METODO81+; 2) SOTTOVALUTIX causa il pericolo 'Ruolo/RLS' (Rappresentante Lavoratori Sicurezza (RLS)); poi HYGIENIX+SICURIX applicano il METODO81+; 3) OBLIVIX causa il pericolo 'Documento' (Documento Valutazione Rischi (DVR)); poi LUXPECTORIX+SICURIX applicano il METODO81+; 4) IMPROVVISIX causa il pericolo 'Sanificazione' (Piano di Sanificazione); poi DOCUMIX+SICURIX applicano il METODO81+; 5) POLVERIX causa il pericolo 'Attrezzature' (Attrezzature e Macchine); poi CIFRIX+SICURIX applicano il METODO81+; 6) POLVERIX causa il pericolo 'Formazione base' (Formazione Generale Lavoratori); poi SICURIX+SICURIX applicano il METODO81+; 7) CROSSIX causa il pericolo 'Temperature' (Controllo Temperature e Celle); poi CIFRIX+SICURIX applicano il METODO81+; 8) RISKIX causa il pericolo 'Registro' (Registro dei Trattamenti); poi LUXPECTORIX+SICURIX applicano il METODO81+; 9) FRETTIX causa il pericolo 'Documento' (Informativa e Consensi); poi CHECKIX+SICURIX applicano il METODO81+; 10) SCHIACCIX causa il pericolo 'DPI' (Uso e Formazione DPI); poi CIFRIX+SICURIX applicano il METODO81+; 11) MULTIX causa il pericolo 'Ruolo/Preposto' (Formazione Preposto); poi PRIVACIX+SICURIX applicano il METODO81+. PALETTE BRAND ESCLUSIVA: nero #05050A, bianco panna, arancione #FF6A1A/#E8501A; ROSSO solo per 'PERICOLO', VERDE per la checklist 'Metodo 81+'. Logo '81+' ben visibile in OGNI vignetta. REGOLA STORIA: SICURIX NON agisce mai da solo - in OGNI vignetta di soluzione si fa AIUTARE dai suoi colleghi EROI (lavoro di squadra, ognuno col suo ruolo). TESTO: didascalie e fumetti MOLTO BREVI (1-4 parole), GRANDI, centrati, in ITALIANO con ORTOGRAFIA PERFETTA, senza parole inventate, lettere doppie errate o testo tagliato. CATTIVI (coerenti col canone): VIBRIX, SOTTOVALUTIX, OBLIVIX, IMPROVVISIX, POLVERIX, CROSSIX, RISKIX, FRETTIX, SCHIACCIX, MULTIX. EROI: CIFRIX, HYGIENIX, LUXPECTORIX, DOCUMIX, SICURIX, CHECKIX, PRIVACIX. NEGATIVE: nessun marchio LEGO reale, nessun personaggio protetto (Asterix ecc.), niente gore/horror, niente claim assoluti ('rischio zero','garantito','zero multe').",In Manifattura c'e' un obbligo che in tanti scoprono solo con la sanzione,"In Manifattura non e' 'se' arriva il controllo, e' 'quando'. Sei pronto?

In manifattura gli adempimenti obbligatori non aspettano: Emergenze/Soccorso, Ruolo/RLS, Documento, Sanificazione, Attrezzature, Formazione base, Temperature, Registro, DPI, Ruolo/Preposto. In questa pagina TALES OF SICURIX il PERICOLO prende forma... e il METODO81+ lo rimette in ordine, passo dopo passo. Immagina la scena: prima il caos, poi la checklist che sistema tutto. Non e' burocrazia: e' la tua tranquillita.
👉 Iscriviti al corso: Corso Primo Soccorso (A-B-C) -> https://81plus.net/?corso=corso-primo-soccorso-a-b-c
▶️ YouTube: youtube.com/@sicurissimo
Contenuto informativo. Prima vedi. Poi sistemi. 81plus.net",Corso Primo Soccorso (A-B-C),https://81plus.net/?corso=corso-primo-soccorso-a-b-c,#TalesOfSicurix #SICURIX #Metodo81 #81plus #Sicurissimo #Sicurezza #HACCP #Privacy #SicurezzaSulLavoro,SICURIX_TALES_105110_6_4_0_16_13_1_18_22_21_8_3.webp,https://drive.google.com/drive/folders/1hICKXdl9JTZBL1pemG19oE_661z-EH_k,IMG_ERR
01.15.00,Agricoltura,A,Ambientale+HACCP+Sicurezza+Privacy,11,Gestione Rifiuti e Registro | Controllo Temperature e Celle | Formazione Preposto | Addetto Antincendio | Formazione GDPR | Corso Alimentarista | RSPP / Datore di Lavoro RSPP | Rischio Rumore | Stress Lavoro-Correlato | Informativa e Consensi | Formazione Generale Lavoratori,D.Lgs152/06 | Reg.CE 852/2004 | D.Lgs81/08 art.37 | DM 2/9/2021 | GDPR art.32 | D.Lgs81/08 art.34 | D.Lgs81/08 Tit.VIII | D.Lgs81/08 art.28 | GDPR art.13 | Accordo Stato-Regioni,"DOCUMIX>OBLIVIX, CONSENSIX>CAOSIX, HYGIENIX>ØTIX, LUXPECTORIX>CADUTIX, CONSENSIX>CAOSIX, LUXPECTORIX>FRETTIX, SCUDIX>CAOSIX, PREPOSTIX>SCHIACCIX, DOCUMIX>RUMORIX, DOCUMIX>IMPROVVISIX, FORMIX>BIOXIX","Crea una PAGINA A FUMETTI a STORIA COMPLETA, verticale A4 (1024x1536), QUALITA' EDITORIALE DA STAMPA, stile ufficiale 'SICURIX TALES' IDENTICO alle immagini di riferimento allegate (stessi personaggi a mattoncini 3D, stessa impaginazione, stessi colori, stesse rese): minifigure espressive, ambientazioni ricche e dettagliate del settore, luci morbide, profondita', bordi vignetta netti. IMPAGINAZIONE OBBLIGATORIA: da 10 a 12 VIGNETTE numerate che raccontano UNA STORIA con arco narrativo completo (1 situazione normale -> 2-4 arrivano i pericoli coi cattivi -> 5-6 tensione/conseguenza -> 7-9 arriva SICURIX con gli eroi e applica il METODO81+ passo per passo -> 10-11 risoluzione ordinata -> 12 finale). HEADER in alto: SICURIX (mantello, medaglione arancione '81+', bussola) che presenta in un fumetto; grande titolo 'SICURIX TALES'; sottotitolo 'AGRICOLTURA: Pericolo vs Soluzione con Metodo 81+'; legenda 3 voci (verde Sicurezza, rosso Rischio, blu 81+ Soluzione); fila di EROI coi nomi: DOCUMIX, CONSENSIX, HYGIENIX, LUXPECTORIX, SCUDIX, PREPOSTIX. FOOTER in basso: grande 'Prima vedi. Poi sistemi.'; banner scudo verde 'PROTEGGIAMO. PREVENIAMO. MIGLIORIAMO.' e triangolo rosso 'DISATTENZIONE. RISCHI. COSTI. CAOS.'; logo '81+' + '81plus.net'. TRAMA (usa questi eventi come vignette; se sono meno di 10 aggiungi vignette di contesto, dialogo e reazione per arrivare a 10-12): 1) OBLIVIX causa il pericolo 'Rifiuti' (Gestione Rifiuti e Registro); poi DOCUMIX+SICURIX applicano il METODO81+; 2) CAOSIX causa il pericolo 'Temperature' (Controllo Temperature e Celle); poi CONSENSIX+SICURIX applicano il METODO81+; 3) ØTIX causa il pericolo 'Ruolo/Preposto' (Formazione Preposto); poi HYGIENIX+SICURIX applicano il METODO81+; 4) CADUTIX causa il pericolo 'Emergenze/Incendio' (Addetto Antincendio); poi LUXPECTORIX+SICURIX applicano il METODO81+; 5) CAOSIX causa il pericolo 'Formazione' (Formazione GDPR); poi CONSENSIX+SICURIX applicano il METODO81+; 6) FRETTIX causa il pericolo 'Corso' (Corso Alimentarista); poi LUXPECTORIX+SICURIX applicano il METODO81+; 7) CAOSIX causa il pericolo 'Ruolo/RSPP' (RSPP / Datore di Lavoro RSPP); poi SCUDIX+SICURIX applicano il METODO81+; 8) SCHIACCIX causa il pericolo 'Rumore' (Rischio Rumore); poi PREPOSTIX+SICURIX applicano il METODO81+; 9) RUMORIX causa il pericolo 'Stress' (Stress Lavoro-Correlato); poi DOCUMIX+SICURIX applicano il METODO81+; 10) IMPROVVISIX causa il pericolo 'Documento' (Informativa e Consensi); poi DOCUMIX+SICURIX applicano il METODO81+; 11) BIOXIX causa il pericolo 'Formazione base' (Formazione Generale Lavoratori); poi FORMIX+SICURIX applicano il METODO81+. PALETTE BRAND ESCLUSIVA: nero #05050A, bianco panna, arancione #FF6A1A/#E8501A; ROSSO solo per 'PERICOLO', VERDE per la checklist 'Metodo 81+'. Logo '81+' ben visibile in OGNI vignetta. REGOLA STORIA: SICURIX NON agisce mai da solo - in OGNI vignetta di soluzione si fa AIUTARE dai suoi colleghi EROI (lavoro di squadra, ognuno col suo ruolo). TESTO: didascalie e fumetti MOLTO BREVI (1-4 parole), GRANDI, centrati, in ITALIANO con ORTOGRAFIA PERFETTA, senza parole inventate, lettere doppie errate o testo tagliato. CATTIVI (coerenti col canone): OBLIVIX, CAOSIX, ØTIX, CADUTIX, FRETTIX, SCHIACCIX, RUMORIX, IMPROVVISIX, BIOXIX. EROI: DOCUMIX, CONSENSIX, HYGIENIX, LUXPECTORIX, SCUDIX, PREPOSTIX, FORMIX. NEGATIVE: nessun marchio LEGO reale, nessun personaggio protetto (Asterix ecc.), niente gore/horror, niente claim assoluti ('rischio zero','garantito','zero multe').",In Agricoltura c'e' un obbligo che in tanti scoprono solo con la sanzione,"Quello che l'ispettore controlla per primo in Agricoltura (e quasi nessuno lo sa)

In agricoltura gli adempimenti obbligatori non aspettano: Rifiuti, Temperature, Ruolo/Preposto, Emergenze/Incendio, Formazione, Corso, Ruolo/RSPP, Rumore, Stress, Documento, Formazione base. In questa pagina TALES OF SICURIX il PERICOLO prende forma... e il METODO81+ lo rimette in ordine, passo dopo passo. Immagina la scena: prima il caos, poi la checklist che sistema tutto. Chi si mette in regola prima, dorme meglio dopo.
👉 Iscriviti al corso: Formazione integrativa lavoratore 4 ore – gestione e smaltimento rifiuti -> https://81plus.net/?corso=formazione-integrativa-lavoratore-4-ore-gestione-e-smaltimen
▶️ YouTube: youtube.com/@sicurissimo
Contenuto informativo. Prima vedi. Poi sistemi. 81plus.net",Formazione integrativa lavoratore 4 ore – gestione e smaltimento rifiuti,https://81plus.net/?corso=formazione-integrativa-lavoratore-4-ore-gestione-e-smaltimen,#TalesOfSicurix #SICURIX #Metodo81 #81plus #Sicurissimo #Ambientale #HACCP #Sicurezza #Privacy #SicurezzaSulLavoro,SICURIX_TALES_011500_27_19_3_7_25_16_5_12_11_22_1.webp,https://drive.google.com/drive/folders/1hICKXdl9JTZBL1pemG19oE_661z-EH_k,IMG_ERR
84.12.40,Istruzione,P,Sicurezza+Privacy,10,Uso e Formazione DPI | Nomina DPO / RPD | Formazione GDPR | Movimentazione Manuale Carichi | Sorveglianza Sanitaria / Medico Competente | Formazione Generale Lavoratori | Formazione Preposto | Registro dei Trattamenti | Formazione Specifica (rischio medio) | RSPP / Datore di Lavoro RSPP,D.Lgs81/08 art.77 | GDPR art.37 | GDPR art.32 | D.Lgs81/08 Tit.VI | D.Lgs81/08 art.41 | Accordo Stato-Regioni | D.Lgs81/08 art.37 | GDPR art.30 | D.Lgs81/08 art.34,"PRIVACIX>RISKIX, CONSENSIX>OBLIVIX, CONSENSIX>RISKIX, CIFRIX>MULTIX, TRACCIX>CAOSIX, HYGIENIX>SOTTOVALUTIX, PREPOSTIX>TAGLIX, CHEFIX>IMPROVVISIX, SICURIX>FUMIX, HYGIENIX>IMPROVVISIX","Crea una PAGINA A FUMETTI a STORIA COMPLETA, verticale A4 (1024x1536), QUALITA' EDITORIALE DA STAMPA, stile ufficiale 'SICURIX TALES' IDENTICO alle immagini di riferimento allegate (stessi personaggi a mattoncini 3D, stessa impaginazione, stessi colori, stesse rese): minifigure espressive, ambientazioni ricche e dettagliate del settore, luci morbide, profondita', bordi vignetta netti. IMPAGINAZIONE OBBLIGATORIA: da 10 a 12 VIGNETTE numerate che raccontano UNA STORIA con arco narrativo completo (1 situazione normale -> 2-4 arrivano i pericoli coi cattivi -> 5-6 tensione/conseguenza -> 7-9 arriva SICURIX con gli eroi e applica il METODO81+ passo per passo -> 10-11 risoluzione ordinata -> 12 finale). HEADER in alto: SICURIX (mantello, medaglione arancione '81+', bussola) che presenta in un fumetto; grande titolo 'SICURIX TALES'; sottotitolo 'ISTRUZIONE: Pericolo vs Soluzione con Metodo 81+'; legenda 3 voci (verde Sicurezza, rosso Rischio, blu 81+ Soluzione); fila di EROI coi nomi: PRIVACIX, CONSENSIX, CIFRIX, TRACCIX, HYGIENIX, PREPOSTIX. FOOTER in basso: grande 'Prima vedi. Poi sistemi.'; banner scudo verde 'PROTEGGIAMO. PREVENIAMO. MIGLIORIAMO.' e triangolo rosso 'DISATTENZIONE. RISCHI. COSTI. CAOS.'; logo '81+' + '81plus.net'. TRAMA (usa questi eventi come vignette; se sono meno di 10 aggiungi vignette di contesto, dialogo e reazione per arrivare a 10-12): 1) RISKIX causa il pericolo 'DPI' (Uso e Formazione DPI); poi PRIVACIX+SICURIX applicano il METODO81+; 2) OBLIVIX causa il pericolo 'DPO' (Nomina DPO / RPD); poi CONSENSIX+SICURIX applicano il METODO81+; 3) RISKIX causa il pericolo 'Formazione' (Formazione GDPR); poi CONSENSIX+SICURIX applicano il METODO81+; 4) MULTIX causa il pericolo 'MMC' (Movimentazione Manuale Carichi); poi CIFRIX+SICURIX applicano il METODO81+; 5) CAOSIX causa il pericolo 'Sorveglianza sanitaria' (Sorveglianza Sanitaria / Medico Competente); poi TRACCIX+SICURIX applicano il METODO81+; 6) SOTTOVALUTIX causa il pericolo 'Formazione base' (Formazione Generale Lavoratori); poi HYGIENIX+SICURIX applicano il METODO81+; 7) TAGLIX causa il pericolo 'Ruolo/Preposto' (Formazione Preposto); poi PREPOSTIX+SICURIX applicano il METODO81+; 8) IMPROVVISIX causa il pericolo 'Registro' (Registro dei Trattamenti); poi CHEFIX+SICURIX applicano il METODO81+; 9) FUMIX causa il pericolo 'Formazione specifica' (Formazione Specifica (rischio medio)); poi SICURIX+SICURIX applicano il METODO81+; 10) IMPROVVISIX causa il pericolo 'Ruolo/RSPP' (RSPP / Datore di Lavoro RSPP); poi HYGIENIX+SICURIX applicano il METODO81+. PALETTE BRAND ESCLUSIVA: nero #05050A, bianco panna, arancione #FF6A1A/#E8501A; ROSSO solo per 'PERICOLO', VERDE per la checklist 'Metodo 81+'. Logo '81+' ben visibile in OGNI vignetta. REGOLA STORIA: SICURIX NON agisce mai da solo - in OGNI vignetta di soluzione si fa AIUTARE dai suoi colleghi EROI (lavoro di squadra, ognuno col suo ruolo). TESTO: didascalie e fumetti MOLTO BREVI (1-4 parole), GRANDI, centrati, in ITALIANO con ORTOGRAFIA PERFETTA, senza parole inventate, lettere doppie errate o testo tagliato. CATTIVI (coerenti col canone): RISKIX, OBLIVIX, MULTIX, CAOSIX, SOTTOVALUTIX, TAGLIX, IMPROVVISIX, FUMIX. EROI: PRIVACIX, CONSENSIX, CIFRIX, TRACCIX, HYGIENIX, PREPOSTIX, CHEFIX, SICURIX. NEGATIVE: nessun marchio LEGO reale, nessun personaggio protetto (Asterix ecc.), niente gore/horror, niente claim assoluti ('rischio zero','garantito','zero multe').","In Istruzione non e' 'se' arriva il controllo, e' 'quando'. Sei pronto?","In Istruzione non e' 'se' arriva il controllo, e' 'quando'. Sei pronto?

In istruzione gli adempimenti obbligatori non aspettano: DPI, DPO, Formazione, MMC, Sorveglianza sanitaria, Formazione base, Ruolo/Preposto, Registro, Formazione specifica, Ruolo/RSPP. In questa pagina TALES OF SICURIX il PERICOLO prende forma... e il METODO81+ lo rimette in ordine, passo dopo passo. Immagina la scena: prima il caos, poi la checklist che sistema tutto. La regola c'e' gia': tu falla lavorare per te.
👉 Iscriviti al corso: Corso Lavori in Quota e DPI Anticaduta -> https://81plus.net/?corso=corso-lavori-in-quota-e-dpi-anticaduta
▶️ YouTube: youtube.com/@sicurissimo
Contenuto informativo. Prima vedi. Poi sistemi. 81plus.net",Corso Lavori in Quota e DPI Anticaduta,https://81plus.net/?corso=corso-lavori-in-quota-e-dpi-anticaduta,#TalesOfSicurix #SICURIX #Metodo81 #81plus #Sicurissimo #Sicurezza #Privacy #SicurezzaSulLavoro,SICURIX_TALES_841240_8_17_15_10_9_1_3_13_2_5.webp,https://drive.google.com/drive/folders/1hICKXdl9JTZBL1pemG19oE_661z-EH_k,IMG_ERR
10.85.03,Manifattura,C,Ambientale+Sicurezza+HACCP+Privacy,12,Gestione Rifiuti e Registro | Formazione Preposto | Formazione Specifica (rischio alto) | Movimentazione Manuale Carichi | Corso Alimentarista | Formazione Ambientale | Sorveglianza Sanitaria / Medico Competente | Controllo Temperature e Celle | Gestione Allergeni | Uso e Formazione DPI | Procedura Data Breach | Manuale HACCP di Autocontrollo,D.Lgs152/06 | D.Lgs81/08 art.37 | Accordo Stato-Regioni | D.Lgs81/08 Tit.VI | Reg.CE 852/2004 | D.Lgs81/08 art.41 | Reg.UE 1169/2011 | D.Lgs81/08 art.77 | GDPR art.33-34,"HYGIENIX>MULTIX, CONSENSIX>OBLIVIX, CONSENSIX>SCIVOLIX, TRACCIX>SOTTOVALUTIX, PREPOSTIX>MESCOLIX, HYGIENIX>RISKIX, HYGIENIX>FUMIX, CHECKIX>MESCOLIX, LUXPECTORIX>CROSSIX, HYGIENIX>NONDPIX, CONSENSIX>HACKIX, DOCUMIX>FRETTIX","Crea una PAGINA A FUMETTI a STORIA COMPLETA, verticale A4 (1024x1536), QUALITA' EDITORIALE DA STAMPA, stile ufficiale 'SICURIX TALES' IDENTICO alle immagini di riferimento allegate (stessi personaggi a mattoncini 3D, stessa impaginazione, stessi colori, stesse rese): minifigure espressive, ambientazioni ricche e dettagliate del settore, luci morbide, profondita', bordi vignetta netti. IMPAGINAZIONE OBBLIGATORIA: da 10 a 12 VIGNETTE numerate che raccontano UNA STORIA con arco narrativo completo (1 situazione normale -> 2-4 arrivano i pericoli coi cattivi -> 5-6 tensione/conseguenza -> 7-9 arriva SICURIX con gli eroi e applica il METODO81+ passo per passo -> 10-11 risoluzione ordinata -> 12 finale). HEADER in alto: SICURIX (mantello, medaglione arancione '81+', bussola) che presenta in un fumetto; grande titolo 'SICURIX TALES'; sottotitolo 'MANIFATTURA: Pericolo vs Soluzione con Metodo 81+'; legenda 3 voci (verde Sicurezza, rosso Rischio, blu 81+ Soluzione); fila di EROI coi nomi: HYGIENIX, CONSENSIX, TRACCIX, PREPOSTIX, CHECKIX, LUXPECTORIX. FOOTER in basso: grande 'Prima vedi. Poi sistemi.'; banner scudo verde 'PROTEGGIAMO. PREVENIAMO. MIGLIORIAMO.' e triangolo rosso 'DISATTENZIONE. RISCHI. COSTI. CAOS.'; logo '81+' + '81plus.net'. TRAMA (usa questi eventi come vignette; se sono meno di 10 aggiungi vignette di contesto, dialogo e reazione per arrivare a 10-12): 1) MULTIX causa il pericolo 'Rifiuti' (Gestione Rifiuti e Registro); poi HYGIENIX+SICURIX applicano il METODO81+; 2) OBLIVIX causa il pericolo 'Ruolo/Preposto' (Formazione Preposto); poi CONSENSIX+SICURIX applicano il METODO81+; 3) SCIVOLIX causa il pericolo 'Formazione specifica' (Formazione Specifica (rischio alto)); poi CONSENSIX+SICURIX applicano il METODO81+; 4) SOTTOVALUTIX causa il pericolo 'MMC' (Movimentazione Manuale Carichi); poi TRACCIX+SICURIX applicano il METODO81+; 5) MESCOLIX causa il pericolo 'Corso' (Corso Alimentarista); poi PREPOSTIX+SICURIX applicano il METODO81+; 6) RISKIX causa il pericolo 'Formazione' (Formazione Ambientale); poi HYGIENIX+SICURIX applicano il METODO81+; 7) FUMIX causa il pericolo 'Sorveglianza sanitaria' (Sorveglianza Sanitaria / Medico Competente); poi HYGIENIX+SICURIX applicano il METODO81+; 8) MESCOLIX causa il pericolo 'Temperature' (Controllo Temperature e Celle); poi CHECKIX+SICURIX applicano il METODO81+; 9) CROSSIX causa il pericolo 'Allergeni' (Gestione Allergeni); poi LUXPECTORIX+SICURIX applicano il METODO81+; 10) NONDPIX causa il pericolo 'DPI' (Uso e Formazione DPI); poi HYGIENIX+SICURIX applicano il METODO81+; 11) HACKIX causa il pericolo 'Data breach' (Procedura Data Breach); poi CONSENSIX+SICURIX applicano il METODO81+; 12) FRETTIX causa il pericolo 'Documento' (Manuale HACCP di Autocontrollo); poi DOCUMIX+SICURIX applicano il METODO81+. PALETTE BRAND ESCLUSIVA: nero #05050A, bianco panna, arancione #FF6A1A/#E8501A; ROSSO solo per 'PERICOLO', VERDE per la checklist 'Metodo 81+'. Logo '81+' ben visibile in OGNI vignetta. REGOLA STORIA: SICURIX NON agisce mai da solo - in OGNI vignetta di soluzione si fa AIUTARE dai suoi colleghi EROI (lavoro di squadra, ognuno col suo ruolo). TESTO: didascalie e fumetti MOLTO BREVI (1-4 parole), GRANDI, centrati, in ITALIANO con ORTOGRAFIA PERFETTA, senza parole inventate, lettere doppie errate o testo tagliato. CATTIVI (coerenti col canone): MULTIX, OBLIVIX, SCIVOLIX, SOTTOVALUTIX, MESCOLIX, RISKIX, FUMIX, CROSSIX, NONDPIX, HACKIX, FRETTIX. EROI: HYGIENIX, CONSENSIX, TRACCIX, PREPOSTIX, CHECKIX, LUXPECTORIX, DOCUMIX. NEGATIVE: nessun marchio LEGO reale, nessun personaggio protetto (Asterix ecc.), niente gore/horror, niente claim assoluti ('rischio zero','garantito','zero multe').",Manifattura: 3 minuti oggi o un problema enorme domani. Scegli tu.,"In Manifattura c'e' un obbligo che in tanti scoprono solo con la sanzione

In manifattura gli adempimenti obbligatori non aspettano: Rifiuti, Ruolo/Preposto, Formazione specifica, MMC, Corso, Formazione, Sorveglianza sanitaria, Temperature, Allergeni, DPI, Data breach, Documento. In questa pagina TALES OF SICURIX il PERICOLO prende forma... e il METODO81+ lo rimette in ordine, passo dopo passo. Immagina la scena: prima il caos, poi la checklist che sistema tutto. Mettere ordine ora costa poco. Rimediare dopo costa caro.
👉 Iscriviti al corso: Formazione integrativa lavoratore 4 ore – gestione e smaltimento rifiuti -> https://81plus.net/?corso=formazione-integrativa-lavoratore-4-ore-gestione-e-smaltimen
▶️ YouTube: youtube.com/@sicurissimo
Contenuto informativo. Prima vedi. Poi sistemi. 81plus.net",Formazione integrativa lavoratore 4 ore – gestione e smaltimento rifiuti,https://81plus.net/?corso=formazione-integrativa-lavoratore-4-ore-gestione-e-smaltimen,#TalesOfSicurix #SICURIX #Metodo81 #81plus #Sicurissimo #Ambientale #Sicurezza #HACCP #Privacy #SicurezzaSulLavoro,SICURIX_TALES_108503_26_3_2_10_15_27_9_18_20_8_25_14.webp,https://drive.google.com/drive/folders/1hICKXdl9JTZBL1pemG19oE_661z-EH_k,IMG_ERR
