codice_ateco,settore,sezione,area_mix,n_vignette,adempimenti,fonti,cast_personaggi,image_prompt,titolo_clickbait,corpo_post,cta_prodotto,cta_url,hashtag,nome_file_webp,drive_folder,stato
28.30.99,Manifattura,C,Ambientale+Sicurezza+Privacy+HACCP,10,Formazione Ambientale | Uso e Formazione DPI | Movimentazione Manuale Carichi | Attrezzature e Macchine | Procedura Data Breach | Registro dei Trattamenti | Formazione GDPR | Piano di Sanificazione | RSPP / Datore di Lavoro RSPP | Formazione Generale Lavoratori,D.Lgs152/06 | D.Lgs81/08 art.77 | D.Lgs81/08 Tit.VI | D.Lgs81/08 Tit.III | GDPR art.33-34 | GDPR art.30 | GDPR art.32 | Reg.CE 852/2004 | D.Lgs81/08 art.34 | Accordo Stato-Regioni,"TRACCIX>MULTIX, SICURIX>IMPROVVISIX, LUXPECTORIX>CHIMIKIX, FORMIX>IMPROVVISIX, LUXPECTORIX>PHISHIX, BLINKIX>MULTIX, DOCUMIX>RISKIX, SICURIX>RISKIX, HYGIENIX>VOLTIX, SICURIX>NONDPIX","Crea una PAGINA A FUMETTI a STORIA COMPLETA, verticale A4 (1024x1536), QUALITA' EDITORIALE DA STAMPA, stile ufficiale 'SICURIX TALES' IDENTICO alle immagini di riferimento allegate (stessi personaggi a mattoncini 3D, stessa impaginazione, stessi colori, stesse rese): minifigure espressive, ambientazioni ricche e dettagliate del settore, luci morbide, profondita', bordi vignetta netti. IMPAGINAZIONE OBBLIGATORIA: da 10 a 12 VIGNETTE numerate che raccontano UNA STORIA con arco narrativo completo (1 situazione normale -> 2-4 arrivano i pericoli coi cattivi -> 5-6 tensione/conseguenza -> 7-9 arriva SICURIX con gli eroi e applica il METODO81+ passo per passo -> 10-11 risoluzione ordinata -> 12 finale). HEADER in alto: SICURIX (mantello, medaglione arancione '81+', bussola) che presenta in un fumetto; grande titolo 'SICURIX TALES'; sottotitolo 'MANIFATTURA: Pericolo vs Soluzione con Metodo 81+'; legenda 3 voci (verde Sicurezza, rosso Rischio, blu 81+ Soluzione); fila di EROI coi nomi: TRACCIX, SICURIX, LUXPECTORIX, FORMIX, BLINKIX, DOCUMIX. FOOTER in basso: grande 'Prima vedi. Poi sistemi.'; banner scudo verde 'PROTEGGIAMO. PREVENIAMO. MIGLIORIAMO.' e triangolo rosso 'DISATTENZIONE. RISCHI. COSTI. CAOS.'; logo '81+' + '81plus.net'. TRAMA (usa questi eventi come vignette; se sono meno di 10 aggiungi vignette di contesto, dialogo e reazione per arrivare a 10-12): 1) MULTIX causa il pericolo 'Formazione' (Formazione Ambientale); poi TRACCIX+SICURIX applicano il METODO81+; 2) IMPROVVISIX causa il pericolo 'DPI' (Uso e Formazione DPI); poi SICURIX+SICURIX applicano il METODO81+; 3) CHIMIKIX causa il pericolo 'MMC' (Movimentazione Manuale Carichi); poi LUXPECTORIX+SICURIX applicano il METODO81+; 4) IMPROVVISIX causa il pericolo 'Attrezzature' (Attrezzature e Macchine); poi FORMIX+SICURIX applicano il METODO81+; 5) PHISHIX causa il pericolo 'Data breach' (Procedura Data Breach); poi LUXPECTORIX+SICURIX applicano il METODO81+; 6) MULTIX causa il pericolo 'Registro' (Registro dei Trattamenti); poi BLINKIX+SICURIX applicano il METODO81+; 7) RISKIX causa il pericolo 'Formazione' (Formazione GDPR); poi DOCUMIX+SICURIX applicano il METODO81+; 8) RISKIX causa il pericolo 'Sanificazione' (Piano di Sanificazione); poi SICURIX+SICURIX applicano il METODO81+; 9) VOLTIX causa il pericolo 'Ruolo/RSPP' (RSPP / Datore di Lavoro RSPP); poi HYGIENIX+SICURIX applicano il METODO81+; 10) NONDPIX causa il pericolo 'Formazione base' (Formazione Generale Lavoratori); poi SICURIX+SICURIX applicano il METODO81+. PALETTE BRAND ESCLUSIVA: nero #05050A, bianco panna, arancione #FF6A1A/#E8501A; ROSSO solo per 'PERICOLO', VERDE per la checklist 'Metodo 81+'. Logo '81+' ben visibile in OGNI vignetta. REGOLA STORIA: SICURIX NON agisce mai da solo - in OGNI vignetta di soluzione si fa AIUTARE dai suoi colleghi EROI (lavoro di squadra, ognuno col suo ruolo). TESTO: didascalie e fumetti MOLTO BREVI (1-4 parole), GRANDI, centrati, in ITALIANO con ORTOGRAFIA PERFETTA, senza parole inventate, lettere doppie errate o testo tagliato. CATTIVI (coerenti col canone): MULTIX, IMPROVVISIX, CHIMIKIX, PHISHIX, RISKIX, VOLTIX, NONDPIX. EROI: TRACCIX, SICURIX, LUXPECTORIX, FORMIX, BLINKIX, DOCUMIX, HYGIENIX. NEGATIVE: nessun marchio LEGO reale, nessun personaggio protetto (Asterix ecc.), niente gore/horror, niente claim assoluti ('rischio zero','garantito','zero multe').","In Manifattura non e' 'se' arriva il controllo, e' 'quando'. Sei pronto?","Quello che l'ispettore controlla per primo in Manifattura (e quasi nessuno lo sa)

In manifattura gli adempimenti obbligatori non aspettano: Formazione, DPI, MMC, Attrezzature, Data breach, Registro, Sanificazione, Ruolo/RSPP, Formazione base. In questa pagina TALES OF SICURIX il PERICOLO prende forma... e il METODO81+ lo rimette in ordine, passo dopo passo. Immagina la scena: prima il caos, poi la checklist che sistema tutto. La regola c'e' gia': tu falla lavorare per te.
👉 Iscriviti al corso: Preposto incaricato alla gestione ambientale nei cantieri - 16 ore -> https://81plus.net/?corso=preposto-incaricato-alla-gestione-ambientale-nei-cantieri-16
▶️ YouTube: youtube.com/@sicurissimo
Contenuto informativo. Prima vedi. Poi sistemi. 81plus.net",Preposto incaricato alla gestione ambientale nei cantieri - 16 ore,https://81plus.net/?corso=preposto-incaricato-alla-gestione-ambientale-nei-cantieri-16,#TalesOfSicurix #SICURIX #Metodo81 #81plus #Sicurissimo #Ambientale #Sicurezza #Privacy #HACCP #SicurezzaSulLavoro,SICURIX_TALES_283099_28_8_10_13_26_23_25_17_5_1.webp,https://drive.google.com/drive/folders/1hICKXdl9JTZBL1pemG19oE_661z-EH_k,IMG_ERR
22.21.00,Manifattura,C,Sicurezza+Privacy+Ambientale+HACCP,11,Addetto Antincendio | Formazione Preposto | Informativa e Consensi | Rischio Chimico | Gestione Rifiuti e Registro | Procedura Data Breach | Documento Valutazione Rischi (DVR) | Controllo Temperature e Celle | RSPP / Datore di Lavoro RSPP | Nomina Incaricati/Responsabili | Formazione Specifica (rischio alto),DM 2/9/2021 | D.Lgs81/08 art.37 | GDPR art.13 | D.Lgs81/08 Tit.IX | D.Lgs152/06 | GDPR art.33-34 | D.Lgs81/08 art.28 | Reg.CE 852/2004 | D.Lgs81/08 art.34 | GDPR art.28-29 | Accordo Stato-Regioni,"LUXPECTORIX>CAOSIX, CONSENSIX>IMPROVVISIX, CHECKIX>MULTIX, CHECKIX>POLVERIX, FORMIX>IMPROVVISIX, HYGIENIX>MULTIX, LUXPECTORIX>BIOXIX, SCUDIX>OBLIVIX, PRIVACIX>RUMORIX, SICURIX>IMPROVVISIX, LUXPECTORIX>SCHIACCIX","Crea una PAGINA A FUMETTI a STORIA COMPLETA, verticale A4 (1024x1536), QUALITA' EDITORIALE DA STAMPA, stile ufficiale 'SICURIX TALES' IDENTICO alle immagini di riferimento allegate (stessi personaggi a mattoncini 3D, stessa impaginazione, stessi colori, stesse rese): minifigure espressive, ambientazioni ricche e dettagliate del settore, luci morbide, profondita', bordi vignetta netti. IMPAGINAZIONE OBBLIGATORIA: da 10 a 12 VIGNETTE numerate che raccontano UNA STORIA con arco narrativo completo (1 situazione normale -> 2-4 arrivano i pericoli coi cattivi -> 5-6 tensione/conseguenza -> 7-9 arriva SICURIX con gli eroi e applica il METODO81+ passo per passo -> 10-11 risoluzione ordinata -> 12 finale). HEADER in alto: SICURIX (mantello, medaglione arancione '81+', bussola) che presenta in un fumetto; grande titolo 'SICURIX TALES'; sottotitolo 'MANIFATTURA: Pericolo vs Soluzione con Metodo 81+'; legenda 3 voci (verde Sicurezza, rosso Rischio, blu 81+ Soluzione); fila di EROI coi nomi: LUXPECTORIX, CONSENSIX, CHECKIX, FORMIX, HYGIENIX, SCUDIX. FOOTER in basso: grande 'Prima vedi. Poi sistemi.'; banner scudo verde 'PROTEGGIAMO. PREVENIAMO. MIGLIORIAMO.' e triangolo rosso 'DISATTENZIONE. RISCHI. COSTI. CAOS.'; logo '81+' + '81plus.net'. TRAMA (usa questi eventi come vignette; se sono meno di 10 aggiungi vignette di contesto, dialogo e reazione per arrivare a 10-12): 1) CAOSIX causa il pericolo 'Emergenze/Incendio' (Addetto Antincendio); poi LUXPECTORIX+SICURIX applicano il METODO81+; 2) IMPROVVISIX causa il pericolo 'Ruolo/Preposto' (Formazione Preposto); poi CONSENSIX+SICURIX applicano il METODO81+; 3) MULTIX causa il pericolo 'Documento' (Informativa e Consensi); poi CHECKIX+SICURIX applicano il METODO81+; 4) POLVERIX causa il pericolo 'Rischio chimico' (Rischio Chimico); poi CHECKIX+SICURIX applicano il METODO81+; 5) IMPROVVISIX causa il pericolo 'Rifiuti' (Gestione Rifiuti e Registro); poi FORMIX+SICURIX applicano il METODO81+; 6) MULTIX causa il pericolo 'Data breach' (Procedura Data Breach); poi HYGIENIX+SICURIX applicano il METODO81+; 7) BIOXIX causa il pericolo 'Documento' (Documento Valutazione Rischi (DVR)); poi LUXPECTORIX+SICURIX applicano il METODO81+; 8) OBLIVIX causa il pericolo 'Temperature' (Controllo Temperature e Celle); poi SCUDIX+SICURIX applicano il METODO81+; 9) RUMORIX causa il pericolo 'Ruolo/RSPP' (RSPP / Datore di Lavoro RSPP); poi PRIVACIX+SICURIX applicano il METODO81+; 10) IMPROVVISIX causa il pericolo 'Nomine' (Nomina Incaricati/Responsabili); poi SICURIX+SICURIX applicano il METODO81+; 11) SCHIACCIX causa il pericolo 'Formazione specifica' (Formazione Specifica (rischio alto)); poi LUXPECTORIX+SICURIX applicano il METODO81+. PALETTE BRAND ESCLUSIVA: nero #05050A, bianco panna, arancione #FF6A1A/#E8501A; ROSSO solo per 'PERICOLO', VERDE per la checklist 'Metodo 81+'. Logo '81+' ben visibile in OGNI vignetta. REGOLA STORIA: SICURIX NON agisce mai da solo - in OGNI vignetta di soluzione si fa AIUTARE dai suoi colleghi EROI (lavoro di squadra, ognuno col suo ruolo). TESTO: didascalie e fumetti MOLTO BREVI (1-4 parole), GRANDI, centrati, in ITALIANO con ORTOGRAFIA PERFETTA, senza parole inventate, lettere doppie errate o testo tagliato. CATTIVI (coerenti col canone): CAOSIX, IMPROVVISIX, MULTIX, POLVERIX, BIOXIX, OBLIVIX, RUMORIX, SCHIACCIX. EROI: LUXPECTORIX, CONSENSIX, CHECKIX, FORMIX, HYGIENIX, SCUDIX, PRIVACIX, SICURIX. NEGATIVE: nessun marchio LEGO reale, nessun personaggio protetto (Asterix ecc.), niente gore/horror, niente claim assoluti ('rischio zero','garantito','zero multe').",La differenza tra chi in Manifattura dorme sereno e chi trema al controllo,"Quello che l'ispettore controlla per primo in Manifattura (e quasi nessuno lo sa)

In manifattura gli adempimenti obbligatori non aspettano: Emergenze/Incendio, Ruolo/Preposto, Documento, Rischio chimico, Rifiuti, Data breach, Temperature, Ruolo/RSPP, Nomine, Formazione specifica. In questa pagina TALES OF SICURIX il PERICOLO prende forma... e il METODO81+ lo rimette in ordine, passo dopo passo. Immagina la scena: prima il caos, poi la checklist che sistema tutto. Chi si mette in regola prima, dorme meglio dopo.
👉 Iscriviti al corso: Corso antincendio livello 1 -> https://81plus.net/?corso=corso-antincendio-livello-1
▶️ YouTube: youtube.com/@sicurissimo
Contenuto informativo. Prima vedi. Poi sistemi. 81plus.net",Corso antincendio livello 1,https://81plus.net/?corso=corso-antincendio-livello-1,#TalesOfSicurix #SICURIX #Metodo81 #81plus #Sicurissimo #Sicurezza #Privacy #Ambientale #HACCP #SicurezzaSulLavoro,SICURIX_TALES_222100_7_3_22_14_27_26_0_19_5_24_2.webp,https://drive.google.com/drive/folders/1hICKXdl9JTZBL1pemG19oE_661z-EH_k,IMG_ERR
47.78.92,Commercio,G,Sicurezza+HACCP,11,Addetto Primo Soccorso | Documento Valutazione Rischi (DVR) | RSPP / Datore di Lavoro RSPP | Controllo Temperature e Celle | Movimentazione Manuale Carichi | Manuale HACCP di Autocontrollo | Uso e Formazione DPI | Corso Alimentarista | Stress Lavoro-Correlato | Lotta agli Infestanti (Pest Control) | Formazione Specifica (rischio medio),DM 388/2003 | D.Lgs81/08 art.28 | D.Lgs81/08 art.34 | Reg.CE 852/2004 | D.Lgs81/08 Tit.VI | D.Lgs81/08 art.77 | Accordo Stato-Regioni,"BLINKIX>FUMIX, CHECKIX>FRETTIX, PRIVACIX>CADUTIX, HYGIENIX>FRETTIX, LUXPECTORIX>SOTTOVALUTIX, HYGIENIX>TEMPORIX, HYGIENIX>FUMIX, TRACCIX>CROSSIX, SICURIX>NONDPIX, PRIVACIX>ACQUAIX, CONSENSIX>FRETTIX","Crea una PAGINA A FUMETTI a STORIA COMPLETA, verticale A4 (1024x1536), QUALITA' EDITORIALE DA STAMPA, stile ufficiale 'SICURIX TALES' IDENTICO alle immagini di riferimento allegate (stessi personaggi a mattoncini 3D, stessa impaginazione, stessi colori, stesse rese): minifigure espressive, ambientazioni ricche e dettagliate del settore, luci morbide, profondita', bordi vignetta netti. IMPAGINAZIONE OBBLIGATORIA: da 10 a 12 VIGNETTE numerate che raccontano UNA STORIA con arco narrativo completo (1 situazione normale -> 2-4 arrivano i pericoli coi cattivi -> 5-6 tensione/conseguenza -> 7-9 arriva SICURIX con gli eroi e applica il METODO81+ passo per passo -> 10-11 risoluzione ordinata -> 12 finale). HEADER in alto: SICURIX (mantello, medaglione arancione '81+', bussola) che presenta in un fumetto; grande titolo 'SICURIX TALES'; sottotitolo 'COMMERCIO: Pericolo vs Soluzione con Metodo 81+'; legenda 3 voci (verde Sicurezza, rosso Rischio, blu 81+ Soluzione); fila di EROI coi nomi: BLINKIX, CHECKIX, PRIVACIX, HYGIENIX, LUXPECTORIX, TRACCIX. FOOTER in basso: grande 'Prima vedi. Poi sistemi.'; banner scudo verde 'PROTEGGIAMO. PREVENIAMO. MIGLIORIAMO.' e triangolo rosso 'DISATTENZIONE. RISCHI. COSTI. CAOS.'; logo '81+' + '81plus.net'. TRAMA (usa questi eventi come vignette; se sono meno di 10 aggiungi vignette di contesto, dialogo e reazione per arrivare a 10-12): 1) FUMIX causa il pericolo 'Emergenze/Soccorso' (Addetto Primo Soccorso); poi BLINKIX+SICURIX applicano il METODO81+; 2) FRETTIX causa il pericolo 'Documento' (Documento Valutazione Rischi (DVR)); poi CHECKIX+SICURIX applicano il METODO81+; 3) CADUTIX causa il pericolo 'Ruolo/RSPP' (RSPP / Datore di Lavoro RSPP); poi PRIVACIX+SICURIX applicano il METODO81+; 4) FRETTIX causa il pericolo 'Temperature' (Controllo Temperature e Celle); poi HYGIENIX+SICURIX applicano il METODO81+; 5) SOTTOVALUTIX causa il pericolo 'MMC' (Movimentazione Manuale Carichi); poi LUXPECTORIX+SICURIX applicano il METODO81+; 6) TEMPORIX causa il pericolo 'Documento' (Manuale HACCP di Autocontrollo); poi HYGIENIX+SICURIX applicano il METODO81+; 7) FUMIX causa il pericolo 'DPI' (Uso e Formazione DPI); poi HYGIENIX+SICURIX applicano il METODO81+; 8) CROSSIX causa il pericolo 'Corso' (Corso Alimentarista); poi TRACCIX+SICURIX applicano il METODO81+; 9) NONDPIX causa il pericolo 'Stress' (Stress Lavoro-Correlato); poi SICURIX+SICURIX applicano il METODO81+; 10) ACQUAIX causa il pericolo 'Infestanti' (Lotta agli Infestanti (Pest Control)); poi PRIVACIX+SICURIX applicano il METODO81+; 11) FRETTIX causa il pericolo 'Formazione specifica' (Formazione Specifica (rischio medio)); poi CONSENSIX+SICURIX applicano il METODO81+. PALETTE BRAND ESCLUSIVA: nero #05050A, bianco panna, arancione #FF6A1A/#E8501A; ROSSO solo per 'PERICOLO', VERDE per la checklist 'Metodo 81+'. Logo '81+' ben visibile in OGNI vignetta. REGOLA STORIA: SICURIX NON agisce mai da solo - in OGNI vignetta di soluzione si fa AIUTARE dai suoi colleghi EROI (lavoro di squadra, ognuno col suo ruolo). TESTO: didascalie e fumetti MOLTO BREVI (1-4 parole), GRANDI, centrati, in ITALIANO con ORTOGRAFIA PERFETTA, senza parole inventate, lettere doppie errate o testo tagliato. CATTIVI (coerenti col canone): FUMIX, FRETTIX, CADUTIX, SOTTOVALUTIX, TEMPORIX, CROSSIX, NONDPIX, ACQUAIX. EROI: BLINKIX, CHECKIX, PRIVACIX, HYGIENIX, LUXPECTORIX, TRACCIX, SICURIX, CONSENSIX. NEGATIVE: nessun marchio LEGO reale, nessun personaggio protetto (Asterix ecc.), niente gore/horror, niente claim assoluti ('rischio zero','garantito','zero multe').",Quello che l'ispettore controlla per primo in Commercio (e quasi nessuno lo sa),"In Commercio c'e' un obbligo che in tanti scoprono solo con la sanzione

In commercio gli adempimenti obbligatori non aspettano: Emergenze/Soccorso, Documento, Ruolo/RSPP, Temperature, MMC, DPI, Corso, Stress, Infestanti, Formazione specifica. In questa pagina TALES OF SICURIX il PERICOLO prende forma... e il METODO81+ lo rimette in ordine, passo dopo passo. Immagina la scena: prima il caos, poi la checklist che sistema tutto. Chi si mette in regola prima, dorme meglio dopo.
👉 Iscriviti al corso: Corso Primo Soccorso (A-B-C) -> https://81plus.net/?corso=corso-primo-soccorso-a-b-c
▶️ YouTube: youtube.com/@sicurissimo
Contenuto informativo. Prima vedi. Poi sistemi. 81plus.net",Corso Primo Soccorso (A-B-C),https://81plus.net/?corso=corso-primo-soccorso-a-b-c,#TalesOfSicurix #SICURIX #Metodo81 #81plus #Sicurissimo #Sicurezza #HACCP #SicurezzaSulLavoro,SICURIX_TALES_477892_6_0_5_16_10_12_8_13_11_17_2.webp,https://drive.google.com/drive/folders/1hICKXdl9JTZBL1pemG19oE_661z-EH_k,IMG_ERR
28.29.10,Manifattura,C,Sicurezza+HACCP+Privacy,10,Attrezzature e Macchine | Piano di Sanificazione | Addetto Primo Soccorso | Registro dei Trattamenti | Lotta agli Infestanti (Pest Control) | Rappresentante Lavoratori Sicurezza (RLS) | Gestione Allergeni | Nomina Incaricati/Responsabili | Sorveglianza Sanitaria / Medico Competente | Formazione Specifica (rischio alto),D.Lgs81/08 Tit.III | Reg.CE 852/2004 | DM 388/2003 | GDPR art.30 | D.Lgs81/08 art.47 | Reg.UE 1169/2011 | GDPR art.28-29 | D.Lgs81/08 art.41 | Accordo Stato-Regioni,"FORMIX>CADUTIX, LUXPECTORIX>FRETTIX, ROBOTIX81>VIBRIX, TRACCIX>HACKIX, SCUDIX>ACQUAIX, LUXPECTORIX>CAOSIX, PRIVACIX>TEMPORIX, CIFRIX>LEAKIX, HYGIENIX>CAOSIX, CIFRIX>FRETTIX","Crea una PAGINA A FUMETTI a STORIA COMPLETA, verticale A4 (1024x1536), QUALITA' EDITORIALE DA STAMPA, stile ufficiale 'SICURIX TALES' IDENTICO alle immagini di riferimento allegate (stessi personaggi a mattoncini 3D, stessa impaginazione, stessi colori, stesse rese): minifigure espressive, ambientazioni ricche e dettagliate del settore, luci morbide, profondita', bordi vignetta netti. IMPAGINAZIONE OBBLIGATORIA: da 10 a 12 VIGNETTE numerate che raccontano UNA STORIA con arco narrativo completo (1 situazione normale -> 2-4 arrivano i pericoli coi cattivi -> 5-6 tensione/conseguenza -> 7-9 arriva SICURIX con gli eroi e applica il METODO81+ passo per passo -> 10-11 risoluzione ordinata -> 12 finale). HEADER in alto: SICURIX (mantello, medaglione arancione '81+', bussola) che presenta in un fumetto; grande titolo 'SICURIX TALES'; sottotitolo 'MANIFATTURA: Pericolo vs Soluzione con Metodo 81+'; legenda 3 voci (verde Sicurezza, rosso Rischio, blu 81+ Soluzione); fila di EROI coi nomi: FORMIX, LUXPECTORIX, ROBOTIX81, TRACCIX, SCUDIX, PRIVACIX. FOOTER in basso: grande 'Prima vedi. Poi sistemi.'; banner scudo verde 'PROTEGGIAMO. PREVENIAMO. MIGLIORIAMO.' e triangolo rosso 'DISATTENZIONE. RISCHI. COSTI. CAOS.'; logo '81+' + '81plus.net'. TRAMA (usa questi eventi come vignette; se sono meno di 10 aggiungi vignette di contesto, dialogo e reazione per arrivare a 10-12): 1) CADUTIX causa il pericolo 'Attrezzature' (Attrezzature e Macchine); poi FORMIX+SICURIX applicano il METODO81+; 2) FRETTIX causa il pericolo 'Sanificazione' (Piano di Sanificazione); poi LUXPECTORIX+SICURIX applicano il METODO81+; 3) VIBRIX causa il pericolo 'Emergenze/Soccorso' (Addetto Primo Soccorso); poi ROBOTIX81+SICURIX applicano il METODO81+; 4) HACKIX causa il pericolo 'Registro' (Registro dei Trattamenti); poi TRACCIX+SICURIX applicano il METODO81+; 5) ACQUAIX causa il pericolo 'Infestanti' (Lotta agli Infestanti (Pest Control)); poi SCUDIX+SICURIX applicano il METODO81+; 6) CAOSIX causa il pericolo 'Ruolo/RLS' (Rappresentante Lavoratori Sicurezza (RLS)); poi LUXPECTORIX+SICURIX applicano il METODO81+; 7) TEMPORIX causa il pericolo 'Allergeni' (Gestione Allergeni); poi PRIVACIX+SICURIX applicano il METODO81+; 8) LEAKIX causa il pericolo 'Nomine' (Nomina Incaricati/Responsabili); poi CIFRIX+SICURIX applicano il METODO81+; 9) CAOSIX causa il pericolo 'Sorveglianza sanitaria' (Sorveglianza Sanitaria / Medico Competente); poi HYGIENIX+SICURIX applicano il METODO81+; 10) FRETTIX causa il pericolo 'Formazione specifica' (Formazione Specifica (rischio alto)); poi CIFRIX+SICURIX applicano il METODO81+. PALETTE BRAND ESCLUSIVA: nero #05050A, bianco panna, arancione #FF6A1A/#E8501A; ROSSO solo per 'PERICOLO', VERDE per la checklist 'Metodo 81+'. Logo '81+' ben visibile in OGNI vignetta. REGOLA STORIA: SICURIX NON agisce mai da solo - in OGNI vignetta di soluzione si fa AIUTARE dai suoi colleghi EROI (lavoro di squadra, ognuno col suo ruolo). TESTO: didascalie e fumetti MOLTO BREVI (1-4 parole), GRANDI, centrati, in ITALIANO con ORTOGRAFIA PERFETTA, senza parole inventate, lettere doppie errate o testo tagliato. CATTIVI (coerenti col canone): CADUTIX, FRETTIX, VIBRIX, HACKIX, ACQUAIX, CAOSIX, TEMPORIX, LEAKIX. EROI: FORMIX, LUXPECTORIX, ROBOTIX81, TRACCIX, SCUDIX, PRIVACIX, CIFRIX, HYGIENIX. NEGATIVE: nessun marchio LEGO reale, nessun personaggio protetto (Asterix ecc.), niente gore/horror, niente claim assoluti ('rischio zero','garantito','zero multe').",In Manifattura c'e' un obbligo che in tanti scoprono solo con la sanzione,"In Manifattura c'e' un obbligo che in tanti scoprono solo con la sanzione

In manifattura gli adempimenti obbligatori non aspettano: Attrezzature, Sanificazione, Emergenze/Soccorso, Registro, Infestanti, Ruolo/RLS, Allergeni, Nomine, Sorveglianza sanitaria, Formazione specifica. In questa pagina TALES OF SICURIX il PERICOLO prende forma... e il METODO81+ lo rimette in ordine, passo dopo passo. Immagina la scena: prima il caos, poi la checklist che sistema tutto. Mettere ordine ora costa poco. Rimediare dopo costa caro.
👉 Iscriviti al corso: Corso Lavori in Quota e DPI Anticaduta -> https://81plus.net/?corso=corso-lavori-in-quota-e-dpi-anticaduta
▶️ YouTube: youtube.com/@sicurissimo
Contenuto informativo. Prima vedi. Poi sistemi. 81plus.net",Corso Lavori in Quota e DPI Anticaduta,https://81plus.net/?corso=corso-lavori-in-quota-e-dpi-anticaduta,#TalesOfSicurix #SICURIX #Metodo81 #81plus #Sicurissimo #Sicurezza #HACCP #Privacy #SicurezzaSulLavoro,SICURIX_TALES_282910_13_16_6_22_19_4_20_23_9_2.webp,https://drive.google.com/drive/folders/1hICKXdl9JTZBL1pemG19oE_661z-EH_k,IMG_ERR
