codice_ateco,settore,sezione,area_mix,n_vignette,adempimenti,fonti,cast_personaggi,image_prompt,titolo_clickbait,corpo_post,cta_prodotto,cta_url,hashtag,nome_file_webp,drive_folder,stato
84.24.20,Istruzione,P,Sicurezza+Privacy,12,Formazione Preposto | Rappresentante Lavoratori Sicurezza (RLS) | Addetto Antincendio | Documento Valutazione Rischi (DVR) | Nomina DPO / RPD | Addetto Primo Soccorso | Valutazione d'Impatto (DPIA) | Registro dei Trattamenti | RSPP / Datore di Lavoro RSPP | Procedura Data Breach | Nomina Incaricati/Responsabili | Formazione GDPR,D.Lgs81/08 art.37 | D.Lgs81/08 art.47 | DM 2/9/2021 | D.Lgs81/08 art.28 | GDPR art.37 | DM 388/2003 | GDPR art.35 | GDPR art.30 | D.Lgs81/08 art.34 | GDPR art.33-34 | GDPR art.28-29 | GDPR art.32,"CHECKIX>SOTTOVALUTIX, FORMIX>ØTIX, CIFRIX>FRETTIX, HYGIENIX>NONDPIX, LUXPECTORIX>CAOSIX, FORMIX>NONDPIX, ROBOTIX81>RISKIX, PREPOSTIX>PERMISSIONIX, LUXPECTORIX>SEGNALEX, DOCUMIX>IMPROVVISIX, LUXPECTORIX>CAOSIX, TRACCIX>RISKIX","Crea una PAGINA A FUMETTI a STORIA COMPLETA, verticale A4 (1024x1536), QUALITA' EDITORIALE DA STAMPA, stile ufficiale 'SICURIX TALES' IDENTICO alle immagini di riferimento allegate (stessi personaggi a mattoncini 3D, stessa impaginazione, stessi colori, stesse rese): minifigure espressive, ambientazioni ricche e dettagliate del settore, luci morbide, profondita', bordi vignetta netti. IMPAGINAZIONE OBBLIGATORIA: da 10 a 12 VIGNETTE numerate che raccontano UNA STORIA con arco narrativo completo (1 situazione normale -> 2-4 arrivano i pericoli coi cattivi -> 5-6 tensione/conseguenza -> 7-9 arriva SICURIX con gli eroi e applica il METODO81+ passo per passo -> 10-11 risoluzione ordinata -> 12 finale). HEADER in alto: SICURIX (mantello, medaglione arancione '81+', bussola) che presenta in un fumetto; grande titolo 'SICURIX TALES'; sottotitolo 'ISTRUZIONE: Pericolo vs Soluzione con Metodo 81+'; legenda 3 voci (verde Sicurezza, rosso Rischio, blu 81+ Soluzione); fila di EROI coi nomi: CHECKIX, FORMIX, CIFRIX, HYGIENIX, LUXPECTORIX, ROBOTIX81. FOOTER in basso: grande 'Prima vedi. Poi sistemi.'; banner scudo verde 'PROTEGGIAMO. PREVENIAMO. MIGLIORIAMO.' e triangolo rosso 'DISATTENZIONE. RISCHI. COSTI. CAOS.'; logo '81+' + '81plus.net'. TRAMA (usa questi eventi come vignette; se sono meno di 10 aggiungi vignette di contesto, dialogo e reazione per arrivare a 10-12): 1) SOTTOVALUTIX causa il pericolo 'Ruolo/Preposto' (Formazione Preposto); poi CHECKIX+SICURIX applicano il METODO81+; 2) ØTIX causa il pericolo 'Ruolo/RLS' (Rappresentante Lavoratori Sicurezza (RLS)); poi FORMIX+SICURIX applicano il METODO81+; 3) FRETTIX causa il pericolo 'Emergenze/Incendio' (Addetto Antincendio); poi CIFRIX+SICURIX applicano il METODO81+; 4) NONDPIX causa il pericolo 'Documento' (Documento Valutazione Rischi (DVR)); poi HYGIENIX+SICURIX applicano il METODO81+; 5) CAOSIX causa il pericolo 'DPO' (Nomina DPO / RPD); poi LUXPECTORIX+SICURIX applicano il METODO81+; 6) NONDPIX causa il pericolo 'Emergenze/Soccorso' (Addetto Primo Soccorso); poi FORMIX+SICURIX applicano il METODO81+; 7) RISKIX causa il pericolo 'DPIA' (Valutazione d'Impatto (DPIA)); poi ROBOTIX81+SICURIX applicano il METODO81+; 8) PERMISSIONIX causa il pericolo 'Registro' (Registro dei Trattamenti); poi PREPOSTIX+SICURIX applicano il METODO81+; 9) SEGNALEX causa il pericolo 'Ruolo/RSPP' (RSPP / Datore di Lavoro RSPP); poi LUXPECTORIX+SICURIX applicano il METODO81+; 10) IMPROVVISIX causa il pericolo 'Data breach' (Procedura Data Breach); poi DOCUMIX+SICURIX applicano il METODO81+; 11) CAOSIX causa il pericolo 'Nomine' (Nomina Incaricati/Responsabili); poi LUXPECTORIX+SICURIX applicano il METODO81+; 12) RISKIX causa il pericolo 'Formazione' (Formazione GDPR); poi TRACCIX+SICURIX applicano il METODO81+. PALETTE BRAND ESCLUSIVA: nero #05050A, bianco panna, arancione #FF6A1A/#E8501A; ROSSO solo per 'PERICOLO', VERDE per la checklist 'Metodo 81+'. Logo '81+' ben visibile in OGNI vignetta. REGOLA STORIA: SICURIX NON agisce mai da solo - in OGNI vignetta di soluzione si fa AIUTARE dai suoi colleghi EROI (lavoro di squadra, ognuno col suo ruolo). TESTO: didascalie e fumetti MOLTO BREVI (1-4 parole), GRANDI, centrati, in ITALIANO con ORTOGRAFIA PERFETTA, senza parole inventate, lettere doppie errate o testo tagliato. CATTIVI (coerenti col canone): SOTTOVALUTIX, ØTIX, FRETTIX, NONDPIX, CAOSIX, RISKIX, PERMISSIONIX, SEGNALEX, IMPROVVISIX. EROI: CHECKIX, FORMIX, CIFRIX, HYGIENIX, LUXPECTORIX, ROBOTIX81, PREPOSTIX, DOCUMIX, TRACCIX. NEGATIVE: nessun marchio LEGO reale, nessun personaggio protetto (Asterix ecc.), niente gore/horror, niente claim assoluti ('rischio zero','garantito','zero multe').",La differenza tra chi in Istruzione dorme sereno e chi trema al controllo,"In Istruzione non e' 'se' arriva il controllo, e' 'quando'. Sei pronto?

In istruzione gli adempimenti obbligatori non aspettano: Ruolo/Preposto, Ruolo/RLS, Emergenze/Incendio, Documento, DPO, Emergenze/Soccorso, DPIA, Registro, Ruolo/RSPP, Data breach, Nomine, Formazione. In questa pagina TALES OF SICURIX il PERICOLO prende forma... e il METODO81+ lo rimette in ordine, passo dopo passo. Immagina la scena: prima il caos, poi la checklist che sistema tutto. Mettere ordine ora costa poco. Rimediare dopo costa caro.
👉 Iscriviti al corso: Corso per Preposto -> https://81plus.net/?corso=corso-per-preposto
▶️ YouTube: youtube.com/@sicurissimo
Contenuto informativo. Prima vedi. Poi sistemi. 81plus.net",Corso per Preposto,https://81plus.net/?corso=corso-per-preposto,#TalesOfSicurix #SICURIX #Metodo81 #81plus #Sicurissimo #Sicurezza #Privacy #SicurezzaSulLavoro,SICURIX_TALES_842420_3_4_7_0_17_6_18_13_5_16_14_15.webp,https://drive.google.com/drive/folders/1hICKXdl9JTZBL1pemG19oE_661z-EH_k,IMG_ERR
46.71.10,Commercio,G,Privacy+Sicurezza+HACCP,10,Videosorveglianza a norma | Documento Valutazione Rischi (DVR) | Procedura Data Breach | Registro dei Trattamenti | Formazione Generale Lavoratori | Piano di Sanificazione | Rappresentante Lavoratori Sicurezza (RLS) | Formazione GDPR | Lotta agli Infestanti (Pest Control) | Addetto Primo Soccorso,Provv.Garante | D.Lgs81/08 art.28 | GDPR art.33-34 | GDPR art.30 | Accordo Stato-Regioni | Reg.CE 852/2004 | D.Lgs81/08 art.47 | GDPR art.32 | DM 388/2003,"CIFRIX>PERMISSIONIX, DOCUMIX>MULTIX, DOCUMIX>PERMISSIONIX, BLINKIX>PERMISSIONIX, LUXPECTORIX>FRETTIX, TRACCIX>DOSAGIX, FORMIX>SCHIACCIX, LUXPECTORIX>FRETTIX, SICURIX>MESCOLIX, CONSENSIX>BIOXIX","Crea una PAGINA A FUMETTI a STORIA COMPLETA, verticale A4 (1024x1536), QUALITA' EDITORIALE DA STAMPA, stile ufficiale 'SICURIX TALES' IDENTICO alle immagini di riferimento allegate (stessi personaggi a mattoncini 3D, stessa impaginazione, stessi colori, stesse rese): minifigure espressive, ambientazioni ricche e dettagliate del settore, luci morbide, profondita', bordi vignetta netti. IMPAGINAZIONE OBBLIGATORIA: da 10 a 12 VIGNETTE numerate che raccontano UNA STORIA con arco narrativo completo (1 situazione normale -> 2-4 arrivano i pericoli coi cattivi -> 5-6 tensione/conseguenza -> 7-9 arriva SICURIX con gli eroi e applica il METODO81+ passo per passo -> 10-11 risoluzione ordinata -> 12 finale). HEADER in alto: SICURIX (mantello, medaglione arancione '81+', bussola) che presenta in un fumetto; grande titolo 'SICURIX TALES'; sottotitolo 'COMMERCIO: Pericolo vs Soluzione con Metodo 81+'; legenda 3 voci (verde Sicurezza, rosso Rischio, blu 81+ Soluzione); fila di EROI coi nomi: CIFRIX, DOCUMIX, BLINKIX, LUXPECTORIX, TRACCIX, FORMIX. FOOTER in basso: grande 'Prima vedi. Poi sistemi.'; banner scudo verde 'PROTEGGIAMO. PREVENIAMO. MIGLIORIAMO.' e triangolo rosso 'DISATTENZIONE. RISCHI. COSTI. CAOS.'; logo '81+' + '81plus.net'. TRAMA (usa questi eventi come vignette; se sono meno di 10 aggiungi vignette di contesto, dialogo e reazione per arrivare a 10-12): 1) PERMISSIONIX causa il pericolo 'Videosorveglianza' (Videosorveglianza a norma); poi CIFRIX+SICURIX applicano il METODO81+; 2) MULTIX causa il pericolo 'Documento' (Documento Valutazione Rischi (DVR)); poi DOCUMIX+SICURIX applicano il METODO81+; 3) PERMISSIONIX causa il pericolo 'Data breach' (Procedura Data Breach); poi DOCUMIX+SICURIX applicano il METODO81+; 4) PERMISSIONIX causa il pericolo 'Registro' (Registro dei Trattamenti); poi BLINKIX+SICURIX applicano il METODO81+; 5) FRETTIX causa il pericolo 'Formazione base' (Formazione Generale Lavoratori); poi LUXPECTORIX+SICURIX applicano il METODO81+; 6) DOSAGIX causa il pericolo 'Sanificazione' (Piano di Sanificazione); poi TRACCIX+SICURIX applicano il METODO81+; 7) SCHIACCIX causa il pericolo 'Ruolo/RLS' (Rappresentante Lavoratori Sicurezza (RLS)); poi FORMIX+SICURIX applicano il METODO81+; 8) FRETTIX causa il pericolo 'Formazione' (Formazione GDPR); poi LUXPECTORIX+SICURIX applicano il METODO81+; 9) MESCOLIX causa il pericolo 'Infestanti' (Lotta agli Infestanti (Pest Control)); poi SICURIX+SICURIX applicano il METODO81+; 10) BIOXIX causa il pericolo 'Emergenze/Soccorso' (Addetto Primo Soccorso); poi CONSENSIX+SICURIX applicano il METODO81+. PALETTE BRAND ESCLUSIVA: nero #05050A, bianco panna, arancione #FF6A1A/#E8501A; ROSSO solo per 'PERICOLO', VERDE per la checklist 'Metodo 81+'. Logo '81+' ben visibile in OGNI vignetta. REGOLA STORIA: SICURIX NON agisce mai da solo - in OGNI vignetta di soluzione si fa AIUTARE dai suoi colleghi EROI (lavoro di squadra, ognuno col suo ruolo). TESTO: didascalie e fumetti MOLTO BREVI (1-4 parole), GRANDI, centrati, in ITALIANO con ORTOGRAFIA PERFETTA, senza parole inventate, lettere doppie errate o testo tagliato. CATTIVI (coerenti col canone): PERMISSIONIX, MULTIX, FRETTIX, DOSAGIX, SCHIACCIX, MESCOLIX, BIOXIX. EROI: CIFRIX, DOCUMIX, BLINKIX, LUXPECTORIX, TRACCIX, FORMIX, SICURIX, CONSENSIX. NEGATIVE: nessun marchio LEGO reale, nessun personaggio protetto (Asterix ecc.), niente gore/horror, niente claim assoluti ('rischio zero','garantito','zero multe').",In Commercio c'e' un obbligo che in tanti scoprono solo con la sanzione,"Commercio: 3 minuti oggi o un problema enorme domani. Scegli tu.

In commercio gli adempimenti obbligatori non aspettano: Videosorveglianza, Documento, Data breach, Registro, Formazione base, Sanificazione, Ruolo/RLS, Formazione, Infestanti, Emergenze/Soccorso. In questa pagina TALES OF SICURIX il PERICOLO prende forma... e il METODO81+ lo rimette in ordine, passo dopo passo. Immagina la scena: prima il caos, poi la checklist che sistema tutto. La regola c'e' gia': tu falla lavorare per te.
👉 Iscriviti al corso: Corso privacy destinato ai lavoratori -> https://81plus.net/?corso=corso-privacy-destinato-ai-lavoratori
▶️ YouTube: youtube.com/@sicurissimo
Contenuto informativo. Prima vedi. Poi sistemi. 81plus.net",Corso privacy destinato ai lavoratori,https://81plus.net/?corso=corso-privacy-destinato-ai-lavoratori,#TalesOfSicurix #SICURIX #Metodo81 #81plus #Sicurissimo #Privacy #Sicurezza #HACCP #SicurezzaSulLavoro,SICURIX_TALES_467110_24_0_23_20_1_14_4_22_17_6.webp,https://drive.google.com/drive/folders/1hICKXdl9JTZBL1pemG19oE_661z-EH_k,IMG_ERR
46.64.19,Commercio,G,HACCP+Sicurezza+Privacy,10,Controllo Temperature e Celle | Rappresentante Lavoratori Sicurezza (RLS) | Piano di Sanificazione | Lotta agli Infestanti (Pest Control) | Gestione Allergeni | RSPP / Datore di Lavoro RSPP | Addetto Primo Soccorso | Formazione Specifica (rischio medio) | Addetto Antincendio | Procedura Data Breach,Reg.CE 852/2004 | D.Lgs81/08 art.47 | Reg.UE 1169/2011 | D.Lgs81/08 art.34 | DM 388/2003 | Accordo Stato-Regioni | DM 2/9/2021 | GDPR art.33-34,"HYGIENIX>MULTIX, CHEFIX>CADUTIX, PREPOSTIX>TEMPORIX, ROBOTIX81>MULTIX, TRACCIX>SPORCKIX, BLINKIX>ØTIX, FORMIX>SEGNALEX, TRACCIX>POLVERIX, LUXPECTORIX>VOLTIX, CIFRIX>FRETTIX","Crea una PAGINA A FUMETTI a STORIA COMPLETA, verticale A4 (1024x1536), QUALITA' EDITORIALE DA STAMPA, stile ufficiale 'SICURIX TALES' IDENTICO alle immagini di riferimento allegate (stessi personaggi a mattoncini 3D, stessa impaginazione, stessi colori, stesse rese): minifigure espressive, ambientazioni ricche e dettagliate del settore, luci morbide, profondita', bordi vignetta netti. IMPAGINAZIONE OBBLIGATORIA: da 10 a 12 VIGNETTE numerate che raccontano UNA STORIA con arco narrativo completo (1 situazione normale -> 2-4 arrivano i pericoli coi cattivi -> 5-6 tensione/conseguenza -> 7-9 arriva SICURIX con gli eroi e applica il METODO81+ passo per passo -> 10-11 risoluzione ordinata -> 12 finale). HEADER in alto: SICURIX (mantello, medaglione arancione '81+', bussola) che presenta in un fumetto; grande titolo 'SICURIX TALES'; sottotitolo 'COMMERCIO: Pericolo vs Soluzione con Metodo 81+'; legenda 3 voci (verde Sicurezza, rosso Rischio, blu 81+ Soluzione); fila di EROI coi nomi: HYGIENIX, CHEFIX, PREPOSTIX, ROBOTIX81, TRACCIX, BLINKIX. FOOTER in basso: grande 'Prima vedi. Poi sistemi.'; banner scudo verde 'PROTEGGIAMO. PREVENIAMO. MIGLIORIAMO.' e triangolo rosso 'DISATTENZIONE. RISCHI. COSTI. CAOS.'; logo '81+' + '81plus.net'. TRAMA (usa questi eventi come vignette; se sono meno di 10 aggiungi vignette di contesto, dialogo e reazione per arrivare a 10-12): 1) MULTIX causa il pericolo 'Temperature' (Controllo Temperature e Celle); poi HYGIENIX+SICURIX applicano il METODO81+; 2) CADUTIX causa il pericolo 'Ruolo/RLS' (Rappresentante Lavoratori Sicurezza (RLS)); poi CHEFIX+SICURIX applicano il METODO81+; 3) TEMPORIX causa il pericolo 'Sanificazione' (Piano di Sanificazione); poi PREPOSTIX+SICURIX applicano il METODO81+; 4) MULTIX causa il pericolo 'Infestanti' (Lotta agli Infestanti (Pest Control)); poi ROBOTIX81+SICURIX applicano il METODO81+; 5) SPORCKIX causa il pericolo 'Allergeni' (Gestione Allergeni); poi TRACCIX+SICURIX applicano il METODO81+; 6) ØTIX causa il pericolo 'Ruolo/RSPP' (RSPP / Datore di Lavoro RSPP); poi BLINKIX+SICURIX applicano il METODO81+; 7) SEGNALEX causa il pericolo 'Emergenze/Soccorso' (Addetto Primo Soccorso); poi FORMIX+SICURIX applicano il METODO81+; 8) POLVERIX causa il pericolo 'Formazione specifica' (Formazione Specifica (rischio medio)); poi TRACCIX+SICURIX applicano il METODO81+; 9) VOLTIX causa il pericolo 'Emergenze/Incendio' (Addetto Antincendio); poi LUXPECTORIX+SICURIX applicano il METODO81+; 10) FRETTIX causa il pericolo 'Data breach' (Procedura Data Breach); poi CIFRIX+SICURIX applicano il METODO81+. PALETTE BRAND ESCLUSIVA: nero #05050A, bianco panna, arancione #FF6A1A/#E8501A; ROSSO solo per 'PERICOLO', VERDE per la checklist 'Metodo 81+'. Logo '81+' ben visibile in OGNI vignetta. REGOLA STORIA: SICURIX NON agisce mai da solo - in OGNI vignetta di soluzione si fa AIUTARE dai suoi colleghi EROI (lavoro di squadra, ognuno col suo ruolo). TESTO: didascalie e fumetti MOLTO BREVI (1-4 parole), GRANDI, centrati, in ITALIANO con ORTOGRAFIA PERFETTA, senza parole inventate, lettere doppie errate o testo tagliato. CATTIVI (coerenti col canone): MULTIX, CADUTIX, TEMPORIX, SPORCKIX, ØTIX, SEGNALEX, POLVERIX, VOLTIX, FRETTIX. EROI: HYGIENIX, CHEFIX, PREPOSTIX, ROBOTIX81, TRACCIX, BLINKIX, FORMIX, LUXPECTORIX, CIFRIX. NEGATIVE: nessun marchio LEGO reale, nessun personaggio protetto (Asterix ecc.), niente gore/horror, niente claim assoluti ('rischio zero','garantito','zero multe').",Commercio: 3 minuti oggi o un problema enorme domani. Scegli tu.,"In Commercio non e' 'se' arriva il controllo, e' 'quando'. Sei pronto?

In commercio gli adempimenti obbligatori non aspettano: Temperature, Ruolo/RLS, Sanificazione, Infestanti, Allergeni, Ruolo/RSPP, Emergenze/Soccorso, Formazione specifica, Emergenze/Incendio, Data breach. In questa pagina TALES OF SICURIX il PERICOLO prende forma... e il METODO81+ lo rimette in ordine, passo dopo passo. Immagina la scena: prima il caos, poi la checklist che sistema tutto. Mettere ordine ora costa poco. Rimediare dopo costa caro.
👉 Iscriviti al corso: Le esecuzioni civili, le procedure concorsuali e i servizi di cancelleria -> https://81plus.net/?corso=le-esecuzioni-civili-le-procedure-concorsuali-e-i-servizi-di
▶️ YouTube: youtube.com/@sicurissimo
Contenuto informativo. Prima vedi. Poi sistemi. 81plus.net","Le esecuzioni civili, le procedure concorsuali e i servizi di cancelleria",https://81plus.net/?corso=le-esecuzioni-civili-le-procedure-concorsuali-e-i-servizi-di,#TalesOfSicurix #SICURIX #Metodo81 #81plus #Sicurissimo #HACCP #Sicurezza #Privacy #SicurezzaSulLavoro,SICURIX_TALES_466419_16_4_14_17_18_5_6_2_7_23.webp,https://drive.google.com/drive/folders/1hICKXdl9JTZBL1pemG19oE_661z-EH_k,IMG_ERR
47.92.31,Commercio,G,HACCP+Sicurezza+Privacy,12,Controllo Temperature e Celle | Stress Lavoro-Correlato | Rappresentante Lavoratori Sicurezza (RLS) | RSPP / Datore di Lavoro RSPP | Movimentazione Manuale Carichi | Addetto Primo Soccorso | Informativa e Consensi | Registro dei Trattamenti | Addetto Antincendio | Uso e Formazione DPI | Formazione Specifica (rischio medio) | Corso Alimentarista,Reg.CE 852/2004 | D.Lgs81/08 art.28 | D.Lgs81/08 art.47 | D.Lgs81/08 art.34 | D.Lgs81/08 Tit.VI | DM 388/2003 | GDPR art.13 | GDPR art.30 | DM 2/9/2021 | D.Lgs81/08 art.77 | Accordo Stato-Regioni,"BLINKIX>IMPROVVISIX, DOCUMIX>POLVERIX, ROBOTIX81>RISKIX, BLINKIX>RISKIX, CHEFIX>RISKIX, SCUDIX>CAOSIX, CIFRIX>CAOSIX, CONSENSIX>FRETTIX, CHECKIX>IMPROVVISIX, FORMIX>CAOSIX, SICURIX>FRETTIX, TRACCIX>FRETTIX","Crea una PAGINA A FUMETTI a STORIA COMPLETA, verticale A4 (1024x1536), QUALITA' EDITORIALE DA STAMPA, stile ufficiale 'SICURIX TALES' IDENTICO alle immagini di riferimento allegate (stessi personaggi a mattoncini 3D, stessa impaginazione, stessi colori, stesse rese): minifigure espressive, ambientazioni ricche e dettagliate del settore, luci morbide, profondita', bordi vignetta netti. IMPAGINAZIONE OBBLIGATORIA: da 10 a 12 VIGNETTE numerate che raccontano UNA STORIA con arco narrativo completo (1 situazione normale -> 2-4 arrivano i pericoli coi cattivi -> 5-6 tensione/conseguenza -> 7-9 arriva SICURIX con gli eroi e applica il METODO81+ passo per passo -> 10-11 risoluzione ordinata -> 12 finale). HEADER in alto: SICURIX (mantello, medaglione arancione '81+', bussola) che presenta in un fumetto; grande titolo 'SICURIX TALES'; sottotitolo 'COMMERCIO: Pericolo vs Soluzione con Metodo 81+'; legenda 3 voci (verde Sicurezza, rosso Rischio, blu 81+ Soluzione); fila di EROI coi nomi: BLINKIX, DOCUMIX, ROBOTIX81, CHEFIX, SCUDIX, CIFRIX. FOOTER in basso: grande 'Prima vedi. Poi sistemi.'; banner scudo verde 'PROTEGGIAMO. PREVENIAMO. MIGLIORIAMO.' e triangolo rosso 'DISATTENZIONE. RISCHI. COSTI. CAOS.'; logo '81+' + '81plus.net'. TRAMA (usa questi eventi come vignette; se sono meno di 10 aggiungi vignette di contesto, dialogo e reazione per arrivare a 10-12): 1) IMPROVVISIX causa il pericolo 'Temperature' (Controllo Temperature e Celle); poi BLINKIX+SICURIX applicano il METODO81+; 2) POLVERIX causa il pericolo 'Stress' (Stress Lavoro-Correlato); poi DOCUMIX+SICURIX applicano il METODO81+; 3) RISKIX causa il pericolo 'Ruolo/RLS' (Rappresentante Lavoratori Sicurezza (RLS)); poi ROBOTIX81+SICURIX applicano il METODO81+; 4) RISKIX causa il pericolo 'Ruolo/RSPP' (RSPP / Datore di Lavoro RSPP); poi BLINKIX+SICURIX applicano il METODO81+; 5) RISKIX causa il pericolo 'MMC' (Movimentazione Manuale Carichi); poi CHEFIX+SICURIX applicano il METODO81+; 6) CAOSIX causa il pericolo 'Emergenze/Soccorso' (Addetto Primo Soccorso); poi SCUDIX+SICURIX applicano il METODO81+; 7) CAOSIX causa il pericolo 'Documento' (Informativa e Consensi); poi CIFRIX+SICURIX applicano il METODO81+; 8) FRETTIX causa il pericolo 'Registro' (Registro dei Trattamenti); poi CONSENSIX+SICURIX applicano il METODO81+; 9) IMPROVVISIX causa il pericolo 'Emergenze/Incendio' (Addetto Antincendio); poi CHECKIX+SICURIX applicano il METODO81+; 10) CAOSIX causa il pericolo 'DPI' (Uso e Formazione DPI); poi FORMIX+SICURIX applicano il METODO81+; 11) FRETTIX causa il pericolo 'Formazione specifica' (Formazione Specifica (rischio medio)); poi SICURIX+SICURIX applicano il METODO81+; 12) FRETTIX causa il pericolo 'Corso' (Corso Alimentarista); poi TRACCIX+SICURIX applicano il METODO81+. PALETTE BRAND ESCLUSIVA: nero #05050A, bianco panna, arancione #FF6A1A/#E8501A; ROSSO solo per 'PERICOLO', VERDE per la checklist 'Metodo 81+'. Logo '81+' ben visibile in OGNI vignetta. REGOLA STORIA: SICURIX NON agisce mai da solo - in OGNI vignetta di soluzione si fa AIUTARE dai suoi colleghi EROI (lavoro di squadra, ognuno col suo ruolo). TESTO: didascalie e fumetti MOLTO BREVI (1-4 parole), GRANDI, centrati, in ITALIANO con ORTOGRAFIA PERFETTA, senza parole inventate, lettere doppie errate o testo tagliato. CATTIVI (coerenti col canone): IMPROVVISIX, POLVERIX, RISKIX, CAOSIX, FRETTIX. EROI: BLINKIX, DOCUMIX, ROBOTIX81, CHEFIX, SCUDIX, CIFRIX, CONSENSIX, CHECKIX, FORMIX, SICURIX, TRACCIX. NEGATIVE: nessun marchio LEGO reale, nessun personaggio protetto (Asterix ecc.), niente gore/horror, niente claim assoluti ('rischio zero','garantito','zero multe').",Commercio: 3 minuti oggi o un problema enorme domani. Scegli tu.,"In Commercio non e' 'se' arriva il controllo, e' 'quando'. Sei pronto?

In commercio gli adempimenti obbligatori non aspettano: Temperature, Stress, Ruolo/RLS, Ruolo/RSPP, MMC, Emergenze/Soccorso, Documento, Registro, Emergenze/Incendio, DPI, Formazione specifica, Corso. In questa pagina TALES OF SICURIX il PERICOLO prende forma... e il METODO81+ lo rimette in ordine, passo dopo passo. Immagina la scena: prima il caos, poi la checklist che sistema tutto. Non e' burocrazia: e' la tua tranquillita.
👉 Iscriviti al corso: Le esecuzioni civili, le procedure concorsuali e i servizi di cancelleria -> https://81plus.net/?corso=le-esecuzioni-civili-le-procedure-concorsuali-e-i-servizi-di
▶️ YouTube: youtube.com/@sicurissimo
Contenuto informativo. Prima vedi. Poi sistemi. 81plus.net","Le esecuzioni civili, le procedure concorsuali e i servizi di cancelleria",https://81plus.net/?corso=le-esecuzioni-civili-le-procedure-concorsuali-e-i-servizi-di,#TalesOfSicurix #SICURIX #Metodo81 #81plus #Sicurissimo #HACCP #Sicurezza #Privacy #SicurezzaSulLavoro,SICURIX_TALES_479231_16_11_4_5_10_6_19_20_7_8_2_13.webp,https://drive.google.com/drive/folders/1hICKXdl9JTZBL1pemG19oE_661z-EH_k,IMG_ERR
