codice_ateco,settore,sezione,area_mix,n_vignette,adempimenti,fonti,cast_personaggi,image_prompt,titolo_clickbait,corpo_post,cta_prodotto,cta_url,hashtag,nome_file_webp,drive_folder,stato
28.29.99,Manifattura,C,Sicurezza+Ambientale+HACCP+Privacy,12,Rappresentante Lavoratori Sicurezza (RLS) | Stress Lavoro-Correlato | Formazione Ambientale | Uso e Formazione DPI | Lotta agli Infestanti (Pest Control) | Manuale HACCP di Autocontrollo | Informativa e Consensi | Piano di Sanificazione | RSPP / Datore di Lavoro RSPP | Rintracciabilita ed Etichettatura | Nomina Incaricati/Responsabili | Gestione Allergeni,D.Lgs81/08 art.47 | D.Lgs81/08 art.28 | D.Lgs152/06 | D.Lgs81/08 art.77 | Reg.CE 852/2004 | GDPR art.13 | D.Lgs81/08 art.34 | Reg.CE 178/2002 | GDPR art.28-29 | Reg.UE 1169/2011,"BLINKIX>CHIMIKIX, ROBOTIX81>RISKIX, ROBOTIX81>OBLIVIX, PREPOSTIX>SOTTOVALUTIX, DOCUMIX>CROSSIX, SCUDIX>FRETTIX, HYGIENIX>RISKIX, HYGIENIX>MESCOLIX, HYGIENIX>VIBRIX, PREPOSTIX>FRETTIX, LUXPECTORIX>LEAKIX, BLINKIX>TEMPORIX","Crea una PAGINA A FUMETTI a STORIA COMPLETA, verticale A4 (1024x1536), QUALITA' EDITORIALE DA STAMPA, stile ufficiale 'SICURIX TALES' IDENTICO alle immagini di riferimento allegate (stessi personaggi a mattoncini 3D, stessa impaginazione, stessi colori, stesse rese): minifigure espressive, ambientazioni ricche e dettagliate del settore, luci morbide, profondita', bordi vignetta netti. IMPAGINAZIONE OBBLIGATORIA: da 10 a 12 VIGNETTE numerate che raccontano UNA STORIA con arco narrativo completo (1 situazione normale -> 2-4 arrivano i pericoli coi cattivi -> 5-6 tensione/conseguenza -> 7-9 arriva SICURIX con gli eroi e applica il METODO81+ passo per passo -> 10-11 risoluzione ordinata -> 12 finale). HEADER in alto: SICURIX (mantello, medaglione arancione '81+', bussola) che presenta in un fumetto; grande titolo 'SICURIX TALES'; sottotitolo 'MANIFATTURA: Pericolo vs Soluzione con Metodo 81+'; legenda 3 voci (verde Sicurezza, rosso Rischio, blu 81+ Soluzione); fila di EROI coi nomi: BLINKIX, ROBOTIX81, PREPOSTIX, DOCUMIX, SCUDIX, HYGIENIX. FOOTER in basso: grande 'Prima vedi. Poi sistemi.'; banner scudo verde 'PROTEGGIAMO. PREVENIAMO. MIGLIORIAMO.' e triangolo rosso 'DISATTENZIONE. RISCHI. COSTI. CAOS.'; logo '81+' + '81plus.net'. TRAMA (usa questi eventi come vignette; se sono meno di 10 aggiungi vignette di contesto, dialogo e reazione per arrivare a 10-12): 1) CHIMIKIX causa il pericolo 'Ruolo/RLS' (Rappresentante Lavoratori Sicurezza (RLS)); poi BLINKIX+SICURIX applicano il METODO81+; 2) RISKIX causa il pericolo 'Stress' (Stress Lavoro-Correlato); poi ROBOTIX81+SICURIX applicano il METODO81+; 3) OBLIVIX causa il pericolo 'Formazione' (Formazione Ambientale); poi ROBOTIX81+SICURIX applicano il METODO81+; 4) SOTTOVALUTIX causa il pericolo 'DPI' (Uso e Formazione DPI); poi PREPOSTIX+SICURIX applicano il METODO81+; 5) CROSSIX causa il pericolo 'Infestanti' (Lotta agli Infestanti (Pest Control)); poi DOCUMIX+SICURIX applicano il METODO81+; 6) FRETTIX causa il pericolo 'Documento' (Manuale HACCP di Autocontrollo); poi SCUDIX+SICURIX applicano il METODO81+; 7) RISKIX causa il pericolo 'Documento' (Informativa e Consensi); poi HYGIENIX+SICURIX applicano il METODO81+; 8) MESCOLIX causa il pericolo 'Sanificazione' (Piano di Sanificazione); poi HYGIENIX+SICURIX applicano il METODO81+; 9) VIBRIX causa il pericolo 'Ruolo/RSPP' (RSPP / Datore di Lavoro RSPP); poi HYGIENIX+SICURIX applicano il METODO81+; 10) FRETTIX causa il pericolo 'Rintracciabilita' (Rintracciabilita ed Etichettatura); poi PREPOSTIX+SICURIX applicano il METODO81+; 11) LEAKIX causa il pericolo 'Nomine' (Nomina Incaricati/Responsabili); poi LUXPECTORIX+SICURIX applicano il METODO81+; 12) TEMPORIX causa il pericolo 'Allergeni' (Gestione Allergeni); poi BLINKIX+SICURIX applicano il METODO81+. PALETTE BRAND ESCLUSIVA: nero #05050A, bianco panna, arancione #FF6A1A/#E8501A; ROSSO solo per 'PERICOLO', VERDE per la checklist 'Metodo 81+'. Logo '81+' ben visibile in OGNI vignetta. REGOLA STORIA: SICURIX NON agisce mai da solo - in OGNI vignetta di soluzione si fa AIUTARE dai suoi colleghi EROI (lavoro di squadra, ognuno col suo ruolo). TESTO: didascalie e fumetti MOLTO BREVI (1-4 parole), GRANDI, centrati, in ITALIANO con ORTOGRAFIA PERFETTA, senza parole inventate, lettere doppie errate o testo tagliato. CATTIVI (coerenti col canone): CHIMIKIX, RISKIX, OBLIVIX, SOTTOVALUTIX, CROSSIX, FRETTIX, MESCOLIX, VIBRIX, LEAKIX, TEMPORIX. EROI: BLINKIX, ROBOTIX81, PREPOSTIX, DOCUMIX, SCUDIX, HYGIENIX, LUXPECTORIX. NEGATIVE: nessun marchio LEGO reale, nessun personaggio protetto (Asterix ecc.), niente gore/horror, niente claim assoluti ('rischio zero','garantito','zero multe').",Quello che l'ispettore controlla per primo in Manifattura (e quasi nessuno lo sa),"La differenza tra chi in Manifattura dorme sereno e chi trema al controllo

In manifattura gli adempimenti obbligatori non aspettano: Ruolo/RLS, Stress, Formazione, DPI, Infestanti, Documento, Sanificazione, Ruolo/RSPP, Rintracciabilita, Nomine, Allergeni. In questa pagina TALES OF SICURIX il PERICOLO prende forma... e il METODO81+ lo rimette in ordine, passo dopo passo. Immagina la scena: prima il caos, poi la checklist che sistema tutto. Chi si mette in regola prima, dorme meglio dopo.
👉 Iscriviti al corso: Corso RLS -> https://81plus.net/?corso=corso-rls
▶️ YouTube: youtube.com/@sicurissimo
Contenuto informativo. Prima vedi. Poi sistemi. 81plus.net",Corso RLS,https://81plus.net/?corso=corso-rls,#TalesOfSicurix #SICURIX #Metodo81 #81plus #Sicurissimo #Sicurezza #Ambientale #HACCP #Privacy #SicurezzaSulLavoro,SICURIX_TALES_282999_4_11_27_8_19_14_21_16_5_17_23_20.webp,https://drive.google.com/drive/folders/1hICKXdl9JTZBL1pemG19oE_661z-EH_k,IMG_ERR
46.17.01,Commercio,G,Privacy+Sicurezza+HACCP,12,Procedura Data Breach | RSPP / Datore di Lavoro RSPP | Controllo Temperature e Celle | Registro dei Trattamenti | Formazione Generale Lavoratori | Gestione Allergeni | Addetto Primo Soccorso | Formazione Preposto | Sorveglianza Sanitaria / Medico Competente | Stress Lavoro-Correlato | Piano di Sanificazione | Rappresentante Lavoratori Sicurezza (RLS),GDPR art.33-34 | D.Lgs81/08 art.34 | Reg.CE 852/2004 | GDPR art.30 | Accordo Stato-Regioni | Reg.UE 1169/2011 | DM 388/2003 | D.Lgs81/08 art.37 | D.Lgs81/08 art.41 | D.Lgs81/08 art.28 | D.Lgs81/08 art.47,"CIFRIX>LEAKIX, PREPOSTIX>SEGNALEX, CHECKIX>MULTIX, CIFRIX>HACKIX, SICURIX>TAGLIX, HYGIENIX>SPORCKIX, TRACCIX>OBLIVIX, SCUDIX>CADUTIX, PRIVACIX>CAOSIX, CHECKIX>TAGLIX, CONSENSIX>IMPROVVISIX, LUXPECTORIX>VIBRIX","Crea una PAGINA A FUMETTI a STORIA COMPLETA, verticale A4 (1024x1536), QUALITA' EDITORIALE DA STAMPA, stile ufficiale 'SICURIX TALES' IDENTICO alle immagini di riferimento allegate (stessi personaggi a mattoncini 3D, stessa impaginazione, stessi colori, stesse rese): minifigure espressive, ambientazioni ricche e dettagliate del settore, luci morbide, profondita', bordi vignetta netti. IMPAGINAZIONE OBBLIGATORIA: da 10 a 12 VIGNETTE numerate che raccontano UNA STORIA con arco narrativo completo (1 situazione normale -> 2-4 arrivano i pericoli coi cattivi -> 5-6 tensione/conseguenza -> 7-9 arriva SICURIX con gli eroi e applica il METODO81+ passo per passo -> 10-11 risoluzione ordinata -> 12 finale). HEADER in alto: SICURIX (mantello, medaglione arancione '81+', bussola) che presenta in un fumetto; grande titolo 'SICURIX TALES'; sottotitolo 'COMMERCIO: Pericolo vs Soluzione con Metodo 81+'; legenda 3 voci (verde Sicurezza, rosso Rischio, blu 81+ Soluzione); fila di EROI coi nomi: CIFRIX, PREPOSTIX, CHECKIX, SICURIX, HYGIENIX, TRACCIX. FOOTER in basso: grande 'Prima vedi. Poi sistemi.'; banner scudo verde 'PROTEGGIAMO. PREVENIAMO. MIGLIORIAMO.' e triangolo rosso 'DISATTENZIONE. RISCHI. COSTI. CAOS.'; logo '81+' + '81plus.net'. TRAMA (usa questi eventi come vignette; se sono meno di 10 aggiungi vignette di contesto, dialogo e reazione per arrivare a 10-12): 1) LEAKIX causa il pericolo 'Data breach' (Procedura Data Breach); poi CIFRIX+SICURIX applicano il METODO81+; 2) SEGNALEX causa il pericolo 'Ruolo/RSPP' (RSPP / Datore di Lavoro RSPP); poi PREPOSTIX+SICURIX applicano il METODO81+; 3) MULTIX causa il pericolo 'Temperature' (Controllo Temperature e Celle); poi CHECKIX+SICURIX applicano il METODO81+; 4) HACKIX causa il pericolo 'Registro' (Registro dei Trattamenti); poi CIFRIX+SICURIX applicano il METODO81+; 5) TAGLIX causa il pericolo 'Formazione base' (Formazione Generale Lavoratori); poi SICURIX+SICURIX applicano il METODO81+; 6) SPORCKIX causa il pericolo 'Allergeni' (Gestione Allergeni); poi HYGIENIX+SICURIX applicano il METODO81+; 7) OBLIVIX causa il pericolo 'Emergenze/Soccorso' (Addetto Primo Soccorso); poi TRACCIX+SICURIX applicano il METODO81+; 8) CADUTIX causa il pericolo 'Ruolo/Preposto' (Formazione Preposto); poi SCUDIX+SICURIX applicano il METODO81+; 9) CAOSIX causa il pericolo 'Sorveglianza sanitaria' (Sorveglianza Sanitaria / Medico Competente); poi PRIVACIX+SICURIX applicano il METODO81+; 10) TAGLIX causa il pericolo 'Stress' (Stress Lavoro-Correlato); poi CHECKIX+SICURIX applicano il METODO81+; 11) IMPROVVISIX causa il pericolo 'Sanificazione' (Piano di Sanificazione); poi CONSENSIX+SICURIX applicano il METODO81+; 12) VIBRIX causa il pericolo 'Ruolo/RLS' (Rappresentante Lavoratori Sicurezza (RLS)); poi LUXPECTORIX+SICURIX applicano il METODO81+. PALETTE BRAND ESCLUSIVA: nero #05050A, bianco panna, arancione #FF6A1A/#E8501A; ROSSO solo per 'PERICOLO', VERDE per la checklist 'Metodo 81+'. Logo '81+' ben visibile in OGNI vignetta. REGOLA STORIA: SICURIX NON agisce mai da solo - in OGNI vignetta di soluzione si fa AIUTARE dai suoi colleghi EROI (lavoro di squadra, ognuno col suo ruolo). TESTO: didascalie e fumetti MOLTO BREVI (1-4 parole), GRANDI, centrati, in ITALIANO con ORTOGRAFIA PERFETTA, senza parole inventate, lettere doppie errate o testo tagliato. CATTIVI (coerenti col canone): LEAKIX, SEGNALEX, MULTIX, HACKIX, TAGLIX, SPORCKIX, OBLIVIX, CADUTIX, CAOSIX, IMPROVVISIX, VIBRIX. EROI: CIFRIX, PREPOSTIX, CHECKIX, SICURIX, HYGIENIX, TRACCIX, SCUDIX, PRIVACIX, CONSENSIX, LUXPECTORIX. NEGATIVE: nessun marchio LEGO reale, nessun personaggio protetto (Asterix ecc.), niente gore/horror, niente claim assoluti ('rischio zero','garantito','zero multe').","In Commercio non e' 'se' arriva il controllo, e' 'quando'. Sei pronto?","La differenza tra chi in Commercio dorme sereno e chi trema al controllo

In commercio gli adempimenti obbligatori non aspettano: Data breach, Ruolo/RSPP, Temperature, Registro, Formazione base, Allergeni, Emergenze/Soccorso, Ruolo/Preposto, Sorveglianza sanitaria, Stress, Sanificazione, Ruolo/RLS. In questa pagina TALES OF SICURIX il PERICOLO prende forma... e il METODO81+ lo rimette in ordine, passo dopo passo. Immagina la scena: prima il caos, poi la checklist che sistema tutto. La regola c'e' gia': tu falla lavorare per te.
👉 Iscriviti al corso: Corso privacy destinato ai lavoratori -> https://81plus.net/?corso=corso-privacy-destinato-ai-lavoratori
▶️ YouTube: youtube.com/@sicurissimo
Contenuto informativo. Prima vedi. Poi sistemi. 81plus.net",Corso privacy destinato ai lavoratori,https://81plus.net/?corso=corso-privacy-destinato-ai-lavoratori,#TalesOfSicurix #SICURIX #Metodo81 #81plus #Sicurissimo #Privacy #Sicurezza #HACCP #SicurezzaSulLavoro,SICURIX_TALES_461701_23_5_16_20_1_18_6_3_9_11_14_4.webp,https://drive.google.com/drive/folders/1hICKXdl9JTZBL1pemG19oE_661z-EH_k,IMG_ERR
81.21.00,PA,O,Privacy+Sicurezza,12,Informativa e Consensi | Sorveglianza Sanitaria / Medico Competente | RSPP / Datore di Lavoro RSPP | Procedura Data Breach | Movimentazione Manuale Carichi | Valutazione d'Impatto (DPIA) | Uso e Formazione DPI | Formazione GDPR | Nomina DPO / RPD | Formazione Generale Lavoratori | Stress Lavoro-Correlato | Addetto Primo Soccorso,GDPR art.13 | D.Lgs81/08 art.41 | D.Lgs81/08 art.34 | GDPR art.33-34 | D.Lgs81/08 Tit.VI | GDPR art.35 | D.Lgs81/08 art.77 | GDPR art.32 | GDPR art.37 | Accordo Stato-Regioni | D.Lgs81/08 art.28 | DM 388/2003,"CHECKIX>CAOSIX, BLINKIX>VOLTIX, SCUDIX>IMPROVVISIX, CHEFIX>HACKIX, TRACCIX>VIBRIX, TRACCIX>PHISHIX, SCUDIX>VOLTIX, SICURIX>CAOSIX, CHEFIX>IMPROVVISIX, TRACCIX>MULTIX, CHECKIX>SCIVOLIX, HYGIENIX>VIBRIX","Crea una PAGINA A FUMETTI a STORIA COMPLETA, verticale A4 (1024x1536), QUALITA' EDITORIALE DA STAMPA, stile ufficiale 'SICURIX TALES' IDENTICO alle immagini di riferimento allegate (stessi personaggi a mattoncini 3D, stessa impaginazione, stessi colori, stesse rese): minifigure espressive, ambientazioni ricche e dettagliate del settore, luci morbide, profondita', bordi vignetta netti. IMPAGINAZIONE OBBLIGATORIA: da 10 a 12 VIGNETTE numerate che raccontano UNA STORIA con arco narrativo completo (1 situazione normale -> 2-4 arrivano i pericoli coi cattivi -> 5-6 tensione/conseguenza -> 7-9 arriva SICURIX con gli eroi e applica il METODO81+ passo per passo -> 10-11 risoluzione ordinata -> 12 finale). HEADER in alto: SICURIX (mantello, medaglione arancione '81+', bussola) che presenta in un fumetto; grande titolo 'SICURIX TALES'; sottotitolo 'PA: Pericolo vs Soluzione con Metodo 81+'; legenda 3 voci (verde Sicurezza, rosso Rischio, blu 81+ Soluzione); fila di EROI coi nomi: CHECKIX, BLINKIX, SCUDIX, CHEFIX, TRACCIX, SICURIX. FOOTER in basso: grande 'Prima vedi. Poi sistemi.'; banner scudo verde 'PROTEGGIAMO. PREVENIAMO. MIGLIORIAMO.' e triangolo rosso 'DISATTENZIONE. RISCHI. COSTI. CAOS.'; logo '81+' + '81plus.net'. TRAMA (usa questi eventi come vignette; se sono meno di 10 aggiungi vignette di contesto, dialogo e reazione per arrivare a 10-12): 1) CAOSIX causa il pericolo 'Documento' (Informativa e Consensi); poi CHECKIX+SICURIX applicano il METODO81+; 2) VOLTIX causa il pericolo 'Sorveglianza sanitaria' (Sorveglianza Sanitaria / Medico Competente); poi BLINKIX+SICURIX applicano il METODO81+; 3) IMPROVVISIX causa il pericolo 'Ruolo/RSPP' (RSPP / Datore di Lavoro RSPP); poi SCUDIX+SICURIX applicano il METODO81+; 4) HACKIX causa il pericolo 'Data breach' (Procedura Data Breach); poi CHEFIX+SICURIX applicano il METODO81+; 5) VIBRIX causa il pericolo 'MMC' (Movimentazione Manuale Carichi); poi TRACCIX+SICURIX applicano il METODO81+; 6) PHISHIX causa il pericolo 'DPIA' (Valutazione d'Impatto (DPIA)); poi TRACCIX+SICURIX applicano il METODO81+; 7) VOLTIX causa il pericolo 'DPI' (Uso e Formazione DPI); poi SCUDIX+SICURIX applicano il METODO81+; 8) CAOSIX causa il pericolo 'Formazione' (Formazione GDPR); poi SICURIX+SICURIX applicano il METODO81+; 9) IMPROVVISIX causa il pericolo 'DPO' (Nomina DPO / RPD); poi CHEFIX+SICURIX applicano il METODO81+; 10) MULTIX causa il pericolo 'Formazione base' (Formazione Generale Lavoratori); poi TRACCIX+SICURIX applicano il METODO81+; 11) SCIVOLIX causa il pericolo 'Stress' (Stress Lavoro-Correlato); poi CHECKIX+SICURIX applicano il METODO81+; 12) VIBRIX causa il pericolo 'Emergenze/Soccorso' (Addetto Primo Soccorso); poi HYGIENIX+SICURIX applicano il METODO81+. PALETTE BRAND ESCLUSIVA: nero #05050A, bianco panna, arancione #FF6A1A/#E8501A; ROSSO solo per 'PERICOLO', VERDE per la checklist 'Metodo 81+'. Logo '81+' ben visibile in OGNI vignetta. REGOLA STORIA: SICURIX NON agisce mai da solo - in OGNI vignetta di soluzione si fa AIUTARE dai suoi colleghi EROI (lavoro di squadra, ognuno col suo ruolo). TESTO: didascalie e fumetti MOLTO BREVI (1-4 parole), GRANDI, centrati, in ITALIANO con ORTOGRAFIA PERFETTA, senza parole inventate, lettere doppie errate o testo tagliato. CATTIVI (coerenti col canone): CAOSIX, VOLTIX, IMPROVVISIX, HACKIX, VIBRIX, PHISHIX, MULTIX, SCIVOLIX. EROI: CHECKIX, BLINKIX, SCUDIX, CHEFIX, TRACCIX, SICURIX, HYGIENIX. NEGATIVE: nessun marchio LEGO reale, nessun personaggio protetto (Asterix ecc.), niente gore/horror, niente claim assoluti ('rischio zero','garantito','zero multe').",PA: 3 minuti oggi o un problema enorme domani. Scegli tu.,"La differenza tra chi in PA dorme sereno e chi trema al controllo

In pa gli adempimenti obbligatori non aspettano: Documento, Sorveglianza sanitaria, Ruolo/RSPP, Data breach, MMC, DPIA, DPI, Formazione, DPO, Formazione base, Stress, Emergenze/Soccorso. In questa pagina TALES OF SICURIX il PERICOLO prende forma... e il METODO81+ lo rimette in ordine, passo dopo passo. Immagina la scena: prima il caos, poi la checklist che sistema tutto. Mettere ordine ora costa poco. Rimediare dopo costa caro.
👉 Iscriviti al corso: Corso privacy destinato ai lavoratori -> https://81plus.net/?corso=corso-privacy-destinato-ai-lavoratori
▶️ YouTube: youtube.com/@sicurissimo
Contenuto informativo. Prima vedi. Poi sistemi. 81plus.net",Corso privacy destinato ai lavoratori,https://81plus.net/?corso=corso-privacy-destinato-ai-lavoratori,#TalesOfSicurix #SICURIX #Metodo81 #81plus #Sicurissimo #Privacy #Sicurezza #SicurezzaSulLavoro,SICURIX_TALES_812100_12_9_5_16_10_18_8_15_17_1_11_6.webp,https://drive.google.com/drive/folders/1hICKXdl9JTZBL1pemG19oE_661z-EH_k,IMG_ERR
12.00.00,Manifattura,C,Sicurezza+HACCP+Privacy,12,Formazione Specifica (rischio alto) | Manuale HACCP di Autocontrollo | Procedura Data Breach | RSPP / Datore di Lavoro RSPP | Controllo Temperature e Celle | Piano di Sanificazione | Rischio Rumore | Documento Valutazione Rischi (DVR) | Movimentazione Manuale Carichi | Stress Lavoro-Correlato | Registro dei Trattamenti | Corso Alimentarista,Accordo Stato-Regioni | Reg.CE 852/2004 | GDPR art.33-34 | D.Lgs81/08 art.34 | D.Lgs81/08 Tit.VIII | D.Lgs81/08 art.28 | D.Lgs81/08 Tit.VI | GDPR art.30,"TRACCIX>VOLTIX, CHEFIX>TEMPORIX, FORMIX>SPYIX, CONSENSIX>CAOSIX, BLINKIX>SCADUTIX, DOCUMIX>ACQUAIX, SICURIX>CADUTIX, CIFRIX>SOTTOVALUTIX, SCUDIX>RISKIX, ROBOTIX81>CADUTIX, PRIVACIX>IMPROVVISIX, SCUDIX>CAOSIX","Crea una PAGINA A FUMETTI a STORIA COMPLETA, verticale A4 (1024x1536), QUALITA' EDITORIALE DA STAMPA, stile ufficiale 'SICURIX TALES' IDENTICO alle immagini di riferimento allegate (stessi personaggi a mattoncini 3D, stessa impaginazione, stessi colori, stesse rese): minifigure espressive, ambientazioni ricche e dettagliate del settore, luci morbide, profondita', bordi vignetta netti. IMPAGINAZIONE OBBLIGATORIA: da 10 a 12 VIGNETTE numerate che raccontano UNA STORIA con arco narrativo completo (1 situazione normale -> 2-4 arrivano i pericoli coi cattivi -> 5-6 tensione/conseguenza -> 7-9 arriva SICURIX con gli eroi e applica il METODO81+ passo per passo -> 10-11 risoluzione ordinata -> 12 finale). HEADER in alto: SICURIX (mantello, medaglione arancione '81+', bussola) che presenta in un fumetto; grande titolo 'SICURIX TALES'; sottotitolo 'MANIFATTURA: Pericolo vs Soluzione con Metodo 81+'; legenda 3 voci (verde Sicurezza, rosso Rischio, blu 81+ Soluzione); fila di EROI coi nomi: TRACCIX, CHEFIX, FORMIX, CONSENSIX, BLINKIX, DOCUMIX. FOOTER in basso: grande 'Prima vedi. Poi sistemi.'; banner scudo verde 'PROTEGGIAMO. PREVENIAMO. MIGLIORIAMO.' e triangolo rosso 'DISATTENZIONE. RISCHI. COSTI. CAOS.'; logo '81+' + '81plus.net'. TRAMA (usa questi eventi come vignette; se sono meno di 10 aggiungi vignette di contesto, dialogo e reazione per arrivare a 10-12): 1) VOLTIX causa il pericolo 'Formazione specifica' (Formazione Specifica (rischio alto)); poi TRACCIX+SICURIX applicano il METODO81+; 2) TEMPORIX causa il pericolo 'Documento' (Manuale HACCP di Autocontrollo); poi CHEFIX+SICURIX applicano il METODO81+; 3) SPYIX causa il pericolo 'Data breach' (Procedura Data Breach); poi FORMIX+SICURIX applicano il METODO81+; 4) CAOSIX causa il pericolo 'Ruolo/RSPP' (RSPP / Datore di Lavoro RSPP); poi CONSENSIX+SICURIX applicano il METODO81+; 5) SCADUTIX causa il pericolo 'Temperature' (Controllo Temperature e Celle); poi BLINKIX+SICURIX applicano il METODO81+; 6) ACQUAIX causa il pericolo 'Sanificazione' (Piano di Sanificazione); poi DOCUMIX+SICURIX applicano il METODO81+; 7) CADUTIX causa il pericolo 'Rumore' (Rischio Rumore); poi SICURIX+SICURIX applicano il METODO81+; 8) SOTTOVALUTIX causa il pericolo 'Documento' (Documento Valutazione Rischi (DVR)); poi CIFRIX+SICURIX applicano il METODO81+; 9) RISKIX causa il pericolo 'MMC' (Movimentazione Manuale Carichi); poi SCUDIX+SICURIX applicano il METODO81+; 10) CADUTIX causa il pericolo 'Stress' (Stress Lavoro-Correlato); poi ROBOTIX81+SICURIX applicano il METODO81+; 11) IMPROVVISIX causa il pericolo 'Registro' (Registro dei Trattamenti); poi PRIVACIX+SICURIX applicano il METODO81+; 12) CAOSIX causa il pericolo 'Corso' (Corso Alimentarista); poi SCUDIX+SICURIX applicano il METODO81+. PALETTE BRAND ESCLUSIVA: nero #05050A, bianco panna, arancione #FF6A1A/#E8501A; ROSSO solo per 'PERICOLO', VERDE per la checklist 'Metodo 81+'. Logo '81+' ben visibile in OGNI vignetta. REGOLA STORIA: SICURIX NON agisce mai da solo - in OGNI vignetta di soluzione si fa AIUTARE dai suoi colleghi EROI (lavoro di squadra, ognuno col suo ruolo). TESTO: didascalie e fumetti MOLTO BREVI (1-4 parole), GRANDI, centrati, in ITALIANO con ORTOGRAFIA PERFETTA, senza parole inventate, lettere doppie errate o testo tagliato. CATTIVI (coerenti col canone): VOLTIX, TEMPORIX, SPYIX, CAOSIX, SCADUTIX, ACQUAIX, CADUTIX, SOTTOVALUTIX, RISKIX, IMPROVVISIX. EROI: TRACCIX, CHEFIX, FORMIX, CONSENSIX, BLINKIX, DOCUMIX, SICURIX, CIFRIX, SCUDIX, ROBOTIX81, PRIVACIX. NEGATIVE: nessun marchio LEGO reale, nessun personaggio protetto (Asterix ecc.), niente gore/horror, niente claim assoluti ('rischio zero','garantito','zero multe').",Manifattura: 3 minuti oggi o un problema enorme domani. Scegli tu.,"Quello che l'ispettore controlla per primo in Manifattura (e quasi nessuno lo sa)

In manifattura gli adempimenti obbligatori non aspettano: Formazione specifica, Documento, Data breach, Ruolo/RSPP, Temperature, Sanificazione, Rumore, MMC, Stress, Registro, Corso. In questa pagina TALES OF SICURIX il PERICOLO prende forma... e il METODO81+ lo rimette in ordine, passo dopo passo. Immagina la scena: prima il caos, poi la checklist che sistema tutto. Non e' burocrazia: e' la tua tranquillita.
👉 Iscriviti al corso: Corso lavoratore parte GENERALE 4 ore -> https://81plus.net/?corso=corso-lavoratore-parte-generale-4-ore
▶️ YouTube: youtube.com/@sicurissimo
Contenuto informativo. Prima vedi. Poi sistemi. 81plus.net",Corso lavoratore parte GENERALE 4 ore,https://81plus.net/?corso=corso-lavoratore-parte-generale-4-ore,#TalesOfSicurix #SICURIX #Metodo81 #81plus #Sicurissimo #Sicurezza #HACCP #Privacy #SicurezzaSulLavoro,SICURIX_TALES_120000_2_14_25_5_18_16_12_0_10_11_22_15.webp,https://drive.google.com/drive/folders/1hICKXdl9JTZBL1pemG19oE_661z-EH_k,IMG_ERR
