codice_ateco,settore,sezione,area_mix,n_vignette,adempimenti,fonti,cast_personaggi,image_prompt,titolo_clickbait,corpo_post,cta_prodotto,cta_url,hashtag,nome_file_webp,drive_folder,stato
52.24.10,Trasporti/Magazzino,H,Ambientale+Privacy+Sicurezza,12,Gestione Rifiuti e Registro | Informativa e Consensi | Registro dei Trattamenti | Formazione GDPR | Formazione Ambientale | Procedura Data Breach | Formazione Preposto | Sorveglianza Sanitaria / Medico Competente | RSPP / Datore di Lavoro RSPP | Documento Valutazione Rischi (DVR) | Addetto Primo Soccorso | Rappresentante Lavoratori Sicurezza (RLS),D.Lgs152/06 | GDPR art.13 | GDPR art.30 | GDPR art.32 | GDPR art.33-34 | D.Lgs81/08 art.37 | D.Lgs81/08 art.41 | D.Lgs81/08 art.34 | D.Lgs81/08 art.28 | DM 388/2003 | D.Lgs81/08 art.47,"CHECKIX>OBLIVIX, CHECKIX>PERMISSIONIX, CHECKIX>RISKIX, CIFRIX>PERMISSIONIX, PREPOSTIX>CAOSIX, DOCUMIX>OBLIVIX, CHECKIX>SCIVOLIX, LUXPECTORIX>RUMORIX, PRIVACIX>TAGLIX, SCUDIX>OBLIVIX, CHEFIX>SCIVOLIX, BLINKIX>CADUTIX","Crea una PAGINA A FUMETTI a STORIA COMPLETA, verticale A4 (1024x1536), QUALITA' EDITORIALE DA STAMPA, stile ufficiale 'SICURIX TALES' IDENTICO alle immagini di riferimento allegate (stessi personaggi a mattoncini 3D, stessa impaginazione, stessi colori, stesse rese): minifigure espressive, ambientazioni ricche e dettagliate del settore, luci morbide, profondita', bordi vignetta netti. IMPAGINAZIONE OBBLIGATORIA: da 10 a 12 VIGNETTE numerate che raccontano UNA STORIA con arco narrativo completo (1 situazione normale -> 2-4 arrivano i pericoli coi cattivi -> 5-6 tensione/conseguenza -> 7-9 arriva SICURIX con gli eroi e applica il METODO81+ passo per passo -> 10-11 risoluzione ordinata -> 12 finale). HEADER in alto: SICURIX (mantello, medaglione arancione '81+', bussola) che presenta in un fumetto; grande titolo 'SICURIX TALES'; sottotitolo 'TRASPORTI/MAGAZZINO: Pericolo vs Soluzione con Metodo 81+'; legenda 3 voci (verde Sicurezza, rosso Rischio, blu 81+ Soluzione); fila di EROI coi nomi: CHECKIX, CIFRIX, PREPOSTIX, DOCUMIX, LUXPECTORIX, PRIVACIX. FOOTER in basso: grande 'Prima vedi. Poi sistemi.'; banner scudo verde 'PROTEGGIAMO. PREVENIAMO. MIGLIORIAMO.' e triangolo rosso 'DISATTENZIONE. RISCHI. COSTI. CAOS.'; logo '81+' + '81plus.net'. TRAMA (usa questi eventi come vignette; se sono meno di 10 aggiungi vignette di contesto, dialogo e reazione per arrivare a 10-12): 1) OBLIVIX causa il pericolo 'Rifiuti' (Gestione Rifiuti e Registro); poi CHECKIX+SICURIX applicano il METODO81+; 2) PERMISSIONIX causa il pericolo 'Documento' (Informativa e Consensi); poi CHECKIX+SICURIX applicano il METODO81+; 3) RISKIX causa il pericolo 'Registro' (Registro dei Trattamenti); poi CHECKIX+SICURIX applicano il METODO81+; 4) PERMISSIONIX causa il pericolo 'Formazione' (Formazione GDPR); poi CIFRIX+SICURIX applicano il METODO81+; 5) CAOSIX causa il pericolo 'Formazione' (Formazione Ambientale); poi PREPOSTIX+SICURIX applicano il METODO81+; 6) OBLIVIX causa il pericolo 'Data breach' (Procedura Data Breach); poi DOCUMIX+SICURIX applicano il METODO81+; 7) SCIVOLIX causa il pericolo 'Ruolo/Preposto' (Formazione Preposto); poi CHECKIX+SICURIX applicano il METODO81+; 8) RUMORIX causa il pericolo 'Sorveglianza sanitaria' (Sorveglianza Sanitaria / Medico Competente); poi LUXPECTORIX+SICURIX applicano il METODO81+; 9) TAGLIX causa il pericolo 'Ruolo/RSPP' (RSPP / Datore di Lavoro RSPP); poi PRIVACIX+SICURIX applicano il METODO81+; 10) OBLIVIX causa il pericolo 'Documento' (Documento Valutazione Rischi (DVR)); poi SCUDIX+SICURIX applicano il METODO81+; 11) SCIVOLIX causa il pericolo 'Emergenze/Soccorso' (Addetto Primo Soccorso); poi CHEFIX+SICURIX applicano il METODO81+; 12) CADUTIX causa il pericolo 'Ruolo/RLS' (Rappresentante Lavoratori Sicurezza (RLS)); poi BLINKIX+SICURIX applicano il METODO81+. PALETTE BRAND ESCLUSIVA: nero #05050A, bianco panna, arancione #FF6A1A/#E8501A; ROSSO solo per 'PERICOLO', VERDE per la checklist 'Metodo 81+'. Logo '81+' ben visibile in OGNI vignetta. REGOLA STORIA: SICURIX NON agisce mai da solo - in OGNI vignetta di soluzione si fa AIUTARE dai suoi colleghi EROI (lavoro di squadra, ognuno col suo ruolo). TESTO: didascalie e fumetti MOLTO BREVI (1-4 parole), GRANDI, centrati, in ITALIANO con ORTOGRAFIA PERFETTA, senza parole inventate, lettere doppie errate o testo tagliato. CATTIVI (coerenti col canone): OBLIVIX, PERMISSIONIX, RISKIX, CAOSIX, SCIVOLIX, RUMORIX, TAGLIX, CADUTIX. EROI: CHECKIX, CIFRIX, PREPOSTIX, DOCUMIX, LUXPECTORIX, PRIVACIX, SCUDIX, CHEFIX, BLINKIX. NEGATIVE: nessun marchio LEGO reale, nessun personaggio protetto (Asterix ecc.), niente gore/horror, niente claim assoluti ('rischio zero','garantito','zero multe').","In Trasporti/Magazzino non e' 'se' arriva il controllo, e' 'quando'. Sei pronto?","La differenza tra chi in Trasporti/Magazzino dorme sereno e chi trema al controllo

In trasporti/magazzino gli adempimenti obbligatori non aspettano: Rifiuti, Documento, Registro, Formazione, Data breach, Ruolo/Preposto, Sorveglianza sanitaria, Ruolo/RSPP, Emergenze/Soccorso, Ruolo/RLS. In questa pagina TALES OF SICURIX il PERICOLO prende forma... e il METODO81+ lo rimette in ordine, passo dopo passo. Immagina la scena: prima il caos, poi la checklist che sistema tutto. Non e' burocrazia: e' la tua tranquillita.
👉 Iscriviti al corso: Formazione integrativa lavoratore 4 ore – gestione e smaltimento rifiuti -> https://81plus.net/?corso=formazione-integrativa-lavoratore-4-ore-gestione-e-smaltimen
▶️ YouTube: youtube.com/@sicurissimo
Contenuto informativo. Prima vedi. Poi sistemi. 81plus.net",Formazione integrativa lavoratore 4 ore – gestione e smaltimento rifiuti,https://81plus.net/?corso=formazione-integrativa-lavoratore-4-ore-gestione-e-smaltimen,#TalesOfSicurix #SICURIX #Metodo81 #81plus #Sicurissimo #Ambientale #Privacy #Sicurezza #SicurezzaSulLavoro,SICURIX_TALES_522410_20_15_16_18_21_19_3_9_5_0_6_4.webp,https://drive.google.com/drive/folders/1hICKXdl9JTZBL1pemG19oE_661z-EH_k,IMG_ERR
33.20.01,Manifattura,C,HACCP+Sicurezza+Privacy+Ambientale,11,Gestione Allergeni | Manuale HACCP di Autocontrollo | Rischio Rumore | Rintracciabilita ed Etichettatura | Corso Alimentarista | Attrezzature e Macchine | Procedura Data Breach | Formazione Generale Lavoratori | Formazione Ambientale | Addetto Primo Soccorso | Informativa e Consensi,Reg.UE 1169/2011 | Reg.CE 852/2004 | D.Lgs81/08 Tit.VIII | Reg.CE 178/2002 | D.Lgs81/08 Tit.III | GDPR art.33-34 | Accordo Stato-Regioni | D.Lgs152/06 | DM 388/2003 | GDPR art.13,"TRACCIX>FRETTIX, HYGIENIX>OBLIVIX, FORMIX>FRETTIX, FORMIX>MESCOLIX, PRIVACIX>CROSSIX, ROBOTIX81>RISKIX, PRIVACIX>RISKIX, ROBOTIX81>CAOSIX, SCUDIX>OBLIVIX, ROBOTIX81>CHIMIKIX, SCUDIX>SPYIX","Crea una PAGINA A FUMETTI a STORIA COMPLETA, verticale A4 (1024x1536), QUALITA' EDITORIALE DA STAMPA, stile ufficiale 'SICURIX TALES' IDENTICO alle immagini di riferimento allegate (stessi personaggi a mattoncini 3D, stessa impaginazione, stessi colori, stesse rese): minifigure espressive, ambientazioni ricche e dettagliate del settore, luci morbide, profondita', bordi vignetta netti. IMPAGINAZIONE OBBLIGATORIA: da 10 a 12 VIGNETTE numerate che raccontano UNA STORIA con arco narrativo completo (1 situazione normale -> 2-4 arrivano i pericoli coi cattivi -> 5-6 tensione/conseguenza -> 7-9 arriva SICURIX con gli eroi e applica il METODO81+ passo per passo -> 10-11 risoluzione ordinata -> 12 finale). HEADER in alto: SICURIX (mantello, medaglione arancione '81+', bussola) che presenta in un fumetto; grande titolo 'SICURIX TALES'; sottotitolo 'MANIFATTURA: Pericolo vs Soluzione con Metodo 81+'; legenda 3 voci (verde Sicurezza, rosso Rischio, blu 81+ Soluzione); fila di EROI coi nomi: TRACCIX, HYGIENIX, FORMIX, PRIVACIX, ROBOTIX81, SCUDIX. FOOTER in basso: grande 'Prima vedi. Poi sistemi.'; banner scudo verde 'PROTEGGIAMO. PREVENIAMO. MIGLIORIAMO.' e triangolo rosso 'DISATTENZIONE. RISCHI. COSTI. CAOS.'; logo '81+' + '81plus.net'. TRAMA (usa questi eventi come vignette; se sono meno di 10 aggiungi vignette di contesto, dialogo e reazione per arrivare a 10-12): 1) FRETTIX causa il pericolo 'Allergeni' (Gestione Allergeni); poi TRACCIX+SICURIX applicano il METODO81+; 2) OBLIVIX causa il pericolo 'Documento' (Manuale HACCP di Autocontrollo); poi HYGIENIX+SICURIX applicano il METODO81+; 3) FRETTIX causa il pericolo 'Rumore' (Rischio Rumore); poi FORMIX+SICURIX applicano il METODO81+; 4) MESCOLIX causa il pericolo 'Rintracciabilita' (Rintracciabilita ed Etichettatura); poi FORMIX+SICURIX applicano il METODO81+; 5) CROSSIX causa il pericolo 'Corso' (Corso Alimentarista); poi PRIVACIX+SICURIX applicano il METODO81+; 6) RISKIX causa il pericolo 'Attrezzature' (Attrezzature e Macchine); poi ROBOTIX81+SICURIX applicano il METODO81+; 7) RISKIX causa il pericolo 'Data breach' (Procedura Data Breach); poi PRIVACIX+SICURIX applicano il METODO81+; 8) CAOSIX causa il pericolo 'Formazione base' (Formazione Generale Lavoratori); poi ROBOTIX81+SICURIX applicano il METODO81+; 9) OBLIVIX causa il pericolo 'Formazione' (Formazione Ambientale); poi SCUDIX+SICURIX applicano il METODO81+; 10) CHIMIKIX causa il pericolo 'Emergenze/Soccorso' (Addetto Primo Soccorso); poi ROBOTIX81+SICURIX applicano il METODO81+; 11) SPYIX causa il pericolo 'Documento' (Informativa e Consensi); poi SCUDIX+SICURIX applicano il METODO81+. PALETTE BRAND ESCLUSIVA: nero #05050A, bianco panna, arancione #FF6A1A/#E8501A; ROSSO solo per 'PERICOLO', VERDE per la checklist 'Metodo 81+'. Logo '81+' ben visibile in OGNI vignetta. REGOLA STORIA: SICURIX NON agisce mai da solo - in OGNI vignetta di soluzione si fa AIUTARE dai suoi colleghi EROI (lavoro di squadra, ognuno col suo ruolo). TESTO: didascalie e fumetti MOLTO BREVI (1-4 parole), GRANDI, centrati, in ITALIANO con ORTOGRAFIA PERFETTA, senza parole inventate, lettere doppie errate o testo tagliato. CATTIVI (coerenti col canone): FRETTIX, OBLIVIX, MESCOLIX, CROSSIX, RISKIX, CAOSIX, CHIMIKIX, SPYIX. EROI: TRACCIX, HYGIENIX, FORMIX, PRIVACIX, ROBOTIX81, SCUDIX. NEGATIVE: nessun marchio LEGO reale, nessun personaggio protetto (Asterix ecc.), niente gore/horror, niente claim assoluti ('rischio zero','garantito','zero multe').",In Manifattura c'e' un obbligo che in tanti scoprono solo con la sanzione,"Manifattura: 3 minuti oggi o un problema enorme domani. Scegli tu.

In manifattura gli adempimenti obbligatori non aspettano: Allergeni, Documento, Rumore, Rintracciabilita, Corso, Attrezzature, Data breach, Formazione base, Formazione, Emergenze/Soccorso. In questa pagina TALES OF SICURIX il PERICOLO prende forma... e il METODO81+ lo rimette in ordine, passo dopo passo. Immagina la scena: prima il caos, poi la checklist che sistema tutto. Mettere ordine ora costa poco. Rimediare dopo costa caro.
👉 Iscriviti al corso: Haccp - Corso responsabile industria alimentare -> https://81plus.net/?corso=haccp-corso-responsabile-industria-alimentare
▶️ YouTube: youtube.com/@sicurissimo
Contenuto informativo. Prima vedi. Poi sistemi. 81plus.net",Haccp - Corso responsabile industria alimentare,https://81plus.net/?corso=haccp-corso-responsabile-industria-alimentare,#TalesOfSicurix #SICURIX #Metodo81 #81plus #Sicurissimo #HACCP #Sicurezza #Privacy #Ambientale #SicurezzaSulLavoro,SICURIX_TALES_332001_21_15_12_18_16_13_26_1_28_6_22.webp,https://drive.google.com/drive/folders/1hICKXdl9JTZBL1pemG19oE_661z-EH_k,IMG_ERR
58.29.00,ICT/Informazione,J,Sicurezza+Privacy,11,Addetto Antincendio | Nomina Incaricati/Responsabili | Registro dei Trattamenti | Procedura Data Breach | Uso e Formazione DPI | RSPP / Datore di Lavoro RSPP | Formazione Preposto | Formazione Specifica (rischio basso) | Formazione GDPR | Informativa e Consensi | Videoterminali (VDT),DM 2/9/2021 | GDPR art.28-29 | GDPR art.30 | GDPR art.33-34 | D.Lgs81/08 art.77 | D.Lgs81/08 art.34 | D.Lgs81/08 art.37 | Accordo Stato-Regioni | GDPR art.32 | GDPR art.13 | D.Lgs81/08 Tit.VII,"ROBOTIX81>FUMIX, HYGIENIX>MULTIX, FORMIX>LEAKIX, DOCUMIX>LEAKIX, ROBOTIX81>ØTIX, LUXPECTORIX>FUMIX, CHEFIX>FRETTIX, CONSENSIX>NONDPIX, TRACCIX>LEAKIX, TRACCIX>CANCELIX, TRACCIX>TAGLIX","Crea una PAGINA A FUMETTI a STORIA COMPLETA, verticale A4 (1024x1536), QUALITA' EDITORIALE DA STAMPA, stile ufficiale 'SICURIX TALES' IDENTICO alle immagini di riferimento allegate (stessi personaggi a mattoncini 3D, stessa impaginazione, stessi colori, stesse rese): minifigure espressive, ambientazioni ricche e dettagliate del settore, luci morbide, profondita', bordi vignetta netti. IMPAGINAZIONE OBBLIGATORIA: da 10 a 12 VIGNETTE numerate che raccontano UNA STORIA con arco narrativo completo (1 situazione normale -> 2-4 arrivano i pericoli coi cattivi -> 5-6 tensione/conseguenza -> 7-9 arriva SICURIX con gli eroi e applica il METODO81+ passo per passo -> 10-11 risoluzione ordinata -> 12 finale). HEADER in alto: SICURIX (mantello, medaglione arancione '81+', bussola) che presenta in un fumetto; grande titolo 'SICURIX TALES'; sottotitolo 'ICT/INFORMAZIONE: Pericolo vs Soluzione con Metodo 81+'; legenda 3 voci (verde Sicurezza, rosso Rischio, blu 81+ Soluzione); fila di EROI coi nomi: ROBOTIX81, HYGIENIX, FORMIX, DOCUMIX, LUXPECTORIX, CHEFIX. FOOTER in basso: grande 'Prima vedi. Poi sistemi.'; banner scudo verde 'PROTEGGIAMO. PREVENIAMO. MIGLIORIAMO.' e triangolo rosso 'DISATTENZIONE. RISCHI. COSTI. CAOS.'; logo '81+' + '81plus.net'. TRAMA (usa questi eventi come vignette; se sono meno di 10 aggiungi vignette di contesto, dialogo e reazione per arrivare a 10-12): 1) FUMIX causa il pericolo 'Emergenze/Incendio' (Addetto Antincendio); poi ROBOTIX81+SICURIX applicano il METODO81+; 2) MULTIX causa il pericolo 'Nomine' (Nomina Incaricati/Responsabili); poi HYGIENIX+SICURIX applicano il METODO81+; 3) LEAKIX causa il pericolo 'Registro' (Registro dei Trattamenti); poi FORMIX+SICURIX applicano il METODO81+; 4) LEAKIX causa il pericolo 'Data breach' (Procedura Data Breach); poi DOCUMIX+SICURIX applicano il METODO81+; 5) ØTIX causa il pericolo 'DPI' (Uso e Formazione DPI); poi ROBOTIX81+SICURIX applicano il METODO81+; 6) FUMIX causa il pericolo 'Ruolo/RSPP' (RSPP / Datore di Lavoro RSPP); poi LUXPECTORIX+SICURIX applicano il METODO81+; 7) FRETTIX causa il pericolo 'Ruolo/Preposto' (Formazione Preposto); poi CHEFIX+SICURIX applicano il METODO81+; 8) NONDPIX causa il pericolo 'Formazione specifica' (Formazione Specifica (rischio basso)); poi CONSENSIX+SICURIX applicano il METODO81+; 9) LEAKIX causa il pericolo 'Formazione' (Formazione GDPR); poi TRACCIX+SICURIX applicano il METODO81+; 10) CANCELIX causa il pericolo 'Documento' (Informativa e Consensi); poi TRACCIX+SICURIX applicano il METODO81+; 11) TAGLIX causa il pericolo 'Videoterminali' (Videoterminali (VDT)); poi TRACCIX+SICURIX applicano il METODO81+. PALETTE BRAND ESCLUSIVA: nero #05050A, bianco panna, arancione #FF6A1A/#E8501A; ROSSO solo per 'PERICOLO', VERDE per la checklist 'Metodo 81+'. Logo '81+' ben visibile in OGNI vignetta. REGOLA STORIA: SICURIX NON agisce mai da solo - in OGNI vignetta di soluzione si fa AIUTARE dai suoi colleghi EROI (lavoro di squadra, ognuno col suo ruolo). TESTO: didascalie e fumetti MOLTO BREVI (1-4 parole), GRANDI, centrati, in ITALIANO con ORTOGRAFIA PERFETTA, senza parole inventate, lettere doppie errate o testo tagliato. CATTIVI (coerenti col canone): FUMIX, MULTIX, LEAKIX, ØTIX, FRETTIX, NONDPIX, CANCELIX, TAGLIX. EROI: ROBOTIX81, HYGIENIX, FORMIX, DOCUMIX, LUXPECTORIX, CHEFIX, CONSENSIX, TRACCIX. NEGATIVE: nessun marchio LEGO reale, nessun personaggio protetto (Asterix ecc.), niente gore/horror, niente claim assoluti ('rischio zero','garantito','zero multe').","In ICT/Informazione non e' 'se' arriva il controllo, e' 'quando'. Sei pronto?","Quello che l'ispettore controlla per primo in ICT/Informazione (e quasi nessuno lo sa)

In ict/informazione gli adempimenti obbligatori non aspettano: Emergenze/Incendio, Nomine, Registro, Data breach, DPI, Ruolo/RSPP, Ruolo/Preposto, Formazione specifica, Formazione, Documento, Videoterminali. In questa pagina TALES OF SICURIX il PERICOLO prende forma... e il METODO81+ lo rimette in ordine, passo dopo passo. Immagina la scena: prima il caos, poi la checklist che sistema tutto. Mettere ordine ora costa poco. Rimediare dopo costa caro.
👉 Iscriviti al corso: Corso antincendio livello 1 -> https://81plus.net/?corso=corso-antincendio-livello-1
▶️ YouTube: youtube.com/@sicurissimo
Contenuto informativo. Prima vedi. Poi sistemi. 81plus.net",Corso antincendio livello 1,https://81plus.net/?corso=corso-antincendio-livello-1,#TalesOfSicurix #SICURIX #Metodo81 #81plus #Sicurissimo #Sicurezza #Privacy #SicurezzaSulLavoro,SICURIX_TALES_582900_7_12_11_14_8_5_3_2_13_10_9.webp,https://drive.google.com/drive/folders/1hICKXdl9JTZBL1pemG19oE_661z-EH_k,IMG_ERR
52.32.00,Trasporti/Magazzino,H,Sicurezza+Privacy+Ambientale,12,Addetto Antincendio | Registro dei Trattamenti | Rischio Rumore | Gestione Rifiuti e Registro | Addetto Primo Soccorso | Movimentazione Manuale Carichi | Formazione Generale Lavoratori | Formazione Ambientale | Uso e Formazione DPI | Formazione Specifica (rischio alto) | Documento Valutazione Rischi (DVR) | Procedura Data Breach,DM 2/9/2021 | GDPR art.30 | D.Lgs81/08 Tit.VIII | D.Lgs152/06 | DM 388/2003 | D.Lgs81/08 Tit.VI | Accordo Stato-Regioni | D.Lgs81/08 art.77 | D.Lgs81/08 art.28 | GDPR art.33-34,"PRIVACIX>VIBRIX, ROBOTIX81>PHISHIX, SICURIX>FRETTIX, ROBOTIX81>IMPROVVISIX, FORMIX>RUMORIX, LUXPECTORIX>NONDPIX, CHEFIX>NONDPIX, SICURIX>FRETTIX, CHEFIX>SOTTOVALUTIX, TRACCIX>VIBRIX, BLINKIX>IMPROVVISIX, CIFRIX>SPYIX","Crea una PAGINA A FUMETTI a STORIA COMPLETA, verticale A4 (1024x1536), QUALITA' EDITORIALE DA STAMPA, stile ufficiale 'SICURIX TALES' IDENTICO alle immagini di riferimento allegate (stessi personaggi a mattoncini 3D, stessa impaginazione, stessi colori, stesse rese): minifigure espressive, ambientazioni ricche e dettagliate del settore, luci morbide, profondita', bordi vignetta netti. IMPAGINAZIONE OBBLIGATORIA: da 10 a 12 VIGNETTE numerate che raccontano UNA STORIA con arco narrativo completo (1 situazione normale -> 2-4 arrivano i pericoli coi cattivi -> 5-6 tensione/conseguenza -> 7-9 arriva SICURIX con gli eroi e applica il METODO81+ passo per passo -> 10-11 risoluzione ordinata -> 12 finale). HEADER in alto: SICURIX (mantello, medaglione arancione '81+', bussola) che presenta in un fumetto; grande titolo 'SICURIX TALES'; sottotitolo 'TRASPORTI/MAGAZZINO: Pericolo vs Soluzione con Metodo 81+'; legenda 3 voci (verde Sicurezza, rosso Rischio, blu 81+ Soluzione); fila di EROI coi nomi: PRIVACIX, ROBOTIX81, SICURIX, FORMIX, LUXPECTORIX, CHEFIX. FOOTER in basso: grande 'Prima vedi. Poi sistemi.'; banner scudo verde 'PROTEGGIAMO. PREVENIAMO. MIGLIORIAMO.' e triangolo rosso 'DISATTENZIONE. RISCHI. COSTI. CAOS.'; logo '81+' + '81plus.net'. TRAMA (usa questi eventi come vignette; se sono meno di 10 aggiungi vignette di contesto, dialogo e reazione per arrivare a 10-12): 1) VIBRIX causa il pericolo 'Emergenze/Incendio' (Addetto Antincendio); poi PRIVACIX+SICURIX applicano il METODO81+; 2) PHISHIX causa il pericolo 'Registro' (Registro dei Trattamenti); poi ROBOTIX81+SICURIX applicano il METODO81+; 3) FRETTIX causa il pericolo 'Rumore' (Rischio Rumore); poi SICURIX+SICURIX applicano il METODO81+; 4) IMPROVVISIX causa il pericolo 'Rifiuti' (Gestione Rifiuti e Registro); poi ROBOTIX81+SICURIX applicano il METODO81+; 5) RUMORIX causa il pericolo 'Emergenze/Soccorso' (Addetto Primo Soccorso); poi FORMIX+SICURIX applicano il METODO81+; 6) NONDPIX causa il pericolo 'MMC' (Movimentazione Manuale Carichi); poi LUXPECTORIX+SICURIX applicano il METODO81+; 7) NONDPIX causa il pericolo 'Formazione base' (Formazione Generale Lavoratori); poi CHEFIX+SICURIX applicano il METODO81+; 8) FRETTIX causa il pericolo 'Formazione' (Formazione Ambientale); poi SICURIX+SICURIX applicano il METODO81+; 9) SOTTOVALUTIX causa il pericolo 'DPI' (Uso e Formazione DPI); poi CHEFIX+SICURIX applicano il METODO81+; 10) VIBRIX causa il pericolo 'Formazione specifica' (Formazione Specifica (rischio alto)); poi TRACCIX+SICURIX applicano il METODO81+; 11) IMPROVVISIX causa il pericolo 'Documento' (Documento Valutazione Rischi (DVR)); poi BLINKIX+SICURIX applicano il METODO81+; 12) SPYIX causa il pericolo 'Data breach' (Procedura Data Breach); poi CIFRIX+SICURIX applicano il METODO81+. PALETTE BRAND ESCLUSIVA: nero #05050A, bianco panna, arancione #FF6A1A/#E8501A; ROSSO solo per 'PERICOLO', VERDE per la checklist 'Metodo 81+'. Logo '81+' ben visibile in OGNI vignetta. REGOLA STORIA: SICURIX NON agisce mai da solo - in OGNI vignetta di soluzione si fa AIUTARE dai suoi colleghi EROI (lavoro di squadra, ognuno col suo ruolo). TESTO: didascalie e fumetti MOLTO BREVI (1-4 parole), GRANDI, centrati, in ITALIANO con ORTOGRAFIA PERFETTA, senza parole inventate, lettere doppie errate o testo tagliato. CATTIVI (coerenti col canone): VIBRIX, PHISHIX, FRETTIX, IMPROVVISIX, RUMORIX, NONDPIX, SOTTOVALUTIX, SPYIX. EROI: PRIVACIX, ROBOTIX81, SICURIX, FORMIX, LUXPECTORIX, CHEFIX, TRACCIX, BLINKIX, CIFRIX. NEGATIVE: nessun marchio LEGO reale, nessun personaggio protetto (Asterix ecc.), niente gore/horror, niente claim assoluti ('rischio zero','garantito','zero multe').",Trasporti/Magazzino: 3 minuti oggi o un problema enorme domani. Scegli tu.,"La differenza tra chi in Trasporti/Magazzino dorme sereno e chi trema al controllo

In trasporti/magazzino gli adempimenti obbligatori non aspettano: Emergenze/Incendio, Registro, Rumore, Rifiuti, Emergenze/Soccorso, MMC, Formazione base, Formazione, DPI, Formazione specifica, Documento, Data breach. In questa pagina TALES OF SICURIX il PERICOLO prende forma... e il METODO81+ lo rimette in ordine, passo dopo passo. Immagina la scena: prima il caos, poi la checklist che sistema tutto. La regola c'e' gia': tu falla lavorare per te.
👉 Iscriviti al corso: Corso antincendio livello 1 -> https://81plus.net/?corso=corso-antincendio-livello-1
▶️ YouTube: youtube.com/@sicurissimo
Contenuto informativo. Prima vedi. Poi sistemi. 81plus.net",Corso antincendio livello 1,https://81plus.net/?corso=corso-antincendio-livello-1,#TalesOfSicurix #SICURIX #Metodo81 #81plus #Sicurissimo #Sicurezza #Privacy #Ambientale #SicurezzaSulLavoro,SICURIX_TALES_523200_7_16_12_20_6_10_1_21_8_2_0_19.webp,https://drive.google.com/drive/folders/1hICKXdl9JTZBL1pemG19oE_661z-EH_k,IMG_ERR
